 00:00:00.000000 IP 192.168.37.101.4840 > 192.168.37.100.4840: UDP, length 1109
 00:00:00.001318 IP 192.168.37.101.4840 > 192.168.37.100.4840: UDP, length 1109
 00:00:00.001353 IP 192.168.37.101.4840 > 192.168.37.100.4840: UDP, length 1109
 00:00:00.001348 IP 192.168.37.101.4840 > 192.168.37.100.4840: UDP, length 1109
 00:00:00.001359 IP 192.168.37.101.4840 > 192.168.37.100.4840: UDP, length 1109
 00:00:00.001371 IP 192.168.37.101.4840 > 192.168.37.100.4840: UDP, length 1109
 00:00:00.001351 IP 192.168.37.101.4840 > 192.168.37.100.4840: UDP, length 1109
 00:00:00.001343 IP 192.168.37.101.4840 > 192.168.37.100.4840: UDP, length 1109
 00:00:00.001359 IP 192.168.37.101.4840 > 192.168.37.100.4840: UDP, length 1109
 00:00:00.001337 IP 192.168.37.101.4840 > 192.168.37.100.4840: UDP, length 1109
 00:00:00.001346 IP 192.168.37.101.4840 > 192.168.37.100.4840: UDP, length 1109
 00:00:00.001329 IP 192.168.37.101.4840 > 192.168.37.100.4840: UDP, length 1109
 00:00:00.001332 IP 192.168.37.101.4840 > 192.168.37.100.4840: UDP, length 1109
 00:00:00.001352 IP 192.168.37.101.4840 > 192.168.37.100.4840: UDP, length 1109
 00:00:00.001357 IP 192.168.37.101.4840 > 192.168.37.100.4840: UDP, length 1109
 00:00:00.001346 IP 192.168.37.101.4840 > 192.168.37.100.4840: UDP, length 1109
 00:00:00.001409 IP 192.168.37.101.4840 > 192.168.37.100.4840: UDP, length 1109
 00:00:00.001358 IP 192.168.37.101.4840 > 192.168.37.100.4840: UDP, length 1109
 00:00:00.001339 IP 192.168.37.101.4840 > 192.168.37.100.4840: UDP, length 1109
 00:00:00.001353 IP 192.168.37.101.4840 > 192.168.37.100.4840: UDP, length 1109
 00:00:00.001338 IP 192.168.37.101.4840 > 192.168.37.100.4840: UDP, length 1109
 00:00:00.001334 IP 192.168.37.101.4840 > 192.168.37.100.4840: UDP, length 1109
 00:00:00.001347 IP 192.168.37.101.4840 > 192.168.37.100.4840: UDP, length 1109
 00:00:00.001337 IP 192.168.37.101.4840 > 192.168.37.100.4840: UDP, length 1109
 00:00:00.001336 IP 192.168.37.101.4840 > 192.168.37.100.4840: UDP, length 1109
 00:00:00.001334 IP 192.168.37.101.4840 > 192.168.37.100.4840: UDP, length 1109
 00:00:00.001343 IP 192.168.37.101.4840 > 192.168.37.100.4840: UDP, length 1109
 00:00:00.001325 IP 192.168.37.101.4840 > 192.168.37.100.4840: UDP, length 1109
 00:00:00.001331 IP 192.168.37.101.4840 > 192.168.37.100.4840: UDP, length 1109
 00:00:00.001329 IP 192.168.37.101.4840 > 192.168.37.100.4840: UDP, length 1109
 00:00:00.001332 IP 192.168.37.101.4840 > 192.168.37.100.4840: UDP, length 1109
 00:00:00.001339 IP 192.168.37.101.4840 > 192.168.37.100.4840: UDP, length 1109
 00:00:00.001334 IP 192.168.37.101.4840 > 192.168.37.100.4840: UDP, length 1109
 00:00:00.001337 IP 192.168.37.101.4840 > 192.168.37.100.4840: UDP, length 1109
 00:00:00.001335 IP 192.168.37.101.4840 > 192.168.37.100.4840: UDP, length 1109
 00:00:00.001332 IP 192.168.37.101.4840 > 192.168.37.100.4840: UDP, length 1109
 00:00:00.001348 IP 192.168.37.101.4840 > 192.168.37.100.4840: UDP, length 1109
 00:00:00.001522 IP 192.168.37.101.4840 > 192.168.37.100.4840: UDP, length 1109
 00:00:00.001367 IP 192.168.37.101.4840 > 192.168.37.100.4840: UDP, length 1109
 00:00:00.001355 IP 192.168.37.101.4840 > 192.168.37.100.4840: UDP, length 1109
 00:00:00.001402 IP 192.168.37.101.4840 > 192.168.37.100.4840: UDP, length 1109
 00:00:00.001362 IP 192.168.37.101.4840 > 192.168.37.100.4840: UDP, length 1109
 00:00:00.001376 IP 192.168.37.101.4840 > 192.168.37.100.4840: UDP, length 1109
 00:00:00.001351 IP 192.168.37.101.4840 > 192.168.37.100.4840: UDP, length 1109
 00:00:00.001338 IP 192.168.37.101.4840 > 192.168.37.100.4840: UDP, length 1109
 00:00:00.001373 IP 192.168.37.101.4840 > 192.168.37.100.4840: UDP, length 1109
 00:00:00.001336 IP 192.168.37.101.4840 > 192.168.37.100.4840: UDP, length 1109
 00:00:00.001343 IP 192.168.37.101.4840 > 192.168.37.100.4840: UDP, length 1109
 00:00:00.001344 IP 192.168.37.101.4840 > 192.168.37.100.4840: UDP, length 1109
 00:00:00.001357 IP 192.168.37.101.4840 > 192.168.37.100.4840: UDP, length 1109
 00:00:00.001366 IP 192.168.37.101.4840 > 192.168.37.100.4840: UDP, length 1109
 00:00:00.001356 IP 192.168.37.101.4840 > 192.168.37.100.4840: UDP, length 1109
 00:00:00.001334 IP 192.168.37.101.4840 > 192.168.37.100.4840: UDP, length 1109
 00:00:00.001348 IP 192.168.37.101.4840 > 192.168.37.100.4840: UDP, length 1109
 00:00:00.001338 IP 192.168.37.101.4840 > 192.168.37.100.4840: UDP, length 1109
 00:00:00.001334 IP 192.168.37.101.4840 > 192.168.37.100.4840: UDP, length 1109
 00:00:00.001352 IP 192.168.37.101.4840 > 192.168.37.100.4840: UDP, length 1109
 00:00:00.001336 IP 192.168.37.101.4840 > 192.168.37.100.4840: UDP, length 1109
 00:00:00.001335 IP 192.168.37.101.4840 > 192.168.37.100.4840: UDP, length 1109
 00:00:00.001349 IP 192.168.37.101.4840 > 192.168.37.100.4840: UDP, length 1109
 00:00:00.001350 IP 192.168.37.101.4840 > 192.168.37.100.4840: UDP, length 1109
 00:00:00.001369 IP 192.168.37.101.4840 > 192.168.37.100.4840: UDP, length 1109
 00:00:00.001356 IP 192.168.37.101.4840 > 192.168.37.100.4840: UDP, length 1109
 00:00:00.001330 IP 192.168.37.101.4840 > 192.168.37.100.4840: UDP, length 1109
 00:00:00.001334 IP 192.168.37.101.4840 > 192.168.37.100.4840: UDP, length 1109
 00:00:00.001379 IP 192.168.37.101.4840 > 192.168.37.100.4840: UDP, length 1109
 00:00:00.001363 IP 192.168.37.101.4840 > 192.168.37.100.4840: UDP, length 1109
 00:00:00.001354 IP 192.168.37.101.4840 > 192.168.37.100.4840: UDP, length 1109
 00:00:00.001512 IP 192.168.37.101.4840 > 192.168.37.100.4840: UDP, length 1109
 00:00:00.001555 IP 192.168.37.101.4840 > 192.168.37.100.4840: UDP, length 1109
 00:00:00.001439 IP 192.168.37.101.4840 > 192.168.37.100.4840: UDP, length 1109
 00:00:00.001385 IP 192.168.37.101.4840 > 192.168.37.100.4840: UDP, length 1109
 00:00:00.001419 IP 192.168.37.101.4840 > 192.168.37.100.4840: UDP, length 1109
 00:00:00.001409 IP 192.168.37.101.4840 > 192.168.37.100.4840: UDP, length 1109
 00:00:00.001422 IP 192.168.37.101.4840 > 192.168.37.100.4840: UDP, length 1109
 00:00:00.001580 IP 192.168.37.101.4840 > 192.168.37.100.4840: UDP, length 1109
 00:00:00.001418 IP 192.168.37.101.4840 > 192.168.37.100.4840: UDP, length 1109
 00:00:00.001375 IP 192.168.37.101.4840 > 192.168.37.100.4840: UDP, length 1109
 00:00:00.001409 IP 192.168.37.101.4840 > 192.168.37.100.4840: UDP, length 1109
 00:00:00.001392 IP 192.168.37.101.4840 > 192.168.37.100.4840: UDP, length 1109
 00:00:00.001358 IP 192.168.37.101.4840 > 192.168.37.100.4840: UDP, length 1109
 00:00:00.001378 IP 192.168.37.101.4840 > 192.168.37.100.4840: UDP, length 1109
 00:00:00.001361 IP 192.168.37.101.4840 > 192.168.37.100.4840: UDP, length 1109
 00:00:00.001347 IP 192.168.37.101.4840 > 192.168.37.100.4840: UDP, length 1109
 00:00:00.001393 IP 192.168.37.101.4840 > 192.168.37.100.4840: UDP, length 1109
 00:00:00.001311 IP 192.168.37.101.4840 > 192.168.37.100.4840: UDP, length 1109
 00:00:00.001430 IP 192.168.37.101.4840 > 192.168.37.100.4840: UDP, length 1109
 00:00:00.001387 IP 192.168.37.101.4840 > 192.168.37.100.4840: UDP, length 1109
 00:00:00.001400 IP 192.168.37.101.4840 > 192.168.37.100.4840: UDP, length 1109
 00:00:00.001393 IP 192.168.37.101.4840 > 192.168.37.100.4840: UDP, length 1109
 00:00:00.001361 IP 192.168.37.101.4840 > 192.168.37.100.4840: UDP, length 1109
 00:00:00.001369 IP 192.168.37.101.4840 > 192.168.37.100.4840: UDP, length 1109
 00:00:00.001420 IP 192.168.37.101.4840 > 192.168.37.100.4840: UDP, length 1109
 00:00:00.001404 IP 192.168.37.101.4840 > 192.168.37.100.4840: UDP, length 1109
 00:00:00.001599 IP 192.168.37.101.4840 > 192.168.37.100.4840: UDP, length 1109
 00:00:00.001463 IP 192.168.37.101.4840 > 192.168.37.100.4840: UDP, length 1109
 00:00:00.001389 IP 192.168.37.101.4840 > 192.168.37.100.4840: UDP, length 1109
 00:00:00.001366 IP 192.168.37.101.4840 > 192.168.37.100.4840: UDP, length 1109
 00:00:00.001347 IP 192.168.37.101.4840 > 192.168.37.100.4840: UDP, length 1109
 00:00:00.001361 IP 192.168.37.101.4840 > 192.168.37.100.4840: UDP, length 1109
 00:00:00.001354 IP 192.168.37.101.4840 > 192.168.37.100.4840: UDP, length 1109
 00:00:00.001353 IP 192.168.37.101.4840 > 192.168.37.100.4840: UDP, length 1109
 00:00:00.001460 IP 192.168.37.101.4840 > 192.168.37.100.4840: UDP, length 1109
 00:00:00.001351 IP 192.168.37.101.4840 > 192.168.37.100.4840: UDP, length 1109
 00:00:00.001374 IP 192.168.37.101.4840 > 192.168.37.100.4840: UDP, length 1109
 00:00:00.001362 IP 192.168.37.101.4840 > 192.168.37.100.4840: UDP, length 1109
 00:00:00.001348 IP 192.168.37.101.4840 > 192.168.37.100.4840: UDP, length 1109
 00:00:00.001354 IP 192.168.37.101.4840 > 192.168.37.100.4840: UDP, length 1109
 00:00:00.001345 IP 192.168.37.101.4840 > 192.168.37.100.4840: UDP, length 1109
 00:00:00.001342 IP 192.168.37.101.4840 > 192.168.37.100.4840: UDP, length 1109
 00:00:00.001350 IP 192.168.37.101.4840 > 192.168.37.100.4840: UDP, length 1109
 00:00:00.001339 IP 192.168.37.101.4840 > 192.168.37.100.4840: UDP, length 1109
 00:00:00.001343 IP 192.168.37.101.4840 > 192.168.37.100.4840: UDP, length 1109
 00:00:00.001354 IP 192.168.37.101.4840 > 192.168.37.100.4840: UDP, length 1109
 00:00:00.001348 IP 192.168.37.101.4840 > 192.168.37.100.4840: UDP, length 1109
 00:00:00.001383 IP 192.168.37.101.4840 > 192.168.37.100.4840: UDP, length 1109
 00:00:00.001397 IP 192.168.37.101.4840 > 192.168.37.100.4840: UDP, length 1109
 00:00:00.001353 IP 192.168.37.101.4840 > 192.168.37.100.4840: UDP, length 1109
 00:00:00.001368 IP 192.168.37.101.4840 > 192.168.37.100.4840: UDP, length 1109
 00:00:00.001338 IP 192.168.37.101.4840 > 192.168.37.100.4840: UDP, length 1109
 00:00:00.001335 IP 192.168.37.101.4840 > 192.168.37.100.4840: UDP, length 1109
 00:00:00.001354 IP 192.168.37.101.4840 > 192.168.37.100.4840: UDP, length 1109
 00:00:00.001340 IP 192.168.37.101.4840 > 192.168.37.100.4840: UDP, length 1109
 00:00:00.001344 IP 192.168.37.101.4840 > 192.168.37.100.4840: UDP, length 1109
 00:00:00.001361 IP 192.168.37.101.4840 > 192.168.37.100.4840: UDP, length 1109
 00:00:00.001342 IP 192.168.37.101.4840 > 192.168.37.100.4840: UDP, length 1109
 00:00:00.001377 IP 192.168.37.101.4840 > 192.168.37.100.4840: UDP, length 1109
 00:00:00.001399 IP 192.168.37.101.4840 > 192.168.37.100.4840: UDP, length 1109
 00:00:00.001354 IP 192.168.37.101.4840 > 192.168.37.100.4840: UDP, length 1109
 00:00:00.001345 IP 192.168.37.101.4840 > 192.168.37.100.4840: UDP, length 1109
 00:00:00.001368 IP 192.168.37.101.4840 > 192.168.37.100.4840: UDP, length 1109
 00:00:00.001354 IP 192.168.37.101.4840 > 192.168.37.100.4840: UDP, length 1109
 00:00:00.001364 IP 192.168.37.101.4840 > 192.168.37.100.4840: UDP, length 1109
 00:00:00.001345 IP 192.168.37.101.4840 > 192.168.37.100.4840: UDP, length 1109
 00:00:00.001352 IP 192.168.37.101.4840 > 192.168.37.100.4840: UDP, length 1109
 00:00:00.001357 IP 192.168.37.101.4840 > 192.168.37.100.4840: UDP, length 1109
 00:00:00.001346 IP 192.168.37.101.4840 > 192.168.37.100.4840: UDP, length 1109
 00:00:00.001337 IP 192.168.37.101.4840 > 192.168.37.100.4840: UDP, length 1109
 00:00:00.001350 IP 192.168.37.101.4840 > 192.168.37.100.4840: UDP, length 1109
 00:00:00.001360 IP 192.168.37.101.4840 > 192.168.37.100.4840: UDP, length 1109
 00:00:00.001360 IP 192.168.37.101.4840 > 192.168.37.100.4840: UDP, length 1109
 00:00:00.001374 IP 192.168.37.101.4840 > 192.168.37.100.4840: UDP, length 1109
 00:00:00.001345 IP 192.168.37.101.4840 > 192.168.37.100.4840: UDP, length 1109
 00:00:00.001338 IP 192.168.37.101.4840 > 192.168.37.100.4840: UDP, length 1109
 00:00:00.001352 IP 192.168.37.101.4840 > 192.168.37.100.4840: UDP, length 1109
 00:00:00.001368 IP 192.168.37.101.4840 > 192.168.37.100.4840: UDP, length 1109
 00:00:00.001355 IP 192.168.37.101.4840 > 192.168.37.100.4840: UDP, length 1109
 00:00:00.001359 IP 192.168.37.101.4840 > 192.168.37.100.4840: UDP, length 1109
 00:00:00.001343 IP 192.168.37.101.4840 > 192.168.37.100.4840: UDP, length 1109
 00:00:00.001665 IP 192.168.37.101.4840 > 192.168.37.100.4840: UDP, length 1109
 00:00:00.001515 IP 192.168.37.101.4840 > 192.168.37.100.4840: UDP, length 1109
 00:00:00.001396 IP 192.168.37.101.4840 > 192.168.37.100.4840: UDP, length 1109
 00:00:00.001370 IP 192.168.37.101.4840 > 192.168.37.100.4840: UDP, length 1109
 00:00:00.001429 IP 192.168.37.101.4840 > 192.168.37.100.4840: UDP, length 1109
 00:00:00.001480 IP 192.168.37.101.4840 > 192.168.37.100.4840: UDP, length 1109
 00:00:00.001381 IP 192.168.37.101.4840 > 192.168.37.100.4840: UDP, length 1109
 00:00:00.001353 IP 192.168.37.101.4840 > 192.168.37.100.4840: UDP, length 1109
 00:00:00.001361 IP 192.168.37.101.4840 > 192.168.37.100.4840: UDP, length 1109
 00:00:00.001346 IP 192.168.37.101.4840 > 192.168.37.100.4840: UDP, length 1109
 00:00:00.001361 IP 192.168.37.101.4840 > 192.168.37.100.4840: UDP, length 1109
 00:00:00.001341 IP 192.168.37.101.4840 > 192.168.37.100.4840: UDP, length 1109
 00:00:00.001345 IP 192.168.37.101.4840 > 192.168.37.100.4840: UDP, length 1109
 00:00:00.001588 IP 192.168.37.101.4840 > 192.168.37.100.4840: UDP, length 1109
 00:00:00.001483 IP 192.168.37.101.4840 > 192.168.37.100.4840: UDP, length 1109
 00:00:00.001375 IP 192.168.37.101.4840 > 192.168.37.100.4840: UDP, length 1109
 00:00:00.001347 IP 192.168.37.101.4840 > 192.168.37.100.4840: UDP, length 1109
 00:00:00.001372 IP 192.168.37.101.4840 > 192.168.37.100.4840: UDP, length 1109
 00:00:00.001352 IP 192.168.37.101.4840 > 192.168.37.100.4840: UDP, length 1109
 00:00:00.001362 IP 192.168.37.101.4840 > 192.168.37.100.4840: UDP, length 1109
 00:00:00.001346 IP 192.168.37.101.4840 > 192.168.37.100.4840: UDP, length 1109
 00:00:00.001356 IP 192.168.37.101.4840 > 192.168.37.100.4840: UDP, length 1109
 00:00:00.001360 IP 192.168.37.101.4840 > 192.168.37.100.4840: UDP, length 1109
 00:00:00.001573 IP 192.168.37.101.4840 > 192.168.37.100.4840: UDP, length 1109
 00:00:00.001539 IP 192.168.37.101.4840 > 192.168.37.100.4840: UDP, length 1109
 00:00:00.001554 IP 192.168.37.101.4840 > 192.168.37.100.4840: UDP, length 1109
 00:00:00.001549 IP 192.168.37.101.4840 > 192.168.37.100.4840: UDP, length 1109
 00:00:00.001403 IP 192.168.37.101.4840 > 192.168.37.100.4840: UDP, length 1109
 00:00:00.001373 IP 192.168.37.101.4840 > 192.168.37.100.4840: UDP, length 1109
 00:00:00.001414 IP 192.168.37.101.4840 > 192.168.37.100.4840: UDP, length 1109
 00:00:00.001362 IP 192.168.37.101.4840 > 192.168.37.100.4840: UDP, length 1109
 00:00:00.001373 IP 192.168.37.101.4840 > 192.168.37.100.4840: UDP, length 1109
 00:00:00.001364 IP 192.168.37.101.4840 > 192.168.37.100.4840: UDP, length 1109
 00:00:00.001351 IP 192.168.37.101.4840 > 192.168.37.100.4840: UDP, length 1109
 00:00:00.001380 IP 192.168.37.101.4840 > 192.168.37.100.4840: UDP, length 1109
 00:00:00.001374 IP 192.168.37.101.4840 > 192.168.37.100.4840: UDP, length 1109
 00:00:00.001350 IP 192.168.37.101.4840 > 192.168.37.100.4840: UDP, length 1109
 00:00:00.001352 IP 192.168.37.101.4840 > 192.168.37.100.4840: UDP, length 1109
 00:00:00.001351 IP 192.168.37.101.4840 > 192.168.37.100.4840: UDP, length 1109
 00:00:00.001345 IP 192.168.37.101.4840 > 192.168.37.100.4840: UDP, length 1109
 00:00:00.001361 IP 192.168.37.101.4840 > 192.168.37.100.4840: UDP, length 1109
 00:00:00.001348 IP 192.168.37.101.4840 > 192.168.37.100.4840: UDP, length 1109
 00:00:00.001362 IP 192.168.37.101.4840 > 192.168.37.100.4840: UDP, length 1109
 00:00:00.001349 IP 192.168.37.101.4840 > 192.168.37.100.4840: UDP, length 1109
 00:00:00.001342 IP 192.168.37.101.4840 > 192.168.37.100.4840: UDP, length 1109
 00:00:00.001358 IP 192.168.37.101.4840 > 192.168.37.100.4840: UDP, length 1109
 00:00:00.001347 IP 192.168.37.101.4840 > 192.168.37.100.4840: UDP, length 1109
 00:00:00.001339 IP 192.168.37.101.4840 > 192.168.37.100.4840: UDP, length 1109
 00:00:00.001754 IP 192.168.37.101.4840 > 192.168.37.100.4840: UDP, length 1109
 00:00:00.001239 IP 192.168.37.101.4840 > 192.168.37.100.4840: UDP, length 1109
 00:00:00.001371 IP 192.168.37.101.4840 > 192.168.37.100.4840: UDP, length 1109
 00:00:00.001349 IP 192.168.37.101.4840 > 192.168.37.100.4840: UDP, length 1109
 00:00:00.001495 IP 192.168.37.101.4840 > 192.168.37.100.4840: UDP, length 1109
 00:00:00.001399 IP 192.168.37.101.4840 > 192.168.37.100.4840: UDP, length 1109
 00:00:00.001346 IP 192.168.37.101.4840 > 192.168.37.100.4840: UDP, length 1109
 00:00:00.001365 IP 192.168.37.101.4840 > 192.168.37.100.4840: UDP, length 1109
 00:00:00.001341 IP 192.168.37.101.4840 > 192.168.37.100.4840: UDP, length 1109
 00:00:00.001339 IP 192.168.37.101.4840 > 192.168.37.100.4840: UDP, length 1109
 00:00:00.001366 IP 192.168.37.101.4840 > 192.168.37.100.4840: UDP, length 1109
 00:00:00.001354 IP 192.168.37.101.4840 > 192.168.37.100.4840: UDP, length 1109
 00:00:00.001355 IP 192.168.37.101.4840 > 192.168.37.100.4840: UDP, length 1109
 00:00:00.001371 IP 192.168.37.101.4840 > 192.168.37.100.4840: UDP, length 1109
 00:00:00.001556 IP 192.168.37.101.4840 > 192.168.37.100.4840: UDP, length 1109
 00:00:00.001418 IP 192.168.37.101.4840 > 192.168.37.100.4840: UDP, length 1109
 00:00:00.001361 IP 192.168.37.101.4840 > 192.168.37.100.4840: UDP, length 1109
 00:00:00.001351 IP 192.168.37.101.4840 > 192.168.37.100.4840: UDP, length 1109
 00:00:00.001454 IP 192.168.37.101.4840 > 192.168.37.100.4840: UDP, length 1109
 00:00:00.001391 IP 192.168.37.101.4840 > 192.168.37.100.4840: UDP, length 1109
 00:00:00.001410 IP 192.168.37.101.4840 > 192.168.37.100.4840: UDP, length 1109
 00:00:00.001381 IP 192.168.37.101.4840 > 192.168.37.100.4840: UDP, length 1109
 00:00:00.001368 IP 192.168.37.101.4840 > 192.168.37.100.4840: UDP, length 1109
 00:00:00.001321 IP 192.168.37.101.4840 > 192.168.37.100.4840: UDP, length 1109
 00:00:00.001346 IP 192.168.37.101.4840 > 192.168.37.100.4840: UDP, length 1109
 00:00:00.001348 IP 192.168.37.101.4840 > 192.168.37.100.4840: UDP, length 1109
 00:00:00.001352 IP 192.168.37.101.4840 > 192.168.37.100.4840: UDP, length 1109
 00:00:00.001341 IP 192.168.37.101.4840 > 192.168.37.100.4840: UDP, length 1109
 00:00:00.001342 IP 192.168.37.101.4840 > 192.168.37.100.4840: UDP, length 1109
 00:00:00.001375 IP 192.168.37.101.4840 > 192.168.37.100.4840: UDP, length 1109
 00:00:00.001344 IP 192.168.37.101.4840 > 192.168.37.100.4840: UDP, length 1109
 00:00:00.001352 IP 192.168.37.101.4840 > 192.168.37.100.4840: UDP, length 1109
 00:00:00.001362 IP 192.168.37.101.4840 > 192.168.37.100.4840: UDP, length 1109
 00:00:00.001349 IP 192.168.37.101.4840 > 192.168.37.100.4840: UDP, length 1109
 00:00:00.001357 IP 192.168.37.101.4840 > 192.168.37.100.4840: UDP, length 1109
 00:00:00.001336 IP 192.168.37.101.4840 > 192.168.37.100.4840: UDP, length 1109
 00:00:00.001342 IP 192.168.37.101.4840 > 192.168.37.100.4840: UDP, length 1109
 00:00:00.001349 IP 192.168.37.101.4840 > 192.168.37.100.4840: UDP, length 1109
 00:00:00.001336 IP 192.168.37.101.4840 > 192.168.37.100.4840: UDP, length 1109
 00:00:00.001334 IP 192.168.37.101.4840 > 192.168.37.100.4840: UDP, length 1109
 00:00:00.001346 IP 192.168.37.101.4840 > 192.168.37.100.4840: UDP, length 1109
 00:00:00.001336 IP 192.168.37.101.4840 > 192.168.37.100.4840: UDP, length 1109
 00:00:00.001337 IP 192.168.37.101.4840 > 192.168.37.100.4840: UDP, length 1109
 00:00:00.001371 IP 192.168.37.101.4840 > 192.168.37.100.4840: UDP, length 1109
 00:00:00.001348 IP 192.168.37.101.4840 > 192.168.37.100.4840: UDP, length 1109
 00:00:00.001338 IP 192.168.37.101.4840 > 192.168.37.100.4840: UDP, length 1109
 00:00:00.001345 IP 192.168.37.101.4840 > 192.168.37.100.4840: UDP, length 1109
 00:00:00.001336 IP 192.168.37.101.4840 > 192.168.37.100.4840: UDP, length 1109
 00:00:00.001361 IP 192.168.37.101.4840 > 192.168.37.100.4840: UDP, length 1109
 00:00:00.001369 IP 192.168.37.101.4840 > 192.168.37.100.4840: UDP, length 1109
 00:00:00.001391 IP 192.168.37.101.4840 > 192.168.37.100.4840: UDP, length 1109
 00:00:00.001381 IP 192.168.37.101.4840 > 192.168.37.100.4840: UDP, length 1109
 00:00:00.001343 IP 192.168.37.101.4840 > 192.168.37.100.4840: UDP, length 1109
 00:00:00.001332 IP 192.168.37.101.4840 > 192.168.37.100.4840: UDP, length 1109
 00:00:00.001356 IP 192.168.37.101.4840 > 192.168.37.100.4840: UDP, length 1109
 00:00:00.001333 IP 192.168.37.101.4840 > 192.168.37.100.4840: UDP, length 1109
 00:00:00.001488 IP 192.168.37.101.4840 > 192.168.37.100.4840: UDP, length 1109
 00:00:00.001437 IP 192.168.37.101.4840 > 192.168.37.100.4840: UDP, length 1109
 00:00:00.001381 IP 192.168.37.101.4840 > 192.168.37.100.4840: UDP, length 1109
 00:00:00.001389 IP 192.168.37.101.4840 > 192.168.37.100.4840: UDP, length 1109
 00:00:00.001372 IP 192.168.37.101.4840 > 192.168.37.100.4840: UDP, length 1109
 00:00:00.001356 IP 192.168.37.101.4840 > 192.168.37.100.4840: UDP, length 1109
 00:00:00.001366 IP 192.168.37.101.4840 > 192.168.37.100.4840: UDP, length 1109
 00:00:00.001341 IP 192.168.37.101.4840 > 192.168.37.100.4840: UDP, length 1109
 00:00:00.001339 IP 192.168.37.101.4840 > 192.168.37.100.4840: UDP, length 1109
 00:00:00.001567 IP 192.168.37.101.4840 > 192.168.37.100.4840: UDP, length 1109
 00:00:00.001400 IP 192.168.37.101.4840 > 192.168.37.100.4840: UDP, length 1109
 00:00:00.001360 IP 192.168.37.101.4840 > 192.168.37.100.4840: UDP, length 1109
 00:00:00.001345 IP 192.168.37.101.4840 > 192.168.37.100.4840: UDP, length 1109
 00:00:00.001334 IP 192.168.37.101.4840 > 192.168.37.100.4840: UDP, length 1109
 00:00:00.001352 IP 192.168.37.101.4840 > 192.168.37.100.4840: UDP, length 1109
 00:00:00.001341 IP 192.168.37.101.4840 > 192.168.37.100.4840: UDP, length 1109
 00:00:00.001328 IP 192.168.37.101.4840 > 192.168.37.100.4840: UDP, length 1109
 00:00:00.001360 IP 192.168.37.101.4840 > 192.168.37.100.4840: UDP, length 1109
 00:00:00.001363 IP 192.168.37.101.4840 > 192.168.37.100.4840: UDP, length 1109
 00:00:00.001341 IP 192.168.37.101.4840 > 192.168.37.100.4840: UDP, length 1109
 00:00:00.001372 IP 192.168.37.101.4840 > 192.168.37.100.4840: UDP, length 1109
 00:00:00.001330 IP 192.168.37.101.4840 > 192.168.37.100.4840: UDP, length 1109
 00:00:00.001352 IP 192.168.37.101.4840 > 192.168.37.100.4840: UDP, length 1109
 00:00:00.001341 IP 192.168.37.101.4840 > 192.168.37.100.4840: UDP, length 1109
 00:00:00.001334 IP 192.168.37.101.4840 > 192.168.37.100.4840: UDP, length 1109
 00:00:00.001349 IP 192.168.37.101.4840 > 192.168.37.100.4840: UDP, length 1109
 00:00:00.001385 IP 192.168.37.101.4840 > 192.168.37.100.4840: UDP, length 1109
 00:00:00.001399 IP 192.168.37.101.4840 > 192.168.37.100.4840: UDP, length 1109
 00:00:00.001367 IP 192.168.37.101.4840 > 192.168.37.100.4840: UDP, length 1109
 00:00:00.001356 IP 192.168.37.101.4840 > 192.168.37.100.4840: UDP, length 1109
 00:00:00.001335 IP 192.168.37.101.4840 > 192.168.37.100.4840: UDP, length 1109
 00:00:00.001411 IP 192.168.37.101.4840 > 192.168.37.100.4840: UDP, length 1109
 00:00:00.001395 IP 192.168.37.101.4840 > 192.168.37.100.4840: UDP, length 1109
 00:00:00.001378 IP 192.168.37.101.4840 > 192.168.37.100.4840: UDP, length 1109
 00:00:00.001340 IP 192.168.37.101.4840 > 192.168.37.100.4840: UDP, length 1109
 00:00:00.001338 IP 192.168.37.101.4840 > 192.168.37.100.4840: UDP, length 1109
 00:00:00.001351 IP 192.168.37.101.4840 > 192.168.37.100.4840: UDP, length 1109
 00:00:00.001340 IP 192.168.37.101.4840 > 192.168.37.100.4840: UDP, length 1109
 00:00:00.001344 IP 192.168.37.101.4840 > 192.168.37.100.4840: UDP, length 1109
 00:00:00.001364 IP 192.168.37.101.4840 > 192.168.37.100.4840: UDP, length 1109
 00:00:00.001356 IP 192.168.37.101.4840 > 192.168.37.100.4840: UDP, length 1109
 00:00:00.001348 IP 192.168.37.101.4840 > 192.168.37.100.4840: UDP, length 1109
 00:00:00.001358 IP 192.168.37.101.4840 > 192.168.37.100.4840: UDP, length 1109
 00:00:00.001338 IP 192.168.37.101.4840 > 192.168.37.100.4840: UDP, length 1109
 00:00:00.001335 IP 192.168.37.101.4840 > 192.168.37.100.4840: UDP, length 1109
 00:00:00.001328 IP 192.168.37.101.4840 > 192.168.37.100.4840: UDP, length 1109
 00:00:00.001336 IP 192.168.37.101.4840 > 192.168.37.100.4840: UDP, length 1109
 00:00:00.001334 IP 192.168.37.101.4840 > 192.168.37.100.4840: UDP, length 1109
 00:00:00.001341 IP 192.168.37.101.4840 > 192.168.37.100.4840: UDP, length 1109
 00:00:00.001351 IP 192.168.37.101.4840 > 192.168.37.100.4840: UDP, length 1109
 00:00:00.002128 IP 192.168.37.101.4840 > 192.168.37.100.4840: UDP, length 1109
 00:00:00.000542 IP 192.168.37.101.4840 > 192.168.37.100.4840: UDP, length 1109
 00:00:00.001332 IP 192.168.37.101.4840 > 192.168.37.100.4840: UDP, length 1109
 00:00:00.001334 IP 192.168.37.101.4840 > 192.168.37.100.4840: UDP, length 1109
 00:00:00.001335 IP 192.168.37.101.4840 > 192.168.37.100.4840: UDP, length 1109
 00:00:00.001338 IP 192.168.37.101.4840 > 192.168.37.100.4840: UDP, length 1109
 00:00:00.001331 IP 192.168.37.101.4840 > 192.168.37.100.4840: UDP, length 1109
 00:00:00.001336 IP 192.168.37.101.4840 > 192.168.37.100.4840: UDP, length 1109
 00:00:00.001340 IP 192.168.37.101.4840 > 192.168.37.100.4840: UDP, length 1109
 00:00:00.001331 IP 192.168.37.101.4840 > 192.168.37.100.4840: UDP, length 1109
 00:00:00.001337 IP 192.168.37.101.4840 > 192.168.37.100.4840: UDP, length 1109
 00:00:00.001341 IP 192.168.37.101.4840 > 192.168.37.100.4840: UDP, length 1109
 00:00:00.001333 IP 192.168.37.101.4840 > 192.168.37.100.4840: UDP, length 1109
 00:00:00.001356 IP 192.168.37.101.4840 > 192.168.37.100.4840: UDP, length 1109
 00:00:00.001331 IP 192.168.37.101.4840 > 192.168.37.100.4840: UDP, length 1109
 00:00:00.001329 IP 192.168.37.101.4840 > 192.168.37.100.4840: UDP, length 1109
 00:00:00.001352 IP 192.168.37.101.4840 > 192.168.37.100.4840: UDP, length 1109
 00:00:00.001336 IP 192.168.37.101.4840 > 192.168.37.100.4840: UDP, length 1109
 00:00:00.001334 IP 192.168.37.101.4840 > 192.168.37.100.4840: UDP, length 1109
 00:00:00.001350 IP 192.168.37.101.4840 > 192.168.37.100.4840: UDP, length 1109
 00:00:00.001352 IP 192.168.37.101.4840 > 192.168.37.100.4840: UDP, length 1109
 00:00:00.001365 IP 192.168.37.101.4840 > 192.168.37.100.4840: UDP, length 1109
 00:00:00.001339 IP 192.168.37.101.4840 > 192.168.37.100.4840: UDP, length 1109
 00:00:00.001329 IP 192.168.37.101.4840 > 192.168.37.100.4840: UDP, length 1109
 00:00:00.001593 IP 192.168.37.101.4840 > 192.168.37.100.4840: UDP, length 1109
 00:00:00.001105 IP 192.168.37.101.4840 > 192.168.37.100.4840: UDP, length 1109
 00:00:00.001334 IP 192.168.37.101.4840 > 192.168.37.100.4840: UDP, length 1109
 00:00:00.001497 IP 192.168.37.101.4840 > 192.168.37.100.4840: UDP, length 1109
 00:00:00.001343 IP 192.168.37.101.4840 > 192.168.37.100.4840: UDP, length 1109
 00:00:00.001351 IP 192.168.37.101.4840 > 192.168.37.100.4840: UDP, length 1109
 00:00:00.001347 IP 192.168.37.101.4840 > 192.168.37.100.4840: UDP, length 1109
 00:00:00.001329 IP 192.168.37.101.4840 > 192.168.37.100.4840: UDP, length 1109
 00:00:00.001337 IP 192.168.37.101.4840 > 192.168.37.100.4840: UDP, length 1109
 00:00:00.001384 IP 192.168.37.101.4840 > 192.168.37.100.4840: UDP, length 1109
 00:00:00.001361 IP 192.168.37.101.4840 > 192.168.37.100.4840: UDP, length 1109
 00:00:00.001362 IP 192.168.37.101.4840 > 192.168.37.100.4840: UDP, length 1109
 00:00:00.001340 IP 192.168.37.101.4840 > 192.168.37.100.4840: UDP, length 1109
 00:00:00.001329 IP 192.168.37.101.4840 > 192.168.37.100.4840: UDP, length 1109
 00:00:00.001353 IP 192.168.37.101.4840 > 192.168.37.100.4840: UDP, length 1109
 00:00:00.001337 IP 192.168.37.101.4840 > 192.168.37.100.4840: UDP, length 1109
 00:00:00.001334 IP 192.168.37.101.4840 > 192.168.37.100.4840: UDP, length 1109
 00:00:00.001348 IP 192.168.37.101.4840 > 192.168.37.100.4840: UDP, length 1109
 00:00:00.001338 IP 192.168.37.101.4840 > 192.168.37.100.4840: UDP, length 1109
 00:00:00.001341 IP 192.168.37.101.4840 > 192.168.37.100.4840: UDP, length 1109
 00:00:00.001351 IP 192.168.37.101.4840 > 192.168.37.100.4840: UDP, length 1109
 00:00:00.001339 IP 192.168.37.101.4840 > 192.168.37.100.4840: UDP, length 1109
 00:00:00.001336 IP 192.168.37.101.4840 > 192.168.37.100.4840: UDP, length 1109
 00:00:00.001348 IP 192.168.37.101.4840 > 192.168.37.100.4840: UDP, length 1109
 00:00:00.001341 IP 192.168.37.101.4840 > 192.168.37.100.4840: UDP, length 1109
 00:00:00.001341 IP 192.168.37.101.4840 > 192.168.37.100.4840: UDP, length 1109
 00:00:00.001364 IP 192.168.37.101.4840 > 192.168.37.100.4840: UDP, length 1109
 00:00:00.001338 IP 192.168.37.101.4840 > 192.168.37.100.4840: UDP, length 1109
 00:00:00.001336 IP 192.168.37.101.4840 > 192.168.37.100.4840: UDP, length 1109
 00:00:00.001371 IP 192.168.37.101.4840 > 192.168.37.100.4840: UDP, length 1109
 00:00:00.001340 IP 192.168.37.101.4840 > 192.168.37.100.4840: UDP, length 1109
 00:00:00.001333 IP 192.168.37.101.4840 > 192.168.37.100.4840: UDP, length 1109
 00:00:00.001345 IP 192.168.37.101.4840 > 192.168.37.100.4840: UDP, length 1109
 00:00:00.001433 IP 192.168.37.101.4840 > 192.168.37.100.4840: UDP, length 1109
 00:00:00.001515 IP 192.168.37.101.4840 > 192.168.37.100.4840: UDP, length 1109
 00:00:00.001424 IP 192.168.37.101.4840 > 192.168.37.100.4840: UDP, length 1109
 00:00:00.001367 IP 192.168.37.101.4840 > 192.168.37.100.4840: UDP, length 1109
 00:00:00.001382 IP 192.168.37.101.4840 > 192.168.37.100.4840: UDP, length 1109
 00:00:00.001377 IP 192.168.37.101.4840 > 192.168.37.100.4840: UDP, length 1109
 00:00:00.001386 IP 192.168.37.101.4840 > 192.168.37.100.4840: UDP, length 1109
 00:00:00.001354 IP 192.168.37.101.4840 > 192.168.37.100.4840: UDP, length 1109
 00:00:00.001347 IP 192.168.37.101.4840 > 192.168.37.100.4840: UDP, length 1109
 00:00:00.001490 IP 192.168.37.101.4840 > 192.168.37.100.4840: UDP, length 1109
 00:00:00.001489 IP 192.168.37.101.4840 > 192.168.37.100.4840: UDP, length 1109
 00:00:00.001423 IP 192.168.37.101.4840 > 192.168.37.100.4840: UDP, length 1109
 00:00:00.001355 IP 192.168.37.101.4840 > 192.168.37.100.4840: UDP, length 1109
 00:00:00.001350 IP 192.168.37.101.4840 > 192.168.37.100.4840: UDP, length 1109
 00:00:00.001369 IP 192.168.37.101.4840 > 192.168.37.100.4840: UDP, length 1109
 00:00:00.001350 IP 192.168.37.101.4840 > 192.168.37.100.4840: UDP, length 1109
 00:00:00.001360 IP 192.168.37.101.4840 > 192.168.37.100.4840: UDP, length 1109
 00:00:00.001348 IP 192.168.37.101.4840 > 192.168.37.100.4840: UDP, length 1109
 00:00:00.001391 IP 192.168.37.101.4840 > 192.168.37.100.4840: UDP, length 1109
 00:00:00.001383 IP 192.168.37.101.4840 > 192.168.37.100.4840: UDP, length 1109
 00:00:00.001363 IP 192.168.37.101.4840 > 192.168.37.100.4840: UDP, length 1109
 00:00:00.001374 IP 192.168.37.101.4840 > 192.168.37.100.4840: UDP, length 1109
 00:00:00.001384 IP 192.168.37.101.4840 > 192.168.37.100.4840: UDP, length 1109
 00:00:00.001362 IP 192.168.37.101.4840 > 192.168.37.100.4840: UDP, length 1109
 00:00:00.001340 IP 192.168.37.101.4840 > 192.168.37.100.4840: UDP, length 1109
 00:00:00.001376 IP 192.168.37.101.4840 > 192.168.37.100.4840: UDP, length 1109
 00:00:00.001337 IP 192.168.37.101.4840 > 192.168.37.100.4840: UDP, length 1109
 00:00:00.001351 IP 192.168.37.101.4840 > 192.168.37.100.4840: UDP, length 1109
 00:00:00.001357 IP 192.168.37.101.4840 > 192.168.37.100.4840: UDP, length 1109
 00:00:00.001366 IP 192.168.37.101.4840 > 192.168.37.100.4840: UDP, length 1109
 00:00:00.001369 IP 192.168.37.101.4840 > 192.168.37.100.4840: UDP, length 1109
 00:00:00.001366 IP 192.168.37.101.4840 > 192.168.37.100.4840: UDP, length 1109
 00:00:00.001354 IP 192.168.37.101.4840 > 192.168.37.100.4840: UDP, length 1109
 00:00:00.001418 IP 192.168.37.101.4840 > 192.168.37.100.4840: UDP, length 1109
 00:00:00.001375 IP 192.168.37.101.4840 > 192.168.37.100.4840: UDP, length 1109
 00:00:00.001583 IP 192.168.37.101.4840 > 192.168.37.100.4840: UDP, length 1109
 00:00:00.001414 IP 192.168.37.101.4840 > 192.168.37.100.4840: UDP, length 1109
 00:00:00.001339 IP 192.168.37.101.4840 > 192.168.37.100.4840: UDP, length 1109
 00:00:00.001372 IP 192.168.37.101.4840 > 192.168.37.100.4840: UDP, length 1109
 00:00:00.001340 IP 192.168.37.101.4840 > 192.168.37.100.4840: UDP, length 1109
 00:00:00.001355 IP 192.168.37.101.4840 > 192.168.37.100.4840: UDP, length 1109
 00:00:00.001336 IP 192.168.37.101.4840 > 192.168.37.100.4840: UDP, length 1109
 00:00:00.001333 IP 192.168.37.101.4840 > 192.168.37.100.4840: UDP, length 1109
 00:00:00.001354 IP 192.168.37.101.4840 > 192.168.37.100.4840: UDP, length 1109
 00:00:00.001338 IP 192.168.37.101.4840 > 192.168.37.100.4840: UDP, length 1109
 00:00:00.001336 IP 192.168.37.101.4840 > 192.168.37.100.4840: UDP, length 1109
 00:00:00.001495 IP 192.168.37.101.4840 > 192.168.37.100.4840: UDP, length 1109
 00:00:00.001343 IP 192.168.37.101.4840 > 192.168.37.100.4840: UDP, length 1109
 00:00:00.001334 IP 192.168.37.101.4840 > 192.168.37.100.4840: UDP, length 1109
 00:00:00.001323 IP 192.168.37.101.4840 > 192.168.37.100.4840: UDP, length 1109
 00:00:00.001408 IP 192.168.37.101.4840 > 192.168.37.100.4840: UDP, length 1109
 00:00:00.001374 IP 192.168.37.101.4840 > 192.168.37.100.4840: UDP, length 1109
 00:00:00.001397 IP 192.168.37.101.4840 > 192.168.37.100.4840: UDP, length 1109
 00:00:00.001382 IP 192.168.37.101.4840 > 192.168.37.100.4840: UDP, length 1109
 00:00:00.001361 IP 192.168.37.101.4840 > 192.168.37.100.4840: UDP, length 1109
 00:00:00.001345 IP 192.168.37.101.4840 > 192.168.37.100.4840: UDP, length 1109
 00:00:00.001334 IP 192.168.37.101.4840 > 192.168.37.100.4840: UDP, length 1109
 00:00:00.001354 IP 192.168.37.101.4840 > 192.168.37.100.4840: UDP, length 1109
 00:00:00.001348 IP 192.168.37.101.4840 > 192.168.37.100.4840: UDP, length 1109
 00:00:00.001339 IP 192.168.37.101.4840 > 192.168.37.100.4840: UDP, length 1109
 00:00:00.001340 IP 192.168.37.101.4840 > 192.168.37.100.4840: UDP, length 1109
 00:00:00.001329 IP 192.168.37.101.4840 > 192.168.37.100.4840: UDP, length 1109
 00:00:00.001356 IP 192.168.37.101.4840 > 192.168.37.100.4840: UDP, length 1109
 00:00:00.001315 IP 192.168.37.101.4840 > 192.168.37.100.4840: UDP, length 1109
 00:00:00.001327 IP 192.168.37.101.4840 > 192.168.37.100.4840: UDP, length 1109
 00:00:00.001340 IP 192.168.37.101.4840 > 192.168.37.100.4840: UDP, length 1109
 00:00:00.001347 IP 192.168.37.101.4840 > 192.168.37.100.4840: UDP, length 1109
 00:00:00.001339 IP 192.168.37.101.4840 > 192.168.37.100.4840: UDP, length 1109
 00:00:00.001339 IP 192.168.37.101.4840 > 192.168.37.100.4840: UDP, length 1109
 00:00:00.001337 IP 192.168.37.101.4840 > 192.168.37.100.4840: UDP, length 1109
 00:00:00.001342 IP 192.168.37.101.4840 > 192.168.37.100.4840: UDP, length 1109
 00:00:00.001338 IP 192.168.37.101.4840 > 192.168.37.100.4840: UDP, length 1109
 00:00:00.001364 IP 192.168.37.101.4840 > 192.168.37.100.4840: UDP, length 1109
 00:00:00.001334 IP 192.168.37.101.4840 > 192.168.37.100.4840: UDP, length 1109
 00:00:00.001332 IP 192.168.37.101.4840 > 192.168.37.100.4840: UDP, length 1109
 00:00:00.001350 IP 192.168.37.101.4840 > 192.168.37.100.4840: UDP, length 1109
 00:00:00.001334 IP 192.168.37.101.4840 > 192.168.37.100.4840: UDP, length 1109
 00:00:00.001334 IP 192.168.37.101.4840 > 192.168.37.100.4840: UDP, length 1109
 00:00:00.001404 IP 192.168.37.101.4840 > 192.168.37.100.4840: UDP, length 1109
 00:00:00.001377 IP 192.168.37.101.4840 > 192.168.37.100.4840: UDP, length 1109
 00:00:00.001372 IP 192.168.37.101.4840 > 192.168.37.100.4840: UDP, length 1109
 00:00:00.001364 IP 192.168.37.101.4840 > 192.168.37.100.4840: UDP, length 1109
 00:00:00.001353 IP 192.168.37.101.4840 > 192.168.37.100.4840: UDP, length 1109
 00:00:00.001370 IP 192.168.37.101.4840 > 192.168.37.100.4840: UDP, length 1109
 00:00:00.001340 IP 192.168.37.101.4840 > 192.168.37.100.4840: UDP, length 1109
 00:00:00.001338 IP 192.168.37.101.4840 > 192.168.37.100.4840: UDP, length 1109
 00:00:00.001518 IP 192.168.37.101.4840 > 192.168.37.100.4840: UDP, length 1109
 00:00:00.001441 IP 192.168.37.101.4840 > 192.168.37.100.4840: UDP, length 1109
 00:00:00.001358 IP 192.168.37.101.4840 > 192.168.37.100.4840: UDP, length 1109
 00:00:00.001347 IP 192.168.37.101.4840 > 192.168.37.100.4840: UDP, length 1109
 00:00:00.001346 IP 192.168.37.101.4840 > 192.168.37.100.4840: UDP, length 1109
 00:00:00.001346 IP 192.168.37.101.4840 > 192.168.37.100.4840: UDP, length 1109
 00:00:00.001334 IP 192.168.37.101.4840 > 192.168.37.100.4840: UDP, length 1109
 00:00:00.001340 IP 192.168.37.101.4840 > 192.168.37.100.4840: UDP, length 1109
 00:00:00.001352 IP 192.168.37.101.4840 > 192.168.37.100.4840: UDP, length 1109
 00:00:00.001340 IP 192.168.37.101.4840 > 192.168.37.100.4840: UDP, length 1109
 00:00:00.001343 IP 192.168.37.101.4840 > 192.168.37.100.4840: UDP, length 1109
 00:00:00.001366 IP 192.168.37.101.4840 > 192.168.37.100.4840: UDP, length 1109
 00:00:00.001341 IP 192.168.37.101.4840 > 192.168.37.100.4840: UDP, length 1109
 00:00:00.001342 IP 192.168.37.101.4840 > 192.168.37.100.4840: UDP, length 1109
 00:00:00.001367 IP 192.168.37.101.4840 > 192.168.37.100.4840: UDP, length 1109
 00:00:00.001340 IP 192.168.37.101.4840 > 192.168.37.100.4840: UDP, length 1109
 00:00:00.001354 IP 192.168.37.101.4840 > 192.168.37.100.4840: UDP, length 1109
 00:00:00.001349 IP 192.168.37.101.4840 > 192.168.37.100.4840: UDP, length 1109
 00:00:00.001341 IP 192.168.37.101.4840 > 192.168.37.100.4840: UDP, length 1109
 00:00:00.001358 IP 192.168.37.101.4840 > 192.168.37.100.4840: UDP, length 1109
 00:00:00.001344 IP 192.168.37.101.4840 > 192.168.37.100.4840: UDP, length 1109
 00:00:00.001347 IP 192.168.37.101.4840 > 192.168.37.100.4840: UDP, length 1109
 00:00:00.001369 IP 192.168.37.101.4840 > 192.168.37.100.4840: UDP, length 1109
 00:00:00.001348 IP 192.168.37.101.4840 > 192.168.37.100.4840: UDP, length 1109
 00:00:00.001340 IP 192.168.37.101.4840 > 192.168.37.100.4840: UDP, length 1109
 00:00:00.001386 IP 192.168.37.101.4840 > 192.168.37.100.4840: UDP, length 1109
 00:00:00.001348 IP 192.168.37.101.4840 > 192.168.37.100.4840: UDP, length 1109
 00:00:00.001346 IP 192.168.37.101.4840 > 192.168.37.100.4840: UDP, length 1109
 00:00:00.001353 IP 192.168.37.101.4840 > 192.168.37.100.4840: UDP, length 1109
 00:00:00.001347 IP 192.168.37.101.4840 > 192.168.37.100.4840: UDP, length 1109
 00:00:00.001338 IP 192.168.37.101.4840 > 192.168.37.100.4840: UDP, length 1109
 00:00:00.001381 IP 192.168.37.101.4840 > 192.168.37.100.4840: UDP, length 1109
 00:00:00.001343 IP 192.168.37.101.4840 > 192.168.37.100.4840: UDP, length 1109
 00:00:00.001356 IP 192.168.37.101.4840 > 192.168.37.100.4840: UDP, length 1109
 00:00:00.001346 IP 192.168.37.101.4840 > 192.168.37.100.4840: UDP, length 1109
 00:00:00.001338 IP 192.168.37.101.4840 > 192.168.37.100.4840: UDP, length 1109
 00:00:00.001350 IP 192.168.37.101.4840 > 192.168.37.100.4840: UDP, length 1109
 00:00:00.001346 IP 192.168.37.101.4840 > 192.168.37.100.4840: UDP, length 1109
 00:00:00.001334 IP 192.168.37.101.4840 > 192.168.37.100.4840: UDP, length 1109
 00:00:00.001367 IP 192.168.37.101.4840 > 192.168.37.100.4840: UDP, length 1109
 00:00:00.001346 IP 192.168.37.101.4840 > 192.168.37.100.4840: UDP, length 1109
 00:00:00.001335 IP 192.168.37.101.4840 > 192.168.37.100.4840: UDP, length 1109
 00:00:00.001362 IP 192.168.37.101.4840 > 192.168.37.100.4840: UDP, length 1109
 00:00:00.001340 IP 192.168.37.101.4840 > 192.168.37.100.4840: UDP, length 1109
 00:00:00.001338 IP 192.168.37.101.4840 > 192.168.37.100.4840: UDP, length 1109
 00:00:00.001354 IP 192.168.37.101.4840 > 192.168.37.100.4840: UDP, length 1109
 00:00:00.001815 IP 192.168.37.101.4840 > 192.168.37.100.4840: UDP, length 1109
 00:00:00.001404 IP 192.168.37.101.4840 > 192.168.37.100.4840: UDP, length 1109
 00:00:00.001385 IP 192.168.37.101.4840 > 192.168.37.100.4840: UDP, length 1109
 00:00:00.001349 IP 192.168.37.101.4840 > 192.168.37.100.4840: UDP, length 1109
 00:00:00.001359 IP 192.168.37.101.4840 > 192.168.37.100.4840: UDP, length 1109
 00:00:00.001373 IP 192.168.37.101.4840 > 192.168.37.100.4840: UDP, length 1109
 00:00:00.001366 IP 192.168.37.101.4840 > 192.168.37.100.4840: UDP, length 1109
 00:00:00.001105 IP 192.168.37.101.4840 > 192.168.37.100.4840: UDP, length 1109
