 00:00:00.000000 IP 192.168.99.1.4840 > 192.168.99.2.4840: UDP, length 1109
 00:00:00.001668 IP 192.168.99.1.4840 > 192.168.99.2.4840: UDP, length 1109
 00:00:00.001548 IP 192.168.99.1.4840 > 192.168.99.2.4840: UDP, length 1109
 00:00:00.001426 IP 192.168.99.1.4840 > 192.168.99.2.4840: UDP, length 1109
 00:00:00.001305 IP 192.168.99.1.4840 > 192.168.99.2.4840: UDP, length 1109
 00:00:00.001427 IP 192.168.99.1.4840 > 192.168.99.2.4840: UDP, length 1109
 00:00:00.001426 IP 192.168.99.1.4840 > 192.168.99.2.4840: UDP, length 1109
 00:00:00.001305 IP 192.168.99.1.4840 > 192.168.99.2.4840: UDP, length 1109
 00:00:00.001428 IP 192.168.99.1.4840 > 192.168.99.2.4840: UDP, length 1109
 00:00:00.001558 IP 192.168.99.1.4840 > 192.168.99.2.4840: UDP, length 1109
 00:00:00.001423 IP 192.168.99.1.4840 > 192.168.99.2.4840: UDP, length 1109
 00:00:00.001435 IP 192.168.99.1.4840 > 192.168.99.2.4840: UDP, length 1109
 00:00:00.001317 IP 192.168.99.1.4840 > 192.168.99.2.4840: UDP, length 1109
 00:00:00.001424 IP 192.168.99.1.4840 > 192.168.99.2.4840: UDP, length 1109
 00:00:00.001305 IP 192.168.99.1.4840 > 192.168.99.2.4840: UDP, length 1109
 00:00:00.001441 IP 192.168.99.1.4840 > 192.168.99.2.4840: UDP, length 1109
 00:00:00.001295 IP 192.168.99.1.4840 > 192.168.99.2.4840: UDP, length 1109
 00:00:00.001431 IP 192.168.99.1.4840 > 192.168.99.2.4840: UDP, length 1109
 00:00:00.001297 IP 192.168.99.1.4840 > 192.168.99.2.4840: UDP, length 1109
 00:00:00.001431 IP 192.168.99.1.4840 > 192.168.99.2.4840: UDP, length 1109
 00:00:00.001303 IP 192.168.99.1.4840 > 192.168.99.2.4840: UDP, length 1109
 00:00:00.001558 IP 192.168.99.1.4840 > 192.168.99.2.4840: UDP, length 1109
 00:00:00.001173 IP 192.168.99.1.4840 > 192.168.99.2.4840: UDP, length 1109
 00:00:00.001426 IP 192.168.99.1.4840 > 192.168.99.2.4840: UDP, length 1109
 00:00:00.001426 IP 192.168.99.1.4840 > 192.168.99.2.4840: UDP, length 1109
 00:00:00.001308 IP 192.168.99.1.4840 > 192.168.99.2.4840: UDP, length 1109
 00:00:00.001310 IP 192.168.99.1.4840 > 192.168.99.2.4840: UDP, length 1109
 00:00:00.001422 IP 192.168.99.1.4840 > 192.168.99.2.4840: UDP, length 1109
 00:00:00.001424 IP 192.168.99.1.4840 > 192.168.99.2.4840: UDP, length 1109
 00:00:00.001430 IP 192.168.99.1.4840 > 192.168.99.2.4840: UDP, length 1109
 00:00:00.001305 IP 192.168.99.1.4840 > 192.168.99.2.4840: UDP, length 1109
 00:00:00.001428 IP 192.168.99.1.4840 > 192.168.99.2.4840: UDP, length 1109
 00:00:00.001425 IP 192.168.99.1.4840 > 192.168.99.2.4840: UDP, length 1109
 00:00:00.001305 IP 192.168.99.1.4840 > 192.168.99.2.4840: UDP, length 1109
 00:00:00.001428 IP 192.168.99.1.4840 > 192.168.99.2.4840: UDP, length 1109
 00:00:00.001307 IP 192.168.99.1.4840 > 192.168.99.2.4840: UDP, length 1109
 00:00:00.001429 IP 192.168.99.1.4840 > 192.168.99.2.4840: UDP, length 1109
 00:00:00.001424 IP 192.168.99.1.4840 > 192.168.99.2.4840: UDP, length 1109
 00:00:00.001305 IP 192.168.99.1.4840 > 192.168.99.2.4840: UDP, length 1109
 00:00:00.001324 IP 192.168.99.1.4840 > 192.168.99.2.4840: UDP, length 1109
 00:00:00.001406 IP 192.168.99.1.4840 > 192.168.99.2.4840: UDP, length 1109
 00:00:00.001304 IP 192.168.99.1.4840 > 192.168.99.2.4840: UDP, length 1109
 00:00:00.001455 IP 192.168.99.1.4840 > 192.168.99.2.4840: UDP, length 1109
 00:00:00.001401 IP 192.168.99.1.4840 > 192.168.99.2.4840: UDP, length 1109
 00:00:00.001303 IP 192.168.99.1.4840 > 192.168.99.2.4840: UDP, length 1109
 00:00:00.001452 IP 192.168.99.1.4840 > 192.168.99.2.4840: UDP, length 1109
 00:00:00.001282 IP 192.168.99.1.4840 > 192.168.99.2.4840: UDP, length 1109
 00:00:00.001306 IP 192.168.99.1.4840 > 192.168.99.2.4840: UDP, length 1109
 00:00:00.001424 IP 192.168.99.1.4840 > 192.168.99.2.4840: UDP, length 1109
 00:00:00.001306 IP 192.168.99.1.4840 > 192.168.99.2.4840: UDP, length 1109
 00:00:00.001430 IP 192.168.99.1.4840 > 192.168.99.2.4840: UDP, length 1109
 00:00:00.001315 IP 192.168.99.1.4840 > 192.168.99.2.4840: UDP, length 1109
 00:00:00.001414 IP 192.168.99.1.4840 > 192.168.99.2.4840: UDP, length 1109
 00:00:00.001303 IP 192.168.99.1.4840 > 192.168.99.2.4840: UDP, length 1109
 00:00:00.001442 IP 192.168.99.1.4840 > 192.168.99.2.4840: UDP, length 1109
 00:00:00.001415 IP 192.168.99.1.4840 > 192.168.99.2.4840: UDP, length 1109
 00:00:00.001427 IP 192.168.99.1.4840 > 192.168.99.2.4840: UDP, length 1109
 00:00:00.001318 IP 192.168.99.1.4840 > 192.168.99.2.4840: UDP, length 1109
 00:00:00.001414 IP 192.168.99.1.4840 > 192.168.99.2.4840: UDP, length 1109
 00:00:00.001317 IP 192.168.99.1.4840 > 192.168.99.2.4840: UDP, length 1109
 00:00:00.001429 IP 192.168.99.1.4840 > 192.168.99.2.4840: UDP, length 1109
 00:00:00.001414 IP 192.168.99.1.4840 > 192.168.99.2.4840: UDP, length 1109
 00:00:00.001322 IP 192.168.99.1.4840 > 192.168.99.2.4840: UDP, length 1109
 00:00:00.001409 IP 192.168.99.1.4840 > 192.168.99.2.4840: UDP, length 1109
 00:00:00.001301 IP 192.168.99.1.4840 > 192.168.99.2.4840: UDP, length 1109
 00:00:00.001459 IP 192.168.99.1.4840 > 192.168.99.2.4840: UDP, length 1109
 00:00:00.001279 IP 192.168.99.1.4840 > 192.168.99.2.4840: UDP, length 1109
 00:00:00.001423 IP 192.168.99.1.4840 > 192.168.99.2.4840: UDP, length 1109
 00:00:00.001307 IP 192.168.99.1.4840 > 192.168.99.2.4840: UDP, length 1109
 00:00:00.001307 IP 192.168.99.1.4840 > 192.168.99.2.4840: UDP, length 1109
 00:00:00.001426 IP 192.168.99.1.4840 > 192.168.99.2.4840: UDP, length 1109
 00:00:00.001428 IP 192.168.99.1.4840 > 192.168.99.2.4840: UDP, length 1109
 00:00:00.001426 IP 192.168.99.1.4840 > 192.168.99.2.4840: UDP, length 1109
 00:00:00.001305 IP 192.168.99.1.4840 > 192.168.99.2.4840: UDP, length 1109
 00:00:00.001426 IP 192.168.99.1.4840 > 192.168.99.2.4840: UDP, length 1109
 00:00:00.001549 IP 192.168.99.1.4840 > 192.168.99.2.4840: UDP, length 1109
 00:00:00.001428 IP 192.168.99.1.4840 > 192.168.99.2.4840: UDP, length 1109
 00:00:00.001316 IP 192.168.99.1.4840 > 192.168.99.2.4840: UDP, length 1109
 00:00:00.001417 IP 192.168.99.1.4840 > 192.168.99.2.4840: UDP, length 1109
 00:00:00.001322 IP 192.168.99.1.4840 > 192.168.99.2.4840: UDP, length 1109
 00:00:00.001408 IP 192.168.99.1.4840 > 192.168.99.2.4840: UDP, length 1109
 00:00:00.001425 IP 192.168.99.1.4840 > 192.168.99.2.4840: UDP, length 1109
 00:00:00.001429 IP 192.168.99.1.4840 > 192.168.99.2.4840: UDP, length 1109
 00:00:00.001183 IP 192.168.99.1.4840 > 192.168.99.2.4840: UDP, length 1109
 00:00:00.001425 IP 192.168.99.1.4840 > 192.168.99.2.4840: UDP, length 1109
 00:00:00.001464 IP 192.168.99.1.4840 > 192.168.99.2.4840: UDP, length 1109
 00:00:00.001272 IP 192.168.99.1.4840 > 192.168.99.2.4840: UDP, length 1109
 00:00:00.001303 IP 192.168.99.1.4840 > 192.168.99.2.4840: UDP, length 1109
 00:00:00.001427 IP 192.168.99.1.4840 > 192.168.99.2.4840: UDP, length 1109
 00:00:00.001304 IP 192.168.99.1.4840 > 192.168.99.2.4840: UDP, length 1109
 00:00:00.001428 IP 192.168.99.1.4840 > 192.168.99.2.4840: UDP, length 1109
 00:00:00.001318 IP 192.168.99.1.4840 > 192.168.99.2.4840: UDP, length 1109
 00:00:00.001413 IP 192.168.99.1.4840 > 192.168.99.2.4840: UDP, length 1109
 00:00:00.001425 IP 192.168.99.1.4840 > 192.168.99.2.4840: UDP, length 1109
 00:00:00.001321 IP 192.168.99.1.4840 > 192.168.99.2.4840: UDP, length 1109
 00:00:00.001297 IP 192.168.99.1.4840 > 192.168.99.2.4840: UDP, length 1109
 00:00:00.001426 IP 192.168.99.1.4840 > 192.168.99.2.4840: UDP, length 1109
 00:00:00.001302 IP 192.168.99.1.4840 > 192.168.99.2.4840: UDP, length 1109
 00:00:00.001308 IP 192.168.99.1.4840 > 192.168.99.2.4840: UDP, length 1109
 00:00:00.001426 IP 192.168.99.1.4840 > 192.168.99.2.4840: UDP, length 1109
 00:00:00.001313 IP 192.168.99.1.4840 > 192.168.99.2.4840: UDP, length 1109
 00:00:00.001423 IP 192.168.99.1.4840 > 192.168.99.2.4840: UDP, length 1109
 00:00:00.001314 IP 192.168.99.1.4840 > 192.168.99.2.4840: UDP, length 1109
 00:00:00.001440 IP 192.168.99.1.4840 > 192.168.99.2.4840: UDP, length 1109
 00:00:00.001416 IP 192.168.99.1.4840 > 192.168.99.2.4840: UDP, length 1109
 00:00:00.001310 IP 192.168.99.1.4840 > 192.168.99.2.4840: UDP, length 1109
 00:00:00.001299 IP 192.168.99.1.4840 > 192.168.99.2.4840: UDP, length 1109
 00:00:00.001424 IP 192.168.99.1.4840 > 192.168.99.2.4840: UDP, length 1109
 00:00:00.001311 IP 192.168.99.1.4840 > 192.168.99.2.4840: UDP, length 1109
 00:00:00.001424 IP 192.168.99.1.4840 > 192.168.99.2.4840: UDP, length 1109
 00:00:00.001305 IP 192.168.99.1.4840 > 192.168.99.2.4840: UDP, length 1109
 00:00:00.001427 IP 192.168.99.1.4840 > 192.168.99.2.4840: UDP, length 1109
 00:00:00.001305 IP 192.168.99.1.4840 > 192.168.99.2.4840: UDP, length 1109
 00:00:00.001427 IP 192.168.99.1.4840 > 192.168.99.2.4840: UDP, length 1109
 00:00:00.001321 IP 192.168.99.1.4840 > 192.168.99.2.4840: UDP, length 1109
 00:00:00.001412 IP 192.168.99.1.4840 > 192.168.99.2.4840: UDP, length 1109
 00:00:00.001305 IP 192.168.99.1.4840 > 192.168.99.2.4840: UDP, length 1109
 00:00:00.001304 IP 192.168.99.1.4840 > 192.168.99.2.4840: UDP, length 1109
 00:00:00.001428 IP 192.168.99.1.4840 > 192.168.99.2.4840: UDP, length 1109
 00:00:00.001427 IP 192.168.99.1.4840 > 192.168.99.2.4840: UDP, length 1109
 00:00:00.001307 IP 192.168.99.1.4840 > 192.168.99.2.4840: UDP, length 1109
 00:00:00.001424 IP 192.168.99.1.4840 > 192.168.99.2.4840: UDP, length 1109
 00:00:00.001304 IP 192.168.99.1.4840 > 192.168.99.2.4840: UDP, length 1109
 00:00:00.001319 IP 192.168.99.1.4840 > 192.168.99.2.4840: UDP, length 1109
 00:00:00.001413 IP 192.168.99.1.4840 > 192.168.99.2.4840: UDP, length 1109
 00:00:00.001312 IP 192.168.99.1.4840 > 192.168.99.2.4840: UDP, length 1109
 00:00:00.001542 IP 192.168.99.1.4840 > 192.168.99.2.4840: UDP, length 1109
 00:00:00.001186 IP 192.168.99.1.4840 > 192.168.99.2.4840: UDP, length 1109
 00:00:00.001439 IP 192.168.99.1.4840 > 192.168.99.2.4840: UDP, length 1109
 00:00:00.001424 IP 192.168.99.1.4840 > 192.168.99.2.4840: UDP, length 1109
 00:00:00.001298 IP 192.168.99.1.4840 > 192.168.99.2.4840: UDP, length 1109
 00:00:00.001303 IP 192.168.99.1.4840 > 192.168.99.2.4840: UDP, length 1109
 00:00:00.001425 IP 192.168.99.1.4840 > 192.168.99.2.4840: UDP, length 1109
 00:00:00.001317 IP 192.168.99.1.4840 > 192.168.99.2.4840: UDP, length 1109
 00:00:00.001414 IP 192.168.99.1.4840 > 192.168.99.2.4840: UDP, length 1109
 00:00:00.001429 IP 192.168.99.1.4840 > 192.168.99.2.4840: UDP, length 1109
 00:00:00.001305 IP 192.168.99.1.4840 > 192.168.99.2.4840: UDP, length 1109
 00:00:00.001429 IP 192.168.99.1.4840 > 192.168.99.2.4840: UDP, length 1109
 00:00:00.001302 IP 192.168.99.1.4840 > 192.168.99.2.4840: UDP, length 1109
 00:00:00.001306 IP 192.168.99.1.4840 > 192.168.99.2.4840: UDP, length 1109
 00:00:00.001441 IP 192.168.99.1.4840 > 192.168.99.2.4840: UDP, length 1109
 00:00:00.001294 IP 192.168.99.1.4840 > 192.168.99.2.4840: UDP, length 1109
 00:00:00.001303 IP 192.168.99.1.4840 > 192.168.99.2.4840: UDP, length 1109
 00:00:00.001427 IP 192.168.99.1.4840 > 192.168.99.2.4840: UDP, length 1109
 00:00:00.001306 IP 192.168.99.1.4840 > 192.168.99.2.4840: UDP, length 1109
 00:00:00.001426 IP 192.168.99.1.4840 > 192.168.99.2.4840: UDP, length 1109
 00:00:00.001431 IP 192.168.99.1.4840 > 192.168.99.2.4840: UDP, length 1109
 00:00:00.001302 IP 192.168.99.1.4840 > 192.168.99.2.4840: UDP, length 1109
 00:00:00.001427 IP 192.168.99.1.4840 > 192.168.99.2.4840: UDP, length 1109
 00:00:00.001314 IP 192.168.99.1.4840 > 192.168.99.2.4840: UDP, length 1109
 00:00:00.001295 IP 192.168.99.1.4840 > 192.168.99.2.4840: UDP, length 1109
 00:00:00.001435 IP 192.168.99.1.4840 > 192.168.99.2.4840: UDP, length 1109
 00:00:00.001295 IP 192.168.99.1.4840 > 192.168.99.2.4840: UDP, length 1109
 00:00:00.001429 IP 192.168.99.1.4840 > 192.168.99.2.4840: UDP, length 1109
 00:00:00.001549 IP 192.168.99.1.4840 > 192.168.99.2.4840: UDP, length 1109
 00:00:00.001426 IP 192.168.99.1.4840 > 192.168.99.2.4840: UDP, length 1109
 00:00:00.001425 IP 192.168.99.1.4840 > 192.168.99.2.4840: UDP, length 1109
 00:00:00.001450 IP 192.168.99.1.4840 > 192.168.99.2.4840: UDP, length 1109
 00:00:00.002012 IP 192.168.99.1.4840 > 192.168.99.2.4840: UDP, length 1109
 00:00:00.001667 IP 192.168.99.1.4840 > 192.168.99.2.4840: UDP, length 1109
 00:00:00.001443 IP 192.168.99.1.4840 > 192.168.99.2.4840: UDP, length 1109
 00:00:00.001411 IP 192.168.99.1.4840 > 192.168.99.2.4840: UDP, length 1109
 00:00:00.001426 IP 192.168.99.1.4840 > 192.168.99.2.4840: UDP, length 1109
 00:00:00.001438 IP 192.168.99.1.4840 > 192.168.99.2.4840: UDP, length 1109
 00:00:00.001301 IP 192.168.99.1.4840 > 192.168.99.2.4840: UDP, length 1109
 00:00:00.001428 IP 192.168.99.1.4840 > 192.168.99.2.4840: UDP, length 1109
 00:00:00.001316 IP 192.168.99.1.4840 > 192.168.99.2.4840: UDP, length 1109
 00:00:00.001295 IP 192.168.99.1.4840 > 192.168.99.2.4840: UDP, length 1109
 00:00:00.001440 IP 192.168.99.1.4840 > 192.168.99.2.4840: UDP, length 1109
 00:00:00.001305 IP 192.168.99.1.4840 > 192.168.99.2.4840: UDP, length 1109
 00:00:00.001429 IP 192.168.99.1.4840 > 192.168.99.2.4840: UDP, length 1109
 00:00:00.001434 IP 192.168.99.1.4840 > 192.168.99.2.4840: UDP, length 1109
 00:00:00.001296 IP 192.168.99.1.4840 > 192.168.99.2.4840: UDP, length 1109
 00:00:00.001304 IP 192.168.99.1.4840 > 192.168.99.2.4840: UDP, length 1109
 00:00:00.001563 IP 192.168.99.1.4840 > 192.168.99.2.4840: UDP, length 1109
 00:00:00.001182 IP 192.168.99.1.4840 > 192.168.99.2.4840: UDP, length 1109
 00:00:00.001415 IP 192.168.99.1.4840 > 192.168.99.2.4840: UDP, length 1109
 00:00:00.001306 IP 192.168.99.1.4840 > 192.168.99.2.4840: UDP, length 1109
 00:00:00.001443 IP 192.168.99.1.4840 > 192.168.99.2.4840: UDP, length 1109
 00:00:00.001289 IP 192.168.99.1.4840 > 192.168.99.2.4840: UDP, length 1109
 00:00:00.001305 IP 192.168.99.1.4840 > 192.168.99.2.4840: UDP, length 1109
 00:00:00.001428 IP 192.168.99.1.4840 > 192.168.99.2.4840: UDP, length 1109
 00:00:00.001426 IP 192.168.99.1.4840 > 192.168.99.2.4840: UDP, length 1109
 00:00:00.001303 IP 192.168.99.1.4840 > 192.168.99.2.4840: UDP, length 1109
 00:00:00.001451 IP 192.168.99.1.4840 > 192.168.99.2.4840: UDP, length 1109
 00:00:00.001408 IP 192.168.99.1.4840 > 192.168.99.2.4840: UDP, length 1109
 00:00:00.001303 IP 192.168.99.1.4840 > 192.168.99.2.4840: UDP, length 1109
 00:00:00.001303 IP 192.168.99.1.4840 > 192.168.99.2.4840: UDP, length 1109
 00:00:00.001425 IP 192.168.99.1.4840 > 192.168.99.2.4840: UDP, length 1109
 00:00:00.001331 IP 192.168.99.1.4840 > 192.168.99.2.4840: UDP, length 1109
 00:00:00.001282 IP 192.168.99.1.4840 > 192.168.99.2.4840: UDP, length 1109
 00:00:00.001433 IP 192.168.99.1.4840 > 192.168.99.2.4840: UDP, length 1109
 00:00:00.001448 IP 192.168.99.1.4840 > 192.168.99.2.4840: UDP, length 1109
 00:00:00.001409 IP 192.168.99.1.4840 > 192.168.99.2.4840: UDP, length 1109
 00:00:00.001427 IP 192.168.99.1.4840 > 192.168.99.2.4840: UDP, length 1109
 00:00:00.001316 IP 192.168.99.1.4840 > 192.168.99.2.4840: UDP, length 1109
 00:00:00.001416 IP 192.168.99.1.4840 > 192.168.99.2.4840: UDP, length 1109
 00:00:00.001308 IP 192.168.99.1.4840 > 192.168.99.2.4840: UDP, length 1109
 00:00:00.001438 IP 192.168.99.1.4840 > 192.168.99.2.4840: UDP, length 1109
 00:00:00.001293 IP 192.168.99.1.4840 > 192.168.99.2.4840: UDP, length 1109
 00:00:00.001432 IP 192.168.99.1.4840 > 192.168.99.2.4840: UDP, length 1109
 00:00:00.001442 IP 192.168.99.1.4840 > 192.168.99.2.4840: UDP, length 1109
 00:00:00.001292 IP 192.168.99.1.4840 > 192.168.99.2.4840: UDP, length 1109
 00:00:00.001439 IP 192.168.99.1.4840 > 192.168.99.2.4840: UDP, length 1109
 00:00:00.001293 IP 192.168.99.1.4840 > 192.168.99.2.4840: UDP, length 1109
 00:00:00.001426 IP 192.168.99.1.4840 > 192.168.99.2.4840: UDP, length 1109
 00:00:00.001547 IP 192.168.99.1.4840 > 192.168.99.2.4840: UDP, length 1109
 00:00:00.001319 IP 192.168.99.1.4840 > 192.168.99.2.4840: UDP, length 1109
 00:00:00.001289 IP 192.168.99.1.4840 > 192.168.99.2.4840: UDP, length 1109
 00:00:00.001310 IP 192.168.99.1.4840 > 192.168.99.2.4840: UDP, length 1109
 00:00:00.001427 IP 192.168.99.1.4840 > 192.168.99.2.4840: UDP, length 1109
 00:00:00.001311 IP 192.168.99.1.4840 > 192.168.99.2.4840: UDP, length 1109
 00:00:00.001324 IP 192.168.99.1.4840 > 192.168.99.2.4840: UDP, length 1109
 00:00:00.001420 IP 192.168.99.1.4840 > 192.168.99.2.4840: UDP, length 1109
 00:00:00.001415 IP 192.168.99.1.4840 > 192.168.99.2.4840: UDP, length 1109
 00:00:00.001325 IP 192.168.99.1.4840 > 192.168.99.2.4840: UDP, length 1109
 00:00:00.001413 IP 192.168.99.1.4840 > 192.168.99.2.4840: UDP, length 1109
 00:00:00.001427 IP 192.168.99.1.4840 > 192.168.99.2.4840: UDP, length 1109
 00:00:00.001327 IP 192.168.99.1.4840 > 192.168.99.2.4840: UDP, length 1109
 00:00:00.001292 IP 192.168.99.1.4840 > 192.168.99.2.4840: UDP, length 1109
 00:00:00.001434 IP 192.168.99.1.4840 > 192.168.99.2.4840: UDP, length 1109
 00:00:00.001305 IP 192.168.99.1.4840 > 192.168.99.2.4840: UDP, length 1109
 00:00:00.001315 IP 192.168.99.1.4840 > 192.168.99.2.4840: UDP, length 1109
 00:00:00.001417 IP 192.168.99.1.4840 > 192.168.99.2.4840: UDP, length 1109
 00:00:00.001309 IP 192.168.99.1.4840 > 192.168.99.2.4840: UDP, length 1109
 00:00:00.001302 IP 192.168.99.1.4840 > 192.168.99.2.4840: UDP, length 1109
 00:00:00.001427 IP 192.168.99.1.4840 > 192.168.99.2.4840: UDP, length 1109
 00:00:00.001306 IP 192.168.99.1.4840 > 192.168.99.2.4840: UDP, length 1109
 00:00:00.001546 IP 192.168.99.1.4840 > 192.168.99.2.4840: UDP, length 1109
 00:00:00.001305 IP 192.168.99.1.4840 > 192.168.99.2.4840: UDP, length 1109
 00:00:00.001309 IP 192.168.99.1.4840 > 192.168.99.2.4840: UDP, length 1109
 00:00:00.001431 IP 192.168.99.1.4840 > 192.168.99.2.4840: UDP, length 1109
 00:00:00.001309 IP 192.168.99.1.4840 > 192.168.99.2.4840: UDP, length 1109
 00:00:00.001325 IP 192.168.99.1.4840 > 192.168.99.2.4840: UDP, length 1109
 00:00:00.001405 IP 192.168.99.1.4840 > 192.168.99.2.4840: UDP, length 1109
 00:00:00.001545 IP 192.168.99.1.4840 > 192.168.99.2.4840: UDP, length 1109
 00:00:00.001446 IP 192.168.99.1.4840 > 192.168.99.2.4840: UDP, length 1109
 00:00:00.002320 IP 192.168.99.1.4840 > 192.168.99.2.4840: UDP, length 1109
 00:00:00.000644 IP 192.168.99.1.4840 > 192.168.99.2.4840: UDP, length 1109
 00:00:00.001309 IP 192.168.99.1.4840 > 192.168.99.2.4840: UDP, length 1109
 00:00:00.001414 IP 192.168.99.1.4840 > 192.168.99.2.4840: UDP, length 1109
 00:00:00.001427 IP 192.168.99.1.4840 > 192.168.99.2.4840: UDP, length 1109
 00:00:00.001803 IP 192.168.99.1.4840 > 192.168.99.2.4840: UDP, length 1109
 00:00:00.001415 IP 192.168.99.1.4840 > 192.168.99.2.4840: UDP, length 1109
 00:00:00.001426 IP 192.168.99.1.4840 > 192.168.99.2.4840: UDP, length 1109
 00:00:00.001554 IP 192.168.99.1.4840 > 192.168.99.2.4840: UDP, length 1109
 00:00:00.001422 IP 192.168.99.1.4840 > 192.168.99.2.4840: UDP, length 1109
 00:00:00.001568 IP 192.168.99.1.4840 > 192.168.99.2.4840: UDP, length 1109
 00:00:00.001405 IP 192.168.99.1.4840 > 192.168.99.2.4840: UDP, length 1109
 00:00:00.001670 IP 192.168.99.1.4840 > 192.168.99.2.4840: UDP, length 1109
 00:00:00.001668 IP 192.168.99.1.4840 > 192.168.99.2.4840: UDP, length 1109
 00:00:00.001669 IP 192.168.99.1.4840 > 192.168.99.2.4840: UDP, length 1109
 00:00:00.001547 IP 192.168.99.1.4840 > 192.168.99.2.4840: UDP, length 1109
 00:00:00.001669 IP 192.168.99.1.4840 > 192.168.99.2.4840: UDP, length 1109
 00:00:00.001548 IP 192.168.99.1.4840 > 192.168.99.2.4840: UDP, length 1109
 00:00:00.001576 IP 192.168.99.1.4840 > 192.168.99.2.4840: UDP, length 1109
 00:00:00.001521 IP 192.168.99.1.4840 > 192.168.99.2.4840: UDP, length 1109
 00:00:00.001425 IP 192.168.99.1.4840 > 192.168.99.2.4840: UDP, length 1109
 00:00:00.001568 IP 192.168.99.1.4840 > 192.168.99.2.4840: UDP, length 1109
 00:00:00.001546 IP 192.168.99.1.4840 > 192.168.99.2.4840: UDP, length 1109
 00:00:00.001559 IP 192.168.99.1.4840 > 192.168.99.2.4840: UDP, length 1109
 00:00:00.001537 IP 192.168.99.1.4840 > 192.168.99.2.4840: UDP, length 1109
 00:00:00.001429 IP 192.168.99.1.4840 > 192.168.99.2.4840: UDP, length 1109
 00:00:00.001546 IP 192.168.99.1.4840 > 192.168.99.2.4840: UDP, length 1109
 00:00:00.001546 IP 192.168.99.1.4840 > 192.168.99.2.4840: UDP, length 1109
 00:00:00.001563 IP 192.168.99.1.4840 > 192.168.99.2.4840: UDP, length 1109
 00:00:00.001412 IP 192.168.99.1.4840 > 192.168.99.2.4840: UDP, length 1109
 00:00:00.001549 IP 192.168.99.1.4840 > 192.168.99.2.4840: UDP, length 1109
 00:00:00.001546 IP 192.168.99.1.4840 > 192.168.99.2.4840: UDP, length 1109
 00:00:00.001549 IP 192.168.99.1.4840 > 192.168.99.2.4840: UDP, length 1109
 00:00:00.001549 IP 192.168.99.1.4840 > 192.168.99.2.4840: UDP, length 1109
 00:00:00.001450 IP 192.168.99.1.4840 > 192.168.99.2.4840: UDP, length 1109
 00:00:00.001645 IP 192.168.99.1.4840 > 192.168.99.2.4840: UDP, length 1109
 00:00:00.001423 IP 192.168.99.1.4840 > 192.168.99.2.4840: UDP, length 1109
 00:00:00.001561 IP 192.168.99.1.4840 > 192.168.99.2.4840: UDP, length 1109
 00:00:00.001535 IP 192.168.99.1.4840 > 192.168.99.2.4840: UDP, length 1109
 00:00:00.001446 IP 192.168.99.1.4840 > 192.168.99.2.4840: UDP, length 1109
 00:00:00.001529 IP 192.168.99.1.4840 > 192.168.99.2.4840: UDP, length 1109
 00:00:00.001553 IP 192.168.99.1.4840 > 192.168.99.2.4840: UDP, length 1109
 00:00:00.001437 IP 192.168.99.1.4840 > 192.168.99.2.4840: UDP, length 1109
 00:00:00.001561 IP 192.168.99.1.4840 > 192.168.99.2.4840: UDP, length 1109
 00:00:00.001536 IP 192.168.99.1.4840 > 192.168.99.2.4840: UDP, length 1109
 00:00:00.001679 IP 192.168.99.1.4840 > 192.168.99.2.4840: UDP, length 1109
 00:00:00.001415 IP 192.168.99.1.4840 > 192.168.99.2.4840: UDP, length 1109
 00:00:00.001430 IP 192.168.99.1.4840 > 192.168.99.2.4840: UDP, length 1109
 00:00:00.001424 IP 192.168.99.1.4840 > 192.168.99.2.4840: UDP, length 1109
 00:00:00.001425 IP 192.168.99.1.4840 > 192.168.99.2.4840: UDP, length 1109
 00:00:00.001306 IP 192.168.99.1.4840 > 192.168.99.2.4840: UDP, length 1109
 00:00:00.001431 IP 192.168.99.1.4840 > 192.168.99.2.4840: UDP, length 1109
 00:00:00.001429 IP 192.168.99.1.4840 > 192.168.99.2.4840: UDP, length 1109
 00:00:00.001301 IP 192.168.99.1.4840 > 192.168.99.2.4840: UDP, length 1109
 00:00:00.001427 IP 192.168.99.1.4840 > 192.168.99.2.4840: UDP, length 1109
 00:00:00.001428 IP 192.168.99.1.4840 > 192.168.99.2.4840: UDP, length 1109
 00:00:00.001439 IP 192.168.99.1.4840 > 192.168.99.2.4840: UDP, length 1109
 00:00:00.001289 IP 192.168.99.1.4840 > 192.168.99.2.4840: UDP, length 1109
 00:00:00.001429 IP 192.168.99.1.4840 > 192.168.99.2.4840: UDP, length 1109
 00:00:00.001546 IP 192.168.99.1.4840 > 192.168.99.2.4840: UDP, length 1109
 00:00:00.001186 IP 192.168.99.1.4840 > 192.168.99.2.4840: UDP, length 1109
 00:00:00.001425 IP 192.168.99.1.4840 > 192.168.99.2.4840: UDP, length 1109
 00:00:00.001307 IP 192.168.99.1.4840 > 192.168.99.2.4840: UDP, length 1109
 00:00:00.001425 IP 192.168.99.1.4840 > 192.168.99.2.4840: UDP, length 1109
 00:00:00.001309 IP 192.168.99.1.4840 > 192.168.99.2.4840: UDP, length 1109
 00:00:00.001423 IP 192.168.99.1.4840 > 192.168.99.2.4840: UDP, length 1109
 00:00:00.001306 IP 192.168.99.1.4840 > 192.168.99.2.4840: UDP, length 1109
 00:00:00.001308 IP 192.168.99.1.4840 > 192.168.99.2.4840: UDP, length 1109
 00:00:00.001446 IP 192.168.99.1.4840 > 192.168.99.2.4840: UDP, length 1109
 00:00:00.001406 IP 192.168.99.1.4840 > 192.168.99.2.4840: UDP, length 1109
 00:00:00.001426 IP 192.168.99.1.4840 > 192.168.99.2.4840: UDP, length 1109
 00:00:00.001327 IP 192.168.99.1.4840 > 192.168.99.2.4840: UDP, length 1109
 00:00:00.001285 IP 192.168.99.1.4840 > 192.168.99.2.4840: UDP, length 1109
 00:00:00.001435 IP 192.168.99.1.4840 > 192.168.99.2.4840: UDP, length 1109
 00:00:00.001432 IP 192.168.99.1.4840 > 192.168.99.2.4840: UDP, length 1109
 00:00:00.001291 IP 192.168.99.1.4840 > 192.168.99.2.4840: UDP, length 1109
 00:00:00.001442 IP 192.168.99.1.4840 > 192.168.99.2.4840: UDP, length 1109
 00:00:00.001292 IP 192.168.99.1.4840 > 192.168.99.2.4840: UDP, length 1109
 00:00:00.001549 IP 192.168.99.1.4840 > 192.168.99.2.4840: UDP, length 1109
 00:00:00.001338 IP 192.168.99.1.4840 > 192.168.99.2.4840: UDP, length 1109
 00:00:00.001270 IP 192.168.99.1.4840 > 192.168.99.2.4840: UDP, length 1109
 00:00:00.001428 IP 192.168.99.1.4840 > 192.168.99.2.4840: UDP, length 1109
 00:00:00.001303 IP 192.168.99.1.4840 > 192.168.99.2.4840: UDP, length 1109
 00:00:00.001319 IP 192.168.99.1.4840 > 192.168.99.2.4840: UDP, length 1109
 00:00:00.001533 IP 192.168.99.1.4840 > 192.168.99.2.4840: UDP, length 1109
 00:00:00.001309 IP 192.168.99.1.4840 > 192.168.99.2.4840: UDP, length 1109
 00:00:00.001424 IP 192.168.99.1.4840 > 192.168.99.2.4840: UDP, length 1109
 00:00:00.001306 IP 192.168.99.1.4840 > 192.168.99.2.4840: UDP, length 1109
 00:00:00.001427 IP 192.168.99.1.4840 > 192.168.99.2.4840: UDP, length 1109
 00:00:00.001309 IP 192.168.99.1.4840 > 192.168.99.2.4840: UDP, length 1109
 00:00:00.001301 IP 192.168.99.1.4840 > 192.168.99.2.4840: UDP, length 1109
 00:00:00.001446 IP 192.168.99.1.4840 > 192.168.99.2.4840: UDP, length 1109
 00:00:00.001287 IP 192.168.99.1.4840 > 192.168.99.2.4840: UDP, length 1109
 00:00:00.001306 IP 192.168.99.1.4840 > 192.168.99.2.4840: UDP, length 1109
 00:00:00.001426 IP 192.168.99.1.4840 > 192.168.99.2.4840: UDP, length 1109
 00:00:00.001427 IP 192.168.99.1.4840 > 192.168.99.2.4840: UDP, length 1109
 00:00:00.001433 IP 192.168.99.1.4840 > 192.168.99.2.4840: UDP, length 1109
 00:00:00.001674 IP 192.168.99.1.4840 > 192.168.99.2.4840: UDP, length 1109
 00:00:00.001539 IP 192.168.99.1.4840 > 192.168.99.2.4840: UDP, length 1109
 00:00:00.001546 IP 192.168.99.1.4840 > 192.168.99.2.4840: UDP, length 1109
 00:00:00.001668 IP 192.168.99.1.4840 > 192.168.99.2.4840: UDP, length 1109
 00:00:00.001550 IP 192.168.99.1.4840 > 192.168.99.2.4840: UDP, length 1109
 00:00:00.001575 IP 192.168.99.1.4840 > 192.168.99.2.4840: UDP, length 1109
 00:00:00.001520 IP 192.168.99.1.4840 > 192.168.99.2.4840: UDP, length 1109
 00:00:00.001548 IP 192.168.99.1.4840 > 192.168.99.2.4840: UDP, length 1109
 00:00:00.001562 IP 192.168.99.1.4840 > 192.168.99.2.4840: UDP, length 1109
 00:00:00.001531 IP 192.168.99.1.4840 > 192.168.99.2.4840: UDP, length 1109
 00:00:00.001444 IP 192.168.99.1.4840 > 192.168.99.2.4840: UDP, length 1109
 00:00:00.001666 IP 192.168.99.1.4840 > 192.168.99.2.4840: UDP, length 1109
 00:00:00.001538 IP 192.168.99.1.4840 > 192.168.99.2.4840: UDP, length 1109
 00:00:00.001300 IP 192.168.99.1.4840 > 192.168.99.2.4840: UDP, length 1109
 00:00:00.001427 IP 192.168.99.1.4840 > 192.168.99.2.4840: UDP, length 1109
 00:00:00.001428 IP 192.168.99.1.4840 > 192.168.99.2.4840: UDP, length 1109
 00:00:00.001453 IP 192.168.99.1.4840 > 192.168.99.2.4840: UDP, length 1109
 00:00:00.001641 IP 192.168.99.1.4840 > 192.168.99.2.4840: UDP, length 1109
 00:00:00.001546 IP 192.168.99.1.4840 > 192.168.99.2.4840: UDP, length 1109
 00:00:00.001552 IP 192.168.99.1.4840 > 192.168.99.2.4840: UDP, length 1109
 00:00:00.001546 IP 192.168.99.1.4840 > 192.168.99.2.4840: UDP, length 1109
 00:00:00.001556 IP 192.168.99.1.4840 > 192.168.99.2.4840: UDP, length 1109
 00:00:00.001541 IP 192.168.99.1.4840 > 192.168.99.2.4840: UDP, length 1109
 00:00:00.001426 IP 192.168.99.1.4840 > 192.168.99.2.4840: UDP, length 1109
 00:00:00.001547 IP 192.168.99.1.4840 > 192.168.99.2.4840: UDP, length 1109
 00:00:00.001562 IP 192.168.99.1.4840 > 192.168.99.2.4840: UDP, length 1109
 00:00:00.001536 IP 192.168.99.1.4840 > 192.168.99.2.4840: UDP, length 1109
 00:00:00.001544 IP 192.168.99.1.4840 > 192.168.99.2.4840: UDP, length 1109
 00:00:00.001547 IP 192.168.99.1.4840 > 192.168.99.2.4840: UDP, length 1109
 00:00:00.001550 IP 192.168.99.1.4840 > 192.168.99.2.4840: UDP, length 1109
 00:00:00.001553 IP 192.168.99.1.4840 > 192.168.99.2.4840: UDP, length 1109
 00:00:00.001559 IP 192.168.99.1.4840 > 192.168.99.2.4840: UDP, length 1109
 00:00:00.001461 IP 192.168.99.1.4840 > 192.168.99.2.4840: UDP, length 1109
 00:00:00.001548 IP 192.168.99.1.4840 > 192.168.99.2.4840: UDP, length 1109
 00:00:00.001546 IP 192.168.99.1.4840 > 192.168.99.2.4840: UDP, length 1109
 00:00:00.001548 IP 192.168.99.1.4840 > 192.168.99.2.4840: UDP, length 1109
 00:00:00.001556 IP 192.168.99.1.4840 > 192.168.99.2.4840: UDP, length 1109
 00:00:00.001541 IP 192.168.99.1.4840 > 192.168.99.2.4840: UDP, length 1109
 00:00:00.001426 IP 192.168.99.1.4840 > 192.168.99.2.4840: UDP, length 1109
 00:00:00.001547 IP 192.168.99.1.4840 > 192.168.99.2.4840: UDP, length 1109
 00:00:00.001549 IP 192.168.99.1.4840 > 192.168.99.2.4840: UDP, length 1109
 00:00:00.001428 IP 192.168.99.1.4840 > 192.168.99.2.4840: UDP, length 1109
 00:00:00.001575 IP 192.168.99.1.4840 > 192.168.99.2.4840: UDP, length 1109
 00:00:00.001517 IP 192.168.99.1.4840 > 192.168.99.2.4840: UDP, length 1109
 00:00:00.001428 IP 192.168.99.1.4840 > 192.168.99.2.4840: UDP, length 1109
 00:00:00.001549 IP 192.168.99.1.4840 > 192.168.99.2.4840: UDP, length 1109
 00:00:00.001548 IP 192.168.99.1.4840 > 192.168.99.2.4840: UDP, length 1109
 00:00:00.001555 IP 192.168.99.1.4840 > 192.168.99.2.4840: UDP, length 1109
 00:00:00.001782 IP 192.168.99.1.4840 > 192.168.99.2.4840: UDP, length 1109
 00:00:00.001426 IP 192.168.99.1.4840 > 192.168.99.2.4840: UDP, length 1109
 00:00:00.001449 IP 192.168.99.1.4840 > 192.168.99.2.4840: UDP, length 1109
 00:00:00.001285 IP 192.168.99.1.4840 > 192.168.99.2.4840: UDP, length 1109
 00:00:00.001427 IP 192.168.99.1.4840 > 192.168.99.2.4840: UDP, length 1109
 00:00:00.001446 IP 192.168.99.1.4840 > 192.168.99.2.4840: UDP, length 1109
 00:00:00.001283 IP 192.168.99.1.4840 > 192.168.99.2.4840: UDP, length 1109
 00:00:00.001307 IP 192.168.99.1.4840 > 192.168.99.2.4840: UDP, length 1109
 00:00:00.001429 IP 192.168.99.1.4840 > 192.168.99.2.4840: UDP, length 1109
 00:00:00.001301 IP 192.168.99.1.4840 > 192.168.99.2.4840: UDP, length 1109
 00:00:00.001429 IP 192.168.99.1.4840 > 192.168.99.2.4840: UDP, length 1109
 00:00:00.001326 IP 192.168.99.1.4840 > 192.168.99.2.4840: UDP, length 1109
 00:00:00.001285 IP 192.168.99.1.4840 > 192.168.99.2.4840: UDP, length 1109
 00:00:00.001454 IP 192.168.99.1.4840 > 192.168.99.2.4840: UDP, length 1109
 00:00:00.001279 IP 192.168.99.1.4840 > 192.168.99.2.4840: UDP, length 1109
 00:00:00.001425 IP 192.168.99.1.4840 > 192.168.99.2.4840: UDP, length 1109
 00:00:00.001306 IP 192.168.99.1.4840 > 192.168.99.2.4840: UDP, length 1109
 00:00:00.001318 IP 192.168.99.1.4840 > 192.168.99.2.4840: UDP, length 1109
 00:00:00.001414 IP 192.168.99.1.4840 > 192.168.99.2.4840: UDP, length 1109
 00:00:00.001324 IP 192.168.99.1.4840 > 192.168.99.2.4840: UDP, length 1109
 00:00:00.001287 IP 192.168.99.1.4840 > 192.168.99.2.4840: UDP, length 1109
 00:00:00.001428 IP 192.168.99.1.4840 > 192.168.99.2.4840: UDP, length 1109
 00:00:00.001446 IP 192.168.99.1.4840 > 192.168.99.2.4840: UDP, length 1109
 00:00:00.001283 IP 192.168.99.1.4840 > 192.168.99.2.4840: UDP, length 1109
 00:00:00.001310 IP 192.168.99.1.4840 > 192.168.99.2.4840: UDP, length 1109
 00:00:00.001422 IP 192.168.99.1.4840 > 192.168.99.2.4840: UDP, length 1109
 00:00:00.001306 IP 192.168.99.1.4840 > 192.168.99.2.4840: UDP, length 1109
 00:00:00.001550 IP 192.168.99.1.4840 > 192.168.99.2.4840: UDP, length 1109
 00:00:00.001461 IP 192.168.99.1.4840 > 192.168.99.2.4840: UDP, length 1109
 00:00:00.001392 IP 192.168.99.1.4840 > 192.168.99.2.4840: UDP, length 1109
 00:00:00.001424 IP 192.168.99.1.4840 > 192.168.99.2.4840: UDP, length 1109
 00:00:00.001431 IP 192.168.99.1.4840 > 192.168.99.2.4840: UDP, length 1109
 00:00:00.001423 IP 192.168.99.1.4840 > 192.168.99.2.4840: UDP, length 1109
 00:00:00.001305 IP 192.168.99.1.4840 > 192.168.99.2.4840: UDP, length 1109
 00:00:00.001426 IP 192.168.99.1.4840 > 192.168.99.2.4840: UDP, length 1109
 00:00:00.001551 IP 192.168.99.1.4840 > 192.168.99.2.4840: UDP, length 1109
 00:00:00.001427 IP 192.168.99.1.4840 > 192.168.99.2.4840: UDP, length 1109
 00:00:00.001424 IP 192.168.99.1.4840 > 192.168.99.2.4840: UDP, length 1109
 00:00:00.001305 IP 192.168.99.1.4840 > 192.168.99.2.4840: UDP, length 1109
 00:00:00.001569 IP 192.168.99.1.4840 > 192.168.99.2.4840: UDP, length 1109
 00:00:00.001181 IP 192.168.99.1.4840 > 192.168.99.2.4840: UDP, length 1109
 00:00:00.001414 IP 192.168.99.1.4840 > 192.168.99.2.4840: UDP, length 1109
 00:00:00.001425 IP 192.168.99.1.4840 > 192.168.99.2.4840: UDP, length 1109
 00:00:00.001305 IP 192.168.99.1.4840 > 192.168.99.2.4840: UDP, length 1109
 00:00:00.001304 IP 192.168.99.1.4840 > 192.168.99.2.4840: UDP, length 1109
 00:00:00.001447 IP 192.168.99.1.4840 > 192.168.99.2.4840: UDP, length 1109
 00:00:00.001405 IP 192.168.99.1.4840 > 192.168.99.2.4840: UDP, length 1109
 00:00:00.001430 IP 192.168.99.1.4840 > 192.168.99.2.4840: UDP, length 1109
 00:00:00.001322 IP 192.168.99.1.4840 > 192.168.99.2.4840: UDP, length 1109
 00:00:00.001408 IP 192.168.99.1.4840 > 192.168.99.2.4840: UDP, length 1109
 00:00:00.001304 IP 192.168.99.1.4840 > 192.168.99.2.4840: UDP, length 1109
 00:00:00.001448 IP 192.168.99.1.4840 > 192.168.99.2.4840: UDP, length 1109
 00:00:00.001286 IP 192.168.99.1.4840 > 192.168.99.2.4840: UDP, length 1109
 00:00:00.001433 IP 192.168.99.1.4840 > 192.168.99.2.4840: UDP, length 1109
 00:00:00.001432 IP 192.168.99.1.4840 > 192.168.99.2.4840: UDP, length 1109
 00:00:00.001412 IP 192.168.99.1.4840 > 192.168.99.2.4840: UDP, length 1109
 00:00:00.001322 IP 192.168.99.1.4840 > 192.168.99.2.4840: UDP, length 1109
 00:00:00.001291 IP 192.168.99.1.4840 > 192.168.99.2.4840: UDP, length 1109
 00:00:00.001427 IP 192.168.99.1.4840 > 192.168.99.2.4840: UDP, length 1109
 00:00:00.001305 IP 192.168.99.1.4840 > 192.168.99.2.4840: UDP, length 1109
 00:00:00.001427 IP 192.168.99.1.4840 > 192.168.99.2.4840: UDP, length 1109
 00:00:00.001305 IP 192.168.99.1.4840 > 192.168.99.2.4840: UDP, length 1109
 00:00:00.001428 IP 192.168.99.1.4840 > 192.168.99.2.4840: UDP, length 1109
 00:00:00.001424 IP 192.168.99.1.4840 > 192.168.99.2.4840: UDP, length 1109
 00:00:00.001307 IP 192.168.99.1.4840 > 192.168.99.2.4840: UDP, length 1109
 00:00:00.001425 IP 192.168.99.1.4840 > 192.168.99.2.4840: UDP, length 1109
 00:00:00.001427 IP 192.168.99.1.4840 > 192.168.99.2.4840: UDP, length 1109
 00:00:00.001306 IP 192.168.99.1.4840 > 192.168.99.2.4840: UDP, length 1109
 00:00:00.001325 IP 192.168.99.1.4840 > 192.168.99.2.4840: UDP, length 1109
 00:00:00.001288 IP 192.168.99.1.4840 > 192.168.99.2.4840: UDP, length 1109
 00:00:00.001424 IP 192.168.99.1.4840 > 192.168.99.2.4840: UDP, length 1109
 00:00:00.001311 IP 192.168.99.1.4840 > 192.168.99.2.4840: UDP, length 1109
 00:00:00.001440 IP 192.168.99.1.4840 > 192.168.99.2.4840: UDP, length 1109
 00:00:00.001546 IP 192.168.99.1.4840 > 192.168.99.2.4840: UDP, length 1109
 00:00:00.001333 IP 192.168.99.1.4840 > 192.168.99.2.4840: UDP, length 1109
 00:00:00.001277 IP 192.168.99.1.4840 > 192.168.99.2.4840: UDP, length 1109
 00:00:00.001429 IP 192.168.99.1.4840 > 192.168.99.2.4840: UDP, length 1109
 00:00:00.001305 IP 192.168.99.1.4840 > 192.168.99.2.4840: UDP, length 1109
 00:00:00.001426 IP 192.168.99.1.4840 > 192.168.99.2.4840: UDP, length 1109
 00:00:00.001426 IP 192.168.99.1.4840 > 192.168.99.2.4840: UDP, length 1109
 00:00:00.001457 IP 192.168.99.1.4840 > 192.168.99.2.4840: UDP, length 1109
 00:00:00.001276 IP 192.168.99.1.4840 > 192.168.99.2.4840: UDP, length 1109
 00:00:00.001442 IP 192.168.99.1.4840 > 192.168.99.2.4840: UDP, length 1109
 00:00:00.001291 IP 192.168.99.1.4840 > 192.168.99.2.4840: UDP, length 1109
 00:00:00.001425 IP 192.168.99.1.4840 > 192.168.99.2.4840: UDP, length 1109
 00:00:00.001435 IP 192.168.99.1.4840 > 192.168.99.2.4840: UDP, length 1109
 00:00:00.001431 IP 192.168.99.1.4840 > 192.168.99.2.4840: UDP, length 1109
 00:00:00.001293 IP 192.168.99.1.4840 > 192.168.99.2.4840: UDP, length 1109
 00:00:00.001448 IP 192.168.99.1.4840 > 192.168.99.2.4840: UDP, length 1109
 00:00:00.001415 IP 192.168.99.1.4840 > 192.168.99.2.4840: UDP, length 1109
 00:00:00.001297 IP 192.168.99.1.4840 > 192.168.99.2.4840: UDP, length 1109
 00:00:00.001448 IP 192.168.99.1.4840 > 192.168.99.2.4840: UDP, length 1109
 00:00:00.001405 IP 192.168.99.1.4840 > 192.168.99.2.4840: UDP, length 1109
 00:00:00.001306 IP 192.168.99.1.4840 > 192.168.99.2.4840: UDP, length 1109
 00:00:00.001302 IP 192.168.99.1.4840 > 192.168.99.2.4840: UDP, length 1109
 00:00:00.001428 IP 192.168.99.1.4840 > 192.168.99.2.4840: UDP, length 1109
 00:00:00.001306 IP 192.168.99.1.4840 > 192.168.99.2.4840: UDP, length 1109
 00:00:00.001424 IP 192.168.99.1.4840 > 192.168.99.2.4840: UDP, length 1109
 00:00:00.001307 IP 192.168.99.1.4840 > 192.168.99.2.4840: UDP, length 1109
 00:00:00.001426 IP 192.168.99.1.4840 > 192.168.99.2.4840: UDP, length 1109
 00:00:00.001331 IP 192.168.99.1.4840 > 192.168.99.2.4840: UDP, length 1109
 00:00:00.001402 IP 192.168.99.1.4840 > 192.168.99.2.4840: UDP, length 1109
 00:00:00.001426 IP 192.168.99.1.4840 > 192.168.99.2.4840: UDP, length 1109
 00:00:00.001561 IP 192.168.99.1.4840 > 192.168.99.2.4840: UDP, length 1109
 00:00:00.001535 IP 192.168.99.1.4840 > 192.168.99.2.4840: UDP, length 1109
 00:00:00.001682 IP 192.168.99.1.4840 > 192.168.99.2.4840: UDP, length 1109
 00:00:00.001673 IP 192.168.99.1.4840 > 192.168.99.2.4840: UDP, length 1109
 00:00:00.001410 IP 192.168.99.1.4840 > 192.168.99.2.4840: UDP, length 1109
 00:00:00.001429 IP 192.168.99.1.4840 > 192.168.99.2.4840: UDP, length 1109
 00:00:00.001424 IP 192.168.99.1.4840 > 192.168.99.2.4840: UDP, length 1109
 00:00:00.001308 IP 192.168.99.1.4840 > 192.168.99.2.4840: UDP, length 1109
 00:00:00.001335 IP 192.168.99.1.4840 > 192.168.99.2.4840: UDP, length 1109
 00:00:00.001516 IP 192.168.99.1.4840 > 192.168.99.2.4840: UDP, length 1109
 00:00:00.001425 IP 192.168.99.1.4840 > 192.168.99.2.4840: UDP, length 1109
 00:00:00.001307 IP 192.168.99.1.4840 > 192.168.99.2.4840: UDP, length 1109
 00:00:00.001425 IP 192.168.99.1.4840 > 192.168.99.2.4840: UDP, length 1109
 00:00:00.001306 IP 192.168.99.1.4840 > 192.168.99.2.4840: UDP, length 1109
 00:00:00.001429 IP 192.168.99.1.4840 > 192.168.99.2.4840: UDP, length 1109
 00:00:00.001304 IP 192.168.99.1.4840 > 192.168.99.2.4840: UDP, length 1109
 00:00:00.001426 IP 192.168.99.1.4840 > 192.168.99.2.4840: UDP, length 1109
 00:00:00.001321 IP 192.168.99.1.4840 > 192.168.99.2.4840: UDP, length 1109
 00:00:00.001291 IP 192.168.99.1.4840 > 192.168.99.2.4840: UDP, length 1109
 00:00:00.001437 IP 192.168.99.1.4840 > 192.168.99.2.4840: UDP, length 1109
 00:00:00.001295 IP 192.168.99.1.4840 > 192.168.99.2.4840: UDP, length 1109
 00:00:00.001425 IP 192.168.99.1.4840 > 192.168.99.2.4840: UDP, length 1109
 00:00:00.001306 IP 192.168.99.1.4840 > 192.168.99.2.4840: UDP, length 1109
 00:00:00.001427 IP 192.168.99.1.4840 > 192.168.99.2.4840: UDP, length 1109
 00:00:00.001427 IP 192.168.99.1.4840 > 192.168.99.2.4840: UDP, length 1109
 00:00:00.001307 IP 192.168.99.1.4840 > 192.168.99.2.4840: UDP, length 1109
 00:00:00.001303 IP 192.168.99.1.4840 > 192.168.99.2.4840: UDP, length 1109
 00:00:00.001428 IP 192.168.99.1.4840 > 192.168.99.2.4840: UDP, length 1109
 00:00:00.001328 IP 192.168.99.1.4840 > 192.168.99.2.4840: UDP, length 1109
 00:00:00.001403 IP 192.168.99.1.4840 > 192.168.99.2.4840: UDP, length 1109
 00:00:00.001305 IP 192.168.99.1.4840 > 192.168.99.2.4840: UDP, length 1109
 00:00:00.001448 IP 192.168.99.1.4840 > 192.168.99.2.4840: UDP, length 1109
 00:00:00.001405 IP 192.168.99.1.4840 > 192.168.99.2.4840: UDP, length 1109
 00:00:00.001186 IP 192.168.99.1.4840 > 192.168.99.2.4840: UDP, length 1109
 00:00:00.001426 IP 192.168.99.1.4840 > 192.168.99.2.4840: UDP, length 1109
 00:00:00.001428 IP 192.168.99.1.4840 > 192.168.99.2.4840: UDP, length 1109
 00:00:00.001305 IP 192.168.99.1.4840 > 192.168.99.2.4840: UDP, length 1109
 00:00:00.001320 IP 192.168.99.1.4840 > 192.168.99.2.4840: UDP, length 1109
 00:00:00.001413 IP 192.168.99.1.4840 > 192.168.99.2.4840: UDP, length 1109
 00:00:00.001305 IP 192.168.99.1.4840 > 192.168.99.2.4840: UDP, length 1109
 00:00:00.001439 IP 192.168.99.1.4840 > 192.168.99.2.4840: UDP, length 1109
