 00:00:00.000000 IP 192.168.99.1.4840 > 192.168.99.2.4840: UDP, length 1109
 00:00:00.001305 IP 192.168.99.1.4840 > 192.168.99.2.4840: UDP, length 1109
 00:00:00.001427 IP 192.168.99.1.4840 > 192.168.99.2.4840: UDP, length 1109
 00:00:00.001427 IP 192.168.99.1.4840 > 192.168.99.2.4840: UDP, length 1109
 00:00:00.001305 IP 192.168.99.1.4840 > 192.168.99.2.4840: UDP, length 1109
 00:00:00.001427 IP 192.168.99.1.4840 > 192.168.99.2.4840: UDP, length 1109
 00:00:00.001311 IP 192.168.99.1.4840 > 192.168.99.2.4840: UDP, length 1109
 00:00:00.001427 IP 192.168.99.1.4840 > 192.168.99.2.4840: UDP, length 1109
 00:00:00.001427 IP 192.168.99.1.4840 > 192.168.99.2.4840: UDP, length 1109
 00:00:00.001306 IP 192.168.99.1.4840 > 192.168.99.2.4840: UDP, length 1109
 00:00:00.001428 IP 192.168.99.1.4840 > 192.168.99.2.4840: UDP, length 1109
 00:00:00.001303 IP 192.168.99.1.4840 > 192.168.99.2.4840: UDP, length 1109
 00:00:00.001305 IP 192.168.99.1.4840 > 192.168.99.2.4840: UDP, length 1109
 00:00:00.001441 IP 192.168.99.1.4840 > 192.168.99.2.4840: UDP, length 1109
 00:00:00.001292 IP 192.168.99.1.4840 > 192.168.99.2.4840: UDP, length 1109
 00:00:00.001305 IP 192.168.99.1.4840 > 192.168.99.2.4840: UDP, length 1109
 00:00:00.001427 IP 192.168.99.1.4840 > 192.168.99.2.4840: UDP, length 1109
 00:00:00.001306 IP 192.168.99.1.4840 > 192.168.99.2.4840: UDP, length 1109
 00:00:00.001327 IP 192.168.99.1.4840 > 192.168.99.2.4840: UDP, length 1109
 00:00:00.001416 IP 192.168.99.1.4840 > 192.168.99.2.4840: UDP, length 1109
 00:00:00.001311 IP 192.168.99.1.4840 > 192.168.99.2.4840: UDP, length 1109
 00:00:00.001437 IP 192.168.99.1.4840 > 192.168.99.2.4840: UDP, length 1109
 00:00:00.001279 IP 192.168.99.1.4840 > 192.168.99.2.4840: UDP, length 1109
 00:00:00.001303 IP 192.168.99.1.4840 > 192.168.99.2.4840: UDP, length 1109
 00:00:00.001430 IP 192.168.99.1.4840 > 192.168.99.2.4840: UDP, length 1109
 00:00:00.001430 IP 192.168.99.1.4840 > 192.168.99.2.4840: UDP, length 1109
 00:00:00.001300 IP 192.168.99.1.4840 > 192.168.99.2.4840: UDP, length 1109
 00:00:00.001425 IP 192.168.99.1.4840 > 192.168.99.2.4840: UDP, length 1109
 00:00:00.001306 IP 192.168.99.1.4840 > 192.168.99.2.4840: UDP, length 1109
 00:00:00.001306 IP 192.168.99.1.4840 > 192.168.99.2.4840: UDP, length 1109
 00:00:00.001464 IP 192.168.99.1.4840 > 192.168.99.2.4840: UDP, length 1109
 00:00:00.001282 IP 192.168.99.1.4840 > 192.168.99.2.4840: UDP, length 1109
 00:00:00.001430 IP 192.168.99.1.4840 > 192.168.99.2.4840: UDP, length 1109
 00:00:00.001455 IP 192.168.99.1.4840 > 192.168.99.2.4840: UDP, length 1109
 00:00:00.001278 IP 192.168.99.1.4840 > 192.168.99.2.4840: UDP, length 1109
 00:00:00.001424 IP 192.168.99.1.4840 > 192.168.99.2.4840: UDP, length 1109
 00:00:00.001305 IP 192.168.99.1.4840 > 192.168.99.2.4840: UDP, length 1109
 00:00:00.001309 IP 192.168.99.1.4840 > 192.168.99.2.4840: UDP, length 1109
 00:00:00.001545 IP 192.168.99.1.4840 > 192.168.99.2.4840: UDP, length 1109
 00:00:00.001306 IP 192.168.99.1.4840 > 192.168.99.2.4840: UDP, length 1109
 00:00:00.001305 IP 192.168.99.1.4840 > 192.168.99.2.4840: UDP, length 1109
 00:00:00.001429 IP 192.168.99.1.4840 > 192.168.99.2.4840: UDP, length 1109
 00:00:00.001318 IP 192.168.99.1.4840 > 192.168.99.2.4840: UDP, length 1109
 00:00:00.001538 IP 192.168.99.1.4840 > 192.168.99.2.4840: UDP, length 1109
 00:00:00.001302 IP 192.168.99.1.4840 > 192.168.99.2.4840: UDP, length 1109
 00:00:00.001318 IP 192.168.99.1.4840 > 192.168.99.2.4840: UDP, length 1109
 00:00:00.001416 IP 192.168.99.1.4840 > 192.168.99.2.4840: UDP, length 1109
 00:00:00.001319 IP 192.168.99.1.4840 > 192.168.99.2.4840: UDP, length 1109
 00:00:00.001429 IP 192.168.99.1.4840 > 192.168.99.2.4840: UDP, length 1109
 00:00:00.001410 IP 192.168.99.1.4840 > 192.168.99.2.4840: UDP, length 1109
 00:00:00.001320 IP 192.168.99.1.4840 > 192.168.99.2.4840: UDP, length 1109
 00:00:00.001425 IP 192.168.99.1.4840 > 192.168.99.2.4840: UDP, length 1109
 00:00:00.001291 IP 192.168.99.1.4840 > 192.168.99.2.4840: UDP, length 1109
 00:00:00.001306 IP 192.168.99.1.4840 > 192.168.99.2.4840: UDP, length 1109
 00:00:00.001548 IP 192.168.99.1.4840 > 192.168.99.2.4840: UDP, length 1109
 00:00:00.001310 IP 192.168.99.1.4840 > 192.168.99.2.4840: UDP, length 1109
 00:00:00.001300 IP 192.168.99.1.4840 > 192.168.99.2.4840: UDP, length 1109
 00:00:00.001427 IP 192.168.99.1.4840 > 192.168.99.2.4840: UDP, length 1109
 00:00:00.001305 IP 192.168.99.1.4840 > 192.168.99.2.4840: UDP, length 1109
 00:00:00.001425 IP 192.168.99.1.4840 > 192.168.99.2.4840: UDP, length 1109
 00:00:00.001310 IP 192.168.99.1.4840 > 192.168.99.2.4840: UDP, length 1109
 00:00:00.001303 IP 192.168.99.1.4840 > 192.168.99.2.4840: UDP, length 1109
 00:00:00.001548 IP 192.168.99.1.4840 > 192.168.99.2.4840: UDP, length 1109
 00:00:00.001181 IP 192.168.99.1.4840 > 192.168.99.2.4840: UDP, length 1109
 00:00:00.001431 IP 192.168.99.1.4840 > 192.168.99.2.4840: UDP, length 1109
 00:00:00.001548 IP 192.168.99.1.4840 > 192.168.99.2.4840: UDP, length 1109
 00:00:00.001182 IP 192.168.99.1.4840 > 192.168.99.2.4840: UDP, length 1109
 00:00:00.001427 IP 192.168.99.1.4840 > 192.168.99.2.4840: UDP, length 1109
 00:00:00.001440 IP 192.168.99.1.4840 > 192.168.99.2.4840: UDP, length 1109
 00:00:00.001293 IP 192.168.99.1.4840 > 192.168.99.2.4840: UDP, length 1109
 00:00:00.001435 IP 192.168.99.1.4840 > 192.168.99.2.4840: UDP, length 1109
 00:00:00.001295 IP 192.168.99.1.4840 > 192.168.99.2.4840: UDP, length 1109
 00:00:00.001309 IP 192.168.99.1.4840 > 192.168.99.2.4840: UDP, length 1109
 00:00:00.001563 IP 192.168.99.1.4840 > 192.168.99.2.4840: UDP, length 1109
 00:00:00.001287 IP 192.168.99.1.4840 > 192.168.99.2.4840: UDP, length 1109
 00:00:00.001306 IP 192.168.99.1.4840 > 192.168.99.2.4840: UDP, length 1109
 00:00:00.001429 IP 192.168.99.1.4840 > 192.168.99.2.4840: UDP, length 1109
 00:00:00.001307 IP 192.168.99.1.4840 > 192.168.99.2.4840: UDP, length 1109
 00:00:00.001426 IP 192.168.99.1.4840 > 192.168.99.2.4840: UDP, length 1109
 00:00:00.001425 IP 192.168.99.1.4840 > 192.168.99.2.4840: UDP, length 1109
 00:00:00.001305 IP 192.168.99.1.4840 > 192.168.99.2.4840: UDP, length 1109
 00:00:00.001427 IP 192.168.99.1.4840 > 192.168.99.2.4840: UDP, length 1109
 00:00:00.001334 IP 192.168.99.1.4840 > 192.168.99.2.4840: UDP, length 1109
 00:00:00.001399 IP 192.168.99.1.4840 > 192.168.99.2.4840: UDP, length 1109
 00:00:00.001423 IP 192.168.99.1.4840 > 192.168.99.2.4840: UDP, length 1109
 00:00:00.001340 IP 192.168.99.1.4840 > 192.168.99.2.4840: UDP, length 1109
 00:00:00.001411 IP 192.168.99.1.4840 > 192.168.99.2.4840: UDP, length 1109
 00:00:00.001304 IP 192.168.99.1.4840 > 192.168.99.2.4840: UDP, length 1109
 00:00:00.001303 IP 192.168.99.1.4840 > 192.168.99.2.4840: UDP, length 1109
 00:00:00.001430 IP 192.168.99.1.4840 > 192.168.99.2.4840: UDP, length 1109
 00:00:00.001305 IP 192.168.99.1.4840 > 192.168.99.2.4840: UDP, length 1109
 00:00:00.001425 IP 192.168.99.1.4840 > 192.168.99.2.4840: UDP, length 1109
 00:00:00.001429 IP 192.168.99.1.4840 > 192.168.99.2.4840: UDP, length 1109
 00:00:00.001306 IP 192.168.99.1.4840 > 192.168.99.2.4840: UDP, length 1109
 00:00:00.001313 IP 192.168.99.1.4840 > 192.168.99.2.4840: UDP, length 1109
 00:00:00.001415 IP 192.168.99.1.4840 > 192.168.99.2.4840: UDP, length 1109
 00:00:00.001319 IP 192.168.99.1.4840 > 192.168.99.2.4840: UDP, length 1109
 00:00:00.001428 IP 192.168.99.1.4840 > 192.168.99.2.4840: UDP, length 1109
 00:00:00.001293 IP 192.168.99.1.4840 > 192.168.99.2.4840: UDP, length 1109
 00:00:00.001305 IP 192.168.99.1.4840 > 192.168.99.2.4840: UDP, length 1109
 00:00:00.001425 IP 192.168.99.1.4840 > 192.168.99.2.4840: UDP, length 1109
 00:00:00.001313 IP 192.168.99.1.4840 > 192.168.99.2.4840: UDP, length 1109
 00:00:00.001419 IP 192.168.99.1.4840 > 192.168.99.2.4840: UDP, length 1109
 00:00:00.001427 IP 192.168.99.1.4840 > 192.168.99.2.4840: UDP, length 1109
 00:00:00.001308 IP 192.168.99.1.4840 > 192.168.99.2.4840: UDP, length 1109
 00:00:00.001426 IP 192.168.99.1.4840 > 192.168.99.2.4840: UDP, length 1109
 00:00:00.001427 IP 192.168.99.1.4840 > 192.168.99.2.4840: UDP, length 1109
 00:00:00.001183 IP 192.168.99.1.4840 > 192.168.99.2.4840: UDP, length 1109
 00:00:00.001455 IP 192.168.99.1.4840 > 192.168.99.2.4840: UDP, length 1109
 00:00:00.001399 IP 192.168.99.1.4840 > 192.168.99.2.4840: UDP, length 1109
 00:00:00.001307 IP 192.168.99.1.4840 > 192.168.99.2.4840: UDP, length 1109
 00:00:00.001440 IP 192.168.99.1.4840 > 192.168.99.2.4840: UDP, length 1109
 00:00:00.001169 IP 192.168.99.1.4840 > 192.168.99.2.4840: UDP, length 1109
 00:00:00.001425 IP 192.168.99.1.4840 > 192.168.99.2.4840: UDP, length 1109
 00:00:00.001427 IP 192.168.99.1.4840 > 192.168.99.2.4840: UDP, length 1109
 00:00:00.001306 IP 192.168.99.1.4840 > 192.168.99.2.4840: UDP, length 1109
 00:00:00.001429 IP 192.168.99.1.4840 > 192.168.99.2.4840: UDP, length 1109
 00:00:00.001429 IP 192.168.99.1.4840 > 192.168.99.2.4840: UDP, length 1109
 00:00:00.001180 IP 192.168.99.1.4840 > 192.168.99.2.4840: UDP, length 1109
 00:00:00.001548 IP 192.168.99.1.4840 > 192.168.99.2.4840: UDP, length 1109
 00:00:00.001317 IP 192.168.99.1.4840 > 192.168.99.2.4840: UDP, length 1109
 00:00:00.001421 IP 192.168.99.1.4840 > 192.168.99.2.4840: UDP, length 1109
 00:00:00.001436 IP 192.168.99.1.4840 > 192.168.99.2.4840: UDP, length 1109
 00:00:00.001316 IP 192.168.99.1.4840 > 192.168.99.2.4840: UDP, length 1109
 00:00:00.001417 IP 192.168.99.1.4840 > 192.168.99.2.4840: UDP, length 1109
 00:00:00.001425 IP 192.168.99.1.4840 > 192.168.99.2.4840: UDP, length 1109
 00:00:00.001185 IP 192.168.99.1.4840 > 192.168.99.2.4840: UDP, length 1109
 00:00:00.001428 IP 192.168.99.1.4840 > 192.168.99.2.4840: UDP, length 1109
 00:00:00.001425 IP 192.168.99.1.4840 > 192.168.99.2.4840: UDP, length 1109
 00:00:00.001305 IP 192.168.99.1.4840 > 192.168.99.2.4840: UDP, length 1109
 00:00:00.001427 IP 192.168.99.1.4840 > 192.168.99.2.4840: UDP, length 1109
 00:00:00.001314 IP 192.168.99.1.4840 > 192.168.99.2.4840: UDP, length 1109
 00:00:00.001313 IP 192.168.99.1.4840 > 192.168.99.2.4840: UDP, length 1109
 00:00:00.001413 IP 192.168.99.1.4840 > 192.168.99.2.4840: UDP, length 1109
 00:00:00.001329 IP 192.168.99.1.4840 > 192.168.99.2.4840: UDP, length 1109
 00:00:00.001279 IP 192.168.99.1.4840 > 192.168.99.2.4840: UDP, length 1109
 00:00:00.001428 IP 192.168.99.1.4840 > 192.168.99.2.4840: UDP, length 1109
 00:00:00.001310 IP 192.168.99.1.4840 > 192.168.99.2.4840: UDP, length 1109
 00:00:00.001423 IP 192.168.99.1.4840 > 192.168.99.2.4840: UDP, length 1109
 00:00:00.001302 IP 192.168.99.1.4840 > 192.168.99.2.4840: UDP, length 1109
 00:00:00.001327 IP 192.168.99.1.4840 > 192.168.99.2.4840: UDP, length 1109
 00:00:00.001650 IP 192.168.99.1.4840 > 192.168.99.2.4840: UDP, length 1109
 00:00:00.001183 IP 192.168.99.1.4840 > 192.168.99.2.4840: UDP, length 1109
 00:00:00.001430 IP 192.168.99.1.4840 > 192.168.99.2.4840: UDP, length 1109
 00:00:00.001423 IP 192.168.99.1.4840 > 192.168.99.2.4840: UDP, length 1109
 00:00:00.001307 IP 192.168.99.1.4840 > 192.168.99.2.4840: UDP, length 1109
 00:00:00.001427 IP 192.168.99.1.4840 > 192.168.99.2.4840: UDP, length 1109
 00:00:00.001304 IP 192.168.99.1.4840 > 192.168.99.2.4840: UDP, length 1109
 00:00:00.001306 IP 192.168.99.1.4840 > 192.168.99.2.4840: UDP, length 1109
 00:00:00.001439 IP 192.168.99.1.4840 > 192.168.99.2.4840: UDP, length 1109
 00:00:00.001296 IP 192.168.99.1.4840 > 192.168.99.2.4840: UDP, length 1109
 00:00:00.001305 IP 192.168.99.1.4840 > 192.168.99.2.4840: UDP, length 1109
 00:00:00.001425 IP 192.168.99.1.4840 > 192.168.99.2.4840: UDP, length 1109
 00:00:00.001307 IP 192.168.99.1.4840 > 192.168.99.2.4840: UDP, length 1109
 00:00:00.001312 IP 192.168.99.1.4840 > 192.168.99.2.4840: UDP, length 1109
 00:00:00.001431 IP 192.168.99.1.4840 > 192.168.99.2.4840: UDP, length 1109
 00:00:00.001295 IP 192.168.99.1.4840 > 192.168.99.2.4840: UDP, length 1109
 00:00:00.001437 IP 192.168.99.1.4840 > 192.168.99.2.4840: UDP, length 1109
 00:00:00.001416 IP 192.168.99.1.4840 > 192.168.99.2.4840: UDP, length 1109
 00:00:00.001305 IP 192.168.99.1.4840 > 192.168.99.2.4840: UDP, length 1109
 00:00:00.001445 IP 192.168.99.1.4840 > 192.168.99.2.4840: UDP, length 1109
 00:00:00.001287 IP 192.168.99.1.4840 > 192.168.99.2.4840: UDP, length 1109
 00:00:00.001304 IP 192.168.99.1.4840 > 192.168.99.2.4840: UDP, length 1109
 00:00:00.001430 IP 192.168.99.1.4840 > 192.168.99.2.4840: UDP, length 1109
 00:00:00.001303 IP 192.168.99.1.4840 > 192.168.99.2.4840: UDP, length 1109
 00:00:00.001303 IP 192.168.99.1.4840 > 192.168.99.2.4840: UDP, length 1109
 00:00:00.001448 IP 192.168.99.1.4840 > 192.168.99.2.4840: UDP, length 1109
 00:00:00.001287 IP 192.168.99.1.4840 > 192.168.99.2.4840: UDP, length 1109
 00:00:00.001305 IP 192.168.99.1.4840 > 192.168.99.2.4840: UDP, length 1109
 00:00:00.001425 IP 192.168.99.1.4840 > 192.168.99.2.4840: UDP, length 1109
 00:00:00.001306 IP 192.168.99.1.4840 > 192.168.99.2.4840: UDP, length 1109
 00:00:00.001426 IP 192.168.99.1.4840 > 192.168.99.2.4840: UDP, length 1109
 00:00:00.001564 IP 192.168.99.1.4840 > 192.168.99.2.4840: UDP, length 1109
 00:00:00.001415 IP 192.168.99.1.4840 > 192.168.99.2.4840: UDP, length 1109
 00:00:00.001545 IP 192.168.99.1.4840 > 192.168.99.2.4840: UDP, length 1109
 00:00:00.001547 IP 192.168.99.1.4840 > 192.168.99.2.4840: UDP, length 1109
 00:00:00.001425 IP 192.168.99.1.4840 > 192.168.99.2.4840: UDP, length 1109
 00:00:00.001688 IP 192.168.99.1.4840 > 192.168.99.2.4840: UDP, length 1109
 00:00:00.001410 IP 192.168.99.1.4840 > 192.168.99.2.4840: UDP, length 1109
 00:00:00.001570 IP 192.168.99.1.4840 > 192.168.99.2.4840: UDP, length 1109
 00:00:00.001526 IP 192.168.99.1.4840 > 192.168.99.2.4840: UDP, length 1109
 00:00:00.001544 IP 192.168.99.1.4840 > 192.168.99.2.4840: UDP, length 1109
 00:00:00.001305 IP 192.168.99.1.4840 > 192.168.99.2.4840: UDP, length 1109
 00:00:00.001681 IP 192.168.99.1.4840 > 192.168.99.2.4840: UDP, length 1109
 00:00:00.001416 IP 192.168.99.1.4840 > 192.168.99.2.4840: UDP, length 1109
 00:00:00.001312 IP 192.168.99.1.4840 > 192.168.99.2.4840: UDP, length 1109
 00:00:00.001541 IP 192.168.99.1.4840 > 192.168.99.2.4840: UDP, length 1109
 00:00:00.001179 IP 192.168.99.1.4840 > 192.168.99.2.4840: UDP, length 1109
 00:00:00.001548 IP 192.168.99.1.4840 > 192.168.99.2.4840: UDP, length 1109
 00:00:00.001307 IP 192.168.99.1.4840 > 192.168.99.2.4840: UDP, length 1109
 00:00:00.001426 IP 192.168.99.1.4840 > 192.168.99.2.4840: UDP, length 1109
 00:00:00.001425 IP 192.168.99.1.4840 > 192.168.99.2.4840: UDP, length 1109
 00:00:00.001186 IP 192.168.99.1.4840 > 192.168.99.2.4840: UDP, length 1109
 00:00:00.001547 IP 192.168.99.1.4840 > 192.168.99.2.4840: UDP, length 1109
 00:00:00.001335 IP 192.168.99.1.4840 > 192.168.99.2.4840: UDP, length 1109
 00:00:00.001405 IP 192.168.99.1.4840 > 192.168.99.2.4840: UDP, length 1109
 00:00:00.001427 IP 192.168.99.1.4840 > 192.168.99.2.4840: UDP, length 1109
 00:00:00.001323 IP 192.168.99.1.4840 > 192.168.99.2.4840: UDP, length 1109
 00:00:00.001285 IP 192.168.99.1.4840 > 192.168.99.2.4840: UDP, length 1109
 00:00:00.001549 IP 192.168.99.1.4840 > 192.168.99.2.4840: UDP, length 1109
 00:00:00.001188 IP 192.168.99.1.4840 > 192.168.99.2.4840: UDP, length 1109
 00:00:00.001543 IP 192.168.99.1.4840 > 192.168.99.2.4840: UDP, length 1109
 00:00:00.001306 IP 192.168.99.1.4840 > 192.168.99.2.4840: UDP, length 1109
 00:00:00.001442 IP 192.168.99.1.4840 > 192.168.99.2.4840: UDP, length 1109
 00:00:00.001414 IP 192.168.99.1.4840 > 192.168.99.2.4840: UDP, length 1109
 00:00:00.001303 IP 192.168.99.1.4840 > 192.168.99.2.4840: UDP, length 1109
 00:00:00.001439 IP 192.168.99.1.4840 > 192.168.99.2.4840: UDP, length 1109
 00:00:00.001413 IP 192.168.99.1.4840 > 192.168.99.2.4840: UDP, length 1109
 00:00:00.001314 IP 192.168.99.1.4840 > 192.168.99.2.4840: UDP, length 1109
 00:00:00.001419 IP 192.168.99.1.4840 > 192.168.99.2.4840: UDP, length 1109
 00:00:00.001305 IP 192.168.99.1.4840 > 192.168.99.2.4840: UDP, length 1109
 00:00:00.001445 IP 192.168.99.1.4840 > 192.168.99.2.4840: UDP, length 1109
 00:00:00.001438 IP 192.168.99.1.4840 > 192.168.99.2.4840: UDP, length 1109
 00:00:00.001294 IP 192.168.99.1.4840 > 192.168.99.2.4840: UDP, length 1109
 00:00:00.001546 IP 192.168.99.1.4840 > 192.168.99.2.4840: UDP, length 1109
 00:00:00.001317 IP 192.168.99.1.4840 > 192.168.99.2.4840: UDP, length 1109
 00:00:00.001416 IP 192.168.99.1.4840 > 192.168.99.2.4840: UDP, length 1109
 00:00:00.001424 IP 192.168.99.1.4840 > 192.168.99.2.4840: UDP, length 1109
 00:00:00.001189 IP 192.168.99.1.4840 > 192.168.99.2.4840: UDP, length 1109
 00:00:00.001552 IP 192.168.99.1.4840 > 192.168.99.2.4840: UDP, length 1109
 00:00:00.001324 IP 192.168.99.1.4840 > 192.168.99.2.4840: UDP, length 1109
 00:00:00.001287 IP 192.168.99.1.4840 > 192.168.99.2.4840: UDP, length 1109
 00:00:00.001423 IP 192.168.99.1.4840 > 192.168.99.2.4840: UDP, length 1109
 00:00:00.001309 IP 192.168.99.1.4840 > 192.168.99.2.4840: UDP, length 1109
 00:00:00.001426 IP 192.168.99.1.4840 > 192.168.99.2.4840: UDP, length 1109
 00:00:00.001428 IP 192.168.99.1.4840 > 192.168.99.2.4840: UDP, length 1109
 00:00:00.001300 IP 192.168.99.1.4840 > 192.168.99.2.4840: UDP, length 1109
 00:00:00.001430 IP 192.168.99.1.4840 > 192.168.99.2.4840: UDP, length 1109
 00:00:00.001305 IP 192.168.99.1.4840 > 192.168.99.2.4840: UDP, length 1109
 00:00:00.001320 IP 192.168.99.1.4840 > 192.168.99.2.4840: UDP, length 1109
 00:00:00.001534 IP 192.168.99.1.4840 > 192.168.99.2.4840: UDP, length 1109
 00:00:00.001307 IP 192.168.99.1.4840 > 192.168.99.2.4840: UDP, length 1109
 00:00:00.001426 IP 192.168.99.1.4840 > 192.168.99.2.4840: UDP, length 1109
 00:00:00.001426 IP 192.168.99.1.4840 > 192.168.99.2.4840: UDP, length 1109
 00:00:00.001304 IP 192.168.99.1.4840 > 192.168.99.2.4840: UDP, length 1109
 00:00:00.001428 IP 192.168.99.1.4840 > 192.168.99.2.4840: UDP, length 1109
 00:00:00.001424 IP 192.168.99.1.4840 > 192.168.99.2.4840: UDP, length 1109
 00:00:00.001305 IP 192.168.99.1.4840 > 192.168.99.2.4840: UDP, length 1109
 00:00:00.001429 IP 192.168.99.1.4840 > 192.168.99.2.4840: UDP, length 1109
 00:00:00.001304 IP 192.168.99.1.4840 > 192.168.99.2.4840: UDP, length 1109
 00:00:00.001426 IP 192.168.99.1.4840 > 192.168.99.2.4840: UDP, length 1109
 00:00:00.001433 IP 192.168.99.1.4840 > 192.168.99.2.4840: UDP, length 1109
 00:00:00.001304 IP 192.168.99.1.4840 > 192.168.99.2.4840: UDP, length 1109
 00:00:00.001421 IP 192.168.99.1.4840 > 192.168.99.2.4840: UDP, length 1109
 00:00:00.001308 IP 192.168.99.1.4840 > 192.168.99.2.4840: UDP, length 1109
 00:00:00.001305 IP 192.168.99.1.4840 > 192.168.99.2.4840: UDP, length 1109
 00:00:00.001443 IP 192.168.99.1.4840 > 192.168.99.2.4840: UDP, length 1109
 00:00:00.001288 IP 192.168.99.1.4840 > 192.168.99.2.4840: UDP, length 1109
 00:00:00.001428 IP 192.168.99.1.4840 > 192.168.99.2.4840: UDP, length 1109
 00:00:00.001446 IP 192.168.99.1.4840 > 192.168.99.2.4840: UDP, length 1109
 00:00:00.001166 IP 192.168.99.1.4840 > 192.168.99.2.4840: UDP, length 1109
 00:00:00.001426 IP 192.168.99.1.4840 > 192.168.99.2.4840: UDP, length 1109
 00:00:00.001427 IP 192.168.99.1.4840 > 192.168.99.2.4840: UDP, length 1109
 00:00:00.001304 IP 192.168.99.1.4840 > 192.168.99.2.4840: UDP, length 1109
 00:00:00.001428 IP 192.168.99.1.4840 > 192.168.99.2.4840: UDP, length 1109
 00:00:00.001318 IP 192.168.99.1.4840 > 192.168.99.2.4840: UDP, length 1109
 00:00:00.001417 IP 192.168.99.1.4840 > 192.168.99.2.4840: UDP, length 1109
 00:00:00.001424 IP 192.168.99.1.4840 > 192.168.99.2.4840: UDP, length 1109
 00:00:00.001327 IP 192.168.99.1.4840 > 192.168.99.2.4840: UDP, length 1109
 00:00:00.001406 IP 192.168.99.1.4840 > 192.168.99.2.4840: UDP, length 1109
 00:00:00.001427 IP 192.168.99.1.4840 > 192.168.99.2.4840: UDP, length 1109
 00:00:00.001317 IP 192.168.99.1.4840 > 192.168.99.2.4840: UDP, length 1109
 00:00:00.001415 IP 192.168.99.1.4840 > 192.168.99.2.4840: UDP, length 1109
 00:00:00.001314 IP 192.168.99.1.4840 > 192.168.99.2.4840: UDP, length 1109
 00:00:00.001294 IP 192.168.99.1.4840 > 192.168.99.2.4840: UDP, length 1109
 00:00:00.001551 IP 192.168.99.1.4840 > 192.168.99.2.4840: UDP, length 1109
 00:00:00.001324 IP 192.168.99.1.4840 > 192.168.99.2.4840: UDP, length 1109
 00:00:00.001283 IP 192.168.99.1.4840 > 192.168.99.2.4840: UDP, length 1109
 00:00:00.001429 IP 192.168.99.1.4840 > 192.168.99.2.4840: UDP, length 1109
 00:00:00.001305 IP 192.168.99.1.4840 > 192.168.99.2.4840: UDP, length 1109
 00:00:00.001426 IP 192.168.99.1.4840 > 192.168.99.2.4840: UDP, length 1109
 00:00:00.001308 IP 192.168.99.1.4840 > 192.168.99.2.4840: UDP, length 1109
 00:00:00.001426 IP 192.168.99.1.4840 > 192.168.99.2.4840: UDP, length 1109
 00:00:00.001423 IP 192.168.99.1.4840 > 192.168.99.2.4840: UDP, length 1109
 00:00:00.001308 IP 192.168.99.1.4840 > 192.168.99.2.4840: UDP, length 1109
 00:00:00.001317 IP 192.168.99.1.4840 > 192.168.99.2.4840: UDP, length 1109
 00:00:00.001416 IP 192.168.99.1.4840 > 192.168.99.2.4840: UDP, length 1109
 00:00:00.001307 IP 192.168.99.1.4840 > 192.168.99.2.4840: UDP, length 1109
 00:00:00.001437 IP 192.168.99.1.4840 > 192.168.99.2.4840: UDP, length 1109
 00:00:00.001417 IP 192.168.99.1.4840 > 192.168.99.2.4840: UDP, length 1109
 00:00:00.001313 IP 192.168.99.1.4840 > 192.168.99.2.4840: UDP, length 1109
 00:00:00.001426 IP 192.168.99.1.4840 > 192.168.99.2.4840: UDP, length 1109
 00:00:00.001416 IP 192.168.99.1.4840 > 192.168.99.2.4840: UDP, length 1109
 00:00:00.001321 IP 192.168.99.1.4840 > 192.168.99.2.4840: UDP, length 1109
 00:00:00.001412 IP 192.168.99.1.4840 > 192.168.99.2.4840: UDP, length 1109
 00:00:00.001306 IP 192.168.99.1.4840 > 192.168.99.2.4840: UDP, length 1109
 00:00:00.001304 IP 192.168.99.1.4840 > 192.168.99.2.4840: UDP, length 1109
 00:00:00.001427 IP 192.168.99.1.4840 > 192.168.99.2.4840: UDP, length 1109
 00:00:00.001307 IP 192.168.99.1.4840 > 192.168.99.2.4840: UDP, length 1109
 00:00:00.001564 IP 192.168.99.1.4840 > 192.168.99.2.4840: UDP, length 1109
 00:00:00.001289 IP 192.168.99.1.4840 > 192.168.99.2.4840: UDP, length 1109
 00:00:00.001304 IP 192.168.99.1.4840 > 192.168.99.2.4840: UDP, length 1109
 00:00:00.001564 IP 192.168.99.1.4840 > 192.168.99.2.4840: UDP, length 1109
 00:00:00.001169 IP 192.168.99.1.4840 > 192.168.99.2.4840: UDP, length 1109
 00:00:00.001429 IP 192.168.99.1.4840 > 192.168.99.2.4840: UDP, length 1109
 00:00:00.001423 IP 192.168.99.1.4840 > 192.168.99.2.4840: UDP, length 1109
 00:00:00.001305 IP 192.168.99.1.4840 > 192.168.99.2.4840: UDP, length 1109
 00:00:00.001427 IP 192.168.99.1.4840 > 192.168.99.2.4840: UDP, length 1109
 00:00:00.001429 IP 192.168.99.1.4840 > 192.168.99.2.4840: UDP, length 1109
 00:00:00.001667 IP 192.168.99.1.4840 > 192.168.99.2.4840: UDP, length 1109
 00:00:00.001676 IP 192.168.99.1.4840 > 192.168.99.2.4840: UDP, length 1109
 00:00:00.001668 IP 192.168.99.1.4840 > 192.168.99.2.4840: UDP, length 1109
 00:00:00.001680 IP 192.168.99.1.4840 > 192.168.99.2.4840: UDP, length 1109
 00:00:00.001560 IP 192.168.99.1.4840 > 192.168.99.2.4840: UDP, length 1109
 00:00:00.001782 IP 192.168.99.1.4840 > 192.168.99.2.4840: UDP, length 1109
 00:00:00.001544 IP 192.168.99.1.4840 > 192.168.99.2.4840: UDP, length 1109
 00:00:00.001435 IP 192.168.99.1.4840 > 192.168.99.2.4840: UDP, length 1109
 00:00:00.001538 IP 192.168.99.1.4840 > 192.168.99.2.4840: UDP, length 1109
 00:00:00.001551 IP 192.168.99.1.4840 > 192.168.99.2.4840: UDP, length 1109
 00:00:00.001786 IP 192.168.99.1.4840 > 192.168.99.2.4840: UDP, length 1109
 00:00:00.001429 IP 192.168.99.1.4840 > 192.168.99.2.4840: UDP, length 1109
 00:00:00.001674 IP 192.168.99.1.4840 > 192.168.99.2.4840: UDP, length 1109
 00:00:00.001542 IP 192.168.99.1.4840 > 192.168.99.2.4840: UDP, length 1109
 00:00:00.001548 IP 192.168.99.1.4840 > 192.168.99.2.4840: UDP, length 1109
 00:00:00.001810 IP 192.168.99.1.4840 > 192.168.99.2.4840: UDP, length 1109
 00:00:00.001407 IP 192.168.99.1.4840 > 192.168.99.2.4840: UDP, length 1109
 00:00:00.001788 IP 192.168.99.1.4840 > 192.168.99.2.4840: UDP, length 1109
 00:00:00.001792 IP 192.168.99.1.4840 > 192.168.99.2.4840: UDP, length 1109
 00:00:00.001545 IP 192.168.99.1.4840 > 192.168.99.2.4840: UDP, length 1109
 00:00:00.001436 IP 192.168.99.1.4840 > 192.168.99.2.4840: UDP, length 1109
 00:00:00.001317 IP 192.168.99.1.4840 > 192.168.99.2.4840: UDP, length 1109
 00:00:00.001415 IP 192.168.99.1.4840 > 192.168.99.2.4840: UDP, length 1109
 00:00:00.001320 IP 192.168.99.1.4840 > 192.168.99.2.4840: UDP, length 1109
 00:00:00.001290 IP 192.168.99.1.4840 > 192.168.99.2.4840: UDP, length 1109
 00:00:00.001551 IP 192.168.99.1.4840 > 192.168.99.2.4840: UDP, length 1109
 00:00:00.002037 IP 192.168.99.1.4840 > 192.168.99.2.4840: UDP, length 1109
 00:00:00.001296 IP 192.168.99.1.4840 > 192.168.99.2.4840: UDP, length 1109
 00:00:00.001428 IP 192.168.99.1.4840 > 192.168.99.2.4840: UDP, length 1109
 00:00:00.001307 IP 192.168.99.1.4840 > 192.168.99.2.4840: UDP, length 1109
 00:00:00.001427 IP 192.168.99.1.4840 > 192.168.99.2.4840: UDP, length 1109
 00:00:00.001545 IP 192.168.99.1.4840 > 192.168.99.2.4840: UDP, length 1109
 00:00:00.001186 IP 192.168.99.1.4840 > 192.168.99.2.4840: UDP, length 1109
 00:00:00.001427 IP 192.168.99.1.4840 > 192.168.99.2.4840: UDP, length 1109
 00:00:00.001425 IP 192.168.99.1.4840 > 192.168.99.2.4840: UDP, length 1109
 00:00:00.001306 IP 192.168.99.1.4840 > 192.168.99.2.4840: UDP, length 1109
 00:00:00.001668 IP 192.168.99.1.4840 > 192.168.99.2.4840: UDP, length 1109
 00:00:00.001306 IP 192.168.99.1.4840 > 192.168.99.2.4840: UDP, length 1109
 00:00:00.001564 IP 192.168.99.1.4840 > 192.168.99.2.4840: UDP, length 1109
 00:00:00.001291 IP 192.168.99.1.4840 > 192.168.99.2.4840: UDP, length 1109
 00:00:00.001301 IP 192.168.99.1.4840 > 192.168.99.2.4840: UDP, length 1109
 00:00:00.001673 IP 192.168.99.1.4840 > 192.168.99.2.4840: UDP, length 1109
 00:00:00.001791 IP 192.168.99.1.4840 > 192.168.99.2.4840: UDP, length 1109
 00:00:00.001565 IP 192.168.99.1.4840 > 192.168.99.2.4840: UDP, length 1109
 00:00:00.001647 IP 192.168.99.1.4840 > 192.168.99.2.4840: UDP, length 1109
 00:00:00.001551 IP 192.168.99.1.4840 > 192.168.99.2.4840: UDP, length 1109
 00:00:00.001549 IP 192.168.99.1.4840 > 192.168.99.2.4840: UDP, length 1109
 00:00:00.001666 IP 192.168.99.1.4840 > 192.168.99.2.4840: UDP, length 1109
 00:00:00.001436 IP 192.168.99.1.4840 > 192.168.99.2.4840: UDP, length 1109
 00:00:00.001784 IP 192.168.99.1.4840 > 192.168.99.2.4840: UDP, length 1109
 00:00:00.001543 IP 192.168.99.1.4840 > 192.168.99.2.4840: UDP, length 1109
 00:00:00.001558 IP 192.168.99.1.4840 > 192.168.99.2.4840: UDP, length 1109
 00:00:00.001659 IP 192.168.99.1.4840 > 192.168.99.2.4840: UDP, length 1109
 00:00:00.001308 IP 192.168.99.1.4840 > 192.168.99.2.4840: UDP, length 1109
 00:00:00.001548 IP 192.168.99.1.4840 > 192.168.99.2.4840: UDP, length 1109
 00:00:00.001305 IP 192.168.99.1.4840 > 192.168.99.2.4840: UDP, length 1109
 00:00:00.001303 IP 192.168.99.1.4840 > 192.168.99.2.4840: UDP, length 1109
 00:00:00.001454 IP 192.168.99.1.4840 > 192.168.99.2.4840: UDP, length 1109
 00:00:00.001401 IP 192.168.99.1.4840 > 192.168.99.2.4840: UDP, length 1109
 00:00:00.001304 IP 192.168.99.1.4840 > 192.168.99.2.4840: UDP, length 1109
 00:00:00.001548 IP 192.168.99.1.4840 > 192.168.99.2.4840: UDP, length 1109
 00:00:00.001430 IP 192.168.99.1.4840 > 192.168.99.2.4840: UDP, length 1109
 00:00:00.001428 IP 192.168.99.1.4840 > 192.168.99.2.4840: UDP, length 1109
 00:00:00.001546 IP 192.168.99.1.4840 > 192.168.99.2.4840: UDP, length 1109
 00:00:00.001424 IP 192.168.99.1.4840 > 192.168.99.2.4840: UDP, length 1109
 00:00:00.001308 IP 192.168.99.1.4840 > 192.168.99.2.4840: UDP, length 1109
 00:00:00.001668 IP 192.168.99.1.4840 > 192.168.99.2.4840: UDP, length 1109
 00:00:00.001306 IP 192.168.99.1.4840 > 192.168.99.2.4840: UDP, length 1109
 00:00:00.001568 IP 192.168.99.1.4840 > 192.168.99.2.4840: UDP, length 1109
 00:00:00.001283 IP 192.168.99.1.4840 > 192.168.99.2.4840: UDP, length 1109
 00:00:00.001425 IP 192.168.99.1.4840 > 192.168.99.2.4840: UDP, length 1109
 00:00:00.001549 IP 192.168.99.1.4840 > 192.168.99.2.4840: UDP, length 1109
 00:00:00.001306 IP 192.168.99.1.4840 > 192.168.99.2.4840: UDP, length 1109
 00:00:00.001306 IP 192.168.99.1.4840 > 192.168.99.2.4840: UDP, length 1109
 00:00:00.001441 IP 192.168.99.1.4840 > 192.168.99.2.4840: UDP, length 1109
 00:00:00.001292 IP 192.168.99.1.4840 > 192.168.99.2.4840: UDP, length 1109
 00:00:00.001427 IP 192.168.99.1.4840 > 192.168.99.2.4840: UDP, length 1109
 00:00:00.002163 IP 192.168.99.1.4840 > 192.168.99.2.4840: UDP, length 1109
 00:00:00.001296 IP 192.168.99.1.4840 > 192.168.99.2.4840: UDP, length 1109
 00:00:00.001545 IP 192.168.99.1.4840 > 192.168.99.2.4840: UDP, length 1109
 00:00:00.001322 IP 192.168.99.1.4840 > 192.168.99.2.4840: UDP, length 1109
 00:00:00.001292 IP 192.168.99.1.4840 > 192.168.99.2.4840: UDP, length 1109
 00:00:00.001547 IP 192.168.99.1.4840 > 192.168.99.2.4840: UDP, length 1109
 00:00:00.001306 IP 192.168.99.1.4840 > 192.168.99.2.4840: UDP, length 1109
 00:00:00.001427 IP 192.168.99.1.4840 > 192.168.99.2.4840: UDP, length 1109
 00:00:00.001427 IP 192.168.99.1.4840 > 192.168.99.2.4840: UDP, length 1109
 00:00:00.001308 IP 192.168.99.1.4840 > 192.168.99.2.4840: UDP, length 1109
 00:00:00.001563 IP 192.168.99.1.4840 > 192.168.99.2.4840: UDP, length 1109
 00:00:00.001546 IP 192.168.99.1.4840 > 192.168.99.2.4840: UDP, length 1109
 00:00:00.001547 IP 192.168.99.1.4840 > 192.168.99.2.4840: UDP, length 1109
 00:00:00.001427 IP 192.168.99.1.4840 > 192.168.99.2.4840: UDP, length 1109
 00:00:00.001723 IP 192.168.99.1.4840 > 192.168.99.2.4840: UDP, length 1109
 00:00:00.001154 IP 192.168.99.1.4840 > 192.168.99.2.4840: UDP, length 1109
 00:00:00.001586 IP 192.168.99.1.4840 > 192.168.99.2.4840: UDP, length 1109
 00:00:00.001331 IP 192.168.99.1.4840 > 192.168.99.2.4840: UDP, length 1109
 00:00:00.002139 IP 192.168.99.1.4840 > 192.168.99.2.4840: UDP, length 1109
 00:00:00.002219 IP 192.168.99.1.4840 > 192.168.99.2.4840: UDP, length 1109
 00:00:00.001140 IP 192.168.99.1.4840 > 192.168.99.2.4840: UDP, length 1109
 00:00:00.002169 IP 192.168.99.1.4840 > 192.168.99.2.4840: UDP, length 1109
 00:00:00.001085 IP 192.168.99.1.4840 > 192.168.99.2.4840: UDP, length 1109
 00:00:00.001205 IP 192.168.99.1.4840 > 192.168.99.2.4840: UDP, length 1109
 00:00:00.002140 IP 192.168.99.1.4840 > 192.168.99.2.4840: UDP, length 1109
 00:00:00.001162 IP 192.168.99.1.4840 > 192.168.99.2.4840: UDP, length 1109
 00:00:00.002155 IP 192.168.99.1.4840 > 192.168.99.2.4840: UDP, length 1109
 00:00:00.001158 IP 192.168.99.1.4840 > 192.168.99.2.4840: UDP, length 1109
 00:00:00.002167 IP 192.168.99.1.4840 > 192.168.99.2.4840: UDP, length 1109
 00:00:00.001217 IP 192.168.99.1.4840 > 192.168.99.2.4840: UDP, length 1109
 00:00:00.001169 IP 192.168.99.1.4840 > 192.168.99.2.4840: UDP, length 1109
 00:00:00.002119 IP 192.168.99.1.4840 > 192.168.99.2.4840: UDP, length 1109
 00:00:00.000986 IP 192.168.99.1.4840 > 192.168.99.2.4840: UDP, length 1109
 00:00:00.001658 IP 192.168.99.1.4840 > 192.168.99.2.4840: UDP, length 1109
 00:00:00.001557 IP 192.168.99.1.4840 > 192.168.99.2.4840: UDP, length 1109
 00:00:00.001538 IP 192.168.99.1.4840 > 192.168.99.2.4840: UDP, length 1109
 00:00:00.001667 IP 192.168.99.1.4840 > 192.168.99.2.4840: UDP, length 1109
 00:00:00.001552 IP 192.168.99.1.4840 > 192.168.99.2.4840: UDP, length 1109
 00:00:00.001666 IP 192.168.99.1.4840 > 192.168.99.2.4840: UDP, length 1109
 00:00:00.001548 IP 192.168.99.1.4840 > 192.168.99.2.4840: UDP, length 1109
 00:00:00.001428 IP 192.168.99.1.4840 > 192.168.99.2.4840: UDP, length 1109
 00:00:00.001424 IP 192.168.99.1.4840 > 192.168.99.2.4840: UDP, length 1109
 00:00:00.001549 IP 192.168.99.1.4840 > 192.168.99.2.4840: UDP, length 1109
 00:00:00.001318 IP 192.168.99.1.4840 > 192.168.99.2.4840: UDP, length 1109
 00:00:00.001415 IP 192.168.99.1.4840 > 192.168.99.2.4840: UDP, length 1109
 00:00:00.001306 IP 192.168.99.1.4840 > 192.168.99.2.4840: UDP, length 1109
 00:00:00.001441 IP 192.168.99.1.4840 > 192.168.99.2.4840: UDP, length 1109
 00:00:00.001408 IP 192.168.99.1.4840 > 192.168.99.2.4840: UDP, length 1109
 00:00:00.002044 IP 192.168.99.1.4840 > 192.168.99.2.4840: UDP, length 1109
 00:00:00.001416 IP 192.168.99.1.4840 > 192.168.99.2.4840: UDP, length 1109
 00:00:00.001547 IP 192.168.99.1.4840 > 192.168.99.2.4840: UDP, length 1109
 00:00:00.001310 IP 192.168.99.1.4840 > 192.168.99.2.4840: UDP, length 1109
 00:00:00.001422 IP 192.168.99.1.4840 > 192.168.99.2.4840: UDP, length 1109
 00:00:00.001305 IP 192.168.99.1.4840 > 192.168.99.2.4840: UDP, length 1109
 00:00:00.001335 IP 192.168.99.1.4840 > 192.168.99.2.4840: UDP, length 1109
 00:00:00.001397 IP 192.168.99.1.4840 > 192.168.99.2.4840: UDP, length 1109
 00:00:00.001309 IP 192.168.99.1.4840 > 192.168.99.2.4840: UDP, length 1109
 00:00:00.001547 IP 192.168.99.1.4840 > 192.168.99.2.4840: UDP, length 1109
 00:00:00.001424 IP 192.168.99.1.4840 > 192.168.99.2.4840: UDP, length 1109
 00:00:00.001306 IP 192.168.99.1.4840 > 192.168.99.2.4840: UDP, length 1109
 00:00:00.001561 IP 192.168.99.1.4840 > 192.168.99.2.4840: UDP, length 1109
 00:00:00.001170 IP 192.168.99.1.4840 > 192.168.99.2.4840: UDP, length 1109
 00:00:00.001429 IP 192.168.99.1.4840 > 192.168.99.2.4840: UDP, length 1109
 00:00:00.001428 IP 192.168.99.1.4840 > 192.168.99.2.4840: UDP, length 1109
 00:00:00.001303 IP 192.168.99.1.4840 > 192.168.99.2.4840: UDP, length 1109
 00:00:00.001307 IP 192.168.99.1.4840 > 192.168.99.2.4840: UDP, length 1109
 00:00:00.001552 IP 192.168.99.1.4840 > 192.168.99.2.4840: UDP, length 1109
 00:00:00.001299 IP 192.168.99.1.4840 > 192.168.99.2.4840: UDP, length 1109
 00:00:00.001426 IP 192.168.99.1.4840 > 192.168.99.2.4840: UDP, length 1109
 00:00:00.001428 IP 192.168.99.1.4840 > 192.168.99.2.4840: UDP, length 1109
 00:00:00.001428 IP 192.168.99.1.4840 > 192.168.99.2.4840: UDP, length 1109
 00:00:00.001451 IP 192.168.99.1.4840 > 192.168.99.2.4840: UDP, length 1109
 00:00:00.001281 IP 192.168.99.1.4840 > 192.168.99.2.4840: UDP, length 1109
 00:00:00.001425 IP 192.168.99.1.4840 > 192.168.99.2.4840: UDP, length 1109
 00:00:00.001305 IP 192.168.99.1.4840 > 192.168.99.2.4840: UDP, length 1109
 00:00:00.001670 IP 192.168.99.1.4840 > 192.168.99.2.4840: UDP, length 1109
 00:00:00.001304 IP 192.168.99.1.4840 > 192.168.99.2.4840: UDP, length 1109
 00:00:00.001427 IP 192.168.99.1.4840 > 192.168.99.2.4840: UDP, length 1109
 00:00:00.001426 IP 192.168.99.1.4840 > 192.168.99.2.4840: UDP, length 1109
 00:00:00.001308 IP 192.168.99.1.4840 > 192.168.99.2.4840: UDP, length 1109
 00:00:00.001426 IP 192.168.99.1.4840 > 192.168.99.2.4840: UDP, length 1109
 00:00:00.001425 IP 192.168.99.1.4840 > 192.168.99.2.4840: UDP, length 1109
 00:00:00.001184 IP 192.168.99.1.4840 > 192.168.99.2.4840: UDP, length 1109
 00:00:00.001443 IP 192.168.99.1.4840 > 192.168.99.2.4840: UDP, length 1109
 00:00:00.001894 IP 192.168.99.1.4840 > 192.168.99.2.4840: UDP, length 1109
 00:00:00.001566 IP 192.168.99.1.4840 > 192.168.99.2.4840: UDP, length 1109
 00:00:00.001412 IP 192.168.99.1.4840 > 192.168.99.2.4840: UDP, length 1109
 00:00:00.001426 IP 192.168.99.1.4840 > 192.168.99.2.4840: UDP, length 1109
 00:00:00.001329 IP 192.168.99.1.4840 > 192.168.99.2.4840: UDP, length 1109
 00:00:00.001401 IP 192.168.99.1.4840 > 192.168.99.2.4840: UDP, length 1109
 00:00:00.001305 IP 192.168.99.1.4840 > 192.168.99.2.4840: UDP, length 1109
 00:00:00.001305 IP 192.168.99.1.4840 > 192.168.99.2.4840: UDP, length 1109
 00:00:00.001429 IP 192.168.99.1.4840 > 192.168.99.2.4840: UDP, length 1109
 00:00:00.001306 IP 192.168.99.1.4840 > 192.168.99.2.4840: UDP, length 1109
 00:00:00.001433 IP 192.168.99.1.4840 > 192.168.99.2.4840: UDP, length 1109
 00:00:00.001434 IP 192.168.99.1.4840 > 192.168.99.2.4840: UDP, length 1109
 00:00:00.001308 IP 192.168.99.1.4840 > 192.168.99.2.4840: UDP, length 1109
 00:00:00.001566 IP 192.168.99.1.4840 > 192.168.99.2.4840: UDP, length 1109
 00:00:00.001287 IP 192.168.99.1.4840 > 192.168.99.2.4840: UDP, length 1109
 00:00:00.001304 IP 192.168.99.1.4840 > 192.168.99.2.4840: UDP, length 1109
 00:00:00.001427 IP 192.168.99.1.4840 > 192.168.99.2.4840: UDP, length 1109
 00:00:00.001305 IP 192.168.99.1.4840 > 192.168.99.2.4840: UDP, length 1109
 00:00:00.002031 IP 192.168.99.1.4840 > 192.168.99.2.4840: UDP, length 1109
 00:00:00.001550 IP 192.168.99.1.4840 > 192.168.99.2.4840: UDP, length 1109
 00:00:00.001304 IP 192.168.99.1.4840 > 192.168.99.2.4840: UDP, length 1109
 00:00:00.001306 IP 192.168.99.1.4840 > 192.168.99.2.4840: UDP, length 1109
 00:00:00.001438 IP 192.168.99.1.4840 > 192.168.99.2.4840: UDP, length 1109
 00:00:00.001417 IP 192.168.99.1.4840 > 192.168.99.2.4840: UDP, length 1109
 00:00:00.001567 IP 192.168.99.1.4840 > 192.168.99.2.4840: UDP, length 1109
 00:00:00.001287 IP 192.168.99.1.4840 > 192.168.99.2.4840: UDP, length 1109
 00:00:00.001303 IP 192.168.99.1.4840 > 192.168.99.2.4840: UDP, length 1109
 00:00:00.001427 IP 192.168.99.1.4840 > 192.168.99.2.4840: UDP, length 1109
 00:00:00.001549 IP 192.168.99.1.4840 > 192.168.99.2.4840: UDP, length 1109
 00:00:00.001425 IP 192.168.99.1.4840 > 192.168.99.2.4840: UDP, length 1109
 00:00:00.001332 IP 192.168.99.1.4840 > 192.168.99.2.4840: UDP, length 1109
 00:00:00.001278 IP 192.168.99.1.4840 > 192.168.99.2.4840: UDP, length 1109
 00:00:00.001427 IP 192.168.99.1.4840 > 192.168.99.2.4840: UDP, length 1109
 00:00:00.001304 IP 192.168.99.1.4840 > 192.168.99.2.4840: UDP, length 1109
 00:00:00.001323 IP 192.168.99.1.4840 > 192.168.99.2.4840: UDP, length 1109
 00:00:00.001536 IP 192.168.99.1.4840 > 192.168.99.2.4840: UDP, length 1109
 00:00:00.001304 IP 192.168.99.1.4840 > 192.168.99.2.4840: UDP, length 1109
 00:00:00.001431 IP 192.168.99.1.4840 > 192.168.99.2.4840: UDP, length 1109
 00:00:00.001302 IP 192.168.99.1.4840 > 192.168.99.2.4840: UDP, length 1109
 00:00:00.001425 IP 192.168.99.1.4840 > 192.168.99.2.4840: UDP, length 1109
 00:00:00.001426 IP 192.168.99.1.4840 > 192.168.99.2.4840: UDP, length 1109
 00:00:00.001306 IP 192.168.99.1.4840 > 192.168.99.2.4840: UDP, length 1109
 00:00:00.001316 IP 192.168.99.1.4840 > 192.168.99.2.4840: UDP, length 1109
 00:00:00.001414 IP 192.168.99.1.4840 > 192.168.99.2.4840: UDP, length 1109
 00:00:00.001323 IP 192.168.99.1.4840 > 192.168.99.2.4840: UDP, length 1109
 00:00:00.001533 IP 192.168.99.1.4840 > 192.168.99.2.4840: UDP, length 1109
 00:00:00.001425 IP 192.168.99.1.4840 > 192.168.99.2.4840: UDP, length 1109
 00:00:00.001554 IP 192.168.99.1.4840 > 192.168.99.2.4840: UDP, length 1109
 00:00:00.001299 IP 192.168.99.1.4840 > 192.168.99.2.4840: UDP, length 1109
 00:00:00.001308 IP 192.168.99.1.4840 > 192.168.99.2.4840: UDP, length 1109
 00:00:00.001544 IP 192.168.99.1.4840 > 192.168.99.2.4840: UDP, length 1109
 00:00:00.001188 IP 192.168.99.1.4840 > 192.168.99.2.4840: UDP, length 1109
 00:00:00.001425 IP 192.168.99.1.4840 > 192.168.99.2.4840: UDP, length 1109
 00:00:00.001440 IP 192.168.99.1.4840 > 192.168.99.2.4840: UDP, length 1109
 00:00:00.002139 IP 192.168.99.1.4840 > 192.168.99.2.4840: UDP, length 1109
 00:00:00.001673 IP 192.168.99.1.4840 > 192.168.99.2.4840: UDP, length 1109
 00:00:00.001316 IP 192.168.99.1.4840 > 192.168.99.2.4840: UDP, length 1109
 00:00:00.001413 IP 192.168.99.1.4840 > 192.168.99.2.4840: UDP, length 1109
 00:00:00.001430 IP 192.168.99.1.4840 > 192.168.99.2.4840: UDP, length 1109
 00:00:00.001301 IP 192.168.99.1.4840 > 192.168.99.2.4840: UDP, length 1109
 00:00:00.001310 IP 192.168.99.1.4840 > 192.168.99.2.4840: UDP, length 1109
 00:00:00.001440 IP 192.168.99.1.4840 > 192.168.99.2.4840: UDP, length 1109
 00:00:00.001323 IP 192.168.99.1.4840 > 192.168.99.2.4840: UDP, length 1109
 00:00:00.001996 IP 192.168.99.1.4840 > 192.168.99.2.4840: UDP, length 1109
 00:00:00.000959 IP 192.168.99.1.4840 > 192.168.99.2.4840: UDP, length 1109
 00:00:00.001413 IP 192.168.99.1.4840 > 192.168.99.2.4840: UDP, length 1109
