 00:00:00.000000 IP 192.168.99.1.4840 > 192.168.99.2.4840: UDP, length 1109
 00:00:00.001307 IP 192.168.99.1.4840 > 192.168.99.2.4840: UDP, length 1109
 00:00:00.001910 IP 192.168.99.1.4840 > 192.168.99.2.4840: UDP, length 1109
 00:00:00.001332 IP 192.168.99.1.4840 > 192.168.99.2.4840: UDP, length 1109
 00:00:00.001524 IP 192.168.99.1.4840 > 192.168.99.2.4840: UDP, length 1109
 00:00:00.001785 IP 192.168.99.1.4840 > 192.168.99.2.4840: UDP, length 1109
 00:00:00.001186 IP 192.168.99.1.4840 > 192.168.99.2.4840: UDP, length 1109
 00:00:00.001912 IP 192.168.99.1.4840 > 192.168.99.2.4840: UDP, length 1109
 00:00:00.001189 IP 192.168.99.1.4840 > 192.168.99.2.4840: UDP, length 1109
 00:00:00.001300 IP 192.168.99.1.4840 > 192.168.99.2.4840: UDP, length 1109
 00:00:00.001676 IP 192.168.99.1.4840 > 192.168.99.2.4840: UDP, length 1109
 00:00:00.000943 IP 192.168.99.1.4840 > 192.168.99.2.4840: UDP, length 1109
 00:00:00.001785 IP 192.168.99.1.4840 > 192.168.99.2.4840: UDP, length 1109
 00:00:00.001183 IP 192.168.99.1.4840 > 192.168.99.2.4840: UDP, length 1109
 00:00:00.001306 IP 192.168.99.1.4840 > 192.168.99.2.4840: UDP, length 1109
 00:00:00.001669 IP 192.168.99.1.4840 > 192.168.99.2.4840: UDP, length 1109
 00:00:00.001064 IP 192.168.99.1.4840 > 192.168.99.2.4840: UDP, length 1109
 00:00:00.001566 IP 192.168.99.1.4840 > 192.168.99.2.4840: UDP, length 1109
 00:00:00.001535 IP 192.168.99.1.4840 > 192.168.99.2.4840: UDP, length 1109
 00:00:00.000944 IP 192.168.99.1.4840 > 192.168.99.2.4840: UDP, length 1109
 00:00:00.001691 IP 192.168.99.1.4840 > 192.168.99.2.4840: UDP, length 1109
 00:00:00.001287 IP 192.168.99.1.4840 > 192.168.99.2.4840: UDP, length 1109
 00:00:00.001196 IP 192.168.99.1.4840 > 192.168.99.2.4840: UDP, length 1109
 00:00:00.001788 IP 192.168.99.1.4840 > 192.168.99.2.4840: UDP, length 1109
 00:00:00.001064 IP 192.168.99.1.4840 > 192.168.99.2.4840: UDP, length 1109
 00:00:00.001307 IP 192.168.99.1.4840 > 192.168.99.2.4840: UDP, length 1109
 00:00:00.001540 IP 192.168.99.1.4840 > 192.168.99.2.4840: UDP, length 1109
 00:00:00.001063 IP 192.168.99.1.4840 > 192.168.99.2.4840: UDP, length 1109
 00:00:00.001548 IP 192.168.99.1.4840 > 192.168.99.2.4840: UDP, length 1109
 00:00:00.001306 IP 192.168.99.1.4840 > 192.168.99.2.4840: UDP, length 1109
 00:00:00.001305 IP 192.168.99.1.4840 > 192.168.99.2.4840: UDP, length 1109
 00:00:00.001790 IP 192.168.99.1.4840 > 192.168.99.2.4840: UDP, length 1109
 00:00:00.001196 IP 192.168.99.1.4840 > 192.168.99.2.4840: UDP, length 1109
 00:00:00.001178 IP 192.168.99.1.4840 > 192.168.99.2.4840: UDP, length 1109
 00:00:00.001673 IP 192.168.99.1.4840 > 192.168.99.2.4840: UDP, length 1109
 00:00:00.001075 IP 192.168.99.1.4840 > 192.168.99.2.4840: UDP, length 1109
 00:00:00.001658 IP 192.168.99.1.4840 > 192.168.99.2.4840: UDP, length 1109
 00:00:00.001310 IP 192.168.99.1.4840 > 192.168.99.2.4840: UDP, length 1109
 00:00:00.001193 IP 192.168.99.1.4840 > 192.168.99.2.4840: UDP, length 1109
 00:00:00.001773 IP 192.168.99.1.4840 > 192.168.99.2.4840: UDP, length 1109
 00:00:00.001067 IP 192.168.99.1.4840 > 192.168.99.2.4840: UDP, length 1109
 00:00:00.001801 IP 192.168.99.1.4840 > 192.168.99.2.4840: UDP, length 1109
 00:00:00.001172 IP 192.168.99.1.4840 > 192.168.99.2.4840: UDP, length 1109
 00:00:00.001183 IP 192.168.99.1.4840 > 192.168.99.2.4840: UDP, length 1109
 00:00:00.001792 IP 192.168.99.1.4840 > 192.168.99.2.4840: UDP, length 1109
 00:00:00.000942 IP 192.168.99.1.4840 > 192.168.99.2.4840: UDP, length 1109
 00:00:00.001671 IP 192.168.99.1.4840 > 192.168.99.2.4840: UDP, length 1109
 00:00:00.001304 IP 192.168.99.1.4840 > 192.168.99.2.4840: UDP, length 1109
 00:00:00.001185 IP 192.168.99.1.4840 > 192.168.99.2.4840: UDP, length 1109
 00:00:00.001823 IP 192.168.99.1.4840 > 192.168.99.2.4840: UDP, length 1109
 00:00:00.001038 IP 192.168.99.1.4840 > 192.168.99.2.4840: UDP, length 1109
 00:00:00.001547 IP 192.168.99.1.4840 > 192.168.99.2.4840: UDP, length 1109
 00:00:00.001426 IP 192.168.99.1.4840 > 192.168.99.2.4840: UDP, length 1109
 00:00:00.001062 IP 192.168.99.1.4840 > 192.168.99.2.4840: UDP, length 1109
 00:00:00.001548 IP 192.168.99.1.4840 > 192.168.99.2.4840: UDP, length 1109
 00:00:00.001447 IP 192.168.99.1.4840 > 192.168.99.2.4840: UDP, length 1109
 00:00:00.001164 IP 192.168.99.1.4840 > 192.168.99.2.4840: UDP, length 1109
 00:00:00.001796 IP 192.168.99.1.4840 > 192.168.99.2.4840: UDP, length 1109
 00:00:00.001057 IP 192.168.99.1.4840 > 192.168.99.2.4840: UDP, length 1109
 00:00:00.001307 IP 192.168.99.1.4840 > 192.168.99.2.4840: UDP, length 1109
 00:00:00.001669 IP 192.168.99.1.4840 > 192.168.99.2.4840: UDP, length 1109
 00:00:00.000942 IP 192.168.99.1.4840 > 192.168.99.2.4840: UDP, length 1109
 00:00:00.001304 IP 192.168.99.1.4840 > 192.168.99.2.4840: UDP, length 1109
 00:00:00.001671 IP 192.168.99.1.4840 > 192.168.99.2.4840: UDP, length 1109
 00:00:00.001180 IP 192.168.99.1.4840 > 192.168.99.2.4840: UDP, length 1109
 00:00:00.001431 IP 192.168.99.1.4840 > 192.168.99.2.4840: UDP, length 1109
 00:00:00.001441 IP 192.168.99.1.4840 > 192.168.99.2.4840: UDP, length 1109
 00:00:00.001291 IP 192.168.99.1.4840 > 192.168.99.2.4840: UDP, length 1109
 00:00:00.001427 IP 192.168.99.1.4840 > 192.168.99.2.4840: UDP, length 1109
 00:00:00.001304 IP 192.168.99.1.4840 > 192.168.99.2.4840: UDP, length 1109
 00:00:00.001181 IP 192.168.99.1.4840 > 192.168.99.2.4840: UDP, length 1109
 00:00:00.001675 IP 192.168.99.1.4840 > 192.168.99.2.4840: UDP, length 1109
 00:00:00.001063 IP 192.168.99.1.4840 > 192.168.99.2.4840: UDP, length 1109
 00:00:00.001183 IP 192.168.99.1.4840 > 192.168.99.2.4840: UDP, length 1109
 00:00:00.001790 IP 192.168.99.1.4840 > 192.168.99.2.4840: UDP, length 1109
 00:00:00.001096 IP 192.168.99.1.4840 > 192.168.99.2.4840: UDP, length 1109
 00:00:00.001392 IP 192.168.99.1.4840 > 192.168.99.2.4840: UDP, length 1109
 00:00:00.001670 IP 192.168.99.1.4840 > 192.168.99.2.4840: UDP, length 1109
 00:00:00.000941 IP 192.168.99.1.4840 > 192.168.99.2.4840: UDP, length 1109
 00:00:00.001549 IP 192.168.99.1.4840 > 192.168.99.2.4840: UDP, length 1109
 00:00:00.001546 IP 192.168.99.1.4840 > 192.168.99.2.4840: UDP, length 1109
 00:00:00.000957 IP 192.168.99.1.4840 > 192.168.99.2.4840: UDP, length 1109
 00:00:00.001534 IP 192.168.99.1.4840 > 192.168.99.2.4840: UDP, length 1109
 00:00:00.001308 IP 192.168.99.1.4840 > 192.168.99.2.4840: UDP, length 1109
 00:00:00.001665 IP 192.168.99.1.4840 > 192.168.99.2.4840: UDP, length 1109
 00:00:00.001428 IP 192.168.99.1.4840 > 192.168.99.2.4840: UDP, length 1109
 00:00:00.001063 IP 192.168.99.1.4840 > 192.168.99.2.4840: UDP, length 1109
 00:00:00.001670 IP 192.168.99.1.4840 > 192.168.99.2.4840: UDP, length 1109
 00:00:00.001306 IP 192.168.99.1.4840 > 192.168.99.2.4840: UDP, length 1109
 00:00:00.001073 IP 192.168.99.1.4840 > 192.168.99.2.4840: UDP, length 1109
 00:00:00.001780 IP 192.168.99.1.4840 > 192.168.99.2.4840: UDP, length 1109
 00:00:00.001064 IP 192.168.99.1.4840 > 192.168.99.2.4840: UDP, length 1109
 00:00:00.001315 IP 192.168.99.1.4840 > 192.168.99.2.4840: UDP, length 1109
 00:00:00.001659 IP 192.168.99.1.4840 > 192.168.99.2.4840: UDP, length 1109
 00:00:00.001180 IP 192.168.99.1.4840 > 192.168.99.2.4840: UDP, length 1109
 00:00:00.001187 IP 192.168.99.1.4840 > 192.168.99.2.4840: UDP, length 1109
 00:00:00.001671 IP 192.168.99.1.4840 > 192.168.99.2.4840: UDP, length 1109
 00:00:00.001421 IP 192.168.99.1.4840 > 192.168.99.2.4840: UDP, length 1109
 00:00:00.001687 IP 192.168.99.1.4840 > 192.168.99.2.4840: UDP, length 1109
 00:00:00.001289 IP 192.168.99.1.4840 > 192.168.99.2.4840: UDP, length 1109
 00:00:00.001670 IP 192.168.99.1.4840 > 192.168.99.2.4840: UDP, length 1109
 00:00:00.001792 IP 192.168.99.1.4840 > 192.168.99.2.4840: UDP, length 1109
 00:00:00.002036 IP 192.168.99.1.4840 > 192.168.99.2.4840: UDP, length 1109
 00:00:00.001176 IP 192.168.99.1.4840 > 192.168.99.2.4840: UDP, length 1109
 00:00:00.001430 IP 192.168.99.1.4840 > 192.168.99.2.4840: UDP, length 1109
 00:00:00.001552 IP 192.168.99.1.4840 > 192.168.99.2.4840: UDP, length 1109
 00:00:00.000937 IP 192.168.99.1.4840 > 192.168.99.2.4840: UDP, length 1109
 00:00:00.001550 IP 192.168.99.1.4840 > 192.168.99.2.4840: UDP, length 1109
 00:00:00.002269 IP 192.168.99.1.4840 > 192.168.99.2.4840: UDP, length 1109
 00:00:00.002413 IP 192.168.99.1.4840 > 192.168.99.2.4840: UDP, length 1109
 00:00:00.000809 IP 192.168.99.1.4840 > 192.168.99.2.4840: UDP, length 1109
 00:00:00.001923 IP 192.168.99.1.4840 > 192.168.99.2.4840: UDP, length 1109
 00:00:00.001198 IP 192.168.99.1.4840 > 192.168.99.2.4840: UDP, length 1109
 00:00:00.001175 IP 192.168.99.1.4840 > 192.168.99.2.4840: UDP, length 1109
 00:00:00.001666 IP 192.168.99.1.4840 > 192.168.99.2.4840: UDP, length 1109
 00:00:00.001323 IP 192.168.99.1.4840 > 192.168.99.2.4840: UDP, length 1109
 00:00:00.002571 IP 192.168.99.1.4840 > 192.168.99.2.4840: UDP, length 1109
 00:00:00.001547 IP 192.168.99.1.4840 > 192.168.99.2.4840: UDP, length 1109
 00:00:00.001548 IP 192.168.99.1.4840 > 192.168.99.2.4840: UDP, length 1109
 00:00:00.001307 IP 192.168.99.1.4840 > 192.168.99.2.4840: UDP, length 1109
 00:00:00.001305 IP 192.168.99.1.4840 > 192.168.99.2.4840: UDP, length 1109
 00:00:00.001305 IP 192.168.99.1.4840 > 192.168.99.2.4840: UDP, length 1109
 00:00:00.001450 IP 192.168.99.1.4840 > 192.168.99.2.4840: UDP, length 1109
 00:00:00.001405 IP 192.168.99.1.4840 > 192.168.99.2.4840: UDP, length 1109
 00:00:00.001304 IP 192.168.99.1.4840 > 192.168.99.2.4840: UDP, length 1109
 00:00:00.001440 IP 192.168.99.1.4840 > 192.168.99.2.4840: UDP, length 1109
 00:00:00.001657 IP 192.168.99.1.4840 > 192.168.99.2.4840: UDP, length 1109
 00:00:00.001184 IP 192.168.99.1.4840 > 192.168.99.2.4840: UDP, length 1109
 00:00:00.001315 IP 192.168.99.1.4840 > 192.168.99.2.4840: UDP, length 1109
 00:00:00.001536 IP 192.168.99.1.4840 > 192.168.99.2.4840: UDP, length 1109
 00:00:00.000961 IP 192.168.99.1.4840 > 192.168.99.2.4840: UDP, length 1109
 00:00:00.001775 IP 192.168.99.1.4840 > 192.168.99.2.4840: UDP, length 1109
 00:00:00.001181 IP 192.168.99.1.4840 > 192.168.99.2.4840: UDP, length 1109
 00:00:00.001209 IP 192.168.99.1.4840 > 192.168.99.2.4840: UDP, length 1109
 00:00:00.002129 IP 192.168.99.1.4840 > 192.168.99.2.4840: UDP, length 1109
 00:00:00.001669 IP 192.168.99.1.4840 > 192.168.99.2.4840: UDP, length 1109
 00:00:00.001319 IP 192.168.99.1.4840 > 192.168.99.2.4840: UDP, length 1109
 00:00:00.001536 IP 192.168.99.1.4840 > 192.168.99.2.4840: UDP, length 1109
 00:00:00.001062 IP 192.168.99.1.4840 > 192.168.99.2.4840: UDP, length 1109
 00:00:00.001561 IP 192.168.99.1.4840 > 192.168.99.2.4840: UDP, length 1109
 00:00:00.001534 IP 192.168.99.1.4840 > 192.168.99.2.4840: UDP, length 1109
 00:00:00.001062 IP 192.168.99.1.4840 > 192.168.99.2.4840: UDP, length 1109
 00:00:00.001913 IP 192.168.99.1.4840 > 192.168.99.2.4840: UDP, length 1109
 00:00:00.001063 IP 192.168.99.1.4840 > 192.168.99.2.4840: UDP, length 1109
 00:00:00.001561 IP 192.168.99.1.4840 > 192.168.99.2.4840: UDP, length 1109
 00:00:00.001414 IP 192.168.99.1.4840 > 192.168.99.2.4840: UDP, length 1109
 00:00:00.000939 IP 192.168.99.1.4840 > 192.168.99.2.4840: UDP, length 1109
 00:00:00.001671 IP 192.168.99.1.4840 > 192.168.99.2.4840: UDP, length 1109
 00:00:00.001305 IP 192.168.99.1.4840 > 192.168.99.2.4840: UDP, length 1109
 00:00:00.001065 IP 192.168.99.1.4840 > 192.168.99.2.4840: UDP, length 1109
 00:00:00.001788 IP 192.168.99.1.4840 > 192.168.99.2.4840: UDP, length 1109
 00:00:00.001187 IP 192.168.99.1.4840 > 192.168.99.2.4840: UDP, length 1109
 00:00:00.001426 IP 192.168.99.1.4840 > 192.168.99.2.4840: UDP, length 1109
 00:00:00.001546 IP 192.168.99.1.4840 > 192.168.99.2.4840: UDP, length 1109
 00:00:00.001186 IP 192.168.99.1.4840 > 192.168.99.2.4840: UDP, length 1109
 00:00:00.001790 IP 192.168.99.1.4840 > 192.168.99.2.4840: UDP, length 1109
 00:00:00.001074 IP 192.168.99.1.4840 > 192.168.99.2.4840: UDP, length 1109
 00:00:00.001439 IP 192.168.99.1.4840 > 192.168.99.2.4840: UDP, length 1109
 00:00:00.001532 IP 192.168.99.1.4840 > 192.168.99.2.4840: UDP, length 1109
 00:00:00.001054 IP 192.168.99.1.4840 > 192.168.99.2.4840: UDP, length 1109
 00:00:00.002519 IP 192.168.99.1.4840 > 192.168.99.2.4840: UDP, length 1109
 00:00:00.001425 IP 192.168.99.1.4840 > 192.168.99.2.4840: UDP, length 1109
 00:00:00.001065 IP 192.168.99.1.4840 > 192.168.99.2.4840: UDP, length 1109
 00:00:00.001789 IP 192.168.99.1.4840 > 192.168.99.2.4840: UDP, length 1109
 00:00:00.001307 IP 192.168.99.1.4840 > 192.168.99.2.4840: UDP, length 1109
 00:00:00.000816 IP 192.168.99.1.4840 > 192.168.99.2.4840: UDP, length 1109
 00:00:00.001912 IP 192.168.99.1.4840 > 192.168.99.2.4840: UDP, length 1109
 00:00:00.001319 IP 192.168.99.1.4840 > 192.168.99.2.4840: UDP, length 1109
 00:00:00.000933 IP 192.168.99.1.4840 > 192.168.99.2.4840: UDP, length 1109
 00:00:00.001786 IP 192.168.99.1.4840 > 192.168.99.2.4840: UDP, length 1109
 00:00:00.001199 IP 192.168.99.1.4840 > 192.168.99.2.4840: UDP, length 1109
 00:00:00.001172 IP 192.168.99.1.4840 > 192.168.99.2.4840: UDP, length 1109
 00:00:00.001669 IP 192.168.99.1.4840 > 192.168.99.2.4840: UDP, length 1109
 00:00:00.001078 IP 192.168.99.1.4840 > 192.168.99.2.4840: UDP, length 1109
 00:00:00.001654 IP 192.168.99.1.4840 > 192.168.99.2.4840: UDP, length 1109
 00:00:00.001304 IP 192.168.99.1.4840 > 192.168.99.2.4840: UDP, length 1109
 00:00:00.001067 IP 192.168.99.1.4840 > 192.168.99.2.4840: UDP, length 1109
 00:00:00.001667 IP 192.168.99.1.4840 > 192.168.99.2.4840: UDP, length 1109
 00:00:00.001189 IP 192.168.99.1.4840 > 192.168.99.2.4840: UDP, length 1109
 00:00:00.001298 IP 192.168.99.1.4840 > 192.168.99.2.4840: UDP, length 1109
 00:00:00.001697 IP 192.168.99.1.4840 > 192.168.99.2.4840: UDP, length 1109
 00:00:00.001276 IP 192.168.99.1.4840 > 192.168.99.2.4840: UDP, length 1109
 00:00:00.001203 IP 192.168.99.1.4840 > 192.168.99.2.4840: UDP, length 1109
 00:00:00.001657 IP 192.168.99.1.4840 > 192.168.99.2.4840: UDP, length 1109
 00:00:00.000938 IP 192.168.99.1.4840 > 192.168.99.2.4840: UDP, length 1109
 00:00:00.001669 IP 192.168.99.1.4840 > 192.168.99.2.4840: UDP, length 1109
 00:00:00.001554 IP 192.168.99.1.4840 > 192.168.99.2.4840: UDP, length 1109
 00:00:00.000941 IP 192.168.99.1.4840 > 192.168.99.2.4840: UDP, length 1109
 00:00:00.001907 IP 192.168.99.1.4840 > 192.168.99.2.4840: UDP, length 1109
 00:00:00.001792 IP 192.168.99.1.4840 > 192.168.99.2.4840: UDP, length 1109
 00:00:00.001075 IP 192.168.99.1.4840 > 192.168.99.2.4840: UDP, length 1109
 00:00:00.001778 IP 192.168.99.1.4840 > 192.168.99.2.4840: UDP, length 1109
 00:00:00.001304 IP 192.168.99.1.4840 > 192.168.99.2.4840: UDP, length 1109
 00:00:00.001320 IP 192.168.99.1.4840 > 192.168.99.2.4840: UDP, length 1109
 00:00:00.001658 IP 192.168.99.1.4840 > 192.168.99.2.4840: UDP, length 1109
 00:00:00.001180 IP 192.168.99.1.4840 > 192.168.99.2.4840: UDP, length 1109
 00:00:00.001804 IP 192.168.99.1.4840 > 192.168.99.2.4840: UDP, length 1109
 00:00:00.001050 IP 192.168.99.1.4840 > 192.168.99.2.4840: UDP, length 1109
 00:00:00.001937 IP 192.168.99.1.4840 > 192.168.99.2.4840: UDP, length 1109
 00:00:00.001428 IP 192.168.99.1.4840 > 192.168.99.2.4840: UDP, length 1109
 00:00:00.001536 IP 192.168.99.1.4840 > 192.168.99.2.4840: UDP, length 1109
 00:00:00.001550 IP 192.168.99.1.4840 > 192.168.99.2.4840: UDP, length 1109
 00:00:00.001543 IP 192.168.99.1.4840 > 192.168.99.2.4840: UDP, length 1109
 00:00:00.001430 IP 192.168.99.1.4840 > 192.168.99.2.4840: UDP, length 1109
 00:00:00.001575 IP 192.168.99.1.4840 > 192.168.99.2.4840: UDP, length 1109
 00:00:00.001157 IP 192.168.99.1.4840 > 192.168.99.2.4840: UDP, length 1109
 00:00:00.001790 IP 192.168.99.1.4840 > 192.168.99.2.4840: UDP, length 1109
 00:00:00.001064 IP 192.168.99.1.4840 > 192.168.99.2.4840: UDP, length 1109
 00:00:00.001910 IP 192.168.99.1.4840 > 192.168.99.2.4840: UDP, length 1109
 00:00:00.000944 IP 192.168.99.1.4840 > 192.168.99.2.4840: UDP, length 1109
 00:00:00.001922 IP 192.168.99.1.4840 > 192.168.99.2.4840: UDP, length 1109
 00:00:00.001171 IP 192.168.99.1.4840 > 192.168.99.2.4840: UDP, length 1109
 00:00:00.001427 IP 192.168.99.1.4840 > 192.168.99.2.4840: UDP, length 1109
 00:00:00.001668 IP 192.168.99.1.4840 > 192.168.99.2.4840: UDP, length 1109
 00:00:00.001065 IP 192.168.99.1.4840 > 192.168.99.2.4840: UDP, length 1109
 00:00:00.001798 IP 192.168.99.1.4840 > 192.168.99.2.4840: UDP, length 1109
 00:00:00.001055 IP 192.168.99.1.4840 > 192.168.99.2.4840: UDP, length 1109
 00:00:00.001797 IP 192.168.99.1.4840 > 192.168.99.2.4840: UDP, length 1109
 00:00:00.001183 IP 192.168.99.1.4840 > 192.168.99.2.4840: UDP, length 1109
 00:00:00.001549 IP 192.168.99.1.4840 > 192.168.99.2.4840: UDP, length 1109
 00:00:00.001425 IP 192.168.99.1.4840 > 192.168.99.2.4840: UDP, length 1109
 00:00:00.001321 IP 192.168.99.1.4840 > 192.168.99.2.4840: UDP, length 1109
 00:00:00.001658 IP 192.168.99.1.4840 > 192.168.99.2.4840: UDP, length 1109
 00:00:00.001061 IP 192.168.99.1.4840 > 192.168.99.2.4840: UDP, length 1109
 00:00:00.001927 IP 192.168.99.1.4840 > 192.168.99.2.4840: UDP, length 1109
 00:00:00.001290 IP 192.168.99.1.4840 > 192.168.99.2.4840: UDP, length 1109
 00:00:00.001184 IP 192.168.99.1.4840 > 192.168.99.2.4840: UDP, length 1109
 00:00:00.001547 IP 192.168.99.1.4840 > 192.168.99.2.4840: UDP, length 1109
 00:00:00.001306 IP 192.168.99.1.4840 > 192.168.99.2.4840: UDP, length 1109
 00:00:00.001790 IP 192.168.99.1.4840 > 192.168.99.2.4840: UDP, length 1109
 00:00:00.000953 IP 192.168.99.1.4840 > 192.168.99.2.4840: UDP, length 1109
 00:00:00.001780 IP 192.168.99.1.4840 > 192.168.99.2.4840: UDP, length 1109
 00:00:00.001193 IP 192.168.99.1.4840 > 192.168.99.2.4840: UDP, length 1109
 00:00:00.001669 IP 192.168.99.1.4840 > 192.168.99.2.4840: UDP, length 1109
 00:00:00.001536 IP 192.168.99.1.4840 > 192.168.99.2.4840: UDP, length 1109
 00:00:00.001193 IP 192.168.99.1.4840 > 192.168.99.2.4840: UDP, length 1109
 00:00:00.001660 IP 192.168.99.1.4840 > 192.168.99.2.4840: UDP, length 1109
 00:00:00.001065 IP 192.168.99.1.4840 > 192.168.99.2.4840: UDP, length 1109
 00:00:00.001923 IP 192.168.99.1.4840 > 192.168.99.2.4840: UDP, length 1109
 00:00:00.001052 IP 192.168.99.1.4840 > 192.168.99.2.4840: UDP, length 1109
 00:00:00.001907 IP 192.168.99.1.4840 > 192.168.99.2.4840: UDP, length 1109
 00:00:00.001067 IP 192.168.99.1.4840 > 192.168.99.2.4840: UDP, length 1109
 00:00:00.001547 IP 192.168.99.1.4840 > 192.168.99.2.4840: UDP, length 1109
 00:00:00.001304 IP 192.168.99.1.4840 > 192.168.99.2.4840: UDP, length 1109
 00:00:00.001683 IP 192.168.99.1.4840 > 192.168.99.2.4840: UDP, length 1109
 00:00:00.001412 IP 192.168.99.1.4840 > 192.168.99.2.4840: UDP, length 1109
 00:00:00.001067 IP 192.168.99.1.4840 > 192.168.99.2.4840: UDP, length 1109
 00:00:00.001790 IP 192.168.99.1.4840 > 192.168.99.2.4840: UDP, length 1109
 00:00:00.001182 IP 192.168.99.1.4840 > 192.168.99.2.4840: UDP, length 1109
 00:00:00.001549 IP 192.168.99.1.4840 > 192.168.99.2.4840: UDP, length 1109
 00:00:00.001423 IP 192.168.99.1.4840 > 192.168.99.2.4840: UDP, length 1109
 00:00:00.001426 IP 192.168.99.1.4840 > 192.168.99.2.4840: UDP, length 1109
 00:00:00.001549 IP 192.168.99.1.4840 > 192.168.99.2.4840: UDP, length 1109
 00:00:00.001065 IP 192.168.99.1.4840 > 192.168.99.2.4840: UDP, length 1109
 00:00:00.001910 IP 192.168.99.1.4840 > 192.168.99.2.4840: UDP, length 1109
 00:00:00.001085 IP 192.168.99.1.4840 > 192.168.99.2.4840: UDP, length 1109
 00:00:00.001530 IP 192.168.99.1.4840 > 192.168.99.2.4840: UDP, length 1109
 00:00:00.001422 IP 192.168.99.1.4840 > 192.168.99.2.4840: UDP, length 1109
 00:00:00.001441 IP 192.168.99.1.4840 > 192.168.99.2.4840: UDP, length 1109
 00:00:00.001537 IP 192.168.99.1.4840 > 192.168.99.2.4840: UDP, length 1109
 00:00:00.001181 IP 192.168.99.1.4840 > 192.168.99.2.4840: UDP, length 1109
 00:00:00.001789 IP 192.168.99.1.4840 > 192.168.99.2.4840: UDP, length 1109
 00:00:00.001067 IP 192.168.99.1.4840 > 192.168.99.2.4840: UDP, length 1109
 00:00:00.001799 IP 192.168.99.1.4840 > 192.168.99.2.4840: UDP, length 1109
 00:00:00.001187 IP 192.168.99.1.4840 > 192.168.99.2.4840: UDP, length 1109
 00:00:00.001774 IP 192.168.99.1.4840 > 192.168.99.2.4840: UDP, length 1109
 00:00:00.001200 IP 192.168.99.1.4840 > 192.168.99.2.4840: UDP, length 1109
 00:00:00.001292 IP 192.168.99.1.4840 > 192.168.99.2.4840: UDP, length 1109
 00:00:00.001668 IP 192.168.99.1.4840 > 192.168.99.2.4840: UDP, length 1109
 00:00:00.001064 IP 192.168.99.1.4840 > 192.168.99.2.4840: UDP, length 1109
 00:00:00.001788 IP 192.168.99.1.4840 > 192.168.99.2.4840: UDP, length 1109
 00:00:00.001186 IP 192.168.99.1.4840 > 192.168.99.2.4840: UDP, length 1109
 00:00:00.001672 IP 192.168.99.1.4840 > 192.168.99.2.4840: UDP, length 1109
 00:00:00.001301 IP 192.168.99.1.4840 > 192.168.99.2.4840: UDP, length 1109
 00:00:00.001550 IP 192.168.99.1.4840 > 192.168.99.2.4840: UDP, length 1109
 00:00:00.001548 IP 192.168.99.1.4840 > 192.168.99.2.4840: UDP, length 1109
 00:00:00.001062 IP 192.168.99.1.4840 > 192.168.99.2.4840: UDP, length 1109
 00:00:00.001911 IP 192.168.99.1.4840 > 192.168.99.2.4840: UDP, length 1109
 00:00:00.000942 IP 192.168.99.1.4840 > 192.168.99.2.4840: UDP, length 1109
 00:00:00.001912 IP 192.168.99.1.4840 > 192.168.99.2.4840: UDP, length 1109
 00:00:00.001062 IP 192.168.99.1.4840 > 192.168.99.2.4840: UDP, length 1109
 00:00:00.001428 IP 192.168.99.1.4840 > 192.168.99.2.4840: UDP, length 1109
 00:00:00.001550 IP 192.168.99.1.4840 > 192.168.99.2.4840: UDP, length 1109
 00:00:00.001666 IP 192.168.99.1.4840 > 192.168.99.2.4840: UDP, length 1109
 00:00:00.001430 IP 192.168.99.1.4840 > 192.168.99.2.4840: UDP, length 1109
 00:00:00.001439 IP 192.168.99.1.4840 > 192.168.99.2.4840: UDP, length 1109
 00:00:00.001548 IP 192.168.99.1.4840 > 192.168.99.2.4840: UDP, length 1109
 00:00:00.001184 IP 192.168.99.1.4840 > 192.168.99.2.4840: UDP, length 1109
 00:00:00.001789 IP 192.168.99.1.4840 > 192.168.99.2.4840: UDP, length 1109
 00:00:00.001087 IP 192.168.99.1.4840 > 192.168.99.2.4840: UDP, length 1109
 00:00:00.001645 IP 192.168.99.1.4840 > 192.168.99.2.4840: UDP, length 1109
 00:00:00.002038 IP 192.168.99.1.4840 > 192.168.99.2.4840: UDP, length 1109
 00:00:00.001105 IP 192.168.99.1.4840 > 192.168.99.2.4840: UDP, length 1109
 00:00:00.001216 IP 192.168.99.1.4840 > 192.168.99.2.4840: UDP, length 1109
 00:00:00.001119 IP 192.168.99.1.4840 > 192.168.99.2.4840: UDP, length 1109
 00:00:00.002184 IP 192.168.99.1.4840 > 192.168.99.2.4840: UDP, length 1109
 00:00:00.001201 IP 192.168.99.1.4840 > 192.168.99.2.4840: UDP, length 1109
 00:00:00.001144 IP 192.168.99.1.4840 > 192.168.99.2.4840: UDP, length 1109
 00:00:00.002131 IP 192.168.99.1.4840 > 192.168.99.2.4840: UDP, length 1109
 00:00:00.001124 IP 192.168.99.1.4840 > 192.168.99.2.4840: UDP, length 1109
 00:00:00.001007 IP 192.168.99.1.4840 > 192.168.99.2.4840: UDP, length 1109
 00:00:00.001061 IP 192.168.99.1.4840 > 192.168.99.2.4840: UDP, length 1109
 00:00:00.001837 IP 192.168.99.1.4840 > 192.168.99.2.4840: UDP, length 1109
 00:00:00.001138 IP 192.168.99.1.4840 > 192.168.99.2.4840: UDP, length 1109
 00:00:00.001441 IP 192.168.99.1.4840 > 192.168.99.2.4840: UDP, length 1109
 00:00:00.001548 IP 192.168.99.1.4840 > 192.168.99.2.4840: UDP, length 1109
 00:00:00.001302 IP 192.168.99.1.4840 > 192.168.99.2.4840: UDP, length 1109
 00:00:00.001681 IP 192.168.99.1.4840 > 192.168.99.2.4840: UDP, length 1109
 00:00:00.001051 IP 192.168.99.1.4840 > 192.168.99.2.4840: UDP, length 1109
 00:00:00.001792 IP 192.168.99.1.4840 > 192.168.99.2.4840: UDP, length 1109
 00:00:00.001181 IP 192.168.99.1.4840 > 192.168.99.2.4840: UDP, length 1109
 00:00:00.001426 IP 192.168.99.1.4840 > 192.168.99.2.4840: UDP, length 1109
 00:00:00.001551 IP 192.168.99.1.4840 > 192.168.99.2.4840: UDP, length 1109
 00:00:00.001304 IP 192.168.99.1.4840 > 192.168.99.2.4840: UDP, length 1109
 00:00:00.001671 IP 192.168.99.1.4840 > 192.168.99.2.4840: UDP, length 1109
 00:00:00.001079 IP 192.168.99.1.4840 > 192.168.99.2.4840: UDP, length 1109
 00:00:00.001897 IP 192.168.99.1.4840 > 192.168.99.2.4840: UDP, length 1109
 00:00:00.001059 IP 192.168.99.1.4840 > 192.168.99.2.4840: UDP, length 1109
 00:00:00.001550 IP 192.168.99.1.4840 > 192.168.99.2.4840: UDP, length 1109
 00:00:00.001427 IP 192.168.99.1.4840 > 192.168.99.2.4840: UDP, length 1109
 00:00:00.001183 IP 192.168.99.1.4840 > 192.168.99.2.4840: UDP, length 1109
 00:00:00.001927 IP 192.168.99.1.4840 > 192.168.99.2.4840: UDP, length 1109
 00:00:00.001410 IP 192.168.99.1.4840 > 192.168.99.2.4840: UDP, length 1109
 00:00:00.001672 IP 192.168.99.1.4840 > 192.168.99.2.4840: UDP, length 1109
 00:00:00.000940 IP 192.168.99.1.4840 > 192.168.99.2.4840: UDP, length 1109
 00:00:00.001787 IP 192.168.99.1.4840 > 192.168.99.2.4840: UDP, length 1109
 00:00:00.001313 IP 192.168.99.1.4840 > 192.168.99.2.4840: UDP, length 1109
 00:00:00.001544 IP 192.168.99.1.4840 > 192.168.99.2.4840: UDP, length 1109
 00:00:00.001306 IP 192.168.99.1.4840 > 192.168.99.2.4840: UDP, length 1109
 00:00:00.001313 IP 192.168.99.1.4840 > 192.168.99.2.4840: UDP, length 1109
 00:00:00.001540 IP 192.168.99.1.4840 > 192.168.99.2.4840: UDP, length 1109
 00:00:00.001182 IP 192.168.99.1.4840 > 192.168.99.2.4840: UDP, length 1109
 00:00:00.002031 IP 192.168.99.1.4840 > 192.168.99.2.4840: UDP, length 1109
 00:00:00.001429 IP 192.168.99.1.4840 > 192.168.99.2.4840: UDP, length 1109
 00:00:00.001425 IP 192.168.99.1.4840 > 192.168.99.2.4840: UDP, length 1109
 00:00:00.001197 IP 192.168.99.1.4840 > 192.168.99.2.4840: UDP, length 1109
 00:00:00.001901 IP 192.168.99.1.4840 > 192.168.99.2.4840: UDP, length 1109
 00:00:00.001064 IP 192.168.99.1.4840 > 192.168.99.2.4840: UDP, length 1109
 00:00:00.001785 IP 192.168.99.1.4840 > 192.168.99.2.4840: UDP, length 1109
 00:00:00.001067 IP 192.168.99.1.4840 > 192.168.99.2.4840: UDP, length 1109
 00:00:00.001666 IP 192.168.99.1.4840 > 192.168.99.2.4840: UDP, length 1109
 00:00:00.001431 IP 192.168.99.1.4840 > 192.168.99.2.4840: UDP, length 1109
 00:00:00.001061 IP 192.168.99.1.4840 > 192.168.99.2.4840: UDP, length 1109
 00:00:00.001804 IP 192.168.99.1.4840 > 192.168.99.2.4840: UDP, length 1109
 00:00:00.001171 IP 192.168.99.1.4840 > 192.168.99.2.4840: UDP, length 1109
 00:00:00.001668 IP 192.168.99.1.4840 > 192.168.99.2.4840: UDP, length 1109
 00:00:00.001185 IP 192.168.99.1.4840 > 192.168.99.2.4840: UDP, length 1109
 00:00:00.001547 IP 192.168.99.1.4840 > 192.168.99.2.4840: UDP, length 1109
 00:00:00.001425 IP 192.168.99.1.4840 > 192.168.99.2.4840: UDP, length 1109
 00:00:00.001082 IP 192.168.99.1.4840 > 192.168.99.2.4840: UDP, length 1109
 00:00:00.002012 IP 192.168.99.1.4840 > 192.168.99.2.4840: UDP, length 1109
 00:00:00.000945 IP 192.168.99.1.4840 > 192.168.99.2.4840: UDP, length 1109
 00:00:00.001797 IP 192.168.99.1.4840 > 192.168.99.2.4840: UDP, length 1109
 00:00:00.001435 IP 192.168.99.1.4840 > 192.168.99.2.4840: UDP, length 1109
 00:00:00.001787 IP 192.168.99.1.4840 > 192.168.99.2.4840: UDP, length 1109
 00:00:00.001077 IP 192.168.99.1.4840 > 192.168.99.2.4840: UDP, length 1109
 00:00:00.001777 IP 192.168.99.1.4840 > 192.168.99.2.4840: UDP, length 1109
 00:00:00.001183 IP 192.168.99.1.4840 > 192.168.99.2.4840: UDP, length 1109
 00:00:00.001793 IP 192.168.99.1.4840 > 192.168.99.2.4840: UDP, length 1109
 00:00:00.001791 IP 192.168.99.1.4840 > 192.168.99.2.4840: UDP, length 1109
 00:00:00.001668 IP 192.168.99.1.4840 > 192.168.99.2.4840: UDP, length 1109
 00:00:00.001550 IP 192.168.99.1.4840 > 192.168.99.2.4840: UDP, length 1109
 00:00:00.001301 IP 192.168.99.1.4840 > 192.168.99.2.4840: UDP, length 1109
 00:00:00.001791 IP 192.168.99.1.4840 > 192.168.99.2.4840: UDP, length 1109
 00:00:00.001184 IP 192.168.99.1.4840 > 192.168.99.2.4840: UDP, length 1109
 00:00:00.001430 IP 192.168.99.1.4840 > 192.168.99.2.4840: UDP, length 1109
 00:00:00.001438 IP 192.168.99.1.4840 > 192.168.99.2.4840: UDP, length 1109
 00:00:00.001048 IP 192.168.99.1.4840 > 192.168.99.2.4840: UDP, length 1109
 00:00:00.001821 IP 192.168.99.1.4840 > 192.168.99.2.4840: UDP, length 1109
 00:00:00.001158 IP 192.168.99.1.4840 > 192.168.99.2.4840: UDP, length 1109
 00:00:00.001182 IP 192.168.99.1.4840 > 192.168.99.2.4840: UDP, length 1109
 00:00:00.001795 IP 192.168.99.1.4840 > 192.168.99.2.4840: UDP, length 1109
 00:00:00.001439 IP 192.168.99.1.4840 > 192.168.99.2.4840: UDP, length 1109
 00:00:00.002273 IP 192.168.99.1.4840 > 192.168.99.2.4840: UDP, length 1109
 00:00:00.001556 IP 192.168.99.1.4840 > 192.168.99.2.4840: UDP, length 1109
 00:00:00.001778 IP 192.168.99.1.4840 > 192.168.99.2.4840: UDP, length 1109
 00:00:00.001550 IP 192.168.99.1.4840 > 192.168.99.2.4840: UDP, length 1109
 00:00:00.001570 IP 192.168.99.1.4840 > 192.168.99.2.4840: UDP, length 1109
 00:00:00.001041 IP 192.168.99.1.4840 > 192.168.99.2.4840: UDP, length 1109
 00:00:00.001793 IP 192.168.99.1.4840 > 192.168.99.2.4840: UDP, length 1109
 00:00:00.001181 IP 192.168.99.1.4840 > 192.168.99.2.4840: UDP, length 1109
 00:00:00.001792 IP 192.168.99.1.4840 > 192.168.99.2.4840: UDP, length 1109
 00:00:00.001059 IP 192.168.99.1.4840 > 192.168.99.2.4840: UDP, length 1109
 00:00:00.001925 IP 192.168.99.1.4840 > 192.168.99.2.4840: UDP, length 1109
 00:00:00.001052 IP 192.168.99.1.4840 > 192.168.99.2.4840: UDP, length 1109
 00:00:00.001435 IP 192.168.99.1.4840 > 192.168.99.2.4840: UDP, length 1109
 00:00:00.001541 IP 192.168.99.1.4840 > 192.168.99.2.4840: UDP, length 1109
 00:00:00.001185 IP 192.168.99.1.4840 > 192.168.99.2.4840: UDP, length 1109
 00:00:00.001787 IP 192.168.99.1.4840 > 192.168.99.2.4840: UDP, length 1109
 00:00:00.001305 IP 192.168.99.1.4840 > 192.168.99.2.4840: UDP, length 1109
 00:00:00.001792 IP 192.168.99.1.4840 > 192.168.99.2.4840: UDP, length 1109
 00:00:00.001209 IP 192.168.99.1.4840 > 192.168.99.2.4840: UDP, length 1109
 00:00:00.001764 IP 192.168.99.1.4840 > 192.168.99.2.4840: UDP, length 1109
 00:00:00.000943 IP 192.168.99.1.4840 > 192.168.99.2.4840: UDP, length 1109
 00:00:00.001684 IP 192.168.99.1.4840 > 192.168.99.2.4840: UDP, length 1109
 00:00:00.001411 IP 192.168.99.1.4840 > 192.168.99.2.4840: UDP, length 1109
 00:00:00.001064 IP 192.168.99.1.4840 > 192.168.99.2.4840: UDP, length 1109
 00:00:00.001791 IP 192.168.99.1.4840 > 192.168.99.2.4840: UDP, length 1109
 00:00:00.001061 IP 192.168.99.1.4840 > 192.168.99.2.4840: UDP, length 1109
 00:00:00.001306 IP 192.168.99.1.4840 > 192.168.99.2.4840: UDP, length 1109
 00:00:00.002167 IP 192.168.99.1.4840 > 192.168.99.2.4840: UDP, length 1109
 00:00:00.001534 IP 192.168.99.1.4840 > 192.168.99.2.4840: UDP, length 1109
 00:00:00.001062 IP 192.168.99.1.4840 > 192.168.99.2.4840: UDP, length 1109
 00:00:00.001672 IP 192.168.99.1.4840 > 192.168.99.2.4840: UDP, length 1109
 00:00:00.001304 IP 192.168.99.1.4840 > 192.168.99.2.4840: UDP, length 1109
 00:00:00.001185 IP 192.168.99.1.4840 > 192.168.99.2.4840: UDP, length 1109
 00:00:00.001668 IP 192.168.99.1.4840 > 192.168.99.2.4840: UDP, length 1109
 00:00:00.001185 IP 192.168.99.1.4840 > 192.168.99.2.4840: UDP, length 1109
 00:00:00.001202 IP 192.168.99.1.4840 > 192.168.99.2.4840: UDP, length 1109
 00:00:00.001772 IP 192.168.99.1.4840 > 192.168.99.2.4840: UDP, length 1109
 00:00:00.001305 IP 192.168.99.1.4840 > 192.168.99.2.4840: UDP, length 1109
 00:00:00.001670 IP 192.168.99.1.4840 > 192.168.99.2.4840: UDP, length 1109
 00:00:00.000941 IP 192.168.99.1.4840 > 192.168.99.2.4840: UDP, length 1109
 00:00:00.001669 IP 192.168.99.1.4840 > 192.168.99.2.4840: UDP, length 1109
 00:00:00.001305 IP 192.168.99.1.4840 > 192.168.99.2.4840: UDP, length 1109
 00:00:00.001064 IP 192.168.99.1.4840 > 192.168.99.2.4840: UDP, length 1109
 00:00:00.001669 IP 192.168.99.1.4840 > 192.168.99.2.4840: UDP, length 1109
 00:00:00.001318 IP 192.168.99.1.4840 > 192.168.99.2.4840: UDP, length 1109
 00:00:00.001655 IP 192.168.99.1.4840 > 192.168.99.2.4840: UDP, length 1109
 00:00:00.001308 IP 192.168.99.1.4840 > 192.168.99.2.4840: UDP, length 1109
 00:00:00.001305 IP 192.168.99.1.4840 > 192.168.99.2.4840: UDP, length 1109
 00:00:00.001794 IP 192.168.99.1.4840 > 192.168.99.2.4840: UDP, length 1109
 00:00:00.001064 IP 192.168.99.1.4840 > 192.168.99.2.4840: UDP, length 1109
 00:00:00.001297 IP 192.168.99.1.4840 > 192.168.99.2.4840: UDP, length 1109
 00:00:00.001671 IP 192.168.99.1.4840 > 192.168.99.2.4840: UDP, length 1109
 00:00:00.001069 IP 192.168.99.1.4840 > 192.168.99.2.4840: UDP, length 1109
 00:00:00.002148 IP 192.168.99.1.4840 > 192.168.99.2.4840: UDP, length 1109
 00:00:00.001790 IP 192.168.99.1.4840 > 192.168.99.2.4840: UDP, length 1109
 00:00:00.000942 IP 192.168.99.1.4840 > 192.168.99.2.4840: UDP, length 1109
 00:00:00.001670 IP 192.168.99.1.4840 > 192.168.99.2.4840: UDP, length 1109
 00:00:00.001425 IP 192.168.99.1.4840 > 192.168.99.2.4840: UDP, length 1109
 00:00:00.001064 IP 192.168.99.1.4840 > 192.168.99.2.4840: UDP, length 1109
 00:00:00.001669 IP 192.168.99.1.4840 > 192.168.99.2.4840: UDP, length 1109
 00:00:00.001191 IP 192.168.99.1.4840 > 192.168.99.2.4840: UDP, length 1109
 00:00:00.001192 IP 192.168.99.1.4840 > 192.168.99.2.4840: UDP, length 1109
 00:00:00.001775 IP 192.168.99.1.4840 > 192.168.99.2.4840: UDP, length 1109
 00:00:00.001065 IP 192.168.99.1.4840 > 192.168.99.2.4840: UDP, length 1109
 00:00:00.001671 IP 192.168.99.1.4840 > 192.168.99.2.4840: UDP, length 1109
 00:00:00.001302 IP 192.168.99.1.4840 > 192.168.99.2.4840: UDP, length 1109
 00:00:00.001074 IP 192.168.99.1.4840 > 192.168.99.2.4840: UDP, length 1109
 00:00:00.001781 IP 192.168.99.1.4840 > 192.168.99.2.4840: UDP, length 1109
 00:00:00.001065 IP 192.168.99.1.4840 > 192.168.99.2.4840: UDP, length 1109
 00:00:00.001320 IP 192.168.99.1.4840 > 192.168.99.2.4840: UDP, length 1109
 00:00:00.001651 IP 192.168.99.1.4840 > 192.168.99.2.4840: UDP, length 1109
 00:00:00.001184 IP 192.168.99.1.4840 > 192.168.99.2.4840: UDP, length 1109
 00:00:00.001914 IP 192.168.99.1.4840 > 192.168.99.2.4840: UDP, length 1109
 00:00:00.000941 IP 192.168.99.1.4840 > 192.168.99.2.4840: UDP, length 1109
 00:00:00.001669 IP 192.168.99.1.4840 > 192.168.99.2.4840: UDP, length 1109
 00:00:00.001304 IP 192.168.99.1.4840 > 192.168.99.2.4840: UDP, length 1109
 00:00:00.001305 IP 192.168.99.1.4840 > 192.168.99.2.4840: UDP, length 1109
 00:00:00.001789 IP 192.168.99.1.4840 > 192.168.99.2.4840: UDP, length 1109
 00:00:00.000957 IP 192.168.99.1.4840 > 192.168.99.2.4840: UDP, length 1109
 00:00:00.001655 IP 192.168.99.1.4840 > 192.168.99.2.4840: UDP, length 1109
 00:00:00.001911 IP 192.168.99.1.4840 > 192.168.99.2.4840: UDP, length 1109
 00:00:00.001548 IP 192.168.99.1.4840 > 192.168.99.2.4840: UDP, length 1109
 00:00:00.001064 IP 192.168.99.1.4840 > 192.168.99.2.4840: UDP, length 1109
 00:00:00.001793 IP 192.168.99.1.4840 > 192.168.99.2.4840: UDP, length 1109
 00:00:00.001060 IP 192.168.99.1.4840 > 192.168.99.2.4840: UDP, length 1109
 00:00:00.001322 IP 192.168.99.1.4840 > 192.168.99.2.4840: UDP, length 1109
 00:00:00.001683 IP 192.168.99.1.4840 > 192.168.99.2.4840: UDP, length 1109
 00:00:00.000942 IP 192.168.99.1.4840 > 192.168.99.2.4840: UDP, length 1109
 00:00:00.001533 IP 192.168.99.1.4840 > 192.168.99.2.4840: UDP, length 1109
 00:00:00.001689 IP 192.168.99.1.4840 > 192.168.99.2.4840: UDP, length 1109
 00:00:00.001771 IP 192.168.99.1.4840 > 192.168.99.2.4840: UDP, length 1109
 00:00:00.001184 IP 192.168.99.1.4840 > 192.168.99.2.4840: UDP, length 1109
 00:00:00.001789 IP 192.168.99.1.4840 > 192.168.99.2.4840: UDP, length 1109
 00:00:00.001063 IP 192.168.99.1.4840 > 192.168.99.2.4840: UDP, length 1109
 00:00:00.001185 IP 192.168.99.1.4840 > 192.168.99.2.4840: UDP, length 1109
 00:00:00.001804 IP 192.168.99.1.4840 > 192.168.99.2.4840: UDP, length 1109
 00:00:00.000933 IP 192.168.99.1.4840 > 192.168.99.2.4840: UDP, length 1109
 00:00:00.001424 IP 192.168.99.1.4840 > 192.168.99.2.4840: UDP, length 1109
 00:00:00.001672 IP 192.168.99.1.4840 > 192.168.99.2.4840: UDP, length 1109
 00:00:00.001061 IP 192.168.99.1.4840 > 192.168.99.2.4840: UDP, length 1109
 00:00:00.001790 IP 192.168.99.1.4840 > 192.168.99.2.4840: UDP, length 1109
 00:00:00.001183 IP 192.168.99.1.4840 > 192.168.99.2.4840: UDP, length 1109
 00:00:00.001186 IP 192.168.99.1.4840 > 192.168.99.2.4840: UDP, length 1109
 00:00:00.001788 IP 192.168.99.1.4840 > 192.168.99.2.4840: UDP, length 1109
 00:00:00.000941 IP 192.168.99.1.4840 > 192.168.99.2.4840: UDP, length 1109
 00:00:00.001426 IP 192.168.99.1.4840 > 192.168.99.2.4840: UDP, length 1109
 00:00:00.001551 IP 192.168.99.1.4840 > 192.168.99.2.4840: UDP, length 1109
 00:00:00.001080 IP 192.168.99.1.4840 > 192.168.99.2.4840: UDP, length 1109
 00:00:00.002016 IP 192.168.99.1.4840 > 192.168.99.2.4840: UDP, length 1109
 00:00:00.000940 IP 192.168.99.1.4840 > 192.168.99.2.4840: UDP, length 1109
 00:00:00.001686 IP 192.168.99.1.4840 > 192.168.99.2.4840: UDP, length 1109
 00:00:00.001407 IP 192.168.99.1.4840 > 192.168.99.2.4840: UDP, length 1109
 00:00:00.000945 IP 192.168.99.1.4840 > 192.168.99.2.4840: UDP, length 1109
 00:00:00.001669 IP 192.168.99.1.4840 > 192.168.99.2.4840: UDP, length 1109
 00:00:00.001303 IP 192.168.99.1.4840 > 192.168.99.2.4840: UDP, length 1109
 00:00:00.001063 IP 192.168.99.1.4840 > 192.168.99.2.4840: UDP, length 1109
 00:00:00.001923 IP 192.168.99.1.4840 > 192.168.99.2.4840: UDP, length 1109
 00:00:00.001051 IP 192.168.99.1.4840 > 192.168.99.2.4840: UDP, length 1109
 00:00:00.001427 IP 192.168.99.1.4840 > 192.168.99.2.4840: UDP, length 1109
 00:00:00.001548 IP 192.168.99.1.4840 > 192.168.99.2.4840: UDP, length 1109
 00:00:00.001064 IP 192.168.99.1.4840 > 192.168.99.2.4840: UDP, length 1109
 00:00:00.001808 IP 192.168.99.1.4840 > 192.168.99.2.4840: UDP, length 1109
 00:00:00.001182 IP 192.168.99.1.4840 > 192.168.99.2.4840: UDP, length 1109
 00:00:00.001173 IP 192.168.99.1.4840 > 192.168.99.2.4840: UDP, length 1109
 00:00:00.001810 IP 192.168.99.1.4840 > 192.168.99.2.4840: UDP, length 1109
 00:00:00.000917 IP 192.168.99.1.4840 > 192.168.99.2.4840: UDP, length 1109
 00:00:00.001911 IP 192.168.99.1.4840 > 192.168.99.2.4840: UDP, length 1109
 00:00:00.001186 IP 192.168.99.1.4840 > 192.168.99.2.4840: UDP, length 1109
 00:00:00.001424 IP 192.168.99.1.4840 > 192.168.99.2.4840: UDP, length 1109
 00:00:00.001548 IP 192.168.99.1.4840 > 192.168.99.2.4840: UDP, length 1109
 00:00:00.001185 IP 192.168.99.1.4840 > 192.168.99.2.4840: UDP, length 1109
 00:00:00.001669 IP 192.168.99.1.4840 > 192.168.99.2.4840: UDP, length 1109
 00:00:00.001065 IP 192.168.99.1.4840 > 192.168.99.2.4840: UDP, length 1109
 00:00:00.002153 IP 192.168.99.1.4840 > 192.168.99.2.4840: UDP, length 1109
 00:00:00.001789 IP 192.168.99.1.4840 > 192.168.99.2.4840: UDP, length 1109
 00:00:00.001187 IP 192.168.99.1.4840 > 192.168.99.2.4840: UDP, length 1109
 00:00:00.001665 IP 192.168.99.1.4840 > 192.168.99.2.4840: UDP, length 1109
 00:00:00.001307 IP 192.168.99.1.4840 > 192.168.99.2.4840: UDP, length 1109
 00:00:00.001079 IP 192.168.99.1.4840 > 192.168.99.2.4840: UDP, length 1109
 00:00:00.001652 IP 192.168.99.1.4840 > 192.168.99.2.4840: UDP, length 1109
 00:00:00.001064 IP 192.168.99.1.4840 > 192.168.99.2.4840: UDP, length 1109
 00:00:00.001449 IP 192.168.99.1.4840 > 192.168.99.2.4840: UDP, length 1109
 00:00:00.002484 IP 192.168.99.1.4840 > 192.168.99.2.4840: UDP, length 1109
 00:00:00.001073 IP 192.168.99.1.4840 > 192.168.99.2.4840: UDP, length 1109
 00:00:00.001202 IP 192.168.99.1.4840 > 192.168.99.2.4840: UDP, length 1109
 00:00:00.001045 IP 192.168.99.1.4840 > 192.168.99.2.4840: UDP, length 1109
 00:00:00.001936 IP 192.168.99.1.4840 > 192.168.99.2.4840: UDP, length 1109
 00:00:00.000940 IP 192.168.99.1.4840 > 192.168.99.2.4840: UDP, length 1109
 00:00:00.001174 IP 192.168.99.1.4840 > 192.168.99.2.4840: UDP, length 1109
 00:00:00.001802 IP 192.168.99.1.4840 > 192.168.99.2.4840: UDP, length 1109
 00:00:00.001046 IP 192.168.99.1.4840 > 192.168.99.2.4840: UDP, length 1109
 00:00:00.001186 IP 192.168.99.1.4840 > 192.168.99.2.4840: UDP, length 1109
 00:00:00.001699 IP 192.168.99.1.4840 > 192.168.99.2.4840: UDP, length 1109
