 00:00:00.000000 IP 192.168.37.101.4840 > 192.168.37.100.4840: UDP, length 1109
 00:00:00.002942 IP 192.168.37.101.4840 > 192.168.37.100.4840: UDP, length 1109
 00:00:00.017636 IP 192.168.37.101.4840 > 192.168.37.100.4840: UDP, length 1109
 00:00:00.017150 IP 192.168.37.101.4840 > 192.168.37.100.4840: UDP, length 1109
 00:00:00.005632 IP 192.168.37.101.4840 > 192.168.37.100.4840: UDP, length 1109
 00:00:00.001725 IP 192.168.37.101.4840 > 192.168.37.100.4840: UDP, length 1109
 00:00:00.002689 IP 192.168.37.101.4840 > 192.168.37.100.4840: UDP, length 1109
 00:00:00.015192 IP 192.168.37.101.4840 > 192.168.37.100.4840: UDP, length 1109
 00:00:00.036254 IP 192.168.37.101.4840 > 192.168.37.100.4840: UDP, length 1109
 00:00:00.016421 IP 192.168.37.101.4840 > 192.168.37.100.4840: UDP, length 1109
 00:00:00.018864 IP 192.168.37.101.4840 > 192.168.37.100.4840: UDP, length 1109
 00:00:00.013228 IP 192.168.37.101.4840 > 192.168.37.100.4840: UDP, length 1109
 00:00:00.007598 IP 192.168.37.101.4840 > 192.168.37.100.4840: UDP, length 1109
 00:00:00.022533 IP 192.168.37.101.4840 > 192.168.37.100.4840: UDP, length 1109
 00:00:00.006861 IP 192.168.37.101.4840 > 192.168.37.100.4840: UDP, length 1109
 00:00:00.031610 IP 192.168.37.101.4840 > 192.168.37.100.4840: UDP, length 1109
 00:00:00.006602 IP 192.168.37.101.4840 > 192.168.37.100.4840: UDP, length 1109
 00:00:00.015932 IP 192.168.37.101.4840 > 192.168.37.100.4840: UDP, length 1109
 00:00:00.041159 IP 192.168.37.101.4840 > 192.168.37.100.4840: UDP, length 1109
 00:00:00.014940 IP 192.168.37.101.4840 > 192.168.37.100.4840: UDP, length 1109
 00:00:00.008083 IP 192.168.37.101.4840 > 192.168.37.100.4840: UDP, length 1109
 00:00:00.014700 IP 192.168.37.101.4840 > 192.168.37.100.4840: UDP, length 1109
 00:00:00.011028 IP 192.168.37.101.4840 > 192.168.37.100.4840: UDP, length 1109
 00:00:00.005141 IP 192.168.37.101.4840 > 192.168.37.100.4840: UDP, length 1109
 00:00:00.001471 IP 192.168.37.101.4840 > 192.168.37.100.4840: UDP, length 1109
 00:00:00.018865 IP 192.168.37.101.4840 > 192.168.37.100.4840: UDP, length 1109
 00:00:00.024503 IP 192.168.37.101.4840 > 192.168.37.100.4840: UDP, length 1109
 00:00:00.001708 IP 192.168.37.101.4840 > 192.168.37.100.4840: UDP, length 1109
 00:00:00.008578 IP 192.168.37.101.4840 > 192.168.37.100.4840: UDP, length 1109
 00:00:00.003920 IP 192.168.37.101.4840 > 192.168.37.100.4840: UDP, length 1109
 00:00:00.010780 IP 192.168.37.101.4840 > 192.168.37.100.4840: UDP, length 1109
 00:00:00.013961 IP 192.168.37.101.4840 > 192.168.37.100.4840: UDP, length 1109
 00:00:00.032592 IP 192.168.37.101.4840 > 192.168.37.100.4840: UDP, length 1109
 00:00:00.033811 IP 192.168.37.101.4840 > 192.168.37.100.4840: UDP, length 1109
 00:00:00.006614 IP 192.168.37.101.4840 > 192.168.37.100.4840: UDP, length 1109
 00:00:00.045080 IP 192.168.37.101.4840 > 192.168.37.100.4840: UDP, length 1109
 00:00:00.001218 IP 192.168.37.101.4840 > 192.168.37.100.4840: UDP, length 1109
 00:00:00.003924 IP 192.168.37.101.4840 > 192.168.37.100.4840: UDP, length 1109
 00:00:00.011272 IP 192.168.37.101.4840 > 192.168.37.100.4840: UDP, length 1109
 00:00:00.010043 IP 192.168.37.101.4840 > 192.168.37.100.4840: UDP, length 1109
 00:00:00.040668 IP 192.168.37.101.4840 > 192.168.37.100.4840: UDP, length 1109
 00:00:00.021805 IP 192.168.37.101.4840 > 192.168.37.100.4840: UDP, length 1109
 00:00:00.019114 IP 192.168.37.101.4840 > 192.168.37.100.4840: UDP, length 1109
 00:00:00.003178 IP 192.168.37.101.4840 > 192.168.37.100.4840: UDP, length 1109
 00:00:00.010783 IP 192.168.37.101.4840 > 192.168.37.100.4840: UDP, length 1109
 00:00:00.013965 IP 192.168.37.101.4840 > 192.168.37.100.4840: UDP, length 1109
 00:00:00.014212 IP 192.168.37.101.4840 > 192.168.37.100.4840: UDP, length 1109
 00:00:00.001474 IP 192.168.37.101.4840 > 192.168.37.100.4840: UDP, length 1109
 00:00:00.010533 IP 192.168.37.101.4840 > 192.168.37.100.4840: UDP, length 1109
 00:00:00.012617 IP 192.168.37.101.4840 > 192.168.37.100.4840: UDP, length 1109
 00:00:00.005165 IP 192.168.37.101.4840 > 192.168.37.100.4840: UDP, length 1109
 00:00:00.007775 IP 192.168.37.101.4840 > 192.168.37.100.4840: UDP, length 1109
 00:00:00.014862 IP 192.168.37.101.4840 > 192.168.37.100.4840: UDP, length 1109
 00:00:00.013472 IP 192.168.37.101.4840 > 192.168.37.100.4840: UDP, length 1109
 00:00:00.012008 IP 192.168.37.101.4840 > 192.168.37.100.4840: UDP, length 1109
 00:00:00.005878 IP 192.168.37.101.4840 > 192.168.37.100.4840: UDP, length 1109
 00:00:00.003432 IP 192.168.37.101.4840 > 192.168.37.100.4840: UDP, length 1109
 00:00:00.013718 IP 192.168.37.101.4840 > 192.168.37.100.4840: UDP, length 1109
 00:00:00.002945 IP 192.168.37.101.4840 > 192.168.37.100.4840: UDP, length 1109
 00:00:00.009315 IP 192.168.37.101.4840 > 192.168.37.100.4840: UDP, length 1109
 00:00:00.001703 IP 192.168.37.101.4840 > 192.168.37.100.4840: UDP, length 1109
 00:00:00.008825 IP 192.168.37.101.4840 > 192.168.37.100.4840: UDP, length 1109
 00:00:00.003431 IP 192.168.37.101.4840 > 192.168.37.100.4840: UDP, length 1109
 00:00:00.019351 IP 192.168.37.101.4840 > 192.168.37.100.4840: UDP, length 1109
 00:00:00.002695 IP 192.168.37.101.4840 > 192.168.37.100.4840: UDP, length 1109
 00:00:00.018867 IP 192.168.37.101.4840 > 192.168.37.100.4840: UDP, length 1109
 00:00:00.020581 IP 192.168.37.101.4840 > 192.168.37.100.4840: UDP, length 1109
 00:00:00.008324 IP 192.168.37.101.4840 > 192.168.37.100.4840: UDP, length 1109
 00:00:00.004170 IP 192.168.37.101.4840 > 192.168.37.100.4840: UDP, length 1109
 00:00:00.017636 IP 192.168.37.101.4840 > 192.168.37.100.4840: UDP, length 1109
 00:00:00.006856 IP 192.168.37.101.4840 > 192.168.37.100.4840: UDP, length 1109
 00:00:00.013239 IP 192.168.37.101.4840 > 192.168.37.100.4840: UDP, length 1109
 00:00:00.042142 IP 192.168.37.101.4840 > 192.168.37.100.4840: UDP, length 1109
 00:00:00.007356 IP 192.168.37.101.4840 > 192.168.37.100.4840: UDP, length 1109
 00:00:00.008076 IP 192.168.37.101.4840 > 192.168.37.100.4840: UDP, length 1109
 00:00:00.013472 IP 192.168.37.101.4840 > 192.168.37.100.4840: UDP, length 1109
 00:00:00.005637 IP 192.168.37.101.4840 > 192.168.37.100.4840: UDP, length 1109
 00:00:00.006864 IP 192.168.37.101.4840 > 192.168.37.100.4840: UDP, length 1109
 00:00:00.023268 IP 192.168.37.101.4840 > 192.168.37.100.4840: UDP, length 1109
 00:00:00.010046 IP 192.168.37.101.4840 > 192.168.37.100.4840: UDP, length 1109
 00:00:00.004408 IP 192.168.37.101.4840 > 192.168.37.100.4840: UDP, length 1109
 00:00:00.019602 IP 192.168.37.101.4840 > 192.168.37.100.4840: UDP, length 1109
 00:00:00.004900 IP 192.168.37.101.4840 > 192.168.37.100.4840: UDP, length 1109
 00:00:00.004899 IP 192.168.37.101.4840 > 192.168.37.100.4840: UDP, length 1109
 00:00:00.004163 IP 192.168.37.101.4840 > 192.168.37.100.4840: UDP, length 1109
 00:00:00.004903 IP 192.168.37.101.4840 > 192.168.37.100.4840: UDP, length 1109
 00:00:00.012248 IP 192.168.37.101.4840 > 192.168.37.100.4840: UDP, length 1109
 00:00:00.012249 IP 192.168.37.101.4840 > 192.168.37.100.4840: UDP, length 1109
 00:00:00.011271 IP 192.168.37.101.4840 > 192.168.37.100.4840: UDP, length 1109
 00:00:00.007593 IP 192.168.37.101.4840 > 192.168.37.100.4840: UDP, length 1109
 00:00:00.013725 IP 192.168.37.101.4840 > 192.168.37.100.4840: UDP, length 1109
 00:00:00.006372 IP 192.168.37.101.4840 > 192.168.37.100.4840: UDP, length 1109
 00:00:00.003179 IP 192.168.37.101.4840 > 192.168.37.100.4840: UDP, length 1109
 00:00:00.006123 IP 192.168.37.101.4840 > 192.168.37.100.4840: UDP, length 1109
 00:00:00.001719 IP 192.168.37.101.4840 > 192.168.37.100.4840: UDP, length 1109
 00:00:00.008818 IP 192.168.37.101.4840 > 192.168.37.100.4840: UDP, length 1109
 00:00:00.004897 IP 192.168.37.101.4840 > 192.168.37.100.4840: UDP, length 1109
 00:00:00.015199 IP 192.168.37.101.4840 > 192.168.37.100.4840: UDP, length 1109
 00:00:00.019844 IP 192.168.37.101.4840 > 192.168.37.100.4840: UDP, length 1109
 00:00:00.003177 IP 192.168.37.101.4840 > 192.168.37.100.4840: UDP, length 1109
 00:00:00.016904 IP 192.168.37.101.4840 > 192.168.37.100.4840: UDP, length 1109
 00:00:00.003195 IP 192.168.37.101.4840 > 192.168.37.100.4840: UDP, length 1109
 00:00:00.019602 IP 192.168.37.101.4840 > 192.168.37.100.4840: UDP, length 1109
 00:00:00.026206 IP 192.168.37.101.4840 > 192.168.37.100.4840: UDP, length 1109
 00:00:00.020091 IP 192.168.37.101.4840 > 192.168.37.100.4840: UDP, length 1109
 00:00:00.027200 IP 192.168.37.101.4840 > 192.168.37.100.4840: UDP, length 1109
 00:00:00.014945 IP 192.168.37.101.4840 > 192.168.37.100.4840: UDP, length 1109
 00:00:00.018128 IP 192.168.37.101.4840 > 192.168.37.100.4840: UDP, length 1109
 00:00:00.011271 IP 192.168.37.101.4840 > 192.168.37.100.4840: UDP, length 1109
 00:00:00.002445 IP 192.168.37.101.4840 > 192.168.37.100.4840: UDP, length 1109
 00:00:00.011029 IP 192.168.37.101.4840 > 192.168.37.100.4840: UDP, length 1109
 00:00:00.003915 IP 192.168.37.101.4840 > 192.168.37.100.4840: UDP, length 1109
 00:00:00.007108 IP 192.168.37.101.4840 > 192.168.37.100.4840: UDP, length 1109
 00:00:00.007845 IP 192.168.37.101.4840 > 192.168.37.100.4840: UDP, length 1109
 00:00:00.020574 IP 192.168.37.101.4840 > 192.168.37.100.4840: UDP, length 1109
 00:00:00.006862 IP 192.168.37.101.4840 > 192.168.37.100.4840: UDP, length 1109
 00:00:00.029649 IP 192.168.37.101.4840 > 192.168.37.100.4840: UDP, length 1109
 00:00:00.022040 IP 192.168.37.101.4840 > 192.168.37.100.4840: UDP, length 1109
 00:00:00.014955 IP 192.168.37.101.4840 > 192.168.37.100.4840: UDP, length 1109
 00:00:00.026943 IP 192.168.37.101.4840 > 192.168.37.100.4840: UDP, length 1109
 00:00:00.016414 IP 192.168.37.101.4840 > 192.168.37.100.4840: UDP, length 1109
 00:00:00.002698 IP 192.168.37.101.4840 > 192.168.37.100.4840: UDP, length 1109
 00:00:00.008086 IP 192.168.37.101.4840 > 192.168.37.100.4840: UDP, length 1109
 00:00:00.010777 IP 192.168.37.101.4840 > 192.168.37.100.4840: UDP, length 1109
 00:00:00.007108 IP 192.168.37.101.4840 > 192.168.37.100.4840: UDP, length 1109
 00:00:00.000975 IP 192.168.37.101.4840 > 192.168.37.100.4840: UDP, length 1109
 00:00:00.011028 IP 192.168.37.101.4840 > 192.168.37.100.4840: UDP, length 1109
 00:00:00.002942 IP 192.168.37.101.4840 > 192.168.37.100.4840: UDP, length 1109
 00:00:00.003916 IP 192.168.37.101.4840 > 192.168.37.100.4840: UDP, length 1109
 00:00:00.006618 IP 192.168.37.101.4840 > 192.168.37.100.4840: UDP, length 1109
 00:00:00.017639 IP 192.168.37.101.4840 > 192.168.37.100.4840: UDP, length 1109
 00:00:00.012737 IP 192.168.37.101.4840 > 192.168.37.100.4840: UDP, length 1109
 00:00:00.001228 IP 192.168.37.101.4840 > 192.168.37.100.4840: UDP, length 1109
 00:00:00.000979 IP 192.168.37.101.4840 > 192.168.37.100.4840: UDP, length 1109
 00:00:00.044102 IP 192.168.37.101.4840 > 192.168.37.100.4840: UDP, length 1109
 00:00:00.002943 IP 192.168.37.101.4840 > 192.168.37.100.4840: UDP, length 1109
 00:00:00.006853 IP 192.168.37.101.4840 > 192.168.37.100.4840: UDP, length 1109
 00:00:00.013721 IP 192.168.37.101.4840 > 192.168.37.100.4840: UDP, length 1109
 00:00:00.004165 IP 192.168.37.101.4840 > 192.168.37.100.4840: UDP, length 1109
 00:00:00.022627 IP 192.168.37.101.4840 > 192.168.37.100.4840: UDP, length 1109
 00:00:00.006156 IP 192.168.37.101.4840 > 192.168.37.100.4840: UDP, length 1109
 00:00:00.001209 IP 192.168.37.101.4840 > 192.168.37.100.4840: UDP, length 1109
 00:00:00.003185 IP 192.168.37.101.4840 > 192.168.37.100.4840: UDP, length 1109
 00:00:00.015436 IP 192.168.37.101.4840 > 192.168.37.100.4840: UDP, length 1109
 00:00:00.001468 IP 192.168.37.101.4840 > 192.168.37.100.4840: UDP, length 1109
 00:00:00.001716 IP 192.168.37.101.4840 > 192.168.37.100.4840: UDP, length 1109
 00:00:00.010780 IP 192.168.37.101.4840 > 192.168.37.100.4840: UDP, length 1109
 00:00:00.007593 IP 192.168.37.101.4840 > 192.168.37.100.4840: UDP, length 1109
 00:00:00.013723 IP 192.168.37.101.4840 > 192.168.37.100.4840: UDP, length 1109
 00:00:00.014454 IP 192.168.37.101.4840 > 192.168.37.100.4840: UDP, length 1109
 00:00:00.006863 IP 192.168.37.101.4840 > 192.168.37.100.4840: UDP, length 1109
 00:00:00.012003 IP 192.168.37.101.4840 > 192.168.37.100.4840: UDP, length 1109
 00:00:00.014947 IP 192.168.37.101.4840 > 192.168.37.100.4840: UDP, length 1109
 00:00:00.011021 IP 192.168.37.101.4840 > 192.168.37.100.4840: UDP, length 1109
 00:00:00.006866 IP 192.168.37.101.4840 > 192.168.37.100.4840: UDP, length 1109
 00:00:00.006863 IP 192.168.37.101.4840 > 192.168.37.100.4840: UDP, length 1109
 00:00:00.020576 IP 192.168.37.101.4840 > 192.168.37.100.4840: UDP, length 1109
 00:00:00.011022 IP 192.168.37.101.4840 > 192.168.37.100.4840: UDP, length 1109
 00:00:00.011759 IP 192.168.37.101.4840 > 192.168.37.100.4840: UDP, length 1109
 00:00:00.002940 IP 192.168.37.101.4840 > 192.168.37.100.4840: UDP, length 1109
 00:00:00.004167 IP 192.168.37.101.4840 > 192.168.37.100.4840: UDP, length 1109
 00:00:00.008082 IP 192.168.37.101.4840 > 192.168.37.100.4840: UDP, length 1109
 00:00:00.006862 IP 192.168.37.101.4840 > 192.168.37.100.4840: UDP, length 1109
 00:00:00.029152 IP 192.168.37.101.4840 > 192.168.37.100.4840: UDP, length 1109
 00:00:00.001469 IP 192.168.37.101.4840 > 192.168.37.100.4840: UDP, length 1109
 00:00:00.004169 IP 192.168.37.101.4840 > 192.168.37.100.4840: UDP, length 1109
 00:00:00.012741 IP 192.168.37.101.4840 > 192.168.37.100.4840: UDP, length 1109
 00:00:00.051632 IP 192.168.37.101.4840 > 192.168.37.100.4840: UDP, length 1109
 00:00:00.035261 IP 192.168.37.101.4840 > 192.168.37.100.4840: UDP, length 1109
 00:00:00.011518 IP 192.168.37.101.4840 > 192.168.37.100.4840: UDP, length 1109
 00:00:00.017393 IP 192.168.37.101.4840 > 192.168.37.100.4840: UDP, length 1109
 00:00:00.031113 IP 192.168.37.101.4840 > 192.168.37.100.4840: UDP, length 1109
 00:00:00.010046 IP 192.168.37.101.4840 > 192.168.37.100.4840: UDP, length 1109
 00:00:00.024497 IP 192.168.37.101.4840 > 192.168.37.100.4840: UDP, length 1109
 00:00:00.001716 IP 192.168.37.101.4840 > 192.168.37.100.4840: UDP, length 1109
 00:00:00.003425 IP 192.168.37.101.4840 > 192.168.37.100.4840: UDP, length 1109
 00:00:00.008825 IP 192.168.37.101.4840 > 192.168.37.100.4840: UDP, length 1109
 00:00:00.001715 IP 192.168.37.101.4840 > 192.168.37.100.4840: UDP, length 1109
 00:00:00.020665 IP 192.168.37.101.4840 > 192.168.37.100.4840: UDP, length 1109
 00:00:00.002346 IP 192.168.37.101.4840 > 192.168.37.100.4840: UDP, length 1109
 00:00:00.015599 IP 192.168.37.101.4840 > 192.168.37.100.4840: UDP, length 1109
 00:00:00.007909 IP 192.168.37.101.4840 > 192.168.37.100.4840: UDP, length 1109
 00:00:00.002706 IP 192.168.37.101.4840 > 192.168.37.100.4840: UDP, length 1109
 00:00:00.007807 IP 192.168.37.101.4840 > 192.168.37.100.4840: UDP, length 1109
 00:00:00.007107 IP 192.168.37.101.4840 > 192.168.37.100.4840: UDP, length 1109
 00:00:00.003918 IP 192.168.37.101.4840 > 192.168.37.100.4840: UDP, length 1109
 00:00:00.011018 IP 192.168.37.101.4840 > 192.168.37.100.4840: UDP, length 1109
 00:00:00.008341 IP 192.168.37.101.4840 > 192.168.37.100.4840: UDP, length 1109
 00:00:00.005386 IP 192.168.37.101.4840 > 192.168.37.100.4840: UDP, length 1109
 00:00:00.015187 IP 192.168.37.101.4840 > 192.168.37.100.4840: UDP, length 1109
 00:00:00.013476 IP 192.168.37.101.4840 > 192.168.37.100.4840: UDP, length 1109
 00:00:00.017403 IP 192.168.37.101.4840 > 192.168.37.100.4840: UDP, length 1109
 00:00:00.007100 IP 192.168.37.101.4840 > 192.168.37.100.4840: UDP, length 1109
 00:00:00.004409 IP 192.168.37.101.4840 > 192.168.37.100.4840: UDP, length 1109
 00:00:00.003672 IP 192.168.37.101.4840 > 192.168.37.100.4840: UDP, length 1109
 00:00:00.015193 IP 192.168.37.101.4840 > 192.168.37.100.4840: UDP, length 1109
 00:00:00.017883 IP 192.168.37.101.4840 > 192.168.37.100.4840: UDP, length 1109
 00:00:00.034550 IP 192.168.37.101.4840 > 192.168.37.100.4840: UDP, length 1109
 00:00:00.016407 IP 192.168.37.101.4840 > 192.168.37.100.4840: UDP, length 1109
 00:00:00.010045 IP 192.168.37.101.4840 > 192.168.37.100.4840: UDP, length 1109
 00:00:00.003921 IP 192.168.37.101.4840 > 192.168.37.100.4840: UDP, length 1109
 00:00:00.006865 IP 192.168.37.101.4840 > 192.168.37.100.4840: UDP, length 1109
 00:00:00.004412 IP 192.168.37.101.4840 > 192.168.37.100.4840: UDP, length 1109
 00:00:00.006851 IP 192.168.37.101.4840 > 192.168.37.100.4840: UDP, length 1109
 00:00:00.019359 IP 192.168.37.101.4840 > 192.168.37.100.4840: UDP, length 1109
 00:00:00.026461 IP 192.168.37.101.4840 > 192.168.37.100.4840: UDP, length 1109
 00:00:00.008082 IP 192.168.37.101.4840 > 192.168.37.100.4840: UDP, length 1109
 00:00:00.008087 IP 192.168.37.101.4840 > 192.168.37.100.4840: UDP, length 1109
 00:00:00.017884 IP 192.168.37.101.4840 > 192.168.37.100.4840: UDP, length 1109
 00:00:00.001220 IP 192.168.37.101.4840 > 192.168.37.100.4840: UDP, length 1109
 00:00:00.019114 IP 192.168.37.101.4840 > 192.168.37.100.4840: UDP, length 1109
 00:00:00.009555 IP 192.168.37.101.4840 > 192.168.37.100.4840: UDP, length 1109
 00:00:00.005391 IP 192.168.37.101.4840 > 192.168.37.100.4840: UDP, length 1109
 00:00:00.006614 IP 192.168.37.101.4840 > 192.168.37.100.4840: UDP, length 1109
 00:00:00.017644 IP 192.168.37.101.4840 > 192.168.37.100.4840: UDP, length 1109
 00:00:00.011022 IP 192.168.37.101.4840 > 192.168.37.100.4840: UDP, length 1109
 00:00:00.001470 IP 192.168.37.101.4840 > 192.168.37.100.4840: UDP, length 1109
 00:00:00.005143 IP 192.168.37.101.4840 > 192.168.37.100.4840: UDP, length 1109
 00:00:00.004412 IP 192.168.37.101.4840 > 192.168.37.100.4840: UDP, length 1109
 00:00:00.004409 IP 192.168.37.101.4840 > 192.168.37.100.4840: UDP, length 1109
 00:00:00.005143 IP 192.168.37.101.4840 > 192.168.37.100.4840: UDP, length 1109
 00:00:00.002939 IP 192.168.37.101.4840 > 192.168.37.100.4840: UDP, length 1109
 00:00:00.008091 IP 192.168.37.101.4840 > 192.168.37.100.4840: UDP, length 1109
 00:00:00.013964 IP 192.168.37.101.4840 > 192.168.37.100.4840: UDP, length 1109
 00:00:00.014942 IP 192.168.37.101.4840 > 192.168.37.100.4840: UDP, length 1109
 00:00:00.016660 IP 192.168.37.101.4840 > 192.168.37.100.4840: UDP, length 1109
 00:00:00.009558 IP 192.168.37.101.4840 > 192.168.37.100.4840: UDP, length 1109
 00:00:00.006611 IP 192.168.37.101.4840 > 192.168.37.100.4840: UDP, length 1109
 00:00:00.014216 IP 192.168.37.101.4840 > 192.168.37.100.4840: UDP, length 1109
 00:00:00.002448 IP 192.168.37.101.4840 > 192.168.37.100.4840: UDP, length 1109
 00:00:00.018130 IP 192.168.37.101.4840 > 192.168.37.100.4840: UDP, length 1109
 00:00:00.001468 IP 192.168.37.101.4840 > 192.168.37.100.4840: UDP, length 1109
 00:00:00.025967 IP 192.168.37.101.4840 > 192.168.37.100.4840: UDP, length 1109
 00:00:00.034053 IP 192.168.37.101.4840 > 192.168.37.100.4840: UDP, length 1109
 00:00:00.019115 IP 192.168.37.101.4840 > 192.168.37.100.4840: UDP, length 1109
 00:00:00.033814 IP 192.168.37.101.4840 > 192.168.37.100.4840: UDP, length 1109
 00:00:00.005628 IP 192.168.37.101.4840 > 192.168.37.100.4840: UDP, length 1109
 00:00:00.004907 IP 192.168.37.101.4840 > 192.168.37.100.4840: UDP, length 1109
 00:00:00.015918 IP 192.168.37.101.4840 > 192.168.37.100.4840: UDP, length 1109
 00:00:00.013478 IP 192.168.37.101.4840 > 192.168.37.100.4840: UDP, length 1109
 00:00:00.004164 IP 192.168.37.101.4840 > 192.168.37.100.4840: UDP, length 1109
 00:00:00.004160 IP 192.168.37.101.4840 > 192.168.37.100.4840: UDP, length 1109
 00:00:00.003684 IP 192.168.37.101.4840 > 192.168.37.100.4840: UDP, length 1109
 00:00:00.008081 IP 192.168.37.101.4840 > 192.168.37.100.4840: UDP, length 1109
 00:00:00.051455 IP 192.168.37.101.4840 > 192.168.37.100.4840: UDP, length 1109
 00:00:00.024495 IP 192.168.37.101.4840 > 192.168.37.100.4840: UDP, length 1109
 00:00:00.014941 IP 192.168.37.101.4840 > 192.168.37.100.4840: UDP, length 1109
 00:00:00.005615 IP 192.168.37.101.4840 > 192.168.37.100.4840: UDP, length 1109
 00:00:00.003828 IP 192.168.37.101.4840 > 192.168.37.100.4840: UDP, length 1109
 00:00:00.019558 IP 192.168.37.101.4840 > 192.168.37.100.4840: UDP, length 1109
 00:00:00.013688 IP 192.168.37.101.4840 > 192.168.37.100.4840: UDP, length 1109
 00:00:00.013240 IP 192.168.37.101.4840 > 192.168.37.100.4840: UDP, length 1109
 00:00:00.001458 IP 192.168.37.101.4840 > 192.168.37.100.4840: UDP, length 1109
 00:00:00.014702 IP 192.168.37.101.4840 > 192.168.37.100.4840: UDP, length 1109
 00:00:00.011997 IP 192.168.37.101.4840 > 192.168.37.100.4840: UDP, length 1109
 00:00:00.031850 IP 192.168.37.101.4840 > 192.168.37.100.4840: UDP, length 1109
 00:00:00.003192 IP 192.168.37.101.4840 > 192.168.37.100.4840: UDP, length 1109
 00:00:00.001709 IP 192.168.37.101.4840 > 192.168.37.100.4840: UDP, length 1109
 00:00:00.004657 IP 192.168.37.101.4840 > 192.168.37.100.4840: UDP, length 1109
 00:00:00.007592 IP 192.168.37.101.4840 > 192.168.37.100.4840: UDP, length 1109
 00:00:00.007107 IP 192.168.37.101.4840 > 192.168.37.100.4840: UDP, length 1109
 00:00:00.034309 IP 192.168.37.101.4840 > 192.168.37.100.4840: UDP, length 1109
 00:00:00.036742 IP 192.168.37.101.4840 > 192.168.37.100.4840: UDP, length 1109
 00:00:00.005389 IP 192.168.37.101.4840 > 192.168.37.100.4840: UDP, length 1109
 00:00:00.009558 IP 192.168.37.101.4840 > 192.168.37.100.4840: UDP, length 1109
 00:00:00.002691 IP 192.168.37.101.4840 > 192.168.37.100.4840: UDP, length 1109
 00:00:00.005145 IP 192.168.37.101.4840 > 192.168.37.100.4840: UDP, length 1109
 00:00:00.014948 IP 192.168.37.101.4840 > 192.168.37.100.4840: UDP, length 1109
 00:00:00.004164 IP 192.168.37.101.4840 > 192.168.37.100.4840: UDP, length 1109
 00:00:00.001473 IP 192.168.37.101.4840 > 192.168.37.100.4840: UDP, length 1109
 00:00:00.005632 IP 192.168.37.101.4840 > 192.168.37.100.4840: UDP, length 1109
 00:00:00.028173 IP 192.168.37.101.4840 > 192.168.37.100.4840: UDP, length 1109
 00:00:00.021565 IP 192.168.37.101.4840 > 192.168.37.100.4840: UDP, length 1109
 00:00:00.028107 IP 192.168.37.101.4840 > 192.168.37.100.4840: UDP, length 1109
 00:00:00.007657 IP 192.168.37.101.4840 > 192.168.37.100.4840: UDP, length 1109
 00:00:00.020305 IP 192.168.37.101.4840 > 192.168.37.100.4840: UDP, length 1109
 00:00:00.031844 IP 192.168.37.101.4840 > 192.168.37.100.4840: UDP, length 1109
 00:00:00.005631 IP 192.168.37.101.4840 > 192.168.37.100.4840: UDP, length 1109
 00:00:00.032510 IP 192.168.37.101.4840 > 192.168.37.100.4840: UDP, length 1109
 00:00:00.011154 IP 192.168.37.101.4840 > 192.168.37.100.4840: UDP, length 1109
 00:00:00.009725 IP 192.168.37.101.4840 > 192.168.37.100.4840: UDP, length 1109
 00:00:00.015127 IP 192.168.37.101.4840 > 192.168.37.100.4840: UDP, length 1109
 00:00:00.014931 IP 192.168.37.101.4840 > 192.168.37.100.4840: UDP, length 1109
 00:00:00.001471 IP 192.168.37.101.4840 > 192.168.37.100.4840: UDP, length 1109
 00:00:00.004169 IP 192.168.37.101.4840 > 192.168.37.100.4840: UDP, length 1109
 00:00:00.008081 IP 192.168.37.101.4840 > 192.168.37.100.4840: UDP, length 1109
 00:00:00.001468 IP 192.168.37.101.4840 > 192.168.37.100.4840: UDP, length 1109
 00:00:00.014951 IP 192.168.37.101.4840 > 192.168.37.100.4840: UDP, length 1109
 00:00:00.012733 IP 192.168.37.101.4840 > 192.168.37.100.4840: UDP, length 1109
 00:00:00.005145 IP 192.168.37.101.4840 > 192.168.37.100.4840: UDP, length 1109
 00:00:00.013969 IP 192.168.37.101.4840 > 192.168.37.100.4840: UDP, length 1109
 00:00:00.002936 IP 192.168.37.101.4840 > 192.168.37.100.4840: UDP, length 1109
 00:00:00.006617 IP 192.168.37.101.4840 > 192.168.37.100.4840: UDP, length 1109
 00:00:00.004409 IP 192.168.37.101.4840 > 192.168.37.100.4840: UDP, length 1109
 00:00:00.005144 IP 192.168.37.101.4840 > 192.168.37.100.4840: UDP, length 1109
 00:00:00.024989 IP 192.168.37.101.4840 > 192.168.37.100.4840: UDP, length 1109
 00:00:00.024999 IP 192.168.37.101.4840 > 192.168.37.100.4840: UDP, length 1109
 00:00:00.008080 IP 192.168.37.101.4840 > 192.168.37.100.4840: UDP, length 1109
 00:00:00.005876 IP 192.168.37.101.4840 > 192.168.37.100.4840: UDP, length 1109
 00:00:00.001233 IP 192.168.37.101.4840 > 192.168.37.100.4840: UDP, length 1109
 00:00:00.009553 IP 192.168.37.101.4840 > 192.168.37.100.4840: UDP, length 1109
 00:00:00.004405 IP 192.168.37.101.4840 > 192.168.37.100.4840: UDP, length 1109
 00:00:00.023029 IP 192.168.37.101.4840 > 192.168.37.100.4840: UDP, length 1109
 00:00:00.013725 IP 192.168.37.101.4840 > 192.168.37.100.4840: UDP, length 1109
 00:00:00.009550 IP 192.168.37.101.4840 > 192.168.37.100.4840: UDP, length 1109
 00:00:00.031360 IP 192.168.37.101.4840 > 192.168.37.100.4840: UDP, length 1109
 00:00:00.001222 IP 192.168.37.101.4840 > 192.168.37.100.4840: UDP, length 1109
 00:00:00.009563 IP 192.168.37.101.4840 > 192.168.37.100.4840: UDP, length 1109
 00:00:00.029644 IP 192.168.37.101.4840 > 192.168.37.100.4840: UDP, length 1109
 00:00:00.008082 IP 192.168.37.101.4840 > 192.168.37.100.4840: UDP, length 1109
 00:00:00.002449 IP 192.168.37.101.4840 > 192.168.37.100.4840: UDP, length 1109
 00:00:00.008333 IP 192.168.37.101.4840 > 192.168.37.100.4840: UDP, length 1109
 00:00:00.011024 IP 192.168.37.101.4840 > 192.168.37.100.4840: UDP, length 1109
 00:00:00.024257 IP 192.168.37.101.4840 > 192.168.37.100.4840: UDP, length 1109
 00:00:00.035767 IP 192.168.37.101.4840 > 192.168.37.100.4840: UDP, length 1109
 00:00:00.008329 IP 192.168.37.101.4840 > 192.168.37.100.4840: UDP, length 1109
 00:00:00.002697 IP 192.168.37.101.4840 > 192.168.37.100.4840: UDP, length 1109
 00:00:00.008083 IP 192.168.37.101.4840 > 192.168.37.100.4840: UDP, length 1109
 00:00:00.020580 IP 192.168.37.101.4840 > 192.168.37.100.4840: UDP, length 1109
 00:00:00.004166 IP 192.168.37.101.4840 > 192.168.37.100.4840: UDP, length 1109
 00:00:00.028660 IP 192.168.37.101.4840 > 192.168.37.100.4840: UDP, length 1109
 00:00:00.012744 IP 192.168.37.101.4840 > 192.168.37.100.4840: UDP, length 1109
 00:00:00.008335 IP 192.168.37.101.4840 > 192.168.37.100.4840: UDP, length 1109
 00:00:00.006611 IP 192.168.37.101.4840 > 192.168.37.100.4840: UDP, length 1109
 00:00:00.013473 IP 192.168.37.101.4840 > 192.168.37.100.4840: UDP, length 1109
 00:00:00.009801 IP 192.168.37.101.4840 > 192.168.37.100.4840: UDP, length 1109
 00:00:00.017888 IP 192.168.37.101.4840 > 192.168.37.100.4840: UDP, length 1109
 00:00:00.005387 IP 192.168.37.101.4840 > 192.168.37.100.4840: UDP, length 1109
 00:00:00.011272 IP 192.168.37.101.4840 > 192.168.37.100.4840: UDP, length 1109
 00:00:00.040913 IP 192.168.37.101.4840 > 192.168.37.100.4840: UDP, length 1109
 00:00:00.010778 IP 192.168.37.101.4840 > 192.168.37.100.4840: UDP, length 1109
 00:00:00.004413 IP 192.168.37.101.4840 > 192.168.37.100.4840: UDP, length 1109
 00:00:00.008327 IP 192.168.37.101.4840 > 192.168.37.100.4840: UDP, length 1109
 00:00:00.008579 IP 192.168.37.101.4840 > 192.168.37.100.4840: UDP, length 1109
 00:00:00.005884 IP 192.168.37.101.4840 > 192.168.37.100.4840: UDP, length 1109
 00:00:00.016411 IP 192.168.37.101.4840 > 192.168.37.100.4840: UDP, length 1109
 00:00:00.027927 IP 192.168.37.101.4840 > 192.168.37.100.4840: UDP, length 1109
 00:00:00.002693 IP 192.168.37.101.4840 > 192.168.37.100.4840: UDP, length 1109
 00:00:00.008327 IP 192.168.37.101.4840 > 192.168.37.100.4840: UDP, length 1109
 00:00:00.005638 IP 192.168.37.101.4840 > 192.168.37.100.4840: UDP, length 1109
 00:00:00.005639 IP 192.168.37.101.4840 > 192.168.37.100.4840: UDP, length 1109
 00:00:00.038710 IP 192.168.37.101.4840 > 192.168.37.100.4840: UDP, length 1109
 00:00:00.002689 IP 192.168.37.101.4840 > 192.168.37.100.4840: UDP, length 1109
 00:00:00.014945 IP 192.168.37.101.4840 > 192.168.37.100.4840: UDP, length 1109
 00:00:00.004171 IP 192.168.37.101.4840 > 192.168.37.100.4840: UDP, length 1109
 00:00:00.030869 IP 192.168.37.101.4840 > 192.168.37.100.4840: UDP, length 1109
 00:00:00.022539 IP 192.168.37.101.4840 > 192.168.37.100.4840: UDP, length 1109
 00:00:00.022997 IP 192.168.37.101.4840 > 192.168.37.100.4840: UDP, length 1109
 00:00:00.021542 IP 192.168.37.101.4840 > 192.168.37.100.4840: UDP, length 1109
 00:00:00.014215 IP 192.168.37.101.4840 > 192.168.37.100.4840: UDP, length 1109
 00:00:00.014943 IP 192.168.37.101.4840 > 192.168.37.100.4840: UDP, length 1109
 00:00:00.025483 IP 192.168.37.101.4840 > 192.168.37.100.4840: UDP, length 1109
 00:00:00.001218 IP 192.168.37.101.4840 > 192.168.37.100.4840: UDP, length 1109
 00:00:00.020091 IP 192.168.37.101.4840 > 192.168.37.100.4840: UDP, length 1109
 00:00:00.003191 IP 192.168.37.101.4840 > 192.168.37.100.4840: UDP, length 1109
 00:00:00.007838 IP 192.168.37.101.4840 > 192.168.37.100.4840: UDP, length 1109
 00:00:00.004165 IP 192.168.37.101.4840 > 192.168.37.100.4840: UDP, length 1109
 00:00:00.042631 IP 192.168.37.101.4840 > 192.168.37.100.4840: UDP, length 1109
 00:00:00.008081 IP 192.168.37.101.4840 > 192.168.37.100.4840: UDP, length 1109
 00:00:00.010788 IP 192.168.37.101.4840 > 192.168.37.100.4840: UDP, length 1109
 00:00:00.012241 IP 192.168.37.101.4840 > 192.168.37.100.4840: UDP, length 1109
 00:00:00.017646 IP 192.168.37.101.4840 > 192.168.37.100.4840: UDP, length 1109
 00:00:00.005390 IP 192.168.37.101.4840 > 192.168.37.100.4840: UDP, length 1109
 00:00:00.028907 IP 192.168.37.101.4840 > 192.168.37.100.4840: UDP, length 1109
 00:00:00.020823 IP 192.168.37.101.4840 > 192.168.37.100.4840: UDP, length 1109
 00:00:00.006619 IP 192.168.37.101.4840 > 192.168.37.100.4840: UDP, length 1109
 00:00:00.016414 IP 192.168.37.101.4840 > 192.168.37.100.4840: UDP, length 1109
 00:00:00.003925 IP 192.168.37.101.4840 > 192.168.37.100.4840: UDP, length 1109
 00:00:00.009061 IP 192.168.37.101.4840 > 192.168.37.100.4840: UDP, length 1109
 00:00:00.026213 IP 192.168.37.101.4840 > 192.168.37.100.4840: UDP, length 1109
 00:00:00.019110 IP 192.168.37.101.4840 > 192.168.37.100.4840: UDP, length 1109
 00:00:00.002942 IP 192.168.37.101.4840 > 192.168.37.100.4840: UDP, length 1109
 00:00:00.003914 IP 192.168.37.101.4840 > 192.168.37.100.4840: UDP, length 1109
 00:00:00.023034 IP 192.168.37.101.4840 > 192.168.37.100.4840: UDP, length 1109
 00:00:00.010777 IP 192.168.37.101.4840 > 192.168.37.100.4840: UDP, length 1109
 00:00:00.020579 IP 192.168.37.101.4840 > 192.168.37.100.4840: UDP, length 1109
 00:00:00.004165 IP 192.168.37.101.4840 > 192.168.37.100.4840: UDP, length 1109
 00:00:00.006861 IP 192.168.37.101.4840 > 192.168.37.100.4840: UDP, length 1109
 00:00:00.008089 IP 192.168.37.101.4840 > 192.168.37.100.4840: UDP, length 1109
 00:00:00.055127 IP 192.168.37.101.4840 > 192.168.37.100.4840: UDP, length 1109
 00:00:00.034539 IP 192.168.37.101.4840 > 192.168.37.100.4840: UDP, length 1109
 00:00:00.012498 IP 192.168.37.101.4840 > 192.168.37.100.4840: UDP, length 1109
 00:00:00.020088 IP 192.168.37.101.4840 > 192.168.37.100.4840: UDP, length 1109
 00:00:00.023279 IP 192.168.37.101.4840 > 192.168.37.100.4840: UDP, length 1109
 00:00:00.012982 IP 192.168.37.101.4840 > 192.168.37.100.4840: UDP, length 1109
 00:00:00.058801 IP 192.168.37.101.4840 > 192.168.37.100.4840: UDP, length 1109
 00:00:00.013226 IP 192.168.37.101.4840 > 192.168.37.100.4840: UDP, length 1109
 00:00:00.016911 IP 192.168.37.101.4840 > 192.168.37.100.4840: UDP, length 1109
 00:00:00.002198 IP 192.168.37.101.4840 > 192.168.37.100.4840: UDP, length 1109
 00:00:00.007353 IP 192.168.37.101.4840 > 192.168.37.100.4840: UDP, length 1109
 00:00:00.014942 IP 192.168.37.101.4840 > 192.168.37.100.4840: UDP, length 1109
 00:00:00.004417 IP 192.168.37.101.4840 > 192.168.37.100.4840: UDP, length 1109
 00:00:00.020090 IP 192.168.37.101.4840 > 192.168.37.100.4840: UDP, length 1109
 00:00:00.001462 IP 192.168.37.101.4840 > 192.168.37.100.4840: UDP, length 1109
 00:00:00.004656 IP 192.168.37.101.4840 > 192.168.37.100.4840: UDP, length 1109
 00:00:00.026946 IP 192.168.37.101.4840 > 192.168.37.100.4840: UDP, length 1109
 00:00:00.018141 IP 192.168.37.101.4840 > 192.168.37.100.4840: UDP, length 1109
 00:00:00.010284 IP 192.168.37.101.4840 > 192.168.37.100.4840: UDP, length 1109
 00:00:00.021316 IP 192.168.37.101.4840 > 192.168.37.100.4840: UDP, length 1109
 00:00:00.047286 IP 192.168.37.101.4840 > 192.168.37.100.4840: UDP, length 1109
 00:00:00.027196 IP 192.168.37.101.4840 > 192.168.37.100.4840: UDP, length 1109
 00:00:00.025722 IP 192.168.37.101.4840 > 192.168.37.100.4840: UDP, length 1109
 00:00:00.001470 IP 192.168.37.101.4840 > 192.168.37.100.4840: UDP, length 1109
 00:00:00.014949 IP 192.168.37.101.4840 > 192.168.37.100.4840: UDP, length 1109
 00:00:00.025478 IP 192.168.37.101.4840 > 192.168.37.100.4840: UDP, length 1109
 00:00:00.013714 IP 192.168.37.101.4840 > 192.168.37.100.4840: UDP, length 1109
 00:00:00.017396 IP 192.168.37.101.4840 > 192.168.37.100.4840: UDP, length 1109
 00:00:00.008824 IP 192.168.37.101.4840 > 192.168.37.100.4840: UDP, length 1109
 00:00:00.001472 IP 192.168.37.101.4840 > 192.168.37.100.4840: UDP, length 1109
 00:00:00.002443 IP 192.168.37.101.4840 > 192.168.37.100.4840: UDP, length 1109
 00:00:00.011268 IP 192.168.37.101.4840 > 192.168.37.100.4840: UDP, length 1109
 00:00:00.016177 IP 192.168.37.101.4840 > 192.168.37.100.4840: UDP, length 1109
 00:00:00.010043 IP 192.168.37.101.4840 > 192.168.37.100.4840: UDP, length 1109
 00:00:00.006371 IP 192.168.37.101.4840 > 192.168.37.100.4840: UDP, length 1109
 00:00:00.007103 IP 192.168.37.101.4840 > 192.168.37.100.4840: UDP, length 1109
 00:00:00.016178 IP 192.168.37.101.4840 > 192.168.37.100.4840: UDP, length 1109
 00:00:00.004158 IP 192.168.37.101.4840 > 192.168.37.100.4840: UDP, length 1109
 00:00:00.012746 IP 192.168.37.101.4840 > 192.168.37.100.4840: UDP, length 1109
 00:00:00.017384 IP 192.168.37.101.4840 > 192.168.37.100.4840: UDP, length 1109
 00:00:00.012989 IP 192.168.37.101.4840 > 192.168.37.100.4840: UDP, length 1109
 00:00:00.039938 IP 192.168.37.101.4840 > 192.168.37.100.4840: UDP, length 1109
 00:00:00.009796 IP 192.168.37.101.4840 > 192.168.37.100.4840: UDP, length 1109
 00:00:00.004164 IP 192.168.37.101.4840 > 192.168.37.100.4840: UDP, length 1109
 00:00:00.001473 IP 192.168.37.101.4840 > 192.168.37.100.4840: UDP, length 1109
 00:00:00.004162 IP 192.168.37.101.4840 > 192.168.37.100.4840: UDP, length 1109
 00:00:00.037981 IP 192.168.37.101.4840 > 192.168.37.100.4840: UDP, length 1109
 00:00:00.009305 IP 192.168.37.101.4840 > 192.168.37.100.4840: UDP, length 1109
 00:00:00.036994 IP 192.168.37.101.4840 > 192.168.37.100.4840: UDP, length 1109
 00:00:00.001470 IP 192.168.37.101.4840 > 192.168.37.100.4840: UDP, length 1109
 00:00:00.009558 IP 192.168.37.101.4840 > 192.168.37.100.4840: UDP, length 1109
 00:00:00.004161 IP 192.168.37.101.4840 > 192.168.37.100.4840: UDP, length 1109
 00:00:00.016177 IP 192.168.37.101.4840 > 192.168.37.100.4840: UDP, length 1109
 00:00:00.017880 IP 192.168.37.101.4840 > 192.168.37.100.4840: UDP, length 1109
 00:00:00.012004 IP 192.168.37.101.4840 > 192.168.37.100.4840: UDP, length 1109
 00:00:00.012005 IP 192.168.37.101.4840 > 192.168.37.100.4840: UDP, length 1109
 00:00:00.006861 IP 192.168.37.101.4840 > 192.168.37.100.4840: UDP, length 1109
 00:00:00.034297 IP 192.168.37.101.4840 > 192.168.37.100.4840: UDP, length 1109
 00:00:00.025974 IP 192.168.37.101.4840 > 192.168.37.100.4840: UDP, length 1109
 00:00:00.004409 IP 192.168.37.101.4840 > 192.168.37.100.4840: UDP, length 1109
 00:00:00.006612 IP 192.168.37.101.4840 > 192.168.37.100.4840: UDP, length 1109
 00:00:00.013476 IP 192.168.37.101.4840 > 192.168.37.100.4840: UDP, length 1109
 00:00:00.035524 IP 192.168.37.101.4840 > 192.168.37.100.4840: UDP, length 1109
 00:00:00.005387 IP 192.168.37.101.4840 > 192.168.37.100.4840: UDP, length 1109
 00:00:00.013477 IP 192.168.37.101.4840 > 192.168.37.100.4840: UDP, length 1109
 00:00:00.008332 IP 192.168.37.101.4840 > 192.168.37.100.4840: UDP, length 1109
 00:00:00.019108 IP 192.168.37.101.4840 > 192.168.37.100.4840: UDP, length 1109
 00:00:00.008095 IP 192.168.37.101.4840 > 192.168.37.100.4840: UDP, length 1109
 00:00:00.005639 IP 192.168.37.101.4840 > 192.168.37.100.4840: UDP, length 1109
 00:00:00.032572 IP 192.168.37.101.4840 > 192.168.37.100.4840: UDP, length 1109
 00:00:00.001470 IP 192.168.37.101.4840 > 192.168.37.100.4840: UDP, length 1109
 00:00:00.004166 IP 192.168.37.101.4840 > 192.168.37.100.4840: UDP, length 1109
 00:00:00.014939 IP 192.168.37.101.4840 > 192.168.37.100.4840: UDP, length 1109
 00:00:00.004171 IP 192.168.37.101.4840 > 192.168.37.100.4840: UDP, length 1109
 00:00:00.016412 IP 192.168.37.101.4840 > 192.168.37.100.4840: UDP, length 1109
 00:00:00.003928 IP 192.168.37.101.4840 > 192.168.37.100.4840: UDP, length 1109
 00:00:00.007842 IP 192.168.37.101.4840 > 192.168.37.100.4840: UDP, length 1109
 00:00:00.013955 IP 192.168.37.101.4840 > 192.168.37.100.4840: UDP, length 1109
 00:00:00.031120 IP 192.168.37.101.4840 > 192.168.37.100.4840: UDP, length 1109
 00:00:00.009554 IP 192.168.37.101.4840 > 192.168.37.100.4840: UDP, length 1109
 00:00:00.002939 IP 192.168.37.101.4840 > 192.168.37.100.4840: UDP, length 1109
 00:00:00.036256 IP 192.168.37.101.4840 > 192.168.37.100.4840: UDP, length 1109
 00:00:00.026220 IP 192.168.37.101.4840 > 192.168.37.100.4840: UDP, length 1109
 00:00:00.021070 IP 192.168.37.101.4840 > 192.168.37.100.4840: UDP, length 1109
 00:00:00.012006 IP 192.168.37.101.4840 > 192.168.37.100.4840: UDP, length 1109
 00:00:00.017145 IP 192.168.37.101.4840 > 192.168.37.100.4840: UDP, length 1109
 00:00:00.012991 IP 192.168.37.101.4840 > 192.168.37.100.4840: UDP, length 1109
 00:00:00.008086 IP 192.168.37.101.4840 > 192.168.37.100.4840: UDP, length 1109
 00:00:00.002934 IP 192.168.37.101.4840 > 192.168.37.100.4840: UDP, length 1109
 00:00:00.021809 IP 192.168.37.101.4840 > 192.168.37.100.4840: UDP, length 1109
 00:00:00.005875 IP 192.168.37.101.4840 > 192.168.37.100.4840: UDP, length 1109
 00:00:00.007843 IP 192.168.37.101.4840 > 192.168.37.100.4840: UDP, length 1109
 00:00:00.009306 IP 192.168.37.101.4840 > 192.168.37.100.4840: UDP, length 1109
 00:00:00.015927 IP 192.168.37.101.4840 > 192.168.37.100.4840: UDP, length 1109
 00:00:00.023030 IP 192.168.37.101.4840 > 192.168.37.100.4840: UDP, length 1109
 00:00:00.001471 IP 192.168.37.101.4840 > 192.168.37.100.4840: UDP, length 1109
 00:00:00.029402 IP 192.168.37.101.4840 > 192.168.37.100.4840: UDP, length 1109
 00:00:00.001466 IP 192.168.37.101.4840 > 192.168.37.100.4840: UDP, length 1109
 00:00:00.018379 IP 192.168.37.101.4840 > 192.168.37.100.4840: UDP, length 1109
 00:00:00.024739 IP 192.168.37.101.4840 > 192.168.37.100.4840: UDP, length 1109
 00:00:00.019112 IP 192.168.37.101.4840 > 192.168.37.100.4840: UDP, length 1109
 00:00:00.001472 IP 192.168.37.101.4840 > 192.168.37.100.4840: UDP, length 1109
 00:00:00.004164 IP 192.168.37.101.4840 > 192.168.37.100.4840: UDP, length 1109
 00:00:00.013948 IP 192.168.37.101.4840 > 192.168.37.100.4840: UDP, length 1109
 00:00:00.046698 IP 192.168.37.101.4840 > 192.168.37.100.4840: UDP, length 1109
 00:00:00.001509 IP 192.168.37.101.4840 > 192.168.37.100.4840: UDP, length 1109
 00:00:00.029895 IP 192.168.37.101.4840 > 192.168.37.100.4840: UDP, length 1109
 00:00:00.008576 IP 192.168.37.101.4840 > 192.168.37.100.4840: UDP, length 1109
 00:00:00.001466 IP 192.168.37.101.4840 > 192.168.37.100.4840: UDP, length 1109
 00:00:00.013713 IP 192.168.37.101.4840 > 192.168.37.100.4840: UDP, length 1109
 00:00:00.028683 IP 192.168.37.101.4840 > 192.168.37.100.4840: UDP, length 1109
 00:00:00.004156 IP 192.168.37.101.4840 > 192.168.37.100.4840: UDP, length 1109
 00:00:00.001471 IP 192.168.37.101.4840 > 192.168.37.100.4840: UDP, length 1109
 00:00:00.006864 IP 192.168.37.101.4840 > 192.168.37.100.4840: UDP, length 1109
 00:00:00.002688 IP 192.168.37.101.4840 > 192.168.37.100.4840: UDP, length 1109
 00:00:00.006864 IP 192.168.37.101.4840 > 192.168.37.100.4840: UDP, length 1109
 00:00:00.034300 IP 192.168.37.101.4840 > 192.168.37.100.4840: UDP, length 1109
 00:00:00.011271 IP 192.168.37.101.4840 > 192.168.37.100.4840: UDP, length 1109
 00:00:00.003670 IP 192.168.37.101.4840 > 192.168.37.100.4840: UDP, length 1109
 00:00:00.002942 IP 192.168.37.101.4840 > 192.168.37.100.4840: UDP, length 1109
 00:00:00.013720 IP 192.168.37.101.4840 > 192.168.37.100.4840: UDP, length 1109
