 00:00:00.000000 IP 192.168.99.1.4840 > 192.168.99.2.4840: UDP, length 1109
 00:00:00.001350 IP 192.168.99.1.4840 > 192.168.99.2.4840: UDP, length 1109
 00:00:00.001357 IP 192.168.99.1.4840 > 192.168.99.2.4840: UDP, length 1109
 00:00:00.001385 IP 192.168.99.1.4840 > 192.168.99.2.4840: UDP, length 1109
 00:00:00.001340 IP 192.168.99.1.4840 > 192.168.99.2.4840: UDP, length 1109
 00:00:00.001353 IP 192.168.99.1.4840 > 192.168.99.2.4840: UDP, length 1109
 00:00:00.001351 IP 192.168.99.1.4840 > 192.168.99.2.4840: UDP, length 1109
 00:00:00.001354 IP 192.168.99.1.4840 > 192.168.99.2.4840: UDP, length 1109
 00:00:00.001543 IP 192.168.99.1.4840 > 192.168.99.2.4840: UDP, length 1109
 00:00:00.001421 IP 192.168.99.1.4840 > 192.168.99.2.4840: UDP, length 1109
 00:00:00.001365 IP 192.168.99.1.4840 > 192.168.99.2.4840: UDP, length 1109
 00:00:00.001346 IP 192.168.99.1.4840 > 192.168.99.2.4840: UDP, length 1109
 00:00:00.001369 IP 192.168.99.1.4840 > 192.168.99.2.4840: UDP, length 1109
 00:00:00.001343 IP 192.168.99.1.4840 > 192.168.99.2.4840: UDP, length 1109
 00:00:00.001550 IP 192.168.99.1.4840 > 192.168.99.2.4840: UDP, length 1109
 00:00:00.001416 IP 192.168.99.1.4840 > 192.168.99.2.4840: UDP, length 1109
 00:00:00.001361 IP 192.168.99.1.4840 > 192.168.99.2.4840: UDP, length 1109
 00:00:00.001359 IP 192.168.99.1.4840 > 192.168.99.2.4840: UDP, length 1109
 00:00:00.001338 IP 192.168.99.1.4840 > 192.168.99.2.4840: UDP, length 1109
 00:00:00.001365 IP 192.168.99.1.4840 > 192.168.99.2.4840: UDP, length 1109
 00:00:00.001359 IP 192.168.99.1.4840 > 192.168.99.2.4840: UDP, length 1109
 00:00:00.001344 IP 192.168.99.1.4840 > 192.168.99.2.4840: UDP, length 1109
 00:00:00.001349 IP 192.168.99.1.4840 > 192.168.99.2.4840: UDP, length 1109
 00:00:00.001339 IP 192.168.99.1.4840 > 192.168.99.2.4840: UDP, length 1109
 00:00:00.001335 IP 192.168.99.1.4840 > 192.168.99.2.4840: UDP, length 1109
 00:00:00.001357 IP 192.168.99.1.4840 > 192.168.99.2.4840: UDP, length 1109
 00:00:00.001343 IP 192.168.99.1.4840 > 192.168.99.2.4840: UDP, length 1109
 00:00:00.001337 IP 192.168.99.1.4840 > 192.168.99.2.4840: UDP, length 1109
 00:00:00.001337 IP 192.168.99.1.4840 > 192.168.99.2.4840: UDP, length 1109
 00:00:00.001335 IP 192.168.99.1.4840 > 192.168.99.2.4840: UDP, length 1109
 00:00:00.001351 IP 192.168.99.1.4840 > 192.168.99.2.4840: UDP, length 1109
 00:00:00.001363 IP 192.168.99.1.4840 > 192.168.99.2.4840: UDP, length 1109
 00:00:00.001345 IP 192.168.99.1.4840 > 192.168.99.2.4840: UDP, length 1109
 00:00:00.001339 IP 192.168.99.1.4840 > 192.168.99.2.4840: UDP, length 1109
 00:00:00.001356 IP 192.168.99.1.4840 > 192.168.99.2.4840: UDP, length 1109
 00:00:00.001365 IP 192.168.99.1.4840 > 192.168.99.2.4840: UDP, length 1109
 00:00:00.001347 IP 192.168.99.1.4840 > 192.168.99.2.4840: UDP, length 1109
 00:00:00.001388 IP 192.168.99.1.4840 > 192.168.99.2.4840: UDP, length 1109
 00:00:00.001362 IP 192.168.99.1.4840 > 192.168.99.2.4840: UDP, length 1109
 00:00:00.001360 IP 192.168.99.1.4840 > 192.168.99.2.4840: UDP, length 1109
 00:00:00.001344 IP 192.168.99.1.4840 > 192.168.99.2.4840: UDP, length 1109
 00:00:00.001338 IP 192.168.99.1.4840 > 192.168.99.2.4840: UDP, length 1109
 00:00:00.001357 IP 192.168.99.1.4840 > 192.168.99.2.4840: UDP, length 1109
 00:00:00.001341 IP 192.168.99.1.4840 > 192.168.99.2.4840: UDP, length 1109
 00:00:00.001356 IP 192.168.99.1.4840 > 192.168.99.2.4840: UDP, length 1109
 00:00:00.001402 IP 192.168.99.1.4840 > 192.168.99.2.4840: UDP, length 1109
 00:00:00.001356 IP 192.168.99.1.4840 > 192.168.99.2.4840: UDP, length 1109
 00:00:00.001342 IP 192.168.99.1.4840 > 192.168.99.2.4840: UDP, length 1109
 00:00:00.001349 IP 192.168.99.1.4840 > 192.168.99.2.4840: UDP, length 1109
 00:00:00.001340 IP 192.168.99.1.4840 > 192.168.99.2.4840: UDP, length 1109
 00:00:00.001369 IP 192.168.99.1.4840 > 192.168.99.2.4840: UDP, length 1109
 00:00:00.001373 IP 192.168.99.1.4840 > 192.168.99.2.4840: UDP, length 1109
 00:00:00.001354 IP 192.168.99.1.4840 > 192.168.99.2.4840: UDP, length 1109
 00:00:00.001484 IP 192.168.99.1.4840 > 192.168.99.2.4840: UDP, length 1109
 00:00:00.001491 IP 192.168.99.1.4840 > 192.168.99.2.4840: UDP, length 1109
 00:00:00.001414 IP 192.168.99.1.4840 > 192.168.99.2.4840: UDP, length 1109
 00:00:00.001387 IP 192.168.99.1.4840 > 192.168.99.2.4840: UDP, length 1109
 00:00:00.001353 IP 192.168.99.1.4840 > 192.168.99.2.4840: UDP, length 1109
 00:00:00.001363 IP 192.168.99.1.4840 > 192.168.99.2.4840: UDP, length 1109
 00:00:00.001367 IP 192.168.99.1.4840 > 192.168.99.2.4840: UDP, length 1109
 00:00:00.001354 IP 192.168.99.1.4840 > 192.168.99.2.4840: UDP, length 1109
 00:00:00.001354 IP 192.168.99.1.4840 > 192.168.99.2.4840: UDP, length 1109
 00:00:00.001349 IP 192.168.99.1.4840 > 192.168.99.2.4840: UDP, length 1109
 00:00:00.001349 IP 192.168.99.1.4840 > 192.168.99.2.4840: UDP, length 1109
 00:00:00.001368 IP 192.168.99.1.4840 > 192.168.99.2.4840: UDP, length 1109
 00:00:00.001339 IP 192.168.99.1.4840 > 192.168.99.2.4840: UDP, length 1109
 00:00:00.001374 IP 192.168.99.1.4840 > 192.168.99.2.4840: UDP, length 1109
 00:00:00.001361 IP 192.168.99.1.4840 > 192.168.99.2.4840: UDP, length 1109
 00:00:00.001343 IP 192.168.99.1.4840 > 192.168.99.2.4840: UDP, length 1109
 00:00:00.001347 IP 192.168.99.1.4840 > 192.168.99.2.4840: UDP, length 1109
 00:00:00.001340 IP 192.168.99.1.4840 > 192.168.99.2.4840: UDP, length 1109
 00:00:00.001374 IP 192.168.99.1.4840 > 192.168.99.2.4840: UDP, length 1109
 00:00:00.001360 IP 192.168.99.1.4840 > 192.168.99.2.4840: UDP, length 1109
 00:00:00.001342 IP 192.168.99.1.4840 > 192.168.99.2.4840: UDP, length 1109
 00:00:00.001333 IP 192.168.99.1.4840 > 192.168.99.2.4840: UDP, length 1109
 00:00:00.001390 IP 192.168.99.1.4840 > 192.168.99.2.4840: UDP, length 1109
 00:00:00.001346 IP 192.168.99.1.4840 > 192.168.99.2.4840: UDP, length 1109
 00:00:00.001338 IP 192.168.99.1.4840 > 192.168.99.2.4840: UDP, length 1109
 00:00:00.001335 IP 192.168.99.1.4840 > 192.168.99.2.4840: UDP, length 1109
 00:00:00.001336 IP 192.168.99.1.4840 > 192.168.99.2.4840: UDP, length 1109
 00:00:00.001336 IP 192.168.99.1.4840 > 192.168.99.2.4840: UDP, length 1109
 00:00:00.001359 IP 192.168.99.1.4840 > 192.168.99.2.4840: UDP, length 1109
 00:00:00.001335 IP 192.168.99.1.4840 > 192.168.99.2.4840: UDP, length 1109
 00:00:00.001346 IP 192.168.99.1.4840 > 192.168.99.2.4840: UDP, length 1109
 00:00:00.001502 IP 192.168.99.1.4840 > 192.168.99.2.4840: UDP, length 1109
 00:00:00.001371 IP 192.168.99.1.4840 > 192.168.99.2.4840: UDP, length 1109
 00:00:00.001344 IP 192.168.99.1.4840 > 192.168.99.2.4840: UDP, length 1109
 00:00:00.001339 IP 192.168.99.1.4840 > 192.168.99.2.4840: UDP, length 1109
 00:00:00.001349 IP 192.168.99.1.4840 > 192.168.99.2.4840: UDP, length 1109
 00:00:00.001380 IP 192.168.99.1.4840 > 192.168.99.2.4840: UDP, length 1109
 00:00:00.001346 IP 192.168.99.1.4840 > 192.168.99.2.4840: UDP, length 1109
 00:00:00.001340 IP 192.168.99.1.4840 > 192.168.99.2.4840: UDP, length 1109
 00:00:00.001361 IP 192.168.99.1.4840 > 192.168.99.2.4840: UDP, length 1109
 00:00:00.001333 IP 192.168.99.1.4840 > 192.168.99.2.4840: UDP, length 1109
 00:00:00.001336 IP 192.168.99.1.4840 > 192.168.99.2.4840: UDP, length 1109
 00:00:00.001362 IP 192.168.99.1.4840 > 192.168.99.2.4840: UDP, length 1109
 00:00:00.001350 IP 192.168.99.1.4840 > 192.168.99.2.4840: UDP, length 1109
 00:00:00.001357 IP 192.168.99.1.4840 > 192.168.99.2.4840: UDP, length 1109
 00:00:00.001344 IP 192.168.99.1.4840 > 192.168.99.2.4840: UDP, length 1109
 00:00:00.001457 IP 192.168.99.1.4840 > 192.168.99.2.4840: UDP, length 1109
 00:00:00.001380 IP 192.168.99.1.4840 > 192.168.99.2.4840: UDP, length 1109
 00:00:00.001369 IP 192.168.99.1.4840 > 192.168.99.2.4840: UDP, length 1109
 00:00:00.001348 IP 192.168.99.1.4840 > 192.168.99.2.4840: UDP, length 1109
 00:00:00.001383 IP 192.168.99.1.4840 > 192.168.99.2.4840: UDP, length 1109
 00:00:00.001356 IP 192.168.99.1.4840 > 192.168.99.2.4840: UDP, length 1109
 00:00:00.001361 IP 192.168.99.1.4840 > 192.168.99.2.4840: UDP, length 1109
 00:00:00.001384 IP 192.168.99.1.4840 > 192.168.99.2.4840: UDP, length 1109
 00:00:00.001345 IP 192.168.99.1.4840 > 192.168.99.2.4840: UDP, length 1109
 00:00:00.001343 IP 192.168.99.1.4840 > 192.168.99.2.4840: UDP, length 1109
 00:00:00.001341 IP 192.168.99.1.4840 > 192.168.99.2.4840: UDP, length 1109
 00:00:00.001344 IP 192.168.99.1.4840 > 192.168.99.2.4840: UDP, length 1109
 00:00:00.001379 IP 192.168.99.1.4840 > 192.168.99.2.4840: UDP, length 1109
 00:00:00.001348 IP 192.168.99.1.4840 > 192.168.99.2.4840: UDP, length 1109
 00:00:00.001340 IP 192.168.99.1.4840 > 192.168.99.2.4840: UDP, length 1109
 00:00:00.001365 IP 192.168.99.1.4840 > 192.168.99.2.4840: UDP, length 1109
 00:00:00.001332 IP 192.168.99.1.4840 > 192.168.99.2.4840: UDP, length 1109
 00:00:00.001333 IP 192.168.99.1.4840 > 192.168.99.2.4840: UDP, length 1109
 00:00:00.001347 IP 192.168.99.1.4840 > 192.168.99.2.4840: UDP, length 1109
 00:00:00.001364 IP 192.168.99.1.4840 > 192.168.99.2.4840: UDP, length 1109
 00:00:00.001315 IP 192.168.99.1.4840 > 192.168.99.2.4840: UDP, length 1109
 00:00:00.001334 IP 192.168.99.1.4840 > 192.168.99.2.4840: UDP, length 1109
 00:00:00.001334 IP 192.168.99.1.4840 > 192.168.99.2.4840: UDP, length 1109
 00:00:00.001332 IP 192.168.99.1.4840 > 192.168.99.2.4840: UDP, length 1109
 00:00:00.001340 IP 192.168.99.1.4840 > 192.168.99.2.4840: UDP, length 1109
 00:00:00.001341 IP 192.168.99.1.4840 > 192.168.99.2.4840: UDP, length 1109
 00:00:00.001343 IP 192.168.99.1.4840 > 192.168.99.2.4840: UDP, length 1109
 00:00:00.001354 IP 192.168.99.1.4840 > 192.168.99.2.4840: UDP, length 1109
 00:00:00.001340 IP 192.168.99.1.4840 > 192.168.99.2.4840: UDP, length 1109
 00:00:00.001341 IP 192.168.99.1.4840 > 192.168.99.2.4840: UDP, length 1109
 00:00:00.001369 IP 192.168.99.1.4840 > 192.168.99.2.4840: UDP, length 1109
 00:00:00.001335 IP 192.168.99.1.4840 > 192.168.99.2.4840: UDP, length 1109
 00:00:00.001362 IP 192.168.99.1.4840 > 192.168.99.2.4840: UDP, length 1109
 00:00:00.001352 IP 192.168.99.1.4840 > 192.168.99.2.4840: UDP, length 1109
 00:00:00.001453 IP 192.168.99.1.4840 > 192.168.99.2.4840: UDP, length 1109
 00:00:00.001406 IP 192.168.99.1.4840 > 192.168.99.2.4840: UDP, length 1109
 00:00:00.001353 IP 192.168.99.1.4840 > 192.168.99.2.4840: UDP, length 1109
 00:00:00.001340 IP 192.168.99.1.4840 > 192.168.99.2.4840: UDP, length 1109
 00:00:00.001362 IP 192.168.99.1.4840 > 192.168.99.2.4840: UDP, length 1109
 00:00:00.001343 IP 192.168.99.1.4840 > 192.168.99.2.4840: UDP, length 1109
 00:00:00.001334 IP 192.168.99.1.4840 > 192.168.99.2.4840: UDP, length 1109
 00:00:00.001689 IP 192.168.99.1.4840 > 192.168.99.2.4840: UDP, length 1109
 00:00:00.001512 IP 192.168.99.1.4840 > 192.168.99.2.4840: UDP, length 1109
 00:00:00.001397 IP 192.168.99.1.4840 > 192.168.99.2.4840: UDP, length 1109
 00:00:00.001364 IP 192.168.99.1.4840 > 192.168.99.2.4840: UDP, length 1109
 00:00:00.001368 IP 192.168.99.1.4840 > 192.168.99.2.4840: UDP, length 1109
 00:00:00.001351 IP 192.168.99.1.4840 > 192.168.99.2.4840: UDP, length 1109
 00:00:00.001365 IP 192.168.99.1.4840 > 192.168.99.2.4840: UDP, length 1109
 00:00:00.001352 IP 192.168.99.1.4840 > 192.168.99.2.4840: UDP, length 1109
 00:00:00.001352 IP 192.168.99.1.4840 > 192.168.99.2.4840: UDP, length 1109
 00:00:00.001356 IP 192.168.99.1.4840 > 192.168.99.2.4840: UDP, length 1109
 00:00:00.001351 IP 192.168.99.1.4840 > 192.168.99.2.4840: UDP, length 1109
 00:00:00.001362 IP 192.168.99.1.4840 > 192.168.99.2.4840: UDP, length 1109
 00:00:00.001570 IP 192.168.99.1.4840 > 192.168.99.2.4840: UDP, length 1109
 00:00:00.001434 IP 192.168.99.1.4840 > 192.168.99.2.4840: UDP, length 1109
 00:00:00.001401 IP 192.168.99.1.4840 > 192.168.99.2.4840: UDP, length 1109
 00:00:00.001368 IP 192.168.99.1.4840 > 192.168.99.2.4840: UDP, length 1109
 00:00:00.001356 IP 192.168.99.1.4840 > 192.168.99.2.4840: UDP, length 1109
 00:00:00.001413 IP 192.168.99.1.4840 > 192.168.99.2.4840: UDP, length 1109
 00:00:00.001367 IP 192.168.99.1.4840 > 192.168.99.2.4840: UDP, length 1109
 00:00:00.001364 IP 192.168.99.1.4840 > 192.168.99.2.4840: UDP, length 1109
 00:00:00.001348 IP 192.168.99.1.4840 > 192.168.99.2.4840: UDP, length 1109
 00:00:00.001376 IP 192.168.99.1.4840 > 192.168.99.2.4840: UDP, length 1109
 00:00:00.001420 IP 192.168.99.1.4840 > 192.168.99.2.4840: UDP, length 1109
 00:00:00.001367 IP 192.168.99.1.4840 > 192.168.99.2.4840: UDP, length 1109
 00:00:00.001359 IP 192.168.99.1.4840 > 192.168.99.2.4840: UDP, length 1109
 00:00:00.001370 IP 192.168.99.1.4840 > 192.168.99.2.4840: UDP, length 1109
 00:00:00.001353 IP 192.168.99.1.4840 > 192.168.99.2.4840: UDP, length 1109
 00:00:00.001390 IP 192.168.99.1.4840 > 192.168.99.2.4840: UDP, length 1109
 00:00:00.001360 IP 192.168.99.1.4840 > 192.168.99.2.4840: UDP, length 1109
 00:00:00.001363 IP 192.168.99.1.4840 > 192.168.99.2.4840: UDP, length 1109
 00:00:00.001396 IP 192.168.99.1.4840 > 192.168.99.2.4840: UDP, length 1109
 00:00:00.001359 IP 192.168.99.1.4840 > 192.168.99.2.4840: UDP, length 1109
 00:00:00.001366 IP 192.168.99.1.4840 > 192.168.99.2.4840: UDP, length 1109
 00:00:00.001373 IP 192.168.99.1.4840 > 192.168.99.2.4840: UDP, length 1109
 00:00:00.001385 IP 192.168.99.1.4840 > 192.168.99.2.4840: UDP, length 1109
 00:00:00.001382 IP 192.168.99.1.4840 > 192.168.99.2.4840: UDP, length 1109
 00:00:00.001353 IP 192.168.99.1.4840 > 192.168.99.2.4840: UDP, length 1109
 00:00:00.001351 IP 192.168.99.1.4840 > 192.168.99.2.4840: UDP, length 1109
 00:00:00.001397 IP 192.168.99.1.4840 > 192.168.99.2.4840: UDP, length 1109
 00:00:00.001358 IP 192.168.99.1.4840 > 192.168.99.2.4840: UDP, length 1109
 00:00:00.001354 IP 192.168.99.1.4840 > 192.168.99.2.4840: UDP, length 1109
 00:00:00.001361 IP 192.168.99.1.4840 > 192.168.99.2.4840: UDP, length 1109
 00:00:00.001345 IP 192.168.99.1.4840 > 192.168.99.2.4840: UDP, length 1109
 00:00:00.001344 IP 192.168.99.1.4840 > 192.168.99.2.4840: UDP, length 1109
 00:00:00.001347 IP 192.168.99.1.4840 > 192.168.99.2.4840: UDP, length 1109
 00:00:00.001357 IP 192.168.99.1.4840 > 192.168.99.2.4840: UDP, length 1109
 00:00:00.001353 IP 192.168.99.1.4840 > 192.168.99.2.4840: UDP, length 1109
 00:00:00.001403 IP 192.168.99.1.4840 > 192.168.99.2.4840: UDP, length 1109
 00:00:00.001351 IP 192.168.99.1.4840 > 192.168.99.2.4840: UDP, length 1109
 00:00:00.001365 IP 192.168.99.1.4840 > 192.168.99.2.4840: UDP, length 1109
 00:00:00.001357 IP 192.168.99.1.4840 > 192.168.99.2.4840: UDP, length 1109
 00:00:00.001382 IP 192.168.99.1.4840 > 192.168.99.2.4840: UDP, length 1109
 00:00:00.001396 IP 192.168.99.1.4840 > 192.168.99.2.4840: UDP, length 1109
 00:00:00.001382 IP 192.168.99.1.4840 > 192.168.99.2.4840: UDP, length 1109
 00:00:00.001356 IP 192.168.99.1.4840 > 192.168.99.2.4840: UDP, length 1109
 00:00:00.001373 IP 192.168.99.1.4840 > 192.168.99.2.4840: UDP, length 1109
 00:00:00.001350 IP 192.168.99.1.4840 > 192.168.99.2.4840: UDP, length 1109
 00:00:00.001360 IP 192.168.99.1.4840 > 192.168.99.2.4840: UDP, length 1109
 00:00:00.001351 IP 192.168.99.1.4840 > 192.168.99.2.4840: UDP, length 1109
 00:00:00.001345 IP 192.168.99.1.4840 > 192.168.99.2.4840: UDP, length 1109
 00:00:00.001382 IP 192.168.99.1.4840 > 192.168.99.2.4840: UDP, length 1109
 00:00:00.001361 IP 192.168.99.1.4840 > 192.168.99.2.4840: UDP, length 1109
 00:00:00.001344 IP 192.168.99.1.4840 > 192.168.99.2.4840: UDP, length 1109
 00:00:00.001359 IP 192.168.99.1.4840 > 192.168.99.2.4840: UDP, length 1109
 00:00:00.001343 IP 192.168.99.1.4840 > 192.168.99.2.4840: UDP, length 1109
 00:00:00.001345 IP 192.168.99.1.4840 > 192.168.99.2.4840: UDP, length 1109
 00:00:00.001344 IP 192.168.99.1.4840 > 192.168.99.2.4840: UDP, length 1109
 00:00:00.001361 IP 192.168.99.1.4840 > 192.168.99.2.4840: UDP, length 1109
 00:00:00.001351 IP 192.168.99.1.4840 > 192.168.99.2.4840: UDP, length 1109
 00:00:00.001375 IP 192.168.99.1.4840 > 192.168.99.2.4840: UDP, length 1109
 00:00:00.001367 IP 192.168.99.1.4840 > 192.168.99.2.4840: UDP, length 1109
 00:00:00.001365 IP 192.168.99.1.4840 > 192.168.99.2.4840: UDP, length 1109
 00:00:00.001341 IP 192.168.99.1.4840 > 192.168.99.2.4840: UDP, length 1109
 00:00:00.001342 IP 192.168.99.1.4840 > 192.168.99.2.4840: UDP, length 1109
 00:00:00.001345 IP 192.168.99.1.4840 > 192.168.99.2.4840: UDP, length 1109
 00:00:00.001341 IP 192.168.99.1.4840 > 192.168.99.2.4840: UDP, length 1109
 00:00:00.001344 IP 192.168.99.1.4840 > 192.168.99.2.4840: UDP, length 1109
 00:00:00.001367 IP 192.168.99.1.4840 > 192.168.99.2.4840: UDP, length 1109
 00:00:00.001375 IP 192.168.99.1.4840 > 192.168.99.2.4840: UDP, length 1109
 00:00:00.001361 IP 192.168.99.1.4840 > 192.168.99.2.4840: UDP, length 1109
 00:00:00.001354 IP 192.168.99.1.4840 > 192.168.99.2.4840: UDP, length 1109
 00:00:00.001347 IP 192.168.99.1.4840 > 192.168.99.2.4840: UDP, length 1109
 00:00:00.001354 IP 192.168.99.1.4840 > 192.168.99.2.4840: UDP, length 1109
 00:00:00.001342 IP 192.168.99.1.4840 > 192.168.99.2.4840: UDP, length 1109
 00:00:00.001365 IP 192.168.99.1.4840 > 192.168.99.2.4840: UDP, length 1109
 00:00:00.001344 IP 192.168.99.1.4840 > 192.168.99.2.4840: UDP, length 1109
 00:00:00.001372 IP 192.168.99.1.4840 > 192.168.99.2.4840: UDP, length 1109
 00:00:00.001347 IP 192.168.99.1.4840 > 192.168.99.2.4840: UDP, length 1109
 00:00:00.001359 IP 192.168.99.1.4840 > 192.168.99.2.4840: UDP, length 1109
 00:00:00.001352 IP 192.168.99.1.4840 > 192.168.99.2.4840: UDP, length 1109
 00:00:00.001348 IP 192.168.99.1.4840 > 192.168.99.2.4840: UDP, length 1109
 00:00:00.001349 IP 192.168.99.1.4840 > 192.168.99.2.4840: UDP, length 1109
 00:00:00.001346 IP 192.168.99.1.4840 > 192.168.99.2.4840: UDP, length 1109
 00:00:00.001343 IP 192.168.99.1.4840 > 192.168.99.2.4840: UDP, length 1109
 00:00:00.001362 IP 192.168.99.1.4840 > 192.168.99.2.4840: UDP, length 1109
 00:00:00.001362 IP 192.168.99.1.4840 > 192.168.99.2.4840: UDP, length 1109
 00:00:00.001357 IP 192.168.99.1.4840 > 192.168.99.2.4840: UDP, length 1109
 00:00:00.001366 IP 192.168.99.1.4840 > 192.168.99.2.4840: UDP, length 1109
 00:00:00.001354 IP 192.168.99.1.4840 > 192.168.99.2.4840: UDP, length 1109
 00:00:00.001355 IP 192.168.99.1.4840 > 192.168.99.2.4840: UDP, length 1109
 00:00:00.001358 IP 192.168.99.1.4840 > 192.168.99.2.4840: UDP, length 1109
 00:00:00.001345 IP 192.168.99.1.4840 > 192.168.99.2.4840: UDP, length 1109
 00:00:00.001342 IP 192.168.99.1.4840 > 192.168.99.2.4840: UDP, length 1109
 00:00:00.001381 IP 192.168.99.1.4840 > 192.168.99.2.4840: UDP, length 1109
 00:00:00.001357 IP 192.168.99.1.4840 > 192.168.99.2.4840: UDP, length 1109
 00:00:00.001362 IP 192.168.99.1.4840 > 192.168.99.2.4840: UDP, length 1109
 00:00:00.001380 IP 192.168.99.1.4840 > 192.168.99.2.4840: UDP, length 1109
 00:00:00.001371 IP 192.168.99.1.4840 > 192.168.99.2.4840: UDP, length 1109
 00:00:00.001358 IP 192.168.99.1.4840 > 192.168.99.2.4840: UDP, length 1109
 00:00:00.001343 IP 192.168.99.1.4840 > 192.168.99.2.4840: UDP, length 1109
 00:00:00.001344 IP 192.168.99.1.4840 > 192.168.99.2.4840: UDP, length 1109
 00:00:00.001366 IP 192.168.99.1.4840 > 192.168.99.2.4840: UDP, length 1109
 00:00:00.001346 IP 192.168.99.1.4840 > 192.168.99.2.4840: UDP, length 1109
 00:00:00.001339 IP 192.168.99.1.4840 > 192.168.99.2.4840: UDP, length 1109
 00:00:00.001320 IP 192.168.99.1.4840 > 192.168.99.2.4840: UDP, length 1109
 00:00:00.001346 IP 192.168.99.1.4840 > 192.168.99.2.4840: UDP, length 1109
 00:00:00.001346 IP 192.168.99.1.4840 > 192.168.99.2.4840: UDP, length 1109
 00:00:00.001400 IP 192.168.99.1.4840 > 192.168.99.2.4840: UDP, length 1109
 00:00:00.001363 IP 192.168.99.1.4840 > 192.168.99.2.4840: UDP, length 1109
 00:00:00.001360 IP 192.168.99.1.4840 > 192.168.99.2.4840: UDP, length 1109
 00:00:00.001347 IP 192.168.99.1.4840 > 192.168.99.2.4840: UDP, length 1109
 00:00:00.001342 IP 192.168.99.1.4840 > 192.168.99.2.4840: UDP, length 1109
 00:00:00.001362 IP 192.168.99.1.4840 > 192.168.99.2.4840: UDP, length 1109
 00:00:00.001411 IP 192.168.99.1.4840 > 192.168.99.2.4840: UDP, length 1109
 00:00:00.001408 IP 192.168.99.1.4840 > 192.168.99.2.4840: UDP, length 1109
 00:00:00.001378 IP 192.168.99.1.4840 > 192.168.99.2.4840: UDP, length 1109
 00:00:00.001359 IP 192.168.99.1.4840 > 192.168.99.2.4840: UDP, length 1109
 00:00:00.001354 IP 192.168.99.1.4840 > 192.168.99.2.4840: UDP, length 1109
 00:00:00.001361 IP 192.168.99.1.4840 > 192.168.99.2.4840: UDP, length 1109
 00:00:00.001342 IP 192.168.99.1.4840 > 192.168.99.2.4840: UDP, length 1109
 00:00:00.001441 IP 192.168.99.1.4840 > 192.168.99.2.4840: UDP, length 1109
 00:00:00.001455 IP 192.168.99.1.4840 > 192.168.99.2.4840: UDP, length 1109
 00:00:00.001361 IP 192.168.99.1.4840 > 192.168.99.2.4840: UDP, length 1109
 00:00:00.001368 IP 192.168.99.1.4840 > 192.168.99.2.4840: UDP, length 1109
 00:00:00.001357 IP 192.168.99.1.4840 > 192.168.99.2.4840: UDP, length 1109
 00:00:00.001359 IP 192.168.99.1.4840 > 192.168.99.2.4840: UDP, length 1109
 00:00:00.001350 IP 192.168.99.1.4840 > 192.168.99.2.4840: UDP, length 1109
 00:00:00.001346 IP 192.168.99.1.4840 > 192.168.99.2.4840: UDP, length 1109
 00:00:00.001357 IP 192.168.99.1.4840 > 192.168.99.2.4840: UDP, length 1109
 00:00:00.001357 IP 192.168.99.1.4840 > 192.168.99.2.4840: UDP, length 1109
 00:00:00.001347 IP 192.168.99.1.4840 > 192.168.99.2.4840: UDP, length 1109
 00:00:00.001347 IP 192.168.99.1.4840 > 192.168.99.2.4840: UDP, length 1109
 00:00:00.001349 IP 192.168.99.1.4840 > 192.168.99.2.4840: UDP, length 1109
 00:00:00.001339 IP 192.168.99.1.4840 > 192.168.99.2.4840: UDP, length 1109
 00:00:00.001358 IP 192.168.99.1.4840 > 192.168.99.2.4840: UDP, length 1109
 00:00:00.001400 IP 192.168.99.1.4840 > 192.168.99.2.4840: UDP, length 1109
 00:00:00.001377 IP 192.168.99.1.4840 > 192.168.99.2.4840: UDP, length 1109
 00:00:00.001359 IP 192.168.99.1.4840 > 192.168.99.2.4840: UDP, length 1109
 00:00:00.001363 IP 192.168.99.1.4840 > 192.168.99.2.4840: UDP, length 1109
 00:00:00.001396 IP 192.168.99.1.4840 > 192.168.99.2.4840: UDP, length 1109
 00:00:00.001361 IP 192.168.99.1.4840 > 192.168.99.2.4840: UDP, length 1109
 00:00:00.001341 IP 192.168.99.1.4840 > 192.168.99.2.4840: UDP, length 1109
 00:00:00.001401 IP 192.168.99.1.4840 > 192.168.99.2.4840: UDP, length 1109
 00:00:00.001364 IP 192.168.99.1.4840 > 192.168.99.2.4840: UDP, length 1109
 00:00:00.001344 IP 192.168.99.1.4840 > 192.168.99.2.4840: UDP, length 1109
 00:00:00.001359 IP 192.168.99.1.4840 > 192.168.99.2.4840: UDP, length 1109
 00:00:00.001771 IP 192.168.99.1.4840 > 192.168.99.2.4840: UDP, length 1109
 00:00:00.001377 IP 192.168.99.1.4840 > 192.168.99.2.4840: UDP, length 1109
 00:00:00.001325 IP 192.168.99.1.4840 > 192.168.99.2.4840: UDP, length 1109
 00:00:00.001344 IP 192.168.99.1.4840 > 192.168.99.2.4840: UDP, length 1109
 00:00:00.001356 IP 192.168.99.1.4840 > 192.168.99.2.4840: UDP, length 1109
 00:00:00.001348 IP 192.168.99.1.4840 > 192.168.99.2.4840: UDP, length 1109
 00:00:00.001341 IP 192.168.99.1.4840 > 192.168.99.2.4840: UDP, length 1109
 00:00:00.001349 IP 192.168.99.1.4840 > 192.168.99.2.4840: UDP, length 1109
 00:00:00.001356 IP 192.168.99.1.4840 > 192.168.99.2.4840: UDP, length 1109
 00:00:00.001128 IP 192.168.99.1.4840 > 192.168.99.2.4840: UDP, length 1109
 00:00:00.001348 IP 192.168.99.1.4840 > 192.168.99.2.4840: UDP, length 1109
 00:00:00.001340 IP 192.168.99.1.4840 > 192.168.99.2.4840: UDP, length 1109
 00:00:00.001344 IP 192.168.99.1.4840 > 192.168.99.2.4840: UDP, length 1109
 00:00:00.001365 IP 192.168.99.1.4840 > 192.168.99.2.4840: UDP, length 1109
 00:00:00.001366 IP 192.168.99.1.4840 > 192.168.99.2.4840: UDP, length 1109
 00:00:00.001394 IP 192.168.99.1.4840 > 192.168.99.2.4840: UDP, length 1109
 00:00:00.001351 IP 192.168.99.1.4840 > 192.168.99.2.4840: UDP, length 1109
 00:00:00.001349 IP 192.168.99.1.4840 > 192.168.99.2.4840: UDP, length 1109
 00:00:00.001386 IP 192.168.99.1.4840 > 192.168.99.2.4840: UDP, length 1109
 00:00:00.001379 IP 192.168.99.1.4840 > 192.168.99.2.4840: UDP, length 1109
 00:00:00.001360 IP 192.168.99.1.4840 > 192.168.99.2.4840: UDP, length 1109
 00:00:00.001629 IP 192.168.99.1.4840 > 192.168.99.2.4840: UDP, length 1109
 00:00:00.001346 IP 192.168.99.1.4840 > 192.168.99.2.4840: UDP, length 1109
 00:00:00.001347 IP 192.168.99.1.4840 > 192.168.99.2.4840: UDP, length 1109
 00:00:00.001372 IP 192.168.99.1.4840 > 192.168.99.2.4840: UDP, length 1109
 00:00:00.001346 IP 192.168.99.1.4840 > 192.168.99.2.4840: UDP, length 1109
 00:00:00.001359 IP 192.168.99.1.4840 > 192.168.99.2.4840: UDP, length 1109
 00:00:00.001365 IP 192.168.99.1.4840 > 192.168.99.2.4840: UDP, length 1109
 00:00:00.001362 IP 192.168.99.1.4840 > 192.168.99.2.4840: UDP, length 1109
 00:00:00.001389 IP 192.168.99.1.4840 > 192.168.99.2.4840: UDP, length 1109
 00:00:00.001356 IP 192.168.99.1.4840 > 192.168.99.2.4840: UDP, length 1109
 00:00:00.001205 IP 192.168.99.1.4840 > 192.168.99.2.4840: UDP, length 1109
 00:00:00.001383 IP 192.168.99.1.4840 > 192.168.99.2.4840: UDP, length 1109
 00:00:00.001045 IP 192.168.99.1.4840 > 192.168.99.2.4840: UDP, length 1109
 00:00:00.001342 IP 192.168.99.1.4840 > 192.168.99.2.4840: UDP, length 1109
 00:00:00.001352 IP 192.168.99.1.4840 > 192.168.99.2.4840: UDP, length 1109
 00:00:00.001349 IP 192.168.99.1.4840 > 192.168.99.2.4840: UDP, length 1109
 00:00:00.001374 IP 192.168.99.1.4840 > 192.168.99.2.4840: UDP, length 1109
 00:00:00.001383 IP 192.168.99.1.4840 > 192.168.99.2.4840: UDP, length 1109
 00:00:00.001354 IP 192.168.99.1.4840 > 192.168.99.2.4840: UDP, length 1109
 00:00:00.001347 IP 192.168.99.1.4840 > 192.168.99.2.4840: UDP, length 1109
 00:00:00.001395 IP 192.168.99.1.4840 > 192.168.99.2.4840: UDP, length 1109
 00:00:00.001374 IP 192.168.99.1.4840 > 192.168.99.2.4840: UDP, length 1109
 00:00:00.001364 IP 192.168.99.1.4840 > 192.168.99.2.4840: UDP, length 1109
 00:00:00.001354 IP 192.168.99.1.4840 > 192.168.99.2.4840: UDP, length 1109
 00:00:00.001346 IP 192.168.99.1.4840 > 192.168.99.2.4840: UDP, length 1109
 00:00:00.001366 IP 192.168.99.1.4840 > 192.168.99.2.4840: UDP, length 1109
 00:00:00.001348 IP 192.168.99.1.4840 > 192.168.99.2.4840: UDP, length 1109
 00:00:00.001339 IP 192.168.99.1.4840 > 192.168.99.2.4840: UDP, length 1109
 00:00:00.001361 IP 192.168.99.1.4840 > 192.168.99.2.4840: UDP, length 1109
 00:00:00.001343 IP 192.168.99.1.4840 > 192.168.99.2.4840: UDP, length 1109
 00:00:00.001365 IP 192.168.99.1.4840 > 192.168.99.2.4840: UDP, length 1109
 00:00:00.001351 IP 192.168.99.1.4840 > 192.168.99.2.4840: UDP, length 1109
 00:00:00.001344 IP 192.168.99.1.4840 > 192.168.99.2.4840: UDP, length 1109
 00:00:00.001352 IP 192.168.99.1.4840 > 192.168.99.2.4840: UDP, length 1109
 00:00:00.001364 IP 192.168.99.1.4840 > 192.168.99.2.4840: UDP, length 1109
 00:00:00.001347 IP 192.168.99.1.4840 > 192.168.99.2.4840: UDP, length 1109
 00:00:00.001363 IP 192.168.99.1.4840 > 192.168.99.2.4840: UDP, length 1109
 00:00:00.001346 IP 192.168.99.1.4840 > 192.168.99.2.4840: UDP, length 1109
 00:00:00.001342 IP 192.168.99.1.4840 > 192.168.99.2.4840: UDP, length 1109
 00:00:00.001356 IP 192.168.99.1.4840 > 192.168.99.2.4840: UDP, length 1109
 00:00:00.001349 IP 192.168.99.1.4840 > 192.168.99.2.4840: UDP, length 1109
 00:00:00.001478 IP 192.168.99.1.4840 > 192.168.99.2.4840: UDP, length 1109
 00:00:00.001470 IP 192.168.99.1.4840 > 192.168.99.2.4840: UDP, length 1109
 00:00:00.001368 IP 192.168.99.1.4840 > 192.168.99.2.4840: UDP, length 1109
 00:00:00.001359 IP 192.168.99.1.4840 > 192.168.99.2.4840: UDP, length 1109
 00:00:00.001356 IP 192.168.99.1.4840 > 192.168.99.2.4840: UDP, length 1109
 00:00:00.001342 IP 192.168.99.1.4840 > 192.168.99.2.4840: UDP, length 1109
 00:00:00.001351 IP 192.168.99.1.4840 > 192.168.99.2.4840: UDP, length 1109
 00:00:00.001349 IP 192.168.99.1.4840 > 192.168.99.2.4840: UDP, length 1109
 00:00:00.001348 IP 192.168.99.1.4840 > 192.168.99.2.4840: UDP, length 1109
 00:00:00.001359 IP 192.168.99.1.4840 > 192.168.99.2.4840: UDP, length 1109
 00:00:00.001361 IP 192.168.99.1.4840 > 192.168.99.2.4840: UDP, length 1109
 00:00:00.001343 IP 192.168.99.1.4840 > 192.168.99.2.4840: UDP, length 1109
 00:00:00.001336 IP 192.168.99.1.4840 > 192.168.99.2.4840: UDP, length 1109
 00:00:00.001341 IP 192.168.99.1.4840 > 192.168.99.2.4840: UDP, length 1109
 00:00:00.001350 IP 192.168.99.1.4840 > 192.168.99.2.4840: UDP, length 1109
 00:00:00.001356 IP 192.168.99.1.4840 > 192.168.99.2.4840: UDP, length 1109
 00:00:00.001346 IP 192.168.99.1.4840 > 192.168.99.2.4840: UDP, length 1109
 00:00:00.001357 IP 192.168.99.1.4840 > 192.168.99.2.4840: UDP, length 1109
 00:00:00.001364 IP 192.168.99.1.4840 > 192.168.99.2.4840: UDP, length 1109
 00:00:00.001367 IP 192.168.99.1.4840 > 192.168.99.2.4840: UDP, length 1109
 00:00:00.001393 IP 192.168.99.1.4840 > 192.168.99.2.4840: UDP, length 1109
 00:00:00.001351 IP 192.168.99.1.4840 > 192.168.99.2.4840: UDP, length 1109
 00:00:00.001341 IP 192.168.99.1.4840 > 192.168.99.2.4840: UDP, length 1109
 00:00:00.001363 IP 192.168.99.1.4840 > 192.168.99.2.4840: UDP, length 1109
 00:00:00.001360 IP 192.168.99.1.4840 > 192.168.99.2.4840: UDP, length 1109
 00:00:00.001346 IP 192.168.99.1.4840 > 192.168.99.2.4840: UDP, length 1109
 00:00:00.001343 IP 192.168.99.1.4840 > 192.168.99.2.4840: UDP, length 1109
 00:00:00.001357 IP 192.168.99.1.4840 > 192.168.99.2.4840: UDP, length 1109
 00:00:00.001358 IP 192.168.99.1.4840 > 192.168.99.2.4840: UDP, length 1109
 00:00:00.001377 IP 192.168.99.1.4840 > 192.168.99.2.4840: UDP, length 1109
 00:00:00.001351 IP 192.168.99.1.4840 > 192.168.99.2.4840: UDP, length 1109
 00:00:00.001393 IP 192.168.99.1.4840 > 192.168.99.2.4840: UDP, length 1109
 00:00:00.001389 IP 192.168.99.1.4840 > 192.168.99.2.4840: UDP, length 1109
 00:00:00.001350 IP 192.168.99.1.4840 > 192.168.99.2.4840: UDP, length 1109
 00:00:00.001358 IP 192.168.99.1.4840 > 192.168.99.2.4840: UDP, length 1109
 00:00:00.001344 IP 192.168.99.1.4840 > 192.168.99.2.4840: UDP, length 1109
 00:00:00.001350 IP 192.168.99.1.4840 > 192.168.99.2.4840: UDP, length 1109
 00:00:00.001385 IP 192.168.99.1.4840 > 192.168.99.2.4840: UDP, length 1109
 00:00:00.001381 IP 192.168.99.1.4840 > 192.168.99.2.4840: UDP, length 1109
 00:00:00.001353 IP 192.168.99.1.4840 > 192.168.99.2.4840: UDP, length 1109
 00:00:00.001356 IP 192.168.99.1.4840 > 192.168.99.2.4840: UDP, length 1109
 00:00:00.002194 IP 192.168.99.1.4840 > 192.168.99.2.4840: UDP, length 1109
 00:00:00.001692 IP 192.168.99.1.4840 > 192.168.99.2.4840: UDP, length 1109
 00:00:00.001490 IP 192.168.99.1.4840 > 192.168.99.2.4840: UDP, length 1109
 00:00:00.001401 IP 192.168.99.1.4840 > 192.168.99.2.4840: UDP, length 1109
 00:00:00.001352 IP 192.168.99.1.4840 > 192.168.99.2.4840: UDP, length 1109
 00:00:00.001357 IP 192.168.99.1.4840 > 192.168.99.2.4840: UDP, length 1109
 00:00:00.001395 IP 192.168.99.1.4840 > 192.168.99.2.4840: UDP, length 1109
 00:00:00.001355 IP 192.168.99.1.4840 > 192.168.99.2.4840: UDP, length 1109
 00:00:00.001351 IP 192.168.99.1.4840 > 192.168.99.2.4840: UDP, length 1109
 00:00:00.001342 IP 192.168.99.1.4840 > 192.168.99.2.4840: UDP, length 1109
 00:00:00.001343 IP 192.168.99.1.4840 > 192.168.99.2.4840: UDP, length 1109
 00:00:00.001349 IP 192.168.99.1.4840 > 192.168.99.2.4840: UDP, length 1109
 00:00:00.001403 IP 192.168.99.1.4840 > 192.168.99.2.4840: UDP, length 1109
 00:00:00.001361 IP 192.168.99.1.4840 > 192.168.99.2.4840: UDP, length 1109
 00:00:00.001363 IP 192.168.99.1.4840 > 192.168.99.2.4840: UDP, length 1109
 00:00:00.001350 IP 192.168.99.1.4840 > 192.168.99.2.4840: UDP, length 1109
 00:00:00.001341 IP 192.168.99.1.4840 > 192.168.99.2.4840: UDP, length 1109
 00:00:00.001358 IP 192.168.99.1.4840 > 192.168.99.2.4840: UDP, length 1109
 00:00:00.001350 IP 192.168.99.1.4840 > 192.168.99.2.4840: UDP, length 1109
 00:00:00.001350 IP 192.168.99.1.4840 > 192.168.99.2.4840: UDP, length 1109
 00:00:00.001398 IP 192.168.99.1.4840 > 192.168.99.2.4840: UDP, length 1109
 00:00:00.001470 IP 192.168.99.1.4840 > 192.168.99.2.4840: UDP, length 1109
 00:00:00.001383 IP 192.168.99.1.4840 > 192.168.99.2.4840: UDP, length 1109
 00:00:00.001431 IP 192.168.99.1.4840 > 192.168.99.2.4840: UDP, length 1109
 00:00:00.001348 IP 192.168.99.1.4840 > 192.168.99.2.4840: UDP, length 1109
 00:00:00.001361 IP 192.168.99.1.4840 > 192.168.99.2.4840: UDP, length 1109
 00:00:00.001340 IP 192.168.99.1.4840 > 192.168.99.2.4840: UDP, length 1109
 00:00:00.001356 IP 192.168.99.1.4840 > 192.168.99.2.4840: UDP, length 1109
 00:00:00.001351 IP 192.168.99.1.4840 > 192.168.99.2.4840: UDP, length 1109
 00:00:00.001338 IP 192.168.99.1.4840 > 192.168.99.2.4840: UDP, length 1109
 00:00:00.001342 IP 192.168.99.1.4840 > 192.168.99.2.4840: UDP, length 1109
 00:00:00.001365 IP 192.168.99.1.4840 > 192.168.99.2.4840: UDP, length 1109
 00:00:00.001345 IP 192.168.99.1.4840 > 192.168.99.2.4840: UDP, length 1109
 00:00:00.001347 IP 192.168.99.1.4840 > 192.168.99.2.4840: UDP, length 1109
 00:00:00.001355 IP 192.168.99.1.4840 > 192.168.99.2.4840: UDP, length 1109
 00:00:00.001354 IP 192.168.99.1.4840 > 192.168.99.2.4840: UDP, length 1109
 00:00:00.001375 IP 192.168.99.1.4840 > 192.168.99.2.4840: UDP, length 1109
 00:00:00.001352 IP 192.168.99.1.4840 > 192.168.99.2.4840: UDP, length 1109
 00:00:00.001354 IP 192.168.99.1.4840 > 192.168.99.2.4840: UDP, length 1109
 00:00:00.001365 IP 192.168.99.1.4840 > 192.168.99.2.4840: UDP, length 1109
 00:00:00.001351 IP 192.168.99.1.4840 > 192.168.99.2.4840: UDP, length 1109
 00:00:00.001351 IP 192.168.99.1.4840 > 192.168.99.2.4840: UDP, length 1109
 00:00:00.001387 IP 192.168.99.1.4840 > 192.168.99.2.4840: UDP, length 1109
 00:00:00.001420 IP 192.168.99.1.4840 > 192.168.99.2.4840: UDP, length 1109
 00:00:00.001377 IP 192.168.99.1.4840 > 192.168.99.2.4840: UDP, length 1109
 00:00:00.001353 IP 192.168.99.1.4840 > 192.168.99.2.4840: UDP, length 1109
 00:00:00.001338 IP 192.168.99.1.4840 > 192.168.99.2.4840: UDP, length 1109
 00:00:00.001370 IP 192.168.99.1.4840 > 192.168.99.2.4840: UDP, length 1109
 00:00:00.001345 IP 192.168.99.1.4840 > 192.168.99.2.4840: UDP, length 1109
 00:00:00.001338 IP 192.168.99.1.4840 > 192.168.99.2.4840: UDP, length 1109
 00:00:00.001350 IP 192.168.99.1.4840 > 192.168.99.2.4840: UDP, length 1109
 00:00:00.001345 IP 192.168.99.1.4840 > 192.168.99.2.4840: UDP, length 1109
 00:00:00.001339 IP 192.168.99.1.4840 > 192.168.99.2.4840: UDP, length 1109
 00:00:00.001353 IP 192.168.99.1.4840 > 192.168.99.2.4840: UDP, length 1109
 00:00:00.001349 IP 192.168.99.1.4840 > 192.168.99.2.4840: UDP, length 1109
 00:00:00.001343 IP 192.168.99.1.4840 > 192.168.99.2.4840: UDP, length 1109
 00:00:00.001356 IP 192.168.99.1.4840 > 192.168.99.2.4840: UDP, length 1109
 00:00:00.001344 IP 192.168.99.1.4840 > 192.168.99.2.4840: UDP, length 1109
 00:00:00.001337 IP 192.168.99.1.4840 > 192.168.99.2.4840: UDP, length 1109
 00:00:00.001353 IP 192.168.99.1.4840 > 192.168.99.2.4840: UDP, length 1109
 00:00:00.001343 IP 192.168.99.1.4840 > 192.168.99.2.4840: UDP, length 1109
 00:00:00.001335 IP 192.168.99.1.4840 > 192.168.99.2.4840: UDP, length 1109
 00:00:00.001348 IP 192.168.99.1.4840 > 192.168.99.2.4840: UDP, length 1109
 00:00:00.001347 IP 192.168.99.1.4840 > 192.168.99.2.4840: UDP, length 1109
 00:00:00.001343 IP 192.168.99.1.4840 > 192.168.99.2.4840: UDP, length 1109
 00:00:00.001357 IP 192.168.99.1.4840 > 192.168.99.2.4840: UDP, length 1109
 00:00:00.001347 IP 192.168.99.1.4840 > 192.168.99.2.4840: UDP, length 1109
 00:00:00.001337 IP 192.168.99.1.4840 > 192.168.99.2.4840: UDP, length 1109
 00:00:00.001358 IP 192.168.99.1.4840 > 192.168.99.2.4840: UDP, length 1109
 00:00:00.001366 IP 192.168.99.1.4840 > 192.168.99.2.4840: UDP, length 1109
 00:00:00.001380 IP 192.168.99.1.4840 > 192.168.99.2.4840: UDP, length 1109
 00:00:00.001364 IP 192.168.99.1.4840 > 192.168.99.2.4840: UDP, length 1109
 00:00:00.001346 IP 192.168.99.1.4840 > 192.168.99.2.4840: UDP, length 1109
 00:00:00.001358 IP 192.168.99.1.4840 > 192.168.99.2.4840: UDP, length 1109
 00:00:00.001347 IP 192.168.99.1.4840 > 192.168.99.2.4840: UDP, length 1109
 00:00:00.001345 IP 192.168.99.1.4840 > 192.168.99.2.4840: UDP, length 1109
 00:00:00.001355 IP 192.168.99.1.4840 > 192.168.99.2.4840: UDP, length 1109
 00:00:00.001344 IP 192.168.99.1.4840 > 192.168.99.2.4840: UDP, length 1109
 00:00:00.001345 IP 192.168.99.1.4840 > 192.168.99.2.4840: UDP, length 1109
 00:00:00.001351 IP 192.168.99.1.4840 > 192.168.99.2.4840: UDP, length 1109
 00:00:00.001348 IP 192.168.99.1.4840 > 192.168.99.2.4840: UDP, length 1109
 00:00:00.001351 IP 192.168.99.1.4840 > 192.168.99.2.4840: UDP, length 1109
 00:00:00.001356 IP 192.168.99.1.4840 > 192.168.99.2.4840: UDP, length 1109
 00:00:00.001344 IP 192.168.99.1.4840 > 192.168.99.2.4840: UDP, length 1109
 00:00:00.001340 IP 192.168.99.1.4840 > 192.168.99.2.4840: UDP, length 1109
 00:00:00.001381 IP 192.168.99.1.4840 > 192.168.99.2.4840: UDP, length 1109
 00:00:00.001349 IP 192.168.99.1.4840 > 192.168.99.2.4840: UDP, length 1109
 00:00:00.001369 IP 192.168.99.1.4840 > 192.168.99.2.4840: UDP, length 1109
 00:00:00.001348 IP 192.168.99.1.4840 > 192.168.99.2.4840: UDP, length 1109
 00:00:00.001345 IP 192.168.99.1.4840 > 192.168.99.2.4840: UDP, length 1109
 00:00:00.001360 IP 192.168.99.1.4840 > 192.168.99.2.4840: UDP, length 1109
 00:00:00.001346 IP 192.168.99.1.4840 > 192.168.99.2.4840: UDP, length 1109
 00:00:00.001339 IP 192.168.99.1.4840 > 192.168.99.2.4840: UDP, length 1109
 00:00:00.001359 IP 192.168.99.1.4840 > 192.168.99.2.4840: UDP, length 1109
 00:00:00.001338 IP 192.168.99.1.4840 > 192.168.99.2.4840: UDP, length 1109
 00:00:00.001343 IP 192.168.99.1.4840 > 192.168.99.2.4840: UDP, length 1109
 00:00:00.001347 IP 192.168.99.1.4840 > 192.168.99.2.4840: UDP, length 1109
 00:00:00.001347 IP 192.168.99.1.4840 > 192.168.99.2.4840: UDP, length 1109
 00:00:00.001362 IP 192.168.99.1.4840 > 192.168.99.2.4840: UDP, length 1109
 00:00:00.001370 IP 192.168.99.1.4840 > 192.168.99.2.4840: UDP, length 1109
 00:00:00.001347 IP 192.168.99.1.4840 > 192.168.99.2.4840: UDP, length 1109
 00:00:00.001349 IP 192.168.99.1.4840 > 192.168.99.2.4840: UDP, length 1109
 00:00:00.001361 IP 192.168.99.1.4840 > 192.168.99.2.4840: UDP, length 1109
 00:00:00.001347 IP 192.168.99.1.4840 > 192.168.99.2.4840: UDP, length 1109
 00:00:00.001380 IP 192.168.99.1.4840 > 192.168.99.2.4840: UDP, length 1109
 00:00:00.001352 IP 192.168.99.1.4840 > 192.168.99.2.4840: UDP, length 1109
 00:00:00.001346 IP 192.168.99.1.4840 > 192.168.99.2.4840: UDP, length 1109
 00:00:00.001353 IP 192.168.99.1.4840 > 192.168.99.2.4840: UDP, length 1109
 00:00:00.001349 IP 192.168.99.1.4840 > 192.168.99.2.4840: UDP, length 1109
 00:00:00.001347 IP 192.168.99.1.4840 > 192.168.99.2.4840: UDP, length 1109
 00:00:00.001346 IP 192.168.99.1.4840 > 192.168.99.2.4840: UDP, length 1109
 00:00:00.001344 IP 192.168.99.1.4840 > 192.168.99.2.4840: UDP, length 1109
 00:00:00.001341 IP 192.168.99.1.4840 > 192.168.99.2.4840: UDP, length 1109
 00:00:00.001361 IP 192.168.99.1.4840 > 192.168.99.2.4840: UDP, length 1109
 00:00:00.001341 IP 192.168.99.1.4840 > 192.168.99.2.4840: UDP, length 1109
 00:00:00.001342 IP 192.168.99.1.4840 > 192.168.99.2.4840: UDP, length 1109
 00:00:00.001343 IP 192.168.99.1.4840 > 192.168.99.2.4840: UDP, length 1109
 00:00:00.001369 IP 192.168.99.1.4840 > 192.168.99.2.4840: UDP, length 1109
 00:00:00.001361 IP 192.168.99.1.4840 > 192.168.99.2.4840: UDP, length 1109
 00:00:00.001367 IP 192.168.99.1.4840 > 192.168.99.2.4840: UDP, length 1109
 00:00:00.001349 IP 192.168.99.1.4840 > 192.168.99.2.4840: UDP, length 1109
 00:00:00.001355 IP 192.168.99.1.4840 > 192.168.99.2.4840: UDP, length 1109
 00:00:00.001353 IP 192.168.99.1.4840 > 192.168.99.2.4840: UDP, length 1109
 00:00:00.001345 IP 192.168.99.1.4840 > 192.168.99.2.4840: UDP, length 1109
 00:00:00.001353 IP 192.168.99.1.4840 > 192.168.99.2.4840: UDP, length 1109
 00:00:00.001345 IP 192.168.99.1.4840 > 192.168.99.2.4840: UDP, length 1109
 00:00:00.001340 IP 192.168.99.1.4840 > 192.168.99.2.4840: UDP, length 1109
