 00:00:00.000000 IP 192.168.37.101.4840 > 192.168.37.100.4840: UDP, length 1109
 00:00:00.000987 IP 192.168.37.101.4840 > 192.168.37.100.4840: UDP, length 1109
 00:00:00.002927 IP 192.168.37.101.4840 > 192.168.37.100.4840: UDP, length 1109
 00:00:00.000996 IP 192.168.37.101.4840 > 192.168.37.100.4840: UDP, length 1109
 00:00:00.003168 IP 192.168.37.101.4840 > 192.168.37.100.4840: UDP, length 1109
 00:00:00.000980 IP 192.168.37.101.4840 > 192.168.37.100.4840: UDP, length 1109
 00:00:00.002938 IP 192.168.37.101.4840 > 192.168.37.100.4840: UDP, length 1109
 00:00:00.000981 IP 192.168.37.101.4840 > 192.168.37.100.4840: UDP, length 1109
 00:00:00.002937 IP 192.168.37.101.4840 > 192.168.37.100.4840: UDP, length 1109
 00:00:00.001469 IP 192.168.37.101.4840 > 192.168.37.100.4840: UDP, length 1109
 00:00:00.002698 IP 192.168.37.101.4840 > 192.168.37.100.4840: UDP, length 1109
 00:00:00.002937 IP 192.168.37.101.4840 > 192.168.37.100.4840: UDP, length 1109
 00:00:00.001235 IP 192.168.37.101.4840 > 192.168.37.100.4840: UDP, length 1109
 00:00:00.002693 IP 192.168.37.101.4840 > 192.168.37.100.4840: UDP, length 1109
 00:00:00.004168 IP 192.168.37.101.4840 > 192.168.37.100.4840: UDP, length 1109
 00:00:00.002696 IP 192.168.37.101.4840 > 192.168.37.100.4840: UDP, length 1109
 00:00:00.004160 IP 192.168.37.101.4840 > 192.168.37.100.4840: UDP, length 1109
 00:00:00.006131 IP 192.168.37.101.4840 > 192.168.37.100.4840: UDP, length 1109
 00:00:00.003917 IP 192.168.37.101.4840 > 192.168.37.100.4840: UDP, length 1109
 00:00:00.002941 IP 192.168.37.101.4840 > 192.168.37.100.4840: UDP, length 1109
 00:00:00.002206 IP 192.168.37.101.4840 > 192.168.37.100.4840: UDP, length 1109
 00:00:00.004900 IP 192.168.37.101.4840 > 192.168.37.100.4840: UDP, length 1109
 00:00:00.002936 IP 192.168.37.101.4840 > 192.168.37.100.4840: UDP, length 1109
 00:00:00.002940 IP 192.168.37.101.4840 > 192.168.37.100.4840: UDP, length 1109
 00:00:00.000992 IP 192.168.37.101.4840 > 192.168.37.100.4840: UDP, length 1109
 00:00:00.001217 IP 192.168.37.101.4840 > 192.168.37.100.4840: UDP, length 1109
 00:00:00.001960 IP 192.168.37.101.4840 > 192.168.37.100.4840: UDP, length 1109
 00:00:00.001223 IP 192.168.37.101.4840 > 192.168.37.100.4840: UDP, length 1109
 00:00:00.002694 IP 192.168.37.101.4840 > 192.168.37.100.4840: UDP, length 1109
 00:00:00.001717 IP 192.168.37.101.4840 > 192.168.37.100.4840: UDP, length 1109
 00:00:00.001221 IP 192.168.37.101.4840 > 192.168.37.100.4840: UDP, length 1109
 00:00:00.001229 IP 192.168.37.101.4840 > 192.168.37.100.4840: UDP, length 1109
 00:00:00.002694 IP 192.168.37.101.4840 > 192.168.37.100.4840: UDP, length 1109
 00:00:00.002939 IP 192.168.37.101.4840 > 192.168.37.100.4840: UDP, length 1109
 00:00:00.000983 IP 192.168.37.101.4840 > 192.168.37.100.4840: UDP, length 1109
 00:00:00.003178 IP 192.168.37.101.4840 > 192.168.37.100.4840: UDP, length 1109
 00:00:00.004174 IP 192.168.37.101.4840 > 192.168.37.100.4840: UDP, length 1109
 00:00:00.003913 IP 192.168.37.101.4840 > 192.168.37.100.4840: UDP, length 1109
 00:00:00.002938 IP 192.168.37.101.4840 > 192.168.37.100.4840: UDP, length 1109
 00:00:00.001720 IP 192.168.37.101.4840 > 192.168.37.100.4840: UDP, length 1109
 00:00:00.002456 IP 192.168.37.101.4840 > 192.168.37.100.4840: UDP, length 1109
 00:00:00.002688 IP 192.168.37.101.4840 > 192.168.37.100.4840: UDP, length 1109
 00:00:00.000980 IP 192.168.37.101.4840 > 192.168.37.100.4840: UDP, length 1109
 00:00:00.003181 IP 192.168.37.101.4840 > 192.168.37.100.4840: UDP, length 1109
 00:00:00.003928 IP 192.168.37.101.4840 > 192.168.37.100.4840: UDP, length 1109
 00:00:00.002937 IP 192.168.37.101.4840 > 192.168.37.100.4840: UDP, length 1109
 00:00:00.004163 IP 192.168.37.101.4840 > 192.168.37.100.4840: UDP, length 1109
 00:00:00.002946 IP 192.168.37.101.4840 > 192.168.37.100.4840: UDP, length 1109
 00:00:00.005882 IP 192.168.37.101.4840 > 192.168.37.100.4840: UDP, length 1109
 00:00:00.002933 IP 192.168.37.101.4840 > 192.168.37.100.4840: UDP, length 1109
 00:00:00.007109 IP 192.168.37.101.4840 > 192.168.37.100.4840: UDP, length 1109
 00:00:00.001959 IP 192.168.37.101.4840 > 192.168.37.100.4840: UDP, length 1109
 00:00:00.002936 IP 192.168.37.101.4840 > 192.168.37.100.4840: UDP, length 1109
 00:00:00.001226 IP 192.168.37.101.4840 > 192.168.37.100.4840: UDP, length 1109
 00:00:00.002944 IP 192.168.37.101.4840 > 192.168.37.100.4840: UDP, length 1109
 00:00:00.002939 IP 192.168.37.101.4840 > 192.168.37.100.4840: UDP, length 1109
 00:00:00.002946 IP 192.168.37.101.4840 > 192.168.37.100.4840: UDP, length 1109
 00:00:00.003175 IP 192.168.37.101.4840 > 192.168.37.100.4840: UDP, length 1109
 00:00:00.002945 IP 192.168.37.101.4840 > 192.168.37.100.4840: UDP, length 1109
 00:00:00.005883 IP 192.168.37.101.4840 > 192.168.37.100.4840: UDP, length 1109
 00:00:00.005138 IP 192.168.37.101.4840 > 192.168.37.100.4840: UDP, length 1109
 00:00:00.002942 IP 192.168.37.101.4840 > 192.168.37.100.4840: UDP, length 1109
 00:00:00.000980 IP 192.168.37.101.4840 > 192.168.37.100.4840: UDP, length 1109
 00:00:00.001962 IP 192.168.37.101.4840 > 192.168.37.100.4840: UDP, length 1109
 00:00:00.001955 IP 192.168.37.101.4840 > 192.168.37.100.4840: UDP, length 1109
 00:00:00.003184 IP 192.168.37.101.4840 > 192.168.37.100.4840: UDP, length 1109
 00:00:00.002945 IP 192.168.37.101.4840 > 192.168.37.100.4840: UDP, length 1109
 00:00:00.002940 IP 192.168.37.101.4840 > 192.168.37.100.4840: UDP, length 1109
 00:00:00.001474 IP 192.168.37.101.4840 > 192.168.37.100.4840: UDP, length 1109
 00:00:00.002442 IP 192.168.37.101.4840 > 192.168.37.100.4840: UDP, length 1109
 00:00:00.006127 IP 192.168.37.101.4840 > 192.168.37.100.4840: UDP, length 1109
 00:00:00.000982 IP 192.168.37.101.4840 > 192.168.37.100.4840: UDP, length 1109
 00:00:00.002937 IP 192.168.37.101.4840 > 192.168.37.100.4840: UDP, length 1109
 00:00:00.001224 IP 192.168.37.101.4840 > 192.168.37.100.4840: UDP, length 1109
 00:00:00.002943 IP 192.168.37.101.4840 > 192.168.37.100.4840: UDP, length 1109
 00:00:00.004408 IP 192.168.37.101.4840 > 192.168.37.100.4840: UDP, length 1109
 00:00:00.002455 IP 192.168.37.101.4840 > 192.168.37.100.4840: UDP, length 1109
 00:00:00.004160 IP 192.168.37.101.4840 > 192.168.37.100.4840: UDP, length 1109
 00:00:00.002943 IP 192.168.37.101.4840 > 192.168.37.100.4840: UDP, length 1109
 00:00:00.005883 IP 192.168.37.101.4840 > 192.168.37.100.4840: UDP, length 1109
 00:00:00.000974 IP 192.168.37.101.4840 > 192.168.37.100.4840: UDP, length 1109
 00:00:00.004166 IP 192.168.37.101.4840 > 192.168.37.100.4840: UDP, length 1109
 00:00:00.001960 IP 192.168.37.101.4840 > 192.168.37.100.4840: UDP, length 1109
 00:00:00.000981 IP 192.168.37.101.4840 > 192.168.37.100.4840: UDP, length 1109
 00:00:00.002936 IP 192.168.37.101.4840 > 192.168.37.100.4840: UDP, length 1109
 00:00:00.001233 IP 192.168.37.101.4840 > 192.168.37.100.4840: UDP, length 1109
 00:00:00.001708 IP 192.168.37.101.4840 > 192.168.37.100.4840: UDP, length 1109
 00:00:00.000984 IP 192.168.37.101.4840 > 192.168.37.100.4840: UDP, length 1109
 00:00:00.003178 IP 192.168.37.101.4840 > 192.168.37.100.4840: UDP, length 1109
 00:00:00.001236 IP 192.168.37.101.4840 > 192.168.37.100.4840: UDP, length 1109
 00:00:00.001707 IP 192.168.37.101.4840 > 192.168.37.100.4840: UDP, length 1109
 00:00:00.002940 IP 192.168.37.101.4840 > 192.168.37.100.4840: UDP, length 1109
 00:00:00.002944 IP 192.168.37.101.4840 > 192.168.37.100.4840: UDP, length 1109
 00:00:00.000980 IP 192.168.37.101.4840 > 192.168.37.100.4840: UDP, length 1109
 00:00:00.001964 IP 192.168.37.101.4840 > 192.168.37.100.4840: UDP, length 1109
 00:00:00.001217 IP 192.168.37.101.4840 > 192.168.37.100.4840: UDP, length 1109
 00:00:00.004912 IP 192.168.37.101.4840 > 192.168.37.100.4840: UDP, length 1109
 00:00:00.001210 IP 192.168.37.101.4840 > 192.168.37.100.4840: UDP, length 1109
 00:00:00.002944 IP 192.168.37.101.4840 > 192.168.37.100.4840: UDP, length 1109
 00:00:00.002694 IP 192.168.37.101.4840 > 192.168.37.100.4840: UDP, length 1109
 00:00:00.001223 IP 192.168.37.101.4840 > 192.168.37.100.4840: UDP, length 1109
 00:00:00.002944 IP 192.168.37.101.4840 > 192.168.37.100.4840: UDP, length 1109
 00:00:00.003921 IP 192.168.37.101.4840 > 192.168.37.100.4840: UDP, length 1109
 00:00:00.003181 IP 192.168.37.101.4840 > 192.168.37.100.4840: UDP, length 1109
 00:00:00.003924 IP 192.168.37.101.4840 > 192.168.37.100.4840: UDP, length 1109
 00:00:00.002941 IP 192.168.37.101.4840 > 192.168.37.100.4840: UDP, length 1109
 00:00:00.003923 IP 192.168.37.101.4840 > 192.168.37.100.4840: UDP, length 1109
 00:00:00.003176 IP 192.168.37.101.4840 > 192.168.37.100.4840: UDP, length 1109
 00:00:00.000980 IP 192.168.37.101.4840 > 192.168.37.100.4840: UDP, length 1109
 00:00:00.005392 IP 192.168.37.101.4840 > 192.168.37.100.4840: UDP, length 1109
 00:00:00.001479 IP 192.168.37.101.4840 > 192.168.37.100.4840: UDP, length 1109
 00:00:00.001216 IP 192.168.37.101.4840 > 192.168.37.100.4840: UDP, length 1109
 00:00:00.002940 IP 192.168.37.101.4840 > 192.168.37.100.4840: UDP, length 1109
 00:00:00.002944 IP 192.168.37.101.4840 > 192.168.37.100.4840: UDP, length 1109
 00:00:00.000986 IP 192.168.37.101.4840 > 192.168.37.100.4840: UDP, length 1109
 00:00:00.001953 IP 192.168.37.101.4840 > 192.168.37.100.4840: UDP, length 1109
 00:00:00.004162 IP 192.168.37.101.4840 > 192.168.37.100.4840: UDP, length 1109
 00:00:00.002942 IP 192.168.37.101.4840 > 192.168.37.100.4840: UDP, length 1109
 00:00:00.002947 IP 192.168.37.101.4840 > 192.168.37.100.4840: UDP, length 1109
 00:00:00.003919 IP 192.168.37.101.4840 > 192.168.37.100.4840: UDP, length 1109
 00:00:00.003175 IP 192.168.37.101.4840 > 192.168.37.100.4840: UDP, length 1109
 00:00:00.001226 IP 192.168.37.101.4840 > 192.168.37.100.4840: UDP, length 1109
 00:00:00.002701 IP 192.168.37.101.4840 > 192.168.37.100.4840: UDP, length 1109
 00:00:00.007102 IP 192.168.37.101.4840 > 192.168.37.100.4840: UDP, length 1109
 00:00:00.002938 IP 192.168.37.101.4840 > 192.168.37.100.4840: UDP, length 1109
 00:00:00.003926 IP 192.168.37.101.4840 > 192.168.37.100.4840: UDP, length 1109
 00:00:00.002932 IP 192.168.37.101.4840 > 192.168.37.100.4840: UDP, length 1109
 00:00:00.004169 IP 192.168.37.101.4840 > 192.168.37.100.4840: UDP, length 1109
 00:00:00.003920 IP 192.168.37.101.4840 > 192.168.37.100.4840: UDP, length 1109
 00:00:00.002934 IP 192.168.37.101.4840 > 192.168.37.100.4840: UDP, length 1109
 00:00:00.004168 IP 192.168.37.101.4840 > 192.168.37.100.4840: UDP, length 1109
 00:00:00.003917 IP 192.168.37.101.4840 > 192.168.37.100.4840: UDP, length 1109
 00:00:00.003193 IP 192.168.37.101.4840 > 192.168.37.100.4840: UDP, length 1109
 00:00:00.003669 IP 192.168.37.101.4840 > 192.168.37.100.4840: UDP, length 1109
 00:00:00.002945 IP 192.168.37.101.4840 > 192.168.37.100.4840: UDP, length 1109
 00:00:00.001216 IP 192.168.37.101.4840 > 192.168.37.100.4840: UDP, length 1109
 00:00:00.001962 IP 192.168.37.101.4840 > 192.168.37.100.4840: UDP, length 1109
 00:00:00.001231 IP 192.168.37.101.4840 > 192.168.37.100.4840: UDP, length 1109
 00:00:00.003674 IP 192.168.37.101.4840 > 192.168.37.100.4840: UDP, length 1109
 00:00:00.003922 IP 192.168.37.101.4840 > 192.168.37.100.4840: UDP, length 1109
 00:00:00.003179 IP 192.168.37.101.4840 > 192.168.37.100.4840: UDP, length 1109
 00:00:00.003923 IP 192.168.37.101.4840 > 192.168.37.100.4840: UDP, length 1109
 00:00:00.003184 IP 192.168.37.101.4840 > 192.168.37.100.4840: UDP, length 1109
 00:00:00.003918 IP 192.168.37.101.4840 > 192.168.37.100.4840: UDP, length 1109
 00:00:00.003194 IP 192.168.37.101.4840 > 192.168.37.100.4840: UDP, length 1109
 00:00:00.000728 IP 192.168.37.101.4840 > 192.168.37.100.4840: UDP, length 1109
 00:00:00.001960 IP 192.168.37.101.4840 > 192.168.37.100.4840: UDP, length 1109
 00:00:00.000981 IP 192.168.37.101.4840 > 192.168.37.100.4840: UDP, length 1109
 00:00:00.004162 IP 192.168.37.101.4840 > 192.168.37.100.4840: UDP, length 1109
 00:00:00.002943 IP 192.168.37.101.4840 > 192.168.37.100.4840: UDP, length 1109
 00:00:00.000996 IP 192.168.37.101.4840 > 192.168.37.100.4840: UDP, length 1109
 00:00:00.003175 IP 192.168.37.101.4840 > 192.168.37.100.4840: UDP, length 1109
 00:00:00.000980 IP 192.168.37.101.4840 > 192.168.37.100.4840: UDP, length 1109
 00:00:00.002932 IP 192.168.37.101.4840 > 192.168.37.100.4840: UDP, length 1109
 00:00:00.002941 IP 192.168.37.101.4840 > 192.168.37.100.4840: UDP, length 1109
 00:00:00.004165 IP 192.168.37.101.4840 > 192.168.37.100.4840: UDP, length 1109
 00:00:00.002694 IP 192.168.37.101.4840 > 192.168.37.100.4840: UDP, length 1109
 00:00:00.000979 IP 192.168.37.101.4840 > 192.168.37.100.4840: UDP, length 1109
 00:00:00.002944 IP 192.168.37.101.4840 > 192.168.37.100.4840: UDP, length 1109
 00:00:00.001956 IP 192.168.37.101.4840 > 192.168.37.100.4840: UDP, length 1109
 00:00:00.002457 IP 192.168.37.101.4840 > 192.168.37.100.4840: UDP, length 1109
 00:00:00.002690 IP 192.168.37.101.4840 > 192.168.37.100.4840: UDP, length 1109
 00:00:00.001468 IP 192.168.37.101.4840 > 192.168.37.100.4840: UDP, length 1109
 00:00:00.002691 IP 192.168.37.101.4840 > 192.168.37.100.4840: UDP, length 1109
 00:00:00.000981 IP 192.168.37.101.4840 > 192.168.37.100.4840: UDP, length 1109
 00:00:00.001726 IP 192.168.37.101.4840 > 192.168.37.100.4840: UDP, length 1109
 00:00:00.001219 IP 192.168.37.101.4840 > 192.168.37.100.4840: UDP, length 1109
 00:00:00.002938 IP 192.168.37.101.4840 > 192.168.37.100.4840: UDP, length 1109
 00:00:00.004163 IP 192.168.37.101.4840 > 192.168.37.100.4840: UDP, length 1109
 00:00:00.002942 IP 192.168.37.101.4840 > 192.168.37.100.4840: UDP, length 1109
 00:00:00.000981 IP 192.168.37.101.4840 > 192.168.37.100.4840: UDP, length 1109
 00:00:00.002946 IP 192.168.37.101.4840 > 192.168.37.100.4840: UDP, length 1109
 00:00:00.001467 IP 192.168.37.101.4840 > 192.168.37.100.4840: UDP, length 1109
 00:00:00.002690 IP 192.168.37.101.4840 > 192.168.37.100.4840: UDP, length 1109
 00:00:00.002703 IP 192.168.37.101.4840 > 192.168.37.100.4840: UDP, length 1109
 00:00:00.001217 IP 192.168.37.101.4840 > 192.168.37.100.4840: UDP, length 1109
 00:00:00.000994 IP 192.168.37.101.4840 > 192.168.37.100.4840: UDP, length 1109
 00:00:00.001952 IP 192.168.37.101.4840 > 192.168.37.100.4840: UDP, length 1109
 00:00:00.000982 IP 192.168.37.101.4840 > 192.168.37.100.4840: UDP, length 1109
 00:00:00.001960 IP 192.168.37.101.4840 > 192.168.37.100.4840: UDP, length 1109
 00:00:00.000984 IP 192.168.37.101.4840 > 192.168.37.100.4840: UDP, length 1109
 00:00:00.004155 IP 192.168.37.101.4840 > 192.168.37.100.4840: UDP, length 1109
 00:00:00.002943 IP 192.168.37.101.4840 > 192.168.37.100.4840: UDP, length 1109
 00:00:00.000975 IP 192.168.37.101.4840 > 192.168.37.100.4840: UDP, length 1109
 00:00:00.002209 IP 192.168.37.101.4840 > 192.168.37.100.4840: UDP, length 1109
 00:00:00.000981 IP 192.168.37.101.4840 > 192.168.37.100.4840: UDP, length 1109
 00:00:00.003916 IP 192.168.37.101.4840 > 192.168.37.100.4840: UDP, length 1109
 00:00:00.002939 IP 192.168.37.101.4840 > 192.168.37.100.4840: UDP, length 1109
 00:00:00.004171 IP 192.168.37.101.4840 > 192.168.37.100.4840: UDP, length 1109
 00:00:00.003674 IP 192.168.37.101.4840 > 192.168.37.100.4840: UDP, length 1109
 00:00:00.003189 IP 192.168.37.101.4840 > 192.168.37.100.4840: UDP, length 1109
 00:00:00.000968 IP 192.168.37.101.4840 > 192.168.37.100.4840: UDP, length 1109
 00:00:00.001961 IP 192.168.37.101.4840 > 192.168.37.100.4840: UDP, length 1109
 00:00:00.004905 IP 192.168.37.101.4840 > 192.168.37.100.4840: UDP, length 1109
 00:00:00.003925 IP 192.168.37.101.4840 > 192.168.37.100.4840: UDP, length 1109
 00:00:00.001957 IP 192.168.37.101.4840 > 192.168.37.100.4840: UDP, length 1109
 00:00:00.001218 IP 192.168.37.101.4840 > 192.168.37.100.4840: UDP, length 1109
 00:00:00.001231 IP 192.168.37.101.4840 > 192.168.37.100.4840: UDP, length 1109
 00:00:00.000731 IP 192.168.37.101.4840 > 192.168.37.100.4840: UDP, length 1109
 00:00:00.001960 IP 192.168.37.101.4840 > 192.168.37.100.4840: UDP, length 1109
 00:00:00.002944 IP 192.168.37.101.4840 > 192.168.37.100.4840: UDP, length 1109
 00:00:00.000980 IP 192.168.37.101.4840 > 192.168.37.100.4840: UDP, length 1109
 00:00:00.004413 IP 192.168.37.101.4840 > 192.168.37.100.4840: UDP, length 1109
 00:00:00.002688 IP 192.168.37.101.4840 > 192.168.37.100.4840: UDP, length 1109
 00:00:00.002943 IP 192.168.37.101.4840 > 192.168.37.100.4840: UDP, length 1109
 00:00:00.000981 IP 192.168.37.101.4840 > 192.168.37.100.4840: UDP, length 1109
 00:00:00.003181 IP 192.168.37.101.4840 > 192.168.37.100.4840: UDP, length 1109
 00:00:00.004899 IP 192.168.37.101.4840 > 192.168.37.100.4840: UDP, length 1109
 00:00:00.001715 IP 192.168.37.101.4840 > 192.168.37.100.4840: UDP, length 1109
 00:00:00.001228 IP 192.168.37.101.4840 > 192.168.37.100.4840: UDP, length 1109
 00:00:00.002941 IP 192.168.37.101.4840 > 192.168.37.100.4840: UDP, length 1109
 00:00:00.002938 IP 192.168.37.101.4840 > 192.168.37.100.4840: UDP, length 1109
 00:00:00.002208 IP 192.168.37.101.4840 > 192.168.37.100.4840: UDP, length 1109
 00:00:00.000979 IP 192.168.37.101.4840 > 192.168.37.100.4840: UDP, length 1109
 00:00:00.002942 IP 192.168.37.101.4840 > 192.168.37.100.4840: UDP, length 1109
 00:00:00.002943 IP 192.168.37.101.4840 > 192.168.37.100.4840: UDP, length 1109
 00:00:00.003179 IP 192.168.37.101.4840 > 192.168.37.100.4840: UDP, length 1109
 00:00:00.003432 IP 192.168.37.101.4840 > 192.168.37.100.4840: UDP, length 1109
 00:00:00.001471 IP 192.168.37.101.4840 > 192.168.37.100.4840: UDP, length 1109
 00:00:00.002942 IP 192.168.37.101.4840 > 192.168.37.100.4840: UDP, length 1109
 00:00:00.002936 IP 192.168.37.101.4840 > 192.168.37.100.4840: UDP, length 1109
 00:00:00.003185 IP 192.168.37.101.4840 > 192.168.37.100.4840: UDP, length 1109
 00:00:00.001712 IP 192.168.37.101.4840 > 192.168.37.100.4840: UDP, length 1109
 00:00:00.001230 IP 192.168.37.101.4840 > 192.168.37.100.4840: UDP, length 1109
 00:00:00.002942 IP 192.168.37.101.4840 > 192.168.37.100.4840: UDP, length 1109
 00:00:00.002935 IP 192.168.37.101.4840 > 192.168.37.100.4840: UDP, length 1109
 00:00:00.003186 IP 192.168.37.101.4840 > 192.168.37.100.4840: UDP, length 1109
 00:00:00.002942 IP 192.168.37.101.4840 > 192.168.37.100.4840: UDP, length 1109
 00:00:00.002937 IP 192.168.37.101.4840 > 192.168.37.100.4840: UDP, length 1109
 00:00:00.002942 IP 192.168.37.101.4840 > 192.168.37.100.4840: UDP, length 1109
 00:00:00.003433 IP 192.168.37.101.4840 > 192.168.37.100.4840: UDP, length 1109
 00:00:00.001708 IP 192.168.37.101.4840 > 192.168.37.100.4840: UDP, length 1109
 00:00:00.000981 IP 192.168.37.101.4840 > 192.168.37.100.4840: UDP, length 1109
 00:00:00.003433 IP 192.168.37.101.4840 > 192.168.37.100.4840: UDP, length 1109
 00:00:00.001469 IP 192.168.37.101.4840 > 192.168.37.100.4840: UDP, length 1109
 00:00:00.002941 IP 192.168.37.101.4840 > 192.168.37.100.4840: UDP, length 1109
 00:00:00.001713 IP 192.168.37.101.4840 > 192.168.37.100.4840: UDP, length 1109
 00:00:00.001473 IP 192.168.37.101.4840 > 192.168.37.100.4840: UDP, length 1109
 00:00:00.003179 IP 192.168.37.101.4840 > 192.168.37.100.4840: UDP, length 1109
 00:00:00.004664 IP 192.168.37.101.4840 > 192.168.37.100.4840: UDP, length 1109
 00:00:00.003177 IP 192.168.37.101.4840 > 192.168.37.100.4840: UDP, length 1109
 00:00:00.002946 IP 192.168.37.101.4840 > 192.168.37.100.4840: UDP, length 1109
 00:00:00.002940 IP 192.168.37.101.4840 > 192.168.37.100.4840: UDP, length 1109
 00:00:00.002941 IP 192.168.37.101.4840 > 192.168.37.100.4840: UDP, length 1109
 00:00:00.002934 IP 192.168.37.101.4840 > 192.168.37.100.4840: UDP, length 1109
 00:00:00.002206 IP 192.168.37.101.4840 > 192.168.37.100.4840: UDP, length 1109
 00:00:00.000980 IP 192.168.37.101.4840 > 192.168.37.100.4840: UDP, length 1109
 00:00:00.002942 IP 192.168.37.101.4840 > 192.168.37.100.4840: UDP, length 1109
 00:00:00.002938 IP 192.168.37.101.4840 > 192.168.37.100.4840: UDP, length 1109
 00:00:00.003183 IP 192.168.37.101.4840 > 192.168.37.100.4840: UDP, length 1109
 00:00:00.002944 IP 192.168.37.101.4840 > 192.168.37.100.4840: UDP, length 1109
 00:00:00.001960 IP 192.168.37.101.4840 > 192.168.37.100.4840: UDP, length 1109
 00:00:00.001474 IP 192.168.37.101.4840 > 192.168.37.100.4840: UDP, length 1109
 00:00:00.001464 IP 192.168.37.101.4840 > 192.168.37.100.4840: UDP, length 1109
 00:00:00.003185 IP 192.168.37.101.4840 > 192.168.37.100.4840: UDP, length 1109
 00:00:00.002949 IP 192.168.37.101.4840 > 192.168.37.100.4840: UDP, length 1109
 00:00:00.002936 IP 192.168.37.101.4840 > 192.168.37.100.4840: UDP, length 1109
 00:00:00.000975 IP 192.168.37.101.4840 > 192.168.37.100.4840: UDP, length 1109
 00:00:00.003183 IP 192.168.37.101.4840 > 192.168.37.100.4840: UDP, length 1109
 00:00:00.003924 IP 192.168.37.101.4840 > 192.168.37.100.4840: UDP, length 1109
 00:00:00.004410 IP 192.168.37.101.4840 > 192.168.37.100.4840: UDP, length 1109
 00:00:00.002692 IP 192.168.37.101.4840 > 192.168.37.100.4840: UDP, length 1109
 00:00:00.003924 IP 192.168.37.101.4840 > 192.168.37.100.4840: UDP, length 1109
 00:00:00.002940 IP 192.168.37.101.4840 > 192.168.37.100.4840: UDP, length 1109
 00:00:00.001471 IP 192.168.37.101.4840 > 192.168.37.100.4840: UDP, length 1109
 00:00:00.002690 IP 192.168.37.101.4840 > 192.168.37.100.4840: UDP, length 1109
 00:00:00.002946 IP 192.168.37.101.4840 > 192.168.37.100.4840: UDP, length 1109
 00:00:00.000976 IP 192.168.37.101.4840 > 192.168.37.100.4840: UDP, length 1109
 00:00:00.002941 IP 192.168.37.101.4840 > 192.168.37.100.4840: UDP, length 1109
 00:00:00.001472 IP 192.168.37.101.4840 > 192.168.37.100.4840: UDP, length 1109
 00:00:00.002445 IP 192.168.37.101.4840 > 192.168.37.100.4840: UDP, length 1109
 00:00:00.004167 IP 192.168.37.101.4840 > 192.168.37.100.4840: UDP, length 1109
 00:00:00.002941 IP 192.168.37.101.4840 > 192.168.37.100.4840: UDP, length 1109
 00:00:00.000982 IP 192.168.37.101.4840 > 192.168.37.100.4840: UDP, length 1109
 00:00:00.002935 IP 192.168.37.101.4840 > 192.168.37.100.4840: UDP, length 1109
 00:00:00.004167 IP 192.168.37.101.4840 > 192.168.37.100.4840: UDP, length 1109
 00:00:00.002940 IP 192.168.37.101.4840 > 192.168.37.100.4840: UDP, length 1109
 00:00:00.003919 IP 192.168.37.101.4840 > 192.168.37.100.4840: UDP, length 1109
 00:00:00.002942 IP 192.168.37.101.4840 > 192.168.37.100.4840: UDP, length 1109
 00:00:00.001218 IP 192.168.37.101.4840 > 192.168.37.100.4840: UDP, length 1109
 00:00:00.002941 IP 192.168.37.101.4840 > 192.168.37.100.4840: UDP, length 1109
 00:00:00.003924 IP 192.168.37.101.4840 > 192.168.37.100.4840: UDP, length 1109
 00:00:00.002943 IP 192.168.37.101.4840 > 192.168.37.100.4840: UDP, length 1109
 00:00:00.000977 IP 192.168.37.101.4840 > 192.168.37.100.4840: UDP, length 1109
 00:00:00.003183 IP 192.168.37.101.4840 > 192.168.37.100.4840: UDP, length 1109
 00:00:00.003918 IP 192.168.37.101.4840 > 192.168.37.100.4840: UDP, length 1109
 00:00:00.001965 IP 192.168.37.101.4840 > 192.168.37.100.4840: UDP, length 1109
 00:00:00.000980 IP 192.168.37.101.4840 > 192.168.37.100.4840: UDP, length 1109
 00:00:00.000978 IP 192.168.37.101.4840 > 192.168.37.100.4840: UDP, length 1109
 00:00:00.003183 IP 192.168.37.101.4840 > 192.168.37.100.4840: UDP, length 1109
 00:00:00.002938 IP 192.168.37.101.4840 > 192.168.37.100.4840: UDP, length 1109
 00:00:00.000984 IP 192.168.37.101.4840 > 192.168.37.100.4840: UDP, length 1109
 00:00:00.002941 IP 192.168.37.101.4840 > 192.168.37.100.4840: UDP, length 1109
 00:00:00.000982 IP 192.168.37.101.4840 > 192.168.37.100.4840: UDP, length 1109
 00:00:00.004896 IP 192.168.37.101.4840 > 192.168.37.100.4840: UDP, length 1109
 00:00:00.003186 IP 192.168.37.101.4840 > 192.168.37.100.4840: UDP, length 1109
 00:00:00.002940 IP 192.168.37.101.4840 > 192.168.37.100.4840: UDP, length 1109
 00:00:00.002944 IP 192.168.37.101.4840 > 192.168.37.100.4840: UDP, length 1109
 00:00:00.002935 IP 192.168.37.101.4840 > 192.168.37.100.4840: UDP, length 1109
 00:00:00.003187 IP 192.168.37.101.4840 > 192.168.37.100.4840: UDP, length 1109
 00:00:00.001960 IP 192.168.37.101.4840 > 192.168.37.100.4840: UDP, length 1109
 00:00:00.002942 IP 192.168.37.101.4840 > 192.168.37.100.4840: UDP, length 1109
 00:00:00.002935 IP 192.168.37.101.4840 > 192.168.37.100.4840: UDP, length 1109
 00:00:00.001718 IP 192.168.37.101.4840 > 192.168.37.100.4840: UDP, length 1109
 00:00:00.001467 IP 192.168.37.101.4840 > 192.168.37.100.4840: UDP, length 1109
 00:00:00.002943 IP 192.168.37.101.4840 > 192.168.37.100.4840: UDP, length 1109
 00:00:00.002935 IP 192.168.37.101.4840 > 192.168.37.100.4840: UDP, length 1109
 00:00:00.002941 IP 192.168.37.101.4840 > 192.168.37.100.4840: UDP, length 1109
 00:00:00.002940 IP 192.168.37.101.4840 > 192.168.37.100.4840: UDP, length 1109
 00:00:00.003189 IP 192.168.37.101.4840 > 192.168.37.100.4840: UDP, length 1109
 00:00:00.002692 IP 192.168.37.101.4840 > 192.168.37.100.4840: UDP, length 1109
 00:00:00.003184 IP 192.168.37.101.4840 > 192.168.37.100.4840: UDP, length 1109
 00:00:00.003188 IP 192.168.37.101.4840 > 192.168.37.100.4840: UDP, length 1109
 00:00:00.002940 IP 192.168.37.101.4840 > 192.168.37.100.4840: UDP, length 1109
 00:00:00.003184 IP 192.168.37.101.4840 > 192.168.37.100.4840: UDP, length 1109
 00:00:00.001713 IP 192.168.37.101.4840 > 192.168.37.100.4840: UDP, length 1109
 00:00:00.001227 IP 192.168.37.101.4840 > 192.168.37.100.4840: UDP, length 1109
 00:00:00.001962 IP 192.168.37.101.4840 > 192.168.37.100.4840: UDP, length 1109
 00:00:00.002943 IP 192.168.37.101.4840 > 192.168.37.100.4840: UDP, length 1109
 00:00:00.002932 IP 192.168.37.101.4840 > 192.168.37.100.4840: UDP, length 1109
 00:00:00.002942 IP 192.168.37.101.4840 > 192.168.37.100.4840: UDP, length 1109
 00:00:00.003188 IP 192.168.37.101.4840 > 192.168.37.100.4840: UDP, length 1109
 00:00:00.002942 IP 192.168.37.101.4840 > 192.168.37.100.4840: UDP, length 1109
 00:00:00.002933 IP 192.168.37.101.4840 > 192.168.37.100.4840: UDP, length 1109
 00:00:00.002942 IP 192.168.37.101.4840 > 192.168.37.100.4840: UDP, length 1109
 00:00:00.002945 IP 192.168.37.101.4840 > 192.168.37.100.4840: UDP, length 1109
 00:00:00.003180 IP 192.168.37.101.4840 > 192.168.37.100.4840: UDP, length 1109
 00:00:00.002941 IP 192.168.37.101.4840 > 192.168.37.100.4840: UDP, length 1109
 00:00:00.003187 IP 192.168.37.101.4840 > 192.168.37.100.4840: UDP, length 1109
 00:00:00.004689 IP 192.168.37.101.4840 > 192.168.37.100.4840: UDP, length 1109
 00:00:00.002924 IP 192.168.37.101.4840 > 192.168.37.100.4840: UDP, length 1109
 00:00:00.003183 IP 192.168.37.101.4840 > 192.168.37.100.4840: UDP, length 1109
 00:00:00.001715 IP 192.168.37.101.4840 > 192.168.37.100.4840: UDP, length 1109
 00:00:00.001227 IP 192.168.37.101.4840 > 192.168.37.100.4840: UDP, length 1109
 00:00:00.002944 IP 192.168.37.101.4840 > 192.168.37.100.4840: UDP, length 1109
 00:00:00.001952 IP 192.168.37.101.4840 > 192.168.37.100.4840: UDP, length 1109
 00:00:00.004170 IP 192.168.37.101.4840 > 192.168.37.100.4840: UDP, length 1109
 00:00:00.002940 IP 192.168.37.101.4840 > 192.168.37.100.4840: UDP, length 1109
 00:00:00.003923 IP 192.168.37.101.4840 > 192.168.37.100.4840: UDP, length 1109
 00:00:00.004163 IP 192.168.37.101.4840 > 192.168.37.100.4840: UDP, length 1109
 00:00:00.002937 IP 192.168.37.101.4840 > 192.168.37.100.4840: UDP, length 1109
 00:00:00.004159 IP 192.168.37.101.4840 > 192.168.37.100.4840: UDP, length 1109
 00:00:00.002943 IP 192.168.37.101.4840 > 192.168.37.100.4840: UDP, length 1109
 00:00:00.003924 IP 192.168.37.101.4840 > 192.168.37.100.4840: UDP, length 1109
 00:00:00.002938 IP 192.168.37.101.4840 > 192.168.37.100.4840: UDP, length 1109
 00:00:00.000980 IP 192.168.37.101.4840 > 192.168.37.100.4840: UDP, length 1109
 00:00:00.003183 IP 192.168.37.101.4840 > 192.168.37.100.4840: UDP, length 1109
 00:00:00.003918 IP 192.168.37.101.4840 > 192.168.37.100.4840: UDP, length 1109
 00:00:00.002946 IP 192.168.37.101.4840 > 192.168.37.100.4840: UDP, length 1109
 00:00:00.000979 IP 192.168.37.101.4840 > 192.168.37.100.4840: UDP, length 1109
 00:00:00.002943 IP 192.168.37.101.4840 > 192.168.37.100.4840: UDP, length 1109
 00:00:00.003178 IP 192.168.37.101.4840 > 192.168.37.100.4840: UDP, length 1109
 00:00:00.000983 IP 192.168.37.101.4840 > 192.168.37.100.4840: UDP, length 1109
 00:00:00.002941 IP 192.168.37.101.4840 > 192.168.37.100.4840: UDP, length 1109
 00:00:00.000980 IP 192.168.37.101.4840 > 192.168.37.100.4840: UDP, length 1109
 00:00:00.002936 IP 192.168.37.101.4840 > 192.168.37.100.4840: UDP, length 1109
 00:00:00.004167 IP 192.168.37.101.4840 > 192.168.37.100.4840: UDP, length 1109
 00:00:00.002942 IP 192.168.37.101.4840 > 192.168.37.100.4840: UDP, length 1109
 00:00:00.003939 IP 192.168.37.101.4840 > 192.168.37.100.4840: UDP, length 1109
 00:00:00.003164 IP 192.168.37.101.4840 > 192.168.37.100.4840: UDP, length 1109
 00:00:00.000979 IP 192.168.37.101.4840 > 192.168.37.100.4840: UDP, length 1109
 00:00:00.002967 IP 192.168.37.101.4840 > 192.168.37.100.4840: UDP, length 1109
 00:00:00.003162 IP 192.168.37.101.4840 > 192.168.37.100.4840: UDP, length 1109
 00:00:00.002942 IP 192.168.37.101.4840 > 192.168.37.100.4840: UDP, length 1109
 00:00:00.003913 IP 192.168.37.101.4840 > 192.168.37.100.4840: UDP, length 1109
 00:00:00.002937 IP 192.168.37.101.4840 > 192.168.37.100.4840: UDP, length 1109
 00:00:00.001231 IP 192.168.37.101.4840 > 192.168.37.100.4840: UDP, length 1109
 00:00:00.002959 IP 192.168.37.101.4840 > 192.168.37.100.4840: UDP, length 1109
 00:00:00.002918 IP 192.168.37.101.4840 > 192.168.37.100.4840: UDP, length 1109
 00:00:00.002942 IP 192.168.37.101.4840 > 192.168.37.100.4840: UDP, length 1109
 00:00:00.002944 IP 192.168.37.101.4840 > 192.168.37.100.4840: UDP, length 1109
 00:00:00.003923 IP 192.168.37.101.4840 > 192.168.37.100.4840: UDP, length 1109
 00:00:00.003176 IP 192.168.37.101.4840 > 192.168.37.100.4840: UDP, length 1109
 00:00:00.000982 IP 192.168.37.101.4840 > 192.168.37.100.4840: UDP, length 1109
 00:00:00.002942 IP 192.168.37.101.4840 > 192.168.37.100.4840: UDP, length 1109
 00:00:00.003924 IP 192.168.37.101.4840 > 192.168.37.100.4840: UDP, length 1109
 00:00:00.002932 IP 192.168.37.101.4840 > 192.168.37.100.4840: UDP, length 1109
 00:00:00.001223 IP 192.168.37.101.4840 > 192.168.37.100.4840: UDP, length 1109
 00:00:00.002945 IP 192.168.37.101.4840 > 192.168.37.100.4840: UDP, length 1109
 00:00:00.000981 IP 192.168.37.101.4840 > 192.168.37.100.4840: UDP, length 1109
 00:00:00.002945 IP 192.168.37.101.4840 > 192.168.37.100.4840: UDP, length 1109
 00:00:00.004156 IP 192.168.37.101.4840 > 192.168.37.100.4840: UDP, length 1109
 00:00:00.003924 IP 192.168.37.101.4840 > 192.168.37.100.4840: UDP, length 1109
 00:00:00.002946 IP 192.168.37.101.4840 > 192.168.37.100.4840: UDP, length 1109
 00:00:00.002931 IP 192.168.37.101.4840 > 192.168.37.100.4840: UDP, length 1109
 00:00:00.001232 IP 192.168.37.101.4840 > 192.168.37.100.4840: UDP, length 1109
 00:00:00.002936 IP 192.168.37.101.4840 > 192.168.37.100.4840: UDP, length 1109
 00:00:00.002942 IP 192.168.37.101.4840 > 192.168.37.100.4840: UDP, length 1109
 00:00:00.000982 IP 192.168.37.101.4840 > 192.168.37.100.4840: UDP, length 1109
 00:00:00.002936 IP 192.168.37.101.4840 > 192.168.37.100.4840: UDP, length 1109
 00:00:00.003184 IP 192.168.37.101.4840 > 192.168.37.100.4840: UDP, length 1109
 00:00:00.001221 IP 192.168.37.101.4840 > 192.168.37.100.4840: UDP, length 1109
 00:00:00.002702 IP 192.168.37.101.4840 > 192.168.37.100.4840: UDP, length 1109
 00:00:00.003918 IP 192.168.37.101.4840 > 192.168.37.100.4840: UDP, length 1109
 00:00:00.001959 IP 192.168.37.101.4840 > 192.168.37.100.4840: UDP, length 1109
 00:00:00.001225 IP 192.168.37.101.4840 > 192.168.37.100.4840: UDP, length 1109
 00:00:00.002942 IP 192.168.37.101.4840 > 192.168.37.100.4840: UDP, length 1109
 00:00:00.000983 IP 192.168.37.101.4840 > 192.168.37.100.4840: UDP, length 1109
 00:00:00.002933 IP 192.168.37.101.4840 > 192.168.37.100.4840: UDP, length 1109
 00:00:00.002942 IP 192.168.37.101.4840 > 192.168.37.100.4840: UDP, length 1109
 00:00:00.001226 IP 192.168.37.101.4840 > 192.168.37.100.4840: UDP, length 1109
 00:00:00.002941 IP 192.168.37.101.4840 > 192.168.37.100.4840: UDP, length 1109
 00:00:00.001474 IP 192.168.37.101.4840 > 192.168.37.100.4840: UDP, length 1109
 00:00:00.002442 IP 192.168.37.101.4840 > 192.168.37.100.4840: UDP, length 1109
 00:00:00.002943 IP 192.168.37.101.4840 > 192.168.37.100.4840: UDP, length 1109
 00:00:00.001464 IP 192.168.37.101.4840 > 192.168.37.100.4840: UDP, length 1109
 00:00:00.001720 IP 192.168.37.101.4840 > 192.168.37.100.4840: UDP, length 1109
 00:00:00.000985 IP 192.168.37.101.4840 > 192.168.37.100.4840: UDP, length 1109
 00:00:00.002933 IP 192.168.37.101.4840 > 192.168.37.100.4840: UDP, length 1109
 00:00:00.000740 IP 192.168.37.101.4840 > 192.168.37.100.4840: UDP, length 1109
 00:00:00.003186 IP 192.168.37.101.4840 > 192.168.37.100.4840: UDP, length 1109
 00:00:00.004166 IP 192.168.37.101.4840 > 192.168.37.100.4840: UDP, length 1109
 00:00:00.002932 IP 192.168.37.101.4840 > 192.168.37.100.4840: UDP, length 1109
 00:00:00.003922 IP 192.168.37.101.4840 > 192.168.37.100.4840: UDP, length 1109
 00:00:00.003188 IP 192.168.37.101.4840 > 192.168.37.100.4840: UDP, length 1109
 00:00:00.000981 IP 192.168.37.101.4840 > 192.168.37.100.4840: UDP, length 1109
 00:00:00.002935 IP 192.168.37.101.4840 > 192.168.37.100.4840: UDP, length 1109
 00:00:00.002940 IP 192.168.37.101.4840 > 192.168.37.100.4840: UDP, length 1109
 00:00:00.000983 IP 192.168.37.101.4840 > 192.168.37.100.4840: UDP, length 1109
 00:00:00.001960 IP 192.168.37.101.4840 > 192.168.37.100.4840: UDP, length 1109
 00:00:00.000984 IP 192.168.37.101.4840 > 192.168.37.100.4840: UDP, length 1109
 00:00:00.003914 IP 192.168.37.101.4840 > 192.168.37.100.4840: UDP, length 1109
 00:00:00.003187 IP 192.168.37.101.4840 > 192.168.37.100.4840: UDP, length 1109
 00:00:00.003922 IP 192.168.37.101.4840 > 192.168.37.100.4840: UDP, length 1109
 00:00:00.002941 IP 192.168.37.101.4840 > 192.168.37.100.4840: UDP, length 1109
 00:00:00.001464 IP 192.168.37.101.4840 > 192.168.37.100.4840: UDP, length 1109
 00:00:00.002696 IP 192.168.37.101.4840 > 192.168.37.100.4840: UDP, length 1109
 00:00:00.001712 IP 192.168.37.101.4840 > 192.168.37.100.4840: UDP, length 1109
 00:00:00.001231 IP 192.168.37.101.4840 > 192.168.37.100.4840: UDP, length 1109
 00:00:00.000981 IP 192.168.37.101.4840 > 192.168.37.100.4840: UDP, length 1109
 00:00:00.002934 IP 192.168.37.101.4840 > 192.168.37.100.4840: UDP, length 1109
 00:00:00.003188 IP 192.168.37.101.4840 > 192.168.37.100.4840: UDP, length 1109
 00:00:00.000981 IP 192.168.37.101.4840 > 192.168.37.100.4840: UDP, length 1109
 00:00:00.002939 IP 192.168.37.101.4840 > 192.168.37.100.4840: UDP, length 1109
 00:00:00.002942 IP 192.168.37.101.4840 > 192.168.37.100.4840: UDP, length 1109
 00:00:00.000974 IP 192.168.37.101.4840 > 192.168.37.100.4840: UDP, length 1109
 00:00:00.003188 IP 192.168.37.101.4840 > 192.168.37.100.4840: UDP, length 1109
 00:00:00.003922 IP 192.168.37.101.4840 > 192.168.37.100.4840: UDP, length 1109
 00:00:00.002935 IP 192.168.37.101.4840 > 192.168.37.100.4840: UDP, length 1109
 00:00:00.001962 IP 192.168.37.101.4840 > 192.168.37.100.4840: UDP, length 1109
 00:00:00.000981 IP 192.168.37.101.4840 > 192.168.37.100.4840: UDP, length 1109
 00:00:00.000977 IP 192.168.37.101.4840 > 192.168.37.100.4840: UDP, length 1109
 00:00:00.003189 IP 192.168.37.101.4840 > 192.168.37.100.4840: UDP, length 1109
 00:00:00.002694 IP 192.168.37.101.4840 > 192.168.37.100.4840: UDP, length 1109
 00:00:00.001221 IP 192.168.37.101.4840 > 192.168.37.100.4840: UDP, length 1109
 00:00:00.002941 IP 192.168.37.101.4840 > 192.168.37.100.4840: UDP, length 1109
 00:00:00.000978 IP 192.168.37.101.4840 > 192.168.37.100.4840: UDP, length 1109
 00:00:00.003193 IP 192.168.37.101.4840 > 192.168.37.100.4840: UDP, length 1109
 00:00:00.003913 IP 192.168.37.101.4840 > 192.168.37.100.4840: UDP, length 1109
 00:00:00.002943 IP 192.168.37.101.4840 > 192.168.37.100.4840: UDP, length 1109
 00:00:00.000975 IP 192.168.37.101.4840 > 192.168.37.100.4840: UDP, length 1109
 00:00:00.003190 IP 192.168.37.101.4840 > 192.168.37.100.4840: UDP, length 1109
 00:00:00.001469 IP 192.168.37.101.4840 > 192.168.37.100.4840: UDP, length 1109
 00:00:00.001226 IP 192.168.37.101.4840 > 192.168.37.100.4840: UDP, length 1109
 00:00:00.001225 IP 192.168.37.101.4840 > 192.168.37.100.4840: UDP, length 1109
 00:00:00.002937 IP 192.168.37.101.4840 > 192.168.37.100.4840: UDP, length 1109
 00:00:00.003191 IP 192.168.37.101.4840 > 192.168.37.100.4840: UDP, length 1109
 00:00:00.000731 IP 192.168.37.101.4840 > 192.168.37.100.4840: UDP, length 1109
 00:00:00.003186 IP 192.168.37.101.4840 > 192.168.37.100.4840: UDP, length 1109
 00:00:00.002699 IP 192.168.37.101.4840 > 192.168.37.100.4840: UDP, length 1109
 00:00:00.003177 IP 192.168.37.101.4840 > 192.168.37.100.4840: UDP, length 1109
 00:00:00.003924 IP 192.168.37.101.4840 > 192.168.37.100.4840: UDP, length 1109
 00:00:00.003184 IP 192.168.37.101.4840 > 192.168.37.100.4840: UDP, length 1109
 00:00:00.000740 IP 192.168.37.101.4840 > 192.168.37.100.4840: UDP, length 1109
 00:00:00.003177 IP 192.168.37.101.4840 > 192.168.37.100.4840: UDP, length 1109
 00:00:00.003924 IP 192.168.37.101.4840 > 192.168.37.100.4840: UDP, length 1109
 00:00:00.002944 IP 192.168.37.101.4840 > 192.168.37.100.4840: UDP, length 1109
 00:00:00.001468 IP 192.168.37.101.4840 > 192.168.37.100.4840: UDP, length 1109
 00:00:00.002689 IP 192.168.37.101.4840 > 192.168.37.100.4840: UDP, length 1109
 00:00:00.003930 IP 192.168.37.101.4840 > 192.168.37.100.4840: UDP, length 1109
 00:00:00.002932 IP 192.168.37.101.4840 > 192.168.37.100.4840: UDP, length 1109
 00:00:00.004167 IP 192.168.37.101.4840 > 192.168.37.100.4840: UDP, length 1109
 00:00:00.002942 IP 192.168.37.101.4840 > 192.168.37.100.4840: UDP, length 1109
 00:00:00.000982 IP 192.168.37.101.4840 > 192.168.37.100.4840: UDP, length 1109
 00:00:00.002941 IP 192.168.37.101.4840 > 192.168.37.100.4840: UDP, length 1109
 00:00:00.001461 IP 192.168.37.101.4840 > 192.168.37.100.4840: UDP, length 1109
 00:00:00.002700 IP 192.168.37.101.4840 > 192.168.37.100.4840: UDP, length 1109
 00:00:00.003920 IP 192.168.37.101.4840 > 192.168.37.100.4840: UDP, length 1109
 00:00:00.002936 IP 192.168.37.101.4840 > 192.168.37.100.4840: UDP, length 1109
 00:00:00.002942 IP 192.168.37.101.4840 > 192.168.37.100.4840: UDP, length 1109
 00:00:00.003188 IP 192.168.37.101.4840 > 192.168.37.100.4840: UDP, length 1109
 00:00:00.004904 IP 192.168.37.101.4840 > 192.168.37.100.4840: UDP, length 1109
 00:00:00.000973 IP 192.168.37.101.4840 > 192.168.37.100.4840: UDP, length 1109
 00:00:00.002939 IP 192.168.37.101.4840 > 192.168.37.100.4840: UDP, length 1109
 00:00:00.003188 IP 192.168.37.101.4840 > 192.168.37.100.4840: UDP, length 1109
 00:00:00.000982 IP 192.168.37.101.4840 > 192.168.37.100.4840: UDP, length 1109
 00:00:00.002941 IP 192.168.37.101.4840 > 192.168.37.100.4840: UDP, length 1109
 00:00:00.002946 IP 192.168.37.101.4840 > 192.168.37.100.4840: UDP, length 1109
 00:00:00.003175 IP 192.168.37.101.4840 > 192.168.37.100.4840: UDP, length 1109
 00:00:00.000981 IP 192.168.37.101.4840 > 192.168.37.100.4840: UDP, length 1109
 00:00:00.002943 IP 192.168.37.101.4840 > 192.168.37.100.4840: UDP, length 1109
 00:00:00.009062 IP 192.168.37.101.4840 > 192.168.37.100.4840: UDP, length 1109
 00:00:00.002940 IP 192.168.37.101.4840 > 192.168.37.100.4840: UDP, length 1109
 00:00:00.001475 IP 192.168.37.101.4840 > 192.168.37.100.4840: UDP, length 1109
 00:00:00.002441 IP 192.168.37.101.4840 > 192.168.37.100.4840: UDP, length 1109
 00:00:00.002944 IP 192.168.37.101.4840 > 192.168.37.100.4840: UDP, length 1109
 00:00:00.001714 IP 192.168.37.101.4840 > 192.168.37.100.4840: UDP, length 1109
 00:00:00.002451 IP 192.168.37.101.4840 > 192.168.37.100.4840: UDP, length 1109
 00:00:00.002936 IP 192.168.37.101.4840 > 192.168.37.100.4840: UDP, length 1109
 00:00:00.003923 IP 192.168.37.101.4840 > 192.168.37.100.4840: UDP, length 1109
