 00:00:00.000000 IP 192.168.37.101.4840 > 192.168.37.100.4840: UDP, length 1109
 00:00:00.003175 IP 192.168.37.101.4840 > 192.168.37.100.4840: UDP, length 1109
 00:00:00.001471 IP 192.168.37.101.4840 > 192.168.37.100.4840: UDP, length 1109
 00:00:00.001469 IP 192.168.37.101.4840 > 192.168.37.100.4840: UDP, length 1109
 00:00:00.000733 IP 192.168.37.101.4840 > 192.168.37.100.4840: UDP, length 1109
 00:00:00.002941 IP 192.168.37.101.4840 > 192.168.37.100.4840: UDP, length 1109
 00:00:00.001470 IP 192.168.37.101.4840 > 192.168.37.100.4840: UDP, length 1109
 00:00:00.001982 IP 192.168.37.101.4840 > 192.168.37.100.4840: UDP, length 1109
 00:00:00.000969 IP 192.168.37.101.4840 > 192.168.37.100.4840: UDP, length 1109
 00:00:00.002686 IP 192.168.37.101.4840 > 192.168.37.100.4840: UDP, length 1109
 00:00:00.001226 IP 192.168.37.101.4840 > 192.168.37.100.4840: UDP, length 1109
 00:00:00.001717 IP 192.168.37.101.4840 > 192.168.37.100.4840: UDP, length 1109
 00:00:00.001222 IP 192.168.37.101.4840 > 192.168.37.100.4840: UDP, length 1109
 00:00:00.000982 IP 192.168.37.101.4840 > 192.168.37.100.4840: UDP, length 1109
 00:00:00.001954 IP 192.168.37.101.4840 > 192.168.37.100.4840: UDP, length 1109
 00:00:00.002944 IP 192.168.37.101.4840 > 192.168.37.100.4840: UDP, length 1109
 00:00:00.000982 IP 192.168.37.101.4840 > 192.168.37.100.4840: UDP, length 1109
 00:00:00.001960 IP 192.168.37.101.4840 > 192.168.37.100.4840: UDP, length 1109
 00:00:00.001221 IP 192.168.37.101.4840 > 192.168.37.100.4840: UDP, length 1109
 00:00:00.000751 IP 192.168.37.101.4840 > 192.168.37.100.4840: UDP, length 1109
 00:00:00.002195 IP 192.168.37.101.4840 > 192.168.37.100.4840: UDP, length 1109
 00:00:00.000984 IP 192.168.37.101.4840 > 192.168.37.100.4840: UDP, length 1109
 00:00:00.001228 IP 192.168.37.101.4840 > 192.168.37.100.4840: UDP, length 1109
 00:00:00.001955 IP 192.168.37.101.4840 > 192.168.37.100.4840: UDP, length 1109
 00:00:00.000981 IP 192.168.37.101.4840 > 192.168.37.100.4840: UDP, length 1109
 00:00:00.001715 IP 192.168.37.101.4840 > 192.168.37.100.4840: UDP, length 1109
 00:00:00.000979 IP 192.168.37.101.4840 > 192.168.37.100.4840: UDP, length 1109
 00:00:00.001472 IP 192.168.37.101.4840 > 192.168.37.100.4840: UDP, length 1109
 00:00:00.001476 IP 192.168.37.101.4840 > 192.168.37.100.4840: UDP, length 1109
 00:00:00.001215 IP 192.168.37.101.4840 > 192.168.37.100.4840: UDP, length 1109
 00:00:00.003193 IP 192.168.37.101.4840 > 192.168.37.100.4840: UDP, length 1109
 00:00:00.000727 IP 192.168.37.101.4840 > 192.168.37.100.4840: UDP, length 1109
 00:00:00.001963 IP 192.168.37.101.4840 > 192.168.37.100.4840: UDP, length 1109
 00:00:00.000981 IP 192.168.37.101.4840 > 192.168.37.100.4840: UDP, length 1109
 00:00:00.003179 IP 192.168.37.101.4840 > 192.168.37.100.4840: UDP, length 1109
 00:00:00.000746 IP 192.168.37.101.4840 > 192.168.37.100.4840: UDP, length 1109
 00:00:00.002196 IP 192.168.37.101.4840 > 192.168.37.100.4840: UDP, length 1109
 00:00:00.000979 IP 192.168.37.101.4840 > 192.168.37.100.4840: UDP, length 1109
 00:00:00.002945 IP 192.168.37.101.4840 > 192.168.37.100.4840: UDP, length 1109
 00:00:00.002941 IP 192.168.37.101.4840 > 192.168.37.100.4840: UDP, length 1109
 00:00:00.000983 IP 192.168.37.101.4840 > 192.168.37.100.4840: UDP, length 1109
 00:00:00.001955 IP 192.168.37.101.4840 > 192.168.37.100.4840: UDP, length 1109
 00:00:00.002201 IP 192.168.37.101.4840 > 192.168.37.100.4840: UDP, length 1109
 00:00:00.000983 IP 192.168.37.101.4840 > 192.168.37.100.4840: UDP, length 1109
 00:00:00.002943 IP 192.168.37.101.4840 > 192.168.37.100.4840: UDP, length 1109
 00:00:00.002943 IP 192.168.37.101.4840 > 192.168.37.100.4840: UDP, length 1109
 00:00:00.000971 IP 192.168.37.101.4840 > 192.168.37.100.4840: UDP, length 1109
 00:00:00.003186 IP 192.168.37.101.4840 > 192.168.37.100.4840: UDP, length 1109
 00:00:00.000982 IP 192.168.37.101.4840 > 192.168.37.100.4840: UDP, length 1109
 00:00:00.001960 IP 192.168.37.101.4840 > 192.168.37.100.4840: UDP, length 1109
 00:00:00.000985 IP 192.168.37.101.4840 > 192.168.37.100.4840: UDP, length 1109
 00:00:00.001708 IP 192.168.37.101.4840 > 192.168.37.100.4840: UDP, length 1109
 00:00:00.001224 IP 192.168.37.101.4840 > 192.168.37.100.4840: UDP, length 1109
 00:00:00.001240 IP 192.168.37.101.4840 > 192.168.37.100.4840: UDP, length 1109
 00:00:00.002926 IP 192.168.37.101.4840 > 192.168.37.100.4840: UDP, length 1109
 00:00:00.000980 IP 192.168.37.101.4840 > 192.168.37.100.4840: UDP, length 1109
 00:00:00.002952 IP 192.168.37.101.4840 > 192.168.37.100.4840: UDP, length 1109
 00:00:00.000966 IP 192.168.37.101.4840 > 192.168.37.100.4840: UDP, length 1109
 00:00:00.003196 IP 192.168.37.101.4840 > 192.168.37.100.4840: UDP, length 1109
 00:00:00.000727 IP 192.168.37.101.4840 > 192.168.37.100.4840: UDP, length 1109
 00:00:00.002941 IP 192.168.37.101.4840 > 192.168.37.100.4840: UDP, length 1109
 00:00:00.003179 IP 192.168.37.101.4840 > 192.168.37.100.4840: UDP, length 1109
 00:00:00.000980 IP 192.168.37.101.4840 > 192.168.37.100.4840: UDP, length 1109
 00:00:00.002944 IP 192.168.37.101.4840 > 192.168.37.100.4840: UDP, length 1109
 00:00:00.000980 IP 192.168.37.101.4840 > 192.168.37.100.4840: UDP, length 1109
 00:00:00.001964 IP 192.168.37.101.4840 > 192.168.37.100.4840: UDP, length 1109
 00:00:00.001959 IP 192.168.37.101.4840 > 192.168.37.100.4840: UDP, length 1109
 00:00:00.001218 IP 192.168.37.101.4840 > 192.168.37.100.4840: UDP, length 1109
 00:00:00.000745 IP 192.168.37.101.4840 > 192.168.37.100.4840: UDP, length 1109
 00:00:00.002197 IP 192.168.37.101.4840 > 192.168.37.100.4840: UDP, length 1109
 00:00:00.000980 IP 192.168.37.101.4840 > 192.168.37.100.4840: UDP, length 1109
 00:00:00.002945 IP 192.168.37.101.4840 > 192.168.37.100.4840: UDP, length 1109
 00:00:00.000978 IP 192.168.37.101.4840 > 192.168.37.100.4840: UDP, length 1109
 00:00:00.001966 IP 192.168.37.101.4840 > 192.168.37.100.4840: UDP, length 1109
 00:00:00.000973 IP 192.168.37.101.4840 > 192.168.37.100.4840: UDP, length 1109
 00:00:00.003183 IP 192.168.37.101.4840 > 192.168.37.100.4840: UDP, length 1109
 00:00:00.000984 IP 192.168.37.101.4840 > 192.168.37.100.4840: UDP, length 1109
 00:00:00.002941 IP 192.168.37.101.4840 > 192.168.37.100.4840: UDP, length 1109
 00:00:00.002944 IP 192.168.37.101.4840 > 192.168.37.100.4840: UDP, length 1109
 00:00:00.001954 IP 192.168.37.101.4840 > 192.168.37.100.4840: UDP, length 1109
 00:00:00.001225 IP 192.168.37.101.4840 > 192.168.37.100.4840: UDP, length 1109
 00:00:00.002942 IP 192.168.37.101.4840 > 192.168.37.100.4840: UDP, length 1109
 00:00:00.000979 IP 192.168.37.101.4840 > 192.168.37.100.4840: UDP, length 1109
 00:00:00.001964 IP 192.168.37.101.4840 > 192.168.37.100.4840: UDP, length 1109
 00:00:00.000972 IP 192.168.37.101.4840 > 192.168.37.100.4840: UDP, length 1109
 00:00:00.003187 IP 192.168.37.101.4840 > 192.168.37.100.4840: UDP, length 1109
 00:00:00.000981 IP 192.168.37.101.4840 > 192.168.37.100.4840: UDP, length 1109
 00:00:00.001961 IP 192.168.37.101.4840 > 192.168.37.100.4840: UDP, length 1109
 00:00:00.000983 IP 192.168.37.101.4840 > 192.168.37.100.4840: UDP, length 1109
 00:00:00.002933 IP 192.168.37.101.4840 > 192.168.37.100.4840: UDP, length 1109
 00:00:00.000981 IP 192.168.37.101.4840 > 192.168.37.100.4840: UDP, length 1109
 00:00:00.001962 IP 192.168.37.101.4840 > 192.168.37.100.4840: UDP, length 1109
 00:00:00.001073 IP 192.168.37.101.4840 > 192.168.37.100.4840: UDP, length 1109
 00:00:00.001377 IP 192.168.37.101.4840 > 192.168.37.100.4840: UDP, length 1109
 00:00:00.001474 IP 192.168.37.101.4840 > 192.168.37.100.4840: UDP, length 1109
 00:00:00.001218 IP 192.168.37.101.4840 > 192.168.37.100.4840: UDP, length 1109
 00:00:00.001960 IP 192.168.37.101.4840 > 192.168.37.100.4840: UDP, length 1109
 00:00:00.000985 IP 192.168.37.101.4840 > 192.168.37.100.4840: UDP, length 1109
 00:00:00.002941 IP 192.168.37.101.4840 > 192.168.37.100.4840: UDP, length 1109
 00:00:00.000978 IP 192.168.37.101.4840 > 192.168.37.100.4840: UDP, length 1109
 00:00:00.002938 IP 192.168.37.101.4840 > 192.168.37.100.4840: UDP, length 1109
 00:00:00.002204 IP 192.168.37.101.4840 > 192.168.37.100.4840: UDP, length 1109
 00:00:00.002942 IP 192.168.37.101.4840 > 192.168.37.100.4840: UDP, length 1109
 00:00:00.000981 IP 192.168.37.101.4840 > 192.168.37.100.4840: UDP, length 1109
 00:00:00.001964 IP 192.168.37.101.4840 > 192.168.37.100.4840: UDP, length 1109
 00:00:00.000973 IP 192.168.37.101.4840 > 192.168.37.100.4840: UDP, length 1109
 00:00:00.000982 IP 192.168.37.101.4840 > 192.168.37.100.4840: UDP, length 1109
 00:00:00.002204 IP 192.168.37.101.4840 > 192.168.37.100.4840: UDP, length 1109
 00:00:00.000980 IP 192.168.37.101.4840 > 192.168.37.100.4840: UDP, length 1109
 00:00:00.001962 IP 192.168.37.101.4840 > 192.168.37.100.4840: UDP, length 1109
 00:00:00.001968 IP 192.168.37.101.4840 > 192.168.37.100.4840: UDP, length 1109
 00:00:00.000980 IP 192.168.37.101.4840 > 192.168.37.100.4840: UDP, length 1109
 00:00:00.002939 IP 192.168.37.101.4840 > 192.168.37.100.4840: UDP, length 1109
 00:00:00.001228 IP 192.168.37.101.4840 > 192.168.37.100.4840: UDP, length 1109
 00:00:00.001957 IP 192.168.37.101.4840 > 192.168.37.100.4840: UDP, length 1109
 00:00:00.000985 IP 192.168.37.101.4840 > 192.168.37.100.4840: UDP, length 1109
 00:00:00.001466 IP 192.168.37.101.4840 > 192.168.37.100.4840: UDP, length 1109
 00:00:00.001468 IP 192.168.37.101.4840 > 192.168.37.100.4840: UDP, length 1109
 00:00:00.000739 IP 192.168.37.101.4840 > 192.168.37.100.4840: UDP, length 1109
 00:00:00.002198 IP 192.168.37.101.4840 > 192.168.37.100.4840: UDP, length 1109
 00:00:00.000983 IP 192.168.37.101.4840 > 192.168.37.100.4840: UDP, length 1109
 00:00:00.002943 IP 192.168.37.101.4840 > 192.168.37.100.4840: UDP, length 1109
 00:00:00.000980 IP 192.168.37.101.4840 > 192.168.37.100.4840: UDP, length 1109
 00:00:00.002946 IP 192.168.37.101.4840 > 192.168.37.100.4840: UDP, length 1109
 00:00:00.000974 IP 192.168.37.101.4840 > 192.168.37.100.4840: UDP, length 1109
 00:00:00.002202 IP 192.168.37.101.4840 > 192.168.37.100.4840: UDP, length 1109
 00:00:00.000985 IP 192.168.37.101.4840 > 192.168.37.100.4840: UDP, length 1109
 00:00:00.001961 IP 192.168.37.101.4840 > 192.168.37.100.4840: UDP, length 1109
 00:00:00.000981 IP 192.168.37.101.4840 > 192.168.37.100.4840: UDP, length 1109
 00:00:00.002934 IP 192.168.37.101.4840 > 192.168.37.100.4840: UDP, length 1109
 00:00:00.000981 IP 192.168.37.101.4840 > 192.168.37.100.4840: UDP, length 1109
 00:00:00.002206 IP 192.168.37.101.4840 > 192.168.37.100.4840: UDP, length 1109
 00:00:00.000981 IP 192.168.37.101.4840 > 192.168.37.100.4840: UDP, length 1109
 00:00:00.000980 IP 192.168.37.101.4840 > 192.168.37.100.4840: UDP, length 1109
 00:00:00.001965 IP 192.168.37.101.4840 > 192.168.37.100.4840: UDP, length 1109
 00:00:00.000971 IP 192.168.37.101.4840 > 192.168.37.100.4840: UDP, length 1109
 00:00:00.002941 IP 192.168.37.101.4840 > 192.168.37.100.4840: UDP, length 1109
 00:00:00.001225 IP 192.168.37.101.4840 > 192.168.37.100.4840: UDP, length 1109
 00:00:00.002942 IP 192.168.37.101.4840 > 192.168.37.100.4840: UDP, length 1109
 00:00:00.000982 IP 192.168.37.101.4840 > 192.168.37.100.4840: UDP, length 1109
 00:00:00.001956 IP 192.168.37.101.4840 > 192.168.37.100.4840: UDP, length 1109
 00:00:00.000980 IP 192.168.37.101.4840 > 192.168.37.100.4840: UDP, length 1109
 00:00:00.001956 IP 192.168.37.101.4840 > 192.168.37.100.4840: UDP, length 1109
 00:00:00.001232 IP 192.168.37.101.4840 > 192.168.37.100.4840: UDP, length 1109
 00:00:00.000981 IP 192.168.37.101.4840 > 192.168.37.100.4840: UDP, length 1109
 00:00:00.001712 IP 192.168.37.101.4840 > 192.168.37.100.4840: UDP, length 1109
 00:00:00.000979 IP 192.168.37.101.4840 > 192.168.37.100.4840: UDP, length 1109
 00:00:00.003679 IP 192.168.37.101.4840 > 192.168.37.100.4840: UDP, length 1109
 00:00:00.001465 IP 192.168.37.101.4840 > 192.168.37.100.4840: UDP, length 1109
 00:00:00.000980 IP 192.168.37.101.4840 > 192.168.37.100.4840: UDP, length 1109
 00:00:00.003188 IP 192.168.37.101.4840 > 192.168.37.100.4840: UDP, length 1109
 00:00:00.000982 IP 192.168.37.101.4840 > 192.168.37.100.4840: UDP, length 1109
 00:00:00.001710 IP 192.168.37.101.4840 > 192.168.37.100.4840: UDP, length 1109
 00:00:00.000979 IP 192.168.37.101.4840 > 192.168.37.100.4840: UDP, length 1109
 00:00:00.001965 IP 192.168.37.101.4840 > 192.168.37.100.4840: UDP, length 1109
 00:00:00.001218 IP 192.168.37.101.4840 > 192.168.37.100.4840: UDP, length 1109
 00:00:00.003189 IP 192.168.37.101.4840 > 192.168.37.100.4840: UDP, length 1109
 00:00:00.000983 IP 192.168.37.101.4840 > 192.168.37.100.4840: UDP, length 1109
 00:00:00.002690 IP 192.168.37.101.4840 > 192.168.37.100.4840: UDP, length 1109
 00:00:00.001227 IP 192.168.37.101.4840 > 192.168.37.100.4840: UDP, length 1109
 00:00:00.001957 IP 192.168.37.101.4840 > 192.168.37.100.4840: UDP, length 1109
 00:00:00.000979 IP 192.168.37.101.4840 > 192.168.37.100.4840: UDP, length 1109
 00:00:00.002943 IP 192.168.37.101.4840 > 192.168.37.100.4840: UDP, length 1109
 00:00:00.000980 IP 192.168.37.101.4840 > 192.168.37.100.4840: UDP, length 1109
 00:00:00.001959 IP 192.168.37.101.4840 > 192.168.37.100.4840: UDP, length 1109
 00:00:00.000993 IP 192.168.37.101.4840 > 192.168.37.100.4840: UDP, length 1109
 00:00:00.001216 IP 192.168.37.101.4840 > 192.168.37.100.4840: UDP, length 1109
 00:00:00.001961 IP 192.168.37.101.4840 > 192.168.37.100.4840: UDP, length 1109
 00:00:00.000981 IP 192.168.37.101.4840 > 192.168.37.100.4840: UDP, length 1109
 00:00:00.002935 IP 192.168.37.101.4840 > 192.168.37.100.4840: UDP, length 1109
 00:00:00.002948 IP 192.168.37.101.4840 > 192.168.37.100.4840: UDP, length 1109
 00:00:00.000973 IP 192.168.37.101.4840 > 192.168.37.100.4840: UDP, length 1109
 00:00:00.002208 IP 192.168.37.101.4840 > 192.168.37.100.4840: UDP, length 1109
 00:00:00.000984 IP 192.168.37.101.4840 > 192.168.37.100.4840: UDP, length 1109
 00:00:00.000730 IP 192.168.37.101.4840 > 192.168.37.100.4840: UDP, length 1109
 00:00:00.002206 IP 192.168.37.101.4840 > 192.168.37.100.4840: UDP, length 1109
 00:00:00.000737 IP 192.168.37.101.4840 > 192.168.37.100.4840: UDP, length 1109
 00:00:00.001242 IP 192.168.37.101.4840 > 192.168.37.100.4840: UDP, length 1109
 00:00:00.002189 IP 192.168.37.101.4840 > 192.168.37.100.4840: UDP, length 1109
 00:00:00.000726 IP 192.168.37.101.4840 > 192.168.37.100.4840: UDP, length 1109
 00:00:00.001960 IP 192.168.37.101.4840 > 192.168.37.100.4840: UDP, length 1109
 00:00:00.000981 IP 192.168.37.101.4840 > 192.168.37.100.4840: UDP, length 1109
 00:00:00.003181 IP 192.168.37.101.4840 > 192.168.37.100.4840: UDP, length 1109
 00:00:00.000982 IP 192.168.37.101.4840 > 192.168.37.100.4840: UDP, length 1109
 00:00:00.002939 IP 192.168.37.101.4840 > 192.168.37.100.4840: UDP, length 1109
 00:00:00.000979 IP 192.168.37.101.4840 > 192.168.37.100.4840: UDP, length 1109
 00:00:00.001962 IP 192.168.37.101.4840 > 192.168.37.100.4840: UDP, length 1109
 00:00:00.000981 IP 192.168.37.101.4840 > 192.168.37.100.4840: UDP, length 1109
 00:00:00.001960 IP 192.168.37.101.4840 > 192.168.37.100.4840: UDP, length 1109
 00:00:00.000982 IP 192.168.37.101.4840 > 192.168.37.100.4840: UDP, length 1109
 00:00:00.001472 IP 192.168.37.101.4840 > 192.168.37.100.4840: UDP, length 1109
 00:00:00.001711 IP 192.168.37.101.4840 > 192.168.37.100.4840: UDP, length 1109
 00:00:00.000983 IP 192.168.37.101.4840 > 192.168.37.100.4840: UDP, length 1109
 00:00:00.002945 IP 192.168.37.101.4840 > 192.168.37.100.4840: UDP, length 1109
 00:00:00.000613 IP 192.168.37.101.4840 > 192.168.37.100.4840: UDP, length 1109
 00:00:00.002456 IP 192.168.37.101.4840 > 192.168.37.100.4840: UDP, length 1109
 00:00:00.000979 IP 192.168.37.101.4840 > 192.168.37.100.4840: UDP, length 1109
 00:00:00.001958 IP 192.168.37.101.4840 > 192.168.37.100.4840: UDP, length 1109
 00:00:00.000980 IP 192.168.37.101.4840 > 192.168.37.100.4840: UDP, length 1109
 00:00:00.003187 IP 192.168.37.101.4840 > 192.168.37.100.4840: UDP, length 1109
 00:00:00.000992 IP 192.168.37.101.4840 > 192.168.37.100.4840: UDP, length 1109
 00:00:00.002928 IP 192.168.37.101.4840 > 192.168.37.100.4840: UDP, length 1109
 00:00:00.002937 IP 192.168.37.101.4840 > 192.168.37.100.4840: UDP, length 1109
 00:00:00.000982 IP 192.168.37.101.4840 > 192.168.37.100.4840: UDP, length 1109
 00:00:00.001957 IP 192.168.37.101.4840 > 192.168.37.100.4840: UDP, length 1109
 00:00:00.001227 IP 192.168.37.101.4840 > 192.168.37.100.4840: UDP, length 1109
 00:00:00.002948 IP 192.168.37.101.4840 > 192.168.37.100.4840: UDP, length 1109
 00:00:00.000727 IP 192.168.37.101.4840 > 192.168.37.100.4840: UDP, length 1109
 00:00:00.003184 IP 192.168.37.101.4840 > 192.168.37.100.4840: UDP, length 1109
 00:00:00.002936 IP 192.168.37.101.4840 > 192.168.37.100.4840: UDP, length 1109
 00:00:00.001230 IP 192.168.37.101.4840 > 192.168.37.100.4840: UDP, length 1109
 00:00:00.001963 IP 192.168.37.101.4840 > 192.168.37.100.4840: UDP, length 1109
 00:00:00.000731 IP 192.168.37.101.4840 > 192.168.37.100.4840: UDP, length 1109
 00:00:00.000979 IP 192.168.37.101.4840 > 192.168.37.100.4840: UDP, length 1109
 00:00:00.001982 IP 192.168.37.101.4840 > 192.168.37.100.4840: UDP, length 1109
 00:00:00.002182 IP 192.168.37.101.4840 > 192.168.37.100.4840: UDP, length 1109
 00:00:00.000980 IP 192.168.37.101.4840 > 192.168.37.100.4840: UDP, length 1109
 00:00:00.002942 IP 192.168.37.101.4840 > 192.168.37.100.4840: UDP, length 1109
 00:00:00.000981 IP 192.168.37.101.4840 > 192.168.37.100.4840: UDP, length 1109
 00:00:00.001964 IP 192.168.37.101.4840 > 192.168.37.100.4840: UDP, length 1109
 00:00:00.000978 IP 192.168.37.101.4840 > 192.168.37.100.4840: UDP, length 1109
 00:00:00.003180 IP 192.168.37.101.4840 > 192.168.37.100.4840: UDP, length 1109
 00:00:00.000746 IP 192.168.37.101.4840 > 192.168.37.100.4840: UDP, length 1109
 00:00:00.002196 IP 192.168.37.101.4840 > 192.168.37.100.4840: UDP, length 1109
 00:00:00.000980 IP 192.168.37.101.4840 > 192.168.37.100.4840: UDP, length 1109
 00:00:00.002946 IP 192.168.37.101.4840 > 192.168.37.100.4840: UDP, length 1109
 00:00:00.000977 IP 192.168.37.101.4840 > 192.168.37.100.4840: UDP, length 1109
 00:00:00.002944 IP 192.168.37.101.4840 > 192.168.37.100.4840: UDP, length 1109
 00:00:00.001460 IP 192.168.37.101.4840 > 192.168.37.100.4840: UDP, length 1109
 00:00:00.001732 IP 192.168.37.101.4840 > 192.168.37.100.4840: UDP, length 1109
 00:00:00.000967 IP 192.168.37.101.4840 > 192.168.37.100.4840: UDP, length 1109
 00:00:00.002205 IP 192.168.37.101.4840 > 192.168.37.100.4840: UDP, length 1109
 00:00:00.000979 IP 192.168.37.101.4840 > 192.168.37.100.4840: UDP, length 1109
 00:00:00.002695 IP 192.168.37.101.4840 > 192.168.37.100.4840: UDP, length 1109
 00:00:00.000978 IP 192.168.37.101.4840 > 192.168.37.100.4840: UDP, length 1109
 00:00:00.001969 IP 192.168.37.101.4840 > 192.168.37.100.4840: UDP, length 1109
 00:00:00.001221 IP 192.168.37.101.4840 > 192.168.37.100.4840: UDP, length 1109
 00:00:00.001958 IP 192.168.37.101.4840 > 192.168.37.100.4840: UDP, length 1109
 00:00:00.002947 IP 192.168.37.101.4840 > 192.168.37.100.4840: UDP, length 1109
 00:00:00.001953 IP 192.168.37.101.4840 > 192.168.37.100.4840: UDP, length 1109
 00:00:00.000978 IP 192.168.37.101.4840 > 192.168.37.100.4840: UDP, length 1109
 00:00:00.003190 IP 192.168.37.101.4840 > 192.168.37.100.4840: UDP, length 1109
 00:00:00.000978 IP 192.168.37.101.4840 > 192.168.37.100.4840: UDP, length 1109
 00:00:00.002945 IP 192.168.37.101.4840 > 192.168.37.100.4840: UDP, length 1109
 00:00:00.002933 IP 192.168.37.101.4840 > 192.168.37.100.4840: UDP, length 1109
 00:00:00.000981 IP 192.168.37.101.4840 > 192.168.37.100.4840: UDP, length 1109
 00:00:00.002208 IP 192.168.37.101.4840 > 192.168.37.100.4840: UDP, length 1109
 00:00:00.000977 IP 192.168.37.101.4840 > 192.168.37.100.4840: UDP, length 1109
 00:00:00.002938 IP 192.168.37.101.4840 > 192.168.37.100.4840: UDP, length 1109
 00:00:00.000979 IP 192.168.37.101.4840 > 192.168.37.100.4840: UDP, length 1109
 00:00:00.002941 IP 192.168.37.101.4840 > 192.168.37.100.4840: UDP, length 1109
 00:00:00.001718 IP 192.168.37.101.4840 > 192.168.37.100.4840: UDP, length 1109
 00:00:00.001469 IP 192.168.37.101.4840 > 192.168.37.100.4840: UDP, length 1109
 00:00:00.000984 IP 192.168.37.101.4840 > 192.168.37.100.4840: UDP, length 1109
 00:00:00.002934 IP 192.168.37.101.4840 > 192.168.37.100.4840: UDP, length 1109
 00:00:00.000981 IP 192.168.37.101.4840 > 192.168.37.100.4840: UDP, length 1109
 00:00:00.001957 IP 192.168.37.101.4840 > 192.168.37.100.4840: UDP, length 1109
 00:00:00.000979 IP 192.168.37.101.4840 > 192.168.37.100.4840: UDP, length 1109
 00:00:00.003193 IP 192.168.37.101.4840 > 192.168.37.100.4840: UDP, length 1109
 00:00:00.000729 IP 192.168.37.101.4840 > 192.168.37.100.4840: UDP, length 1109
 00:00:00.002944 IP 192.168.37.101.4840 > 192.168.37.100.4840: UDP, length 1109
 00:00:00.001468 IP 192.168.37.101.4840 > 192.168.37.100.4840: UDP, length 1109
 00:00:00.001710 IP 192.168.37.101.4840 > 192.168.37.100.4840: UDP, length 1109
 00:00:00.001234 IP 192.168.37.101.4840 > 192.168.37.100.4840: UDP, length 1109
 00:00:00.001720 IP 192.168.37.101.4840 > 192.168.37.100.4840: UDP, length 1109
 00:00:00.000972 IP 192.168.37.101.4840 > 192.168.37.100.4840: UDP, length 1109
 00:00:00.001961 IP 192.168.37.101.4840 > 192.168.37.100.4840: UDP, length 1109
 00:00:00.000982 IP 192.168.37.101.4840 > 192.168.37.100.4840: UDP, length 1109
 00:00:00.001217 IP 192.168.37.101.4840 > 192.168.37.100.4840: UDP, length 1109
 00:00:00.001726 IP 192.168.37.101.4840 > 192.168.37.100.4840: UDP, length 1109
 00:00:00.001218 IP 192.168.37.101.4840 > 192.168.37.100.4840: UDP, length 1109
 00:00:00.002945 IP 192.168.37.101.4840 > 192.168.37.100.4840: UDP, length 1109
 00:00:00.000977 IP 192.168.37.101.4840 > 192.168.37.100.4840: UDP, length 1109
 00:00:00.001962 IP 192.168.37.101.4840 > 192.168.37.100.4840: UDP, length 1109
 00:00:00.000984 IP 192.168.37.101.4840 > 192.168.37.100.4840: UDP, length 1109
 00:00:00.001462 IP 192.168.37.101.4840 > 192.168.37.100.4840: UDP, length 1109
 00:00:00.001715 IP 192.168.37.101.4840 > 192.168.37.100.4840: UDP, length 1109
 00:00:00.000982 IP 192.168.37.101.4840 > 192.168.37.100.4840: UDP, length 1109
 00:00:00.001963 IP 192.168.37.101.4840 > 192.168.37.100.4840: UDP, length 1109
 00:00:00.000976 IP 192.168.37.101.4840 > 192.168.37.100.4840: UDP, length 1109
 00:00:00.002939 IP 192.168.37.101.4840 > 192.168.37.100.4840: UDP, length 1109
 00:00:00.000985 IP 192.168.37.101.4840 > 192.168.37.100.4840: UDP, length 1109
 00:00:00.002203 IP 192.168.37.101.4840 > 192.168.37.100.4840: UDP, length 1109
 00:00:00.000982 IP 192.168.37.101.4840 > 192.168.37.100.4840: UDP, length 1109
 00:00:00.002940 IP 192.168.37.101.4840 > 192.168.37.100.4840: UDP, length 1109
 00:00:00.000728 IP 192.168.37.101.4840 > 192.168.37.100.4840: UDP, length 1109
 00:00:00.002205 IP 192.168.37.101.4840 > 192.168.37.100.4840: UDP, length 1109
 00:00:00.000986 IP 192.168.37.101.4840 > 192.168.37.100.4840: UDP, length 1109
 00:00:00.003182 IP 192.168.37.101.4840 > 192.168.37.100.4840: UDP, length 1109
 00:00:00.000979 IP 192.168.37.101.4840 > 192.168.37.100.4840: UDP, length 1109
 00:00:00.001964 IP 192.168.37.101.4840 > 192.168.37.100.4840: UDP, length 1109
 00:00:00.000730 IP 192.168.37.101.4840 > 192.168.37.100.4840: UDP, length 1109
 00:00:00.002942 IP 192.168.37.101.4840 > 192.168.37.100.4840: UDP, length 1109
 00:00:00.001220 IP 192.168.37.101.4840 > 192.168.37.100.4840: UDP, length 1109
 00:00:00.002212 IP 192.168.37.101.4840 > 192.168.37.100.4840: UDP, length 1109
 00:00:00.000982 IP 192.168.37.101.4840 > 192.168.37.100.4840: UDP, length 1109
 00:00:00.002689 IP 192.168.37.101.4840 > 192.168.37.100.4840: UDP, length 1109
 00:00:00.000979 IP 192.168.37.101.4840 > 192.168.37.100.4840: UDP, length 1109
 00:00:00.001964 IP 192.168.37.101.4840 > 192.168.37.100.4840: UDP, length 1109
 00:00:00.001218 IP 192.168.37.101.4840 > 192.168.37.100.4840: UDP, length 1109
 00:00:00.003194 IP 192.168.37.101.4840 > 192.168.37.100.4840: UDP, length 1109
 00:00:00.002690 IP 192.168.37.101.4840 > 192.168.37.100.4840: UDP, length 1109
 00:00:00.000980 IP 192.168.37.101.4840 > 192.168.37.100.4840: UDP, length 1109
 00:00:00.001963 IP 192.168.37.101.4840 > 192.168.37.100.4840: UDP, length 1109
 00:00:00.000979 IP 192.168.37.101.4840 > 192.168.37.100.4840: UDP, length 1109
 00:00:00.003445 IP 192.168.37.101.4840 > 192.168.37.100.4840: UDP, length 1109
 00:00:00.000722 IP 192.168.37.101.4840 > 192.168.37.100.4840: UDP, length 1109
 00:00:00.002937 IP 192.168.37.101.4840 > 192.168.37.100.4840: UDP, length 1109
 00:00:00.001718 IP 192.168.37.101.4840 > 192.168.37.100.4840: UDP, length 1109
 00:00:00.001470 IP 192.168.37.101.4840 > 192.168.37.100.4840: UDP, length 1109
 00:00:00.000979 IP 192.168.37.101.4840 > 192.168.37.100.4840: UDP, length 1109
 00:00:00.001713 IP 192.168.37.101.4840 > 192.168.37.100.4840: UDP, length 1109
 00:00:00.001224 IP 192.168.37.101.4840 > 192.168.37.100.4840: UDP, length 1109
 00:00:00.002944 IP 192.168.37.101.4840 > 192.168.37.100.4840: UDP, length 1109
 00:00:00.000972 IP 192.168.37.101.4840 > 192.168.37.100.4840: UDP, length 1109
 00:00:00.002210 IP 192.168.37.101.4840 > 192.168.37.100.4840: UDP, length 1109
 00:00:00.000986 IP 192.168.37.101.4840 > 192.168.37.100.4840: UDP, length 1109
 00:00:00.002934 IP 192.168.37.101.4840 > 192.168.37.100.4840: UDP, length 1109
 00:00:00.000740 IP 192.168.37.101.4840 > 192.168.37.100.4840: UDP, length 1109
 00:00:00.002196 IP 192.168.37.101.4840 > 192.168.37.100.4840: UDP, length 1109
 00:00:00.000853 IP 192.168.37.101.4840 > 192.168.37.100.4840: UDP, length 1109
 00:00:00.003172 IP 192.168.37.101.4840 > 192.168.37.100.4840: UDP, length 1109
 00:00:00.000981 IP 192.168.37.101.4840 > 192.168.37.100.4840: UDP, length 1109
 00:00:00.002940 IP 192.168.37.101.4840 > 192.168.37.100.4840: UDP, length 1109
 00:00:00.000985 IP 192.168.37.101.4840 > 192.168.37.100.4840: UDP, length 1109
 00:00:00.001954 IP 192.168.37.101.4840 > 192.168.37.100.4840: UDP, length 1109
 00:00:00.000978 IP 192.168.37.101.4840 > 192.168.37.100.4840: UDP, length 1109
 00:00:00.003187 IP 192.168.37.101.4840 > 192.168.37.100.4840: UDP, length 1109
 00:00:00.000982 IP 192.168.37.101.4840 > 192.168.37.100.4840: UDP, length 1109
 00:00:00.001964 IP 192.168.37.101.4840 > 192.168.37.100.4840: UDP, length 1109
 00:00:00.000973 IP 192.168.37.101.4840 > 192.168.37.100.4840: UDP, length 1109
 00:00:00.002941 IP 192.168.37.101.4840 > 192.168.37.100.4840: UDP, length 1109
 00:00:00.003186 IP 192.168.37.101.4840 > 192.168.37.100.4840: UDP, length 1109
 00:00:00.000979 IP 192.168.37.101.4840 > 192.168.37.100.4840: UDP, length 1109
 00:00:00.002937 IP 192.168.37.101.4840 > 192.168.37.100.4840: UDP, length 1109
 00:00:00.000982 IP 192.168.37.101.4840 > 192.168.37.100.4840: UDP, length 1109
 00:00:00.002938 IP 192.168.37.101.4840 > 192.168.37.100.4840: UDP, length 1109
 00:00:00.003190 IP 192.168.37.101.4840 > 192.168.37.100.4840: UDP, length 1109
 00:00:00.000981 IP 192.168.37.101.4840 > 192.168.37.100.4840: UDP, length 1109
 00:00:00.002934 IP 192.168.37.101.4840 > 192.168.37.100.4840: UDP, length 1109
 00:00:00.000979 IP 192.168.37.101.4840 > 192.168.37.100.4840: UDP, length 1109
 00:00:00.002941 IP 192.168.37.101.4840 > 192.168.37.100.4840: UDP, length 1109
 00:00:00.000979 IP 192.168.37.101.4840 > 192.168.37.100.4840: UDP, length 1109
 00:00:00.002212 IP 192.168.37.101.4840 > 192.168.37.100.4840: UDP, length 1109
 00:00:00.000729 IP 192.168.37.101.4840 > 192.168.37.100.4840: UDP, length 1109
 00:00:00.003187 IP 192.168.37.101.4840 > 192.168.37.100.4840: UDP, length 1109
 00:00:00.000736 IP 192.168.37.101.4840 > 192.168.37.100.4840: UDP, length 1109
 00:00:00.002199 IP 192.168.37.101.4840 > 192.168.37.100.4840: UDP, length 1109
 00:00:00.000980 IP 192.168.37.101.4840 > 192.168.37.100.4840: UDP, length 1109
 00:00:00.002943 IP 192.168.37.101.4840 > 192.168.37.100.4840: UDP, length 1109
 00:00:00.000981 IP 192.168.37.101.4840 > 192.168.37.100.4840: UDP, length 1109
 00:00:00.002944 IP 192.168.37.101.4840 > 192.168.37.100.4840: UDP, length 1109
 00:00:00.000979 IP 192.168.37.101.4840 > 192.168.37.100.4840: UDP, length 1109
 00:00:00.002199 IP 192.168.37.101.4840 > 192.168.37.100.4840: UDP, length 1109
 00:00:00.000745 IP 192.168.37.101.4840 > 192.168.37.100.4840: UDP, length 1109
 00:00:00.003178 IP 192.168.37.101.4840 > 192.168.37.100.4840: UDP, length 1109
 00:00:00.000982 IP 192.168.37.101.4840 > 192.168.37.100.4840: UDP, length 1109
 00:00:00.002939 IP 192.168.37.101.4840 > 192.168.37.100.4840: UDP, length 1109
 00:00:00.000983 IP 192.168.37.101.4840 > 192.168.37.100.4840: UDP, length 1109
 00:00:00.001957 IP 192.168.37.101.4840 > 192.168.37.100.4840: UDP, length 1109
 00:00:00.001223 IP 192.168.37.101.4840 > 192.168.37.100.4840: UDP, length 1109
 00:00:00.002943 IP 192.168.37.101.4840 > 192.168.37.100.4840: UDP, length 1109
 00:00:00.000980 IP 192.168.37.101.4840 > 192.168.37.100.4840: UDP, length 1109
 00:00:00.002941 IP 192.168.37.101.4840 > 192.168.37.100.4840: UDP, length 1109
 00:00:00.001465 IP 192.168.37.101.4840 > 192.168.37.100.4840: UDP, length 1109
 00:00:00.001472 IP 192.168.37.101.4840 > 192.168.37.100.4840: UDP, length 1109
 00:00:00.001226 IP 192.168.37.101.4840 > 192.168.37.100.4840: UDP, length 1109
 00:00:00.001961 IP 192.168.37.101.4840 > 192.168.37.100.4840: UDP, length 1109
 00:00:00.000980 IP 192.168.37.101.4840 > 192.168.37.100.4840: UDP, length 1109
 00:00:00.002945 IP 192.168.37.101.4840 > 192.168.37.100.4840: UDP, length 1109
 00:00:00.000972 IP 192.168.37.101.4840 > 192.168.37.100.4840: UDP, length 1109
 00:00:00.003452 IP 192.168.37.101.4840 > 192.168.37.100.4840: UDP, length 1109
 00:00:00.000692 IP 192.168.37.101.4840 > 192.168.37.100.4840: UDP, length 1109
 00:00:00.001962 IP 192.168.37.101.4840 > 192.168.37.100.4840: UDP, length 1109
 00:00:00.000974 IP 192.168.37.101.4840 > 192.168.37.100.4840: UDP, length 1109
 00:00:00.003192 IP 192.168.37.101.4840 > 192.168.37.100.4840: UDP, length 1109
 00:00:00.000729 IP 192.168.37.101.4840 > 192.168.37.100.4840: UDP, length 1109
 00:00:00.001965 IP 192.168.37.101.4840 > 192.168.37.100.4840: UDP, length 1109
 00:00:00.000979 IP 192.168.37.101.4840 > 192.168.37.100.4840: UDP, length 1109
 00:00:00.003179 IP 192.168.37.101.4840 > 192.168.37.100.4840: UDP, length 1109
 00:00:00.000744 IP 192.168.37.101.4840 > 192.168.37.100.4840: UDP, length 1109
 00:00:00.003178 IP 192.168.37.101.4840 > 192.168.37.100.4840: UDP, length 1109
 00:00:00.000981 IP 192.168.37.101.4840 > 192.168.37.100.4840: UDP, length 1109
 00:00:00.002946 IP 192.168.37.101.4840 > 192.168.37.100.4840: UDP, length 1109
 00:00:00.003175 IP 192.168.37.101.4840 > 192.168.37.100.4840: UDP, length 1109
 00:00:00.000745 IP 192.168.37.101.4840 > 192.168.37.100.4840: UDP, length 1109
 00:00:00.003178 IP 192.168.37.101.4840 > 192.168.37.100.4840: UDP, length 1109
 00:00:00.000982 IP 192.168.37.101.4840 > 192.168.37.100.4840: UDP, length 1109
 00:00:00.001980 IP 192.168.37.101.4840 > 192.168.37.100.4840: UDP, length 1109
 00:00:00.000962 IP 192.168.37.101.4840 > 192.168.37.100.4840: UDP, length 1109
 00:00:00.002935 IP 192.168.37.101.4840 > 192.168.37.100.4840: UDP, length 1109
 00:00:00.000980 IP 192.168.37.101.4840 > 192.168.37.100.4840: UDP, length 1109
 00:00:00.002208 IP 192.168.37.101.4840 > 192.168.37.100.4840: UDP, length 1109
 00:00:00.000980 IP 192.168.37.101.4840 > 192.168.37.100.4840: UDP, length 1109
 00:00:00.002943 IP 192.168.37.101.4840 > 192.168.37.100.4840: UDP, length 1109
 00:00:00.000982 IP 192.168.37.101.4840 > 192.168.37.100.4840: UDP, length 1109
 00:00:00.002934 IP 192.168.37.101.4840 > 192.168.37.100.4840: UDP, length 1109
 00:00:00.000982 IP 192.168.37.101.4840 > 192.168.37.100.4840: UDP, length 1109
 00:00:00.002206 IP 192.168.37.101.4840 > 192.168.37.100.4840: UDP, length 1109
 00:00:00.000981 IP 192.168.37.101.4840 > 192.168.37.100.4840: UDP, length 1109
 00:00:00.001962 IP 192.168.37.101.4840 > 192.168.37.100.4840: UDP, length 1109
 00:00:00.000972 IP 192.168.37.101.4840 > 192.168.37.100.4840: UDP, length 1109
 00:00:00.000982 IP 192.168.37.101.4840 > 192.168.37.100.4840: UDP, length 1109
 00:00:00.001958 IP 192.168.37.101.4840 > 192.168.37.100.4840: UDP, length 1109
 00:00:00.000977 IP 192.168.37.101.4840 > 192.168.37.100.4840: UDP, length 1109
 00:00:00.001231 IP 192.168.37.101.4840 > 192.168.37.100.4840: UDP, length 1109
 00:00:00.001965 IP 192.168.37.101.4840 > 192.168.37.100.4840: UDP, length 1109
 00:00:00.000728 IP 192.168.37.101.4840 > 192.168.37.100.4840: UDP, length 1109
 00:00:00.002944 IP 192.168.37.101.4840 > 192.168.37.100.4840: UDP, length 1109
 00:00:00.001217 IP 192.168.37.101.4840 > 192.168.37.100.4840: UDP, length 1109
 00:00:00.001959 IP 192.168.37.101.4840 > 192.168.37.100.4840: UDP, length 1109
 00:00:00.001237 IP 192.168.37.101.4840 > 192.168.37.100.4840: UDP, length 1109
 00:00:00.002691 IP 192.168.37.101.4840 > 192.168.37.100.4840: UDP, length 1109
 00:00:00.000977 IP 192.168.37.101.4840 > 192.168.37.100.4840: UDP, length 1109
 00:00:00.001968 IP 192.168.37.101.4840 > 192.168.37.100.4840: UDP, length 1109
 00:00:00.001216 IP 192.168.37.101.4840 > 192.168.37.100.4840: UDP, length 1109
 00:00:00.003198 IP 192.168.37.101.4840 > 192.168.37.100.4840: UDP, length 1109
 00:00:00.000724 IP 192.168.37.101.4840 > 192.168.37.100.4840: UDP, length 1109
 00:00:00.002938 IP 192.168.37.101.4840 > 192.168.37.100.4840: UDP, length 1109
 00:00:00.000986 IP 192.168.37.101.4840 > 192.168.37.100.4840: UDP, length 1109
 00:00:00.001959 IP 192.168.37.101.4840 > 192.168.37.100.4840: UDP, length 1109
 00:00:00.001219 IP 192.168.37.101.4840 > 192.168.37.100.4840: UDP, length 1109
 00:00:00.001715 IP 192.168.37.101.4840 > 192.168.37.100.4840: UDP, length 1109
 00:00:00.001226 IP 192.168.37.101.4840 > 192.168.37.100.4840: UDP, length 1109
 00:00:00.000984 IP 192.168.37.101.4840 > 192.168.37.100.4840: UDP, length 1109
 00:00:00.002943 IP 192.168.37.101.4840 > 192.168.37.100.4840: UDP, length 1109
 00:00:00.000976 IP 192.168.37.101.4840 > 192.168.37.100.4840: UDP, length 1109
 00:00:00.001966 IP 192.168.37.101.4840 > 192.168.37.100.4840: UDP, length 1109
 00:00:00.000971 IP 192.168.37.101.4840 > 192.168.37.100.4840: UDP, length 1109
 00:00:00.003187 IP 192.168.37.101.4840 > 192.168.37.100.4840: UDP, length 1109
 00:00:00.000986 IP 192.168.37.101.4840 > 192.168.37.100.4840: UDP, length 1109
 00:00:00.002938 IP 192.168.37.101.4840 > 192.168.37.100.4840: UDP, length 1109
 00:00:00.002936 IP 192.168.37.101.4840 > 192.168.37.100.4840: UDP, length 1109
 00:00:00.000980 IP 192.168.37.101.4840 > 192.168.37.100.4840: UDP, length 1109
 00:00:00.002207 IP 192.168.37.101.4840 > 192.168.37.100.4840: UDP, length 1109
 00:00:00.000979 IP 192.168.37.101.4840 > 192.168.37.100.4840: UDP, length 1109
 00:00:00.001960 IP 192.168.37.101.4840 > 192.168.37.100.4840: UDP, length 1109
 00:00:00.000983 IP 192.168.37.101.4840 > 192.168.37.100.4840: UDP, length 1109
 00:00:00.001954 IP 192.168.37.101.4840 > 192.168.37.100.4840: UDP, length 1109
 00:00:00.000983 IP 192.168.37.101.4840 > 192.168.37.100.4840: UDP, length 1109
 00:00:00.000976 IP 192.168.37.101.4840 > 192.168.37.100.4840: UDP, length 1109
 00:00:00.002211 IP 192.168.37.101.4840 > 192.168.37.100.4840: UDP, length 1109
 00:00:00.000981 IP 192.168.37.101.4840 > 192.168.37.100.4840: UDP, length 1109
 00:00:00.001464 IP 192.168.37.101.4840 > 192.168.37.100.4840: UDP, length 1109
 00:00:00.001473 IP 192.168.37.101.4840 > 192.168.37.100.4840: UDP, length 1109
 00:00:00.000980 IP 192.168.37.101.4840 > 192.168.37.100.4840: UDP, length 1109
 00:00:00.002939 IP 192.168.37.101.4840 > 192.168.37.100.4840: UDP, length 1109
 00:00:00.000989 IP 192.168.37.101.4840 > 192.168.37.100.4840: UDP, length 1109
 00:00:00.001955 IP 192.168.37.101.4840 > 192.168.37.100.4840: UDP, length 1109
 00:00:00.000974 IP 192.168.37.101.4840 > 192.168.37.100.4840: UDP, length 1109
 00:00:00.003184 IP 192.168.37.101.4840 > 192.168.37.100.4840: UDP, length 1109
 00:00:00.000986 IP 192.168.37.101.4840 > 192.168.37.100.4840: UDP, length 1109
 00:00:00.002941 IP 192.168.37.101.4840 > 192.168.37.100.4840: UDP, length 1109
 00:00:00.001962 IP 192.168.37.101.4840 > 192.168.37.100.4840: UDP, length 1109
 00:00:00.000973 IP 192.168.37.101.4840 > 192.168.37.100.4840: UDP, length 1109
 00:00:00.003187 IP 192.168.37.101.4840 > 192.168.37.100.4840: UDP, length 1109
 00:00:00.000981 IP 192.168.37.101.4840 > 192.168.37.100.4840: UDP, length 1109
 00:00:00.001961 IP 192.168.37.101.4840 > 192.168.37.100.4840: UDP, length 1109
 00:00:00.002944 IP 192.168.37.101.4840 > 192.168.37.100.4840: UDP, length 1109
 00:00:00.000971 IP 192.168.37.101.4840 > 192.168.37.100.4840: UDP, length 1109
 00:00:00.001961 IP 192.168.37.101.4840 > 192.168.37.100.4840: UDP, length 1109
 00:00:00.000979 IP 192.168.37.101.4840 > 192.168.37.100.4840: UDP, length 1109
 00:00:00.003189 IP 192.168.37.101.4840 > 192.168.37.100.4840: UDP, length 1109
 00:00:00.001222 IP 192.168.37.101.4840 > 192.168.37.100.4840: UDP, length 1109
 00:00:00.001474 IP 192.168.37.101.4840 > 192.168.37.100.4840: UDP, length 1109
 00:00:00.001221 IP 192.168.37.101.4840 > 192.168.37.100.4840: UDP, length 1109
 00:00:00.001955 IP 192.168.37.101.4840 > 192.168.37.100.4840: UDP, length 1109
 00:00:00.002946 IP 192.168.37.101.4840 > 192.168.37.100.4840: UDP, length 1109
 00:00:00.002938 IP 192.168.37.101.4840 > 192.168.37.100.4840: UDP, length 1109
 00:00:00.001963 IP 192.168.37.101.4840 > 192.168.37.100.4840: UDP, length 1109
 00:00:00.000981 IP 192.168.37.101.4840 > 192.168.37.100.4840: UDP, length 1109
 00:00:00.003433 IP 192.168.37.101.4840 > 192.168.37.100.4840: UDP, length 1109
 00:00:00.002689 IP 192.168.37.101.4840 > 192.168.37.100.4840: UDP, length 1109
 00:00:00.001971 IP 192.168.37.101.4840 > 192.168.37.100.4840: UDP, length 1109
 00:00:00.000976 IP 192.168.37.101.4840 > 192.168.37.100.4840: UDP, length 1109
 00:00:00.002195 IP 192.168.37.101.4840 > 192.168.37.100.4840: UDP, length 1109
 00:00:00.000743 IP 192.168.37.101.4840 > 192.168.37.100.4840: UDP, length 1109
 00:00:00.002201 IP 192.168.37.101.4840 > 192.168.37.100.4840: UDP, length 1109
 00:00:00.000979 IP 192.168.37.101.4840 > 192.168.37.100.4840: UDP, length 1109
 00:00:00.001962 IP 192.168.37.101.4840 > 192.168.37.100.4840: UDP, length 1109
 00:00:00.001963 IP 192.168.37.101.4840 > 192.168.37.100.4840: UDP, length 1109
 00:00:00.000981 IP 192.168.37.101.4840 > 192.168.37.100.4840: UDP, length 1109
 00:00:00.002935 IP 192.168.37.101.4840 > 192.168.37.100.4840: UDP, length 1109
 00:00:00.003185 IP 192.168.37.101.4840 > 192.168.37.100.4840: UDP, length 1109
 00:00:00.002943 IP 192.168.37.101.4840 > 192.168.37.100.4840: UDP, length 1109
 00:00:00.002941 IP 192.168.37.101.4840 > 192.168.37.100.4840: UDP, length 1109
 00:00:00.001955 IP 192.168.37.101.4840 > 192.168.37.100.4840: UDP, length 1109
 00:00:00.000982 IP 192.168.37.101.4840 > 192.168.37.100.4840: UDP, length 1109
 00:00:00.002208 IP 192.168.37.101.4840 > 192.168.37.100.4840: UDP, length 1109
 00:00:00.000978 IP 192.168.37.101.4840 > 192.168.37.100.4840: UDP, length 1109
 00:00:00.001960 IP 192.168.37.101.4840 > 192.168.37.100.4840: UDP, length 1109
 00:00:00.000983 IP 192.168.37.101.4840 > 192.168.37.100.4840: UDP, length 1109
 00:00:00.002934 IP 192.168.37.101.4840 > 192.168.37.100.4840: UDP, length 1109
 00:00:00.000982 IP 192.168.37.101.4840 > 192.168.37.100.4840: UDP, length 1109
 00:00:00.002205 IP 192.168.37.101.4840 > 192.168.37.100.4840: UDP, length 1109
 00:00:00.000979 IP 192.168.37.101.4840 > 192.168.37.100.4840: UDP, length 1109
 00:00:00.002950 IP 192.168.37.101.4840 > 192.168.37.100.4840: UDP, length 1109
 00:00:00.001951 IP 192.168.37.101.4840 > 192.168.37.100.4840: UDP, length 1109
 00:00:00.000976 IP 192.168.37.101.4840 > 192.168.37.100.4840: UDP, length 1109
 00:00:00.001469 IP 192.168.37.101.4840 > 192.168.37.100.4840: UDP, length 1109
